,ID,Type,Story,Parent,Points,Comments,Author,Title,URL,Content,Created
131,10083341,comment,10071695.0,10083131.0,0,0,dredmorbius,,,I get the sense I&,
132,10083340,story,,,1,0,nashequilibrium,Ask HN: How many contacts do you have in your address book,,How many contacts do you have in your address book and what % have you not met in real life?,1439949921.0
133,10083339,comment,10080956.0,10082912.0,0,0,TazeTSchnitzel,,,"> You are doing it wrong. You are not supposed to &quot;learn&quot; C++, not entirely.<p>If you aren&",
134,10083338,story,,,1,0,memebox,Lead iOS Development at Memebox (YC W15),https://jobs.lever.co/memebox/f623326e-7256-4527-a839-f366028171cb,,1439949885.0
135,10083337,comment,10079832.0,10083130.0,0,0,Karunamon,,,"Thankfully, the law is not C++ and we have this thing called &quot;judgement&quot;.<p>This is unlawful interference, pure and simple.",1439949835.0
136,10083336,story,,,4,0,prawn,The Definitive Guide to GTFS-Realtime,https://gumroad.com/l/gtfsrt,,1439949828.0
137,10083335,comment,10079169.0,10082320.0,0,0,gech,,,"What if they lobby against better, safer solutions developed in the future because it affects their bottom line?",1439949817.0
138,10083333,comment,10083264.0,10083324.0,0,0,uptown,,,Using what as a metric?,1439949747.0
139,10083332,comment,10083111.0,10083111.0,0,0,marktangotango,,,"Just left an example of this, founder built a product with a core cadre of about 5 developers, after a slow first 5 years, the market caught up, and then sales doubled every year for next 5 years ($100M plus in sales).<p>CEO was highly involved with the product, even led the dev team for several years.  Unfortunately he was little more than an enthusiastic amateur when it came to technical matters, and had strong opinions on how to implement things.  His team was not experienced, so didn&",
140,10083331,comment,10080065.0,10081528.0,0,0,thenipper,,,Fair enough! I&,
141,10083330,comment,10079832.0,10082590.0,0,0,vinceguidry,,,You could do that. Just ask people who you see using cell phones and laptops to leave. You don&,
142,10083328,story,,,1,0,curiousgeek,Federal judge rules OPT extension for STEM students invalid,https://www.insidehighered.com/quicktakes/2015/08/17/judge-invalidates-component-foreign-student-work-program,,1439949631.0
143,10083327,comment,10083264.0,10083317.0,0,0,scuur,,,What would be the best way you recommend of doing that?,1439949621.0
144,10083326,story,,,100,38,noteloop,Startups That Launched at YC S15 Demo Day 1,http://techcrunch.com/2015/08/18/hardware-demo-day/,,1439949612.0
145,10083325,comment,10080065.0,10080447.0,0,0,cthalupa,,,I&,
