,ID,Type,Story,Parent,Points,Comments,Author,Title,URL,Content,Created
0,10485367,comment,10485091.0,10485205.0,0,0,whyIndeed,,,"Well, these are a different species of insect though. Yellow jackets are wasps, fundamentally different from honey bees.<p>The behavior of honey bees is one driven moreso by an inherited willingness to engage in servitude, than with wasps. Wasps are predatory carnivores, and their nests are smaller, more distributed, and constructed out of found materials, modified and pasted together. Wasps don&",
1,10485366,comment,10479620.0,10481921.0,0,0,tonyarkles,,,"&quot;quite familiar&quot; seems more natural to me. Also, the odd comma spacing immediately jumps out at me.",1446350338.0
2,10485365,comment,10485012.0,10485316.0,0,0,hentrep,,,"As others have mentioned, this all occurred before the AK-47 was put into production. I believe the Mosin-Nagant 91/30 was standard issue for Soviets in WW2.",1446350312.0
3,10485363,story,,,1,1,joshuabocanegra,Humai is reinventing the afterlife,http://humaitech.com,,1446350228.0
4,10485362,comment,10479620.0,10480925.0,0,0,tonyarkles,,,I think the point was that it&,
5,10485361,comment,10480390.0,10482203.0,0,0,kbenson,,,"Instead of &quot;good at markets&quot;, I interpreted it as &quot;good at understanding complex systems&quot;.  I never assumed the companies they would contact would be entirely financially based, I think the idea is that if someone can figure this out the should essentially be vetted (after a good in-person meeting) as a good candidate for almost any project you want to throw at them.<p>To me, the stock-market aspect of this seems entirely because it&",
6,10485360,story,,,1,2,realfrontier,Ask HN: How can students with no work/intership experience stand out?,,I&,
7,10485359,comment,10483936.0,10485046.0,0,0,auscompgeek,,,"The Facebook Chat XMPP gateway was shut down long ago. Facebook Messenger uses the MQTT protocol, rather than XMPP.",1446350048.0
8,10485358,comment,10482033.0,10482424.0,0,0,XorNot,,,Bitcoin manages 7 transactions per second globally. The internet is...somewhat faster then that.,1446349910.0
9,10485357,comment,10485012.0,10485316.0,0,0,dollaaron,,,"In AK-47, the 47 comes from the year the design was finished, design work didn&",
10,10485355,comment,10485012.0,10485012.0,0,0,ikeboy,,,Those first few paragraphs give off so many crank vibes.,1446349863.0
11,10485353,comment,10483780.0,10485095.0,0,0,e12e,,,> The documentation for systemd and its utilities is second to none.<p><pre><code>  $ man none\n  No manual entry for none\n</code></pre>\nSounds about right.,1446349861.0
12,10485352,comment,10485012.0,10485316.0,0,0,usaphp,,,"Ak-47 was designed in 1949, I think you are missing something, war was over by that time",1446349829.0
13,10485350,comment,10482033.0,10482292.0,0,0,XorNot,,,It&,
14,10485349,story,,,1,0,sunnyps,Thoughts on YouTube Red,http://pewdie.tumblr.com/post/132147138150/thoughts-on-youtube-red,,1446349779.0
15,10485347,comment,10484414.0,10485317.0,0,0,supercoder,,,Could just as easily use a table to create an image in an email,1446349729.0
16,10485346,comment,10483751.0,10484406.0,0,0,azakai,,,>> This is not just a heuristic for detecting bias. It&,
17,10485345,comment,10483780.0,10485001.0,0,0,brazzledazzle,,,I haven&,
18,10485344,comment,10483780.0,10485303.0,0,0,ymse,,,Hm? It&,
19,10485343,comment,10483846.0,10484734.0,0,0,musesum,,,To paraphrase MM: Let&,
20,10485342,comment,10483747.0,10483747.0,0,0,userbinator,,,"Assuming 3.5G instructions per second, that&",
21,10485341,story,,,1,0,hamedjf,Is the 'Tech Bubble' in Silicon Valley Avoidable?,http://techrasa.com/2015/10/31/is-the-tech-bubble-in-silicon-valley-avoidable/,,1446349539.0
22,10485340,comment,10483751.0,10485304.0,0,0,rewqfdsa,,,"If the bias reflects a real Bayesian prior, it isn&",
23,10485339,story,,,43,7,NnamdiJr,Generating Captions: Describing Videos with Neural Networks,https://medium.com/@samim/generating-captions-c31f00e8396e,,
24,10485338,comment,10483751.0,10485283.0,0,0,rewqfdsa,,,Yet he didn&,
25,10485337,comment,10483354.0,10485258.0,0,0,vezzy-fnord,,,"Two things:<p>a) The MINIX 3 developers had an enormous head start from reusing MINIX 2 in its entirety. In fact, that&",
26,10485336,comment,10483751.0,10484553.0,0,0,grayclhn,,,I suspect the math is easier if you reframe the hypothesis to be about the derivatives: adding one more person from either group should have the same marginal effect on outcomes. As you get more observations you get more in a neighborhood of the cutoff which gives a consistent estimator of the derivative.,1446349398.0
27,10485335,comment,10482578.0,10485229.0,0,0,ivoryst,,,"So your friends have witnessed human sacrifice of children?\nGet real. If you dont want to be taken out of context, dont use colorful anectdotes straight out of a 1850s novel.",1446349330.0
28,10485334,comment,10485012.0,10485012.0,0,0,jonesb6,,,"I just watched &quot;Back to 1942&quot; which shows a glimpse of WWII from the Chinese perspective. They had to cope with a famine AND a war, and lost ~20 million people during the struggle. To put it into perspective Russia lost around ~28 million [1].<p>In my opinion it was an excellent film that left me again pondering how much I&",
29,10485333,story,,,2,0,zdw,Oursourcing makes sense if you think “software” is a fad,http://everythingsysadmin.com/2015/10/outsourcing-was-such-a-mistake.html,,1446349228.0
30,10485332,comment,10483695.0,10485249.0,0,0,scrollaway,,,Same. It&,
31,10485331,comment,10484947.0,10484947.0,0,0,ilaksh,,,We may want some way to regulate company and individual actions even though we don&,
32,10485330,comment,10483523.0,10483790.0,0,0,rsync,,,&quot;Is there a quality laptop not bound to an ecosystem that doesn&,
33,10485329,comment,10481752.0,10483951.0,0,0,lujim,,,> Hyperinflation in Germany was caused by a mix of high economic penalties post WW1 and reckless actions by private banks and investors. It&,
34,10485327,story,,,1,0,zdw,Automatic social discipline,http://www.marco.org/2015/10/30/automatic-social-discipline,,1446349046.0
35,10485326,comment,10483857.0,10483857.0,0,0,ahmad19526,,,I love this walkthrough! I&,
36,10485324,story,,,3,1,kawera,Undersea Internet Cables Are Surprisingly Vulnerable,http://www.wired.com/2015/10/undersea-cable-maps,,1446348979.0
37,10485323,comment,10483695.0,10483695.0,0,0,javajosh,,,Yes! In fact I&,
38,10485322,comment,10483846.0,10484265.0,0,0,drumdance,,,Haven&,
39,10485321,comment,10482578.0,10485148.0,0,0,ivoryst,,,"Sorry, but what exactly is your point (in plain english)?<p>And I used the term &quot;outsider&quot; to refer to any perceived differences, whether its race, gender, religion, beliefs etc. And yes, some people condone; while others actively participate.<p>I&",
40,10485319,comment,10484653.0,10484653.0,0,0,openfuture,,,I&,
41,10485318,comment,10482517.0,10485295.0,0,0,troyinjapan,,,"<a href=""http://fountain.io/_img/fountain-quickreference.jpg"" rel=""nofollow"">http://fountain.io/_img/fountain-quickreference.jpg</a>",1446348835.0
42,10485317,comment,10484414.0,10484773.0,0,0,personjerry,,,I question the value of adding MBs to your email to forcibly embed an image.<p>Actually this could become a liability if spammers catch on.,1446348822.0
43,10485316,comment,10485012.0,10485012.0,0,0,orionblastar,,,"What I was taught in public school is that the Germans used slave labor and POWs to work in factories to make their weapons, tanks, planes, rockets, etc and this led to a quality control issue while the USA and Britain had well paid and well fed people who made better quality weapons, tanks, aircraft, etc.<p>The Russians had an advantage because of their AK-47 rifle and a lot of fighting was done at the Russian front as Hitler tried to take over Russia. People forgot that Russia did a lot of fighting as well as had better weapons and stuff as well.<p>The USA has military superiority because we have better technology and better trained people. For example our fighter jets are better designed and our pilots are better trained than their Russian counterparts. Most of the USA&",
44,10485315,comment,10483523.0,10485178.0,0,0,urda,,,"What you described is not a right, and they are allowed to control what is or is not in their store. Whether you like it or not.",1446348717.0
45,10485314,comment,10484367.0,10485082.0,0,0,jbandela1,,,At this year&,
46,10485313,comment,10481752.0,10483807.0,0,0,lujim,,,There is no inflation because QE money is used to keep up the demand for US Treasuries which keeps long term interest rates low.  It jacked up asset prices because baby boomers can&,
47,10485312,comment,10484367.0,10485076.0,0,0,akiselev,,,"Rust functions return expressions, not objects and it is entirely up to the compiled code at the function call site whether it is placed in the stack or the heap, and whether the function code is inlined or not (thus expanding the stack allocated in the parent function). ::new doesn&",
48,10485311,comment,10447090.0,10447090.0,0,0,irshad,,,"I have a online mobile school management app cum website .it include all facilities like the inter connection between studrnt teachers and parents and also have online fees payment ,discussion center , online exams , etc\n   Search Quoryz.com\n Mob +971565920694",1446348662.0
49,10485310,comment,10483024.0,10484566.0,0,0,giaour,,,Yup.,1446348636.0
50,10485309,comment,10483751.0,10483751.0,0,0,174676,,,"Even assuming equal distribution of ability, there is still the problem of whether you can measure performance without bias.",1446348633.0
51,10485308,comment,10484164.0,10484164.0,0,0,1971genocide,,,"Of-course america is going to be country with the most american dollars !<p>All this analysis tells me is that america is suffering from the same sort of inflation that Spain suffered when it stopped becoming the economical power house and Britain suffered during the 20th Century. What happens is money that was issued as dollar debt to foreigners creeps back into the economy that taxes in american dollar.<p><a href=""https://en.wikipedia.org/wiki/List_of_countries_by_GDP_(PPP)_per_capita"" rel=""nofollow"">https://en.wikipedia.org/wiki/List_of_countries_by_GDP_(PPP)...</a><p>This list should tell you everything - The difference in purchasing power between a Swed and american is just 6,000 dollars.<p>This is not even accounting for how expensive healthcare /education is in america - since america does a shitty job training its doctors compared to European nations - and even cuba.",1446348631.0
52,10485306,comment,10483780.0,10483780.0,0,0,throw23000,,,I have to make this comment with a throwaway as its related to my previous job. Leaving aside the technical issues the launch of systemd &,
53,10485305,comment,10483047.0,10485277.0,0,0,vinceguidry,,,The biggest thing I missed was separation between routes and controllers. In Sinatra they&,
54,10485304,comment,10483751.0,10484882.0,0,0,gammarator,,,> you&,
55,10485303,comment,10483780.0,10483780.0,0,0,Stratoscope,,,"Interesting to see that the commit linked here has been yanked from the repo.<p>For the curious, here is the original commit comment:<p>> remove systemd support<p>> systemd people are not willing to play nice with the rest of the world.<p>> Therefore there is no reason for the rest of the world to cooperate with them.<p>> Signed-off-by: Denys Vlasenko <vda.linux@googlemail.com><p><a href=""http://webcache.googleusercontent.com/search?q=cache%3Ahttp%3A%2F%2Fgit.busybox.net%2Fbusybox%2Fcommit%2F%3Fid%3Daccd9eeb719916da974584b33b1aeced5f3bb346&oq=cache%3Ahttp%3A%2F%2Fgit.busybox.net%2Fbusybox%2Fcommit%2F%3Fid%3Daccd9eeb719916da974584b33b1aeced5f3bb346"" rel=""nofollow"">http://webcache.googleusercontent.com/search?q=cache%3Ahttp%...</a>",1446348376.0
56,10485302,comment,10483523.0,10483523.0,0,0,klean92,,,Most of the arguments I read here are: it&,
57,10485301,comment,10483747.0,10483747.0,0,0,j42,,,Can anyone comment on whether it would be a good or bad idea to try to implement this in production ASAP?<p>I&,
58,10485300,story,,,1,0,luu,On the Importance of Internal Networking,http://blog.erikdev.com/post/123581252872/on-the-importance-of-internal-networking,,1446348192.0
59,10485299,comment,10485150.0,10485217.0,0,0,greenyoda,,,"That assumes that the content is actually worth $1/read. For example, blogs with pictures of cute cats get huge amounts of traffic, but if they start charging for access, 100% of their visitors will go away and find the same content for free somewhere else in about ten seconds. Most technical blogs have the same problem: for example, if you have a blog about Python programming, you&",
60,10485298,comment,10483780.0,10485146.0,0,0,tinco,,,I&,
61,10485297,comment,10483751.0,10484882.0,0,0,drumdance,,,"Women musicians started getting orchestra positions in much greater numbers after auditions were made blind.<p>If biases affect how a professional musician hears music, is it so shocking to think unconscious bias might affect someone&",
62,10485296,comment,10484653.0,10484653.0,0,0,eccstartup,,,Documentation in PDF available?,1446348165.0
63,10485295,comment,10482517.0,10482517.0,0,0,wodenokoto,,,"Oma similar note, what is up with the style/layout of movie scripts?<p>As an outsider it looks quite ugly compared to even a standard setting in google docs or word.<p>I&",
64,10485294,story,,,2,0,Oatseller,UK's New Reporting Obligations on Modern Slavery and Human Trafficking,http://www.natlawreview.com/article/uk-s-new-reporting-obligations-modern-slavery-and-human-trafficking,,1446348118.0
65,10485292,comment,10478970.0,10483299.0,0,0,hueving,,,But there are many massive investments at the academic and government research level that lead to nothing directly useful for consumers due to lack of investment interests in bringing it to market. Just look at the next generation Internet architectures that go nowhere. You can&,
66,10485291,comment,10483751.0,10484474.0,0,0,174676,,,"Sorry but your reasoning does not let pg off the hook. In his article he says that the way to determine bias is by measuring the performance of those that got through. With your excuse, all you have to do is measure the number of people that got through in a particular group relative to the other group.",1446347988.0
67,10485290,comment,10485054.0,10485160.0,0,0,rayalez,,,"Yeah, I would really advise you to remove adsense(for me it is showing completely irrelevant ads), and focus on affiliate. It will be much more relevant and you will make more money.<p>And I would create a store, contact whiskey manufactures, and start selling their products, that shouldn&",
68,10485289,comment,10483024.0,10484412.0,0,0,mikeash,,,Software doesn&,
69,10485288,comment,10481752.0,10483814.0,0,0,lujim,,,"The &quot;any questions at this point&quot; comment seems a bit snippy and unnecessary, I was just trying to figure out what you were talking about... but no biggy here goes.<p>So financial derivatives?  Futures, options, shorting etc?  Derivatives can play a very important role in the financial system.  They can also be abused.<p>Futures allow farmers (or airlines, or anyone else dependent on commodity prices) to hedge the chances of a bad harvest (or increased fuel prices) by locking in rates early.  It&",
70,10485287,comment,10483354.0,10483901.0,0,0,orionblastar,,,"Windows NT 3.1 was based on Microsoft OS/2 NT 3.0, it was originally Microsoft&",
71,10485286,story,,,73,84,Futurebot,The Mystery of the Vanishing Pay Raise,http://www.nytimes.com/2015/11/01/sunday-review/the-mystery-of-the-vanishing-pay-raise.html,,1446347841.0
72,10485285,comment,10483751.0,10484602.0,0,0,graycat,,,"Errata:<p>Replace<p>Type I Error:  We reject the null\nhypothesis when it is true, e.g., we\nconclude bias when there is none.<p>Type II Error:  We fail to reject (i.e.,\nwe accept) the null hypothesis when it is\nfalse.<p>with<p>Type I Error:  We reject the null\nhypothesis when it is true; e.g., we\nconclude bias when there is none.<p>Type II Error:  We fail to reject (i.e.,\nwe accept) the null hypothesis when it is\nfalse; e.g., we conclude there is no bias\nwhen there is.<p>Replace<p>For a random number, how about starting\nwith a 32 bit integer, with appropriately\nlong precision arithmetic multiply by\n5^15, add 1, take modulo 2^47, and scale\nas we want?<p>with<p>For a random number, how about starting\nwith a 32 bit integer, with appropriately\nlong precision arithmetic multiply by\n5^15, add 1, take modulo 2^47, take the\nresulting integer, scale as we want for\nstirring our pot, and use that integer as\nthe start of another random number?<p>Replace<p>Else First Round looks like the good guys,\nare &quot;certified statistically fair to\nwomen&quot;, may get more deal flow from women,\nand Betty, <i>et al.</i>, can be happy that First\nRound is so nice!<p>with<p>Else First Round looks like the good guys,\nare <i>statistically certified fair to\nwomen</i>, may get more deal flow from women,\nand Betty, <i>et al.</i>, can be happy that First\nRound is so nice!<p>Replace<p>Notice that either way Betty, <i>et al.,</i>\nare &quot;happy&quot;.  That&",
73,10485284,comment,10482701.0,10484879.0,0,0,mikeash,,,It shouldn&,
74,10485283,comment,10483751.0,10484823.0,0,0,pygy_,,,You&,
75,10485282,comment,10483354.0,10485272.0,0,0,nickpsecurity,,,"Hey, millions of dollars can always help. It will be in my HOWTO for successful FOSS if I ever write one. :)<p>I think the simple architecture is their main benefit, though. They only put in complexity where the most benefit. Then they reused NetBSD&",
76,10485281,story,,,2,0,adambrod,Show HN: Search for Elixir and Erlang Packages in Alfred,https://github.com/AdamBrodzinski/alfred-hex-search,,1446347619.0
77,10485280,comment,10484414.0,10485232.0,0,0,mistercow,,,"What was the input type? PNG? If so, that means that a lot of the size gain is due to the fact that PNG can compress based on similarities between rows, while GZIP on the CSS is only compressing in the horizontal direction.",1446347575.0
78,10485279,comment,10483751.0,10484675.0,0,0,gozo,,,"Unfortunately I think this is a problem with many of his essays. They often present a very specific argument with reservations, which makes the argument very hard to disagree with since you have to argue relevance which requires a lot more insight. It&",
79,10485278,comment,10483751.0,10483751.0,0,0,jameshart,,,There&,
80,10485277,comment,10483047.0,10484836.0,0,0,glassx,,,> I&,
81,10485276,comment,10484653.0,10485162.0,0,0,vinceguidry,,,"A lot of downvotes happen by accident, as on mobile it&",
82,10485275,comment,10483523.0,10485233.0,0,0,Dylan16807,,,Yes.,1446347410.0
83,10485274,comment,10484653.0,10484653.0,0,0,Direct,,,"I tried switching to this editor permanently from vim. The selection based movements are asurdly good, I could kill for something like this in vim.<p>However I couldn&",
84,10485273,comment,10483024.0,10483471.0,0,0,mark-r,,,You&,
85,10485272,comment,10483354.0,10485258.0,0,0,carussell,,,"Another notable difference between Hurd and MINIX  is that Tanenbaum got millions of funding from the EU to improve MINIX. Having the organizational backing of a research university helps, too.",1446347345.0
86,10485271,comment,10483751.0,10484106.0,0,0,Tloewald,,,There&,
87,10485270,comment,10483354.0,10484095.0,0,0,mindcrime,,,I imagine you got downvoted because this thread is neither about Chesterton nor about atheism.  HN culture is generally not very tolerant of threads that deviate into things that aren&,
88,10485269,comment,10483354.0,10483452.0,0,0,nickpsecurity,,,"And Samsung uses INTEGRITY Multivisor in KNOX.<p><a href=""http://www.ghs.com/products/rtos/integrity_virtualization.html"" rel=""nofollow"">http://www.ghs.com/products/rtos/integrity_virtualization.ht...</a><p>Multivisor is kind of a combination of the INTEGRITY RTOS and virtualization stuff.<p>The leader in this kind of stuff was OKL4 like in your reference, though. General Dynamics supplies their stuff now due to acquisition.",1446347313.0
89,10485268,comment,10478940.0,10480336.0,0,0,bshanks,,,Paying prisons based on gamed recidivism rates would probably still be better than not.,1446347297.0
90,10485267,comment,10483354.0,10483561.0,0,0,orionblastar,,,"IIRC Darling uses GNUStep and CLANG to try and run OSX binaries.<p><a href=""https://www.darlinghq.org/"" rel=""nofollow"">https://www.darlinghq.org/</a><p><a href=""http://www.darlinghq.org/project-status"" rel=""nofollow"">http://www.darlinghq.org/project-status</a><p>I tried it out before in a Lubuntu virtual machine and had to install CLANG and other stuff to compile it with GNUStep and it is very limited in what it can run.<p>I linked to the project status page because some of the links on the main page are 404 errors.<p>Here it is on Github if people want to help out:\n<a href=""https://github.com/darlinghq/darling"" rel=""nofollow"">https://github.com/darlinghq/darling</a><p>Here are the build requirements:\n<a href=""http://www.darlinghq.org/build-instructions"" rel=""nofollow"">http://www.darlinghq.org/build-instructions</a>",1446347266.0
91,10485265,comment,10483523.0,10484562.0,0,0,Dylan16807,,,They regularly get pulled.  Wanting an app that is going to still exist in a week is not moving the goalposts.  The point is that the rules have removed all good apps with those features from the store.,1446347184.0
92,10485264,comment,10482676.0,10483881.0,0,0,greglindahl,,,The definition of &quot;torture&quot; you&,
93,10485263,comment,10483523.0,10484328.0,0,0,ISL,,,Forcing someone to display someone else&,
94,10485262,comment,10483523.0,10484084.0,0,0,Dylan16807,,,> Google Play simply doesn&,
95,10485261,comment,10483354.0,10484162.0,0,0,nickpsecurity,,,"Quark microkernel in MorphOS\n<a href=""https://en.wikipedia.org/wiki/Quark_%28kernel%29"" rel=""nofollow"">https://en.wikipedia.org/wiki/Quark_%28kernel%29</a><p>MorphOS - quite fast and usable :)\n<a href=""http://www.morphos-team.net/intro"" rel=""nofollow"">http://www.morphos-team.net/intro</a><p>So, out with the old and in with the new.",1446347077.0
96,10485260,comment,10484414.0,10484842.0,0,0,Theodores,,,"...and 296% CPU for one Chrome tab whilst it is doing it, with negligible &",
97,10485259,comment,10483354.0,10483539.0,0,0,AceJohnny2,,,"> Now that was a misery, but one I attribute more to the uncaring attitude of the company that wrote the STB&",
98,10485258,comment,10483354.0,10485226.0,0,0,nickpsecurity,,,I was going by Tannenbaum&,
99,10485257,story,,,2,0,Sandman,Can Civil Comments Kill the Internet Troll?,http://techcrunch.com/2015/10/31/can-civil-comments-kill-internet-trolls/?ncid=rss,,1446346808.0
