,ID,Type,Story,Parent,Points,Comments,Author,Title,URL,Content,Created
0,4175161,comment,4174550.0,4174895.0,2,0,alttab,,,API comparability does not ensure functional comparability. Two code bases too.,1340942384.0
1,4175160,comment,4164784.0,4166329.0,1,0,il,,,"Congratulations on your success- but you must realize that a 400 person, instantly profitable service company is the exception, not the norm. The vast majority of service companies are two guys in a garage treading water and struggling to survive.<p>You probably won't be the next Facebook, but, generally speaking, it's a lot easier for a software company ""Micro ISV"" to get leverage and scale than a service company- that's why service companies don't get funded.<p>Thanks for the detailed response- it was a really interesting read and great perspective for me to think about.",1340942373.0
2,4175159,comment,4174643.0,4174643.0,1,0,thetrumanshow,,,"Hi Elastic, welcome to the sales business. We're working on a sales process standardization system, which we assume will be a component of your business going forward, so it will be interesting to track your progress. We probably won't be getting anywhere near the sales-team-as-a-service area. Best of luck! Edit: removed a baseless assumption.",1340942346.0
3,4175158,comment,4174284.0,4175008.0,2,0,mark_story,,,"You're going to hate the future of all microsoft platforms then.  Xbox, windows, and windows phone all share this design language.",1340942299.0
4,4175157,comment,4173773.0,4174594.0,-1,0,CrazedGeek,,,"You'll only regret it if you have an obsession with upgrading your OS. If you don't really care, any phone running ICS right now will suit you fine.",1340942276.0
5,4175156,comment,4174550.0,4175098.0,6,0,Supermighty,,,"No, it's not difficult to support oldIE. Single Column, nothing fancy. But the business people don't want that. They want it to look identical in every browser, and the web designers are scared shitless of losing money to tell them different. The problem is that business people don't know that hours of extra work are required to do this. And when they are told they don't care.",1340942270.0
6,4175155,story,,,1,0,gbrennan,Cameron To Film Multiple Avatar Sequels Back to Back,http://www.33rdsquare.com/2012/06/cameron-to-film-multiple-avatar-sequels.html,,1340942218.0
7,4175154,comment,4173854.0,4174446.0,3,0,Estragon,,,"The simple vs easy concept is broader than data sharing.  One example is perl, which is quite easy to pick up but complects many things, like strings representing numbers being silently coerced into numeric values.<p>Another example, where I immediately thought of simple/easy as it came up:  I realized the other day that a component of an app I've been designing serves two almost independent purposes, and I can drastically simplify the design by making separate components.<p>The video you linked doesn't seem to be available anymore.  The slides are available on scribd, but they don't seem to make much sense without the context of the talk.",1340942156.0
8,4175153,comment,4174284.0,4174884.0,3,0,duaneb,,,"Oh god, I thought that was an April Fools joke. Does Microsoft not hire design people? It looks horrific!",1340942065.0
9,4175152,comment,4174550.0,4174816.0,2,0,hrabago,,,> They are only used if the person using them doesn't know what a browser is.<p>...or their company doesn't have the budget to upgrade their entire department to Windows 7.,1340942063.0
10,4175151,comment,4174612.0,4175069.0,2,0,dguaraglia,,,"Yeah, I suspected as much... and even then the video feeds seemed to break a bit. Can't imagine what it'd look like over 3G (LTE would fare much better I guess, but there's like 2 places in California where you have LTE coverage)",1340942042.0
11,4175150,comment,4174550.0,4175098.0,0,0,alttab,,,"I'll tell you the numbers. We spend way too much effort trying to make our sophisticated web app work with ie7. The industry demands innovation in ux but it's nearly impossible to provide it when you are writing for 4 browsers. In a lot of cases we struggle for hours on one problem and end up writing a separate implementation for that feature that doesn't perform as well.<p>Now we have segmentation in experience, help documentation, and support.<p>It's expensive as fuck.",1340942041.0
12,4175149,story,,,1,0,westnile34,Kinesio Tape Therapy,http://paradisevillagechiro.com/kinesio-tape-therapy/,,1340941992.0
13,4175148,comment,4174550.0,4174791.0,1,0,mark_story,,,"Last I checked zepto doesn't have support for any of the simulated selectors like `:checked`, `:input` and friends.  If you use any of them, its not drop in.",1340941967.0
14,4175147,comment,4174550.0,4175021.0,8,0,vlad,,,"jQuery 1.x supports all Microsoft browsers released over the past 11 years, while jQuery 2.x will only support Microsoft browsers released a little over a year before today.",1340941937.0
15,4175146,comment,4174643.0,4174643.0,1,0,jmvoodoo,,,I'm in the enterprise software business and there are already a lot of available options for enterprise resellers. The typical reason they fail is essentially dilution (lack of product knowledge or lack of incentive to sell your product vs another). It will be interesting to see how (or if) they manage to solve that. Does anyone from the company want to chime in (to a potential customer if you have a good answer?),1340941883.0
16,4175145,comment,4174550.0,4174727.0,8,0,CrazedGeek,,,"Download and runtime speed are definitely a problem on desktop OSes -- mobile broadband, slow DSL, netbooks, that sort of thing.",1340941866.0
17,4175144,comment,4174384.0,4174642.0,1,0,cageface,,,"At my last job I was making way more money than I could realistically spend, but there was no way I could go half-time and get those precious hours back for other things.<p>Consulting gives me that freedom, which I appreciate more and more as the years go by.",1340941864.0
18,4175143,comment,4173854.0,4173854.0,4,0,gruseom,,,"I like most of the points he makes but that ""complect"" business is fingers-on-a-chalkboard pretentious to my ears. ""Coupling"" and ""complexity"" are perfectly good words and have been used for decades to talk about this stuff.<p>But the stuff about how simplicity and easiness are not the same (at least in the short run) is very good.",1340941837.0
19,4175142,comment,4173773.0,4173963.0,1,0,randomdata,,,"<i>All I remember is their usage of QNX, but they did a terrible job with growing the community.</i><p>Apple's Rhapsody, acquired and released, not unlike RIM's story, during the company's downward spiral, was by and large a failure too. It eventually became the core of their massive success. It is not necessarily too late for RIM to turn it around.",1340941837.0
20,4175141,story,,,136,32,ra5cal,"Minitel, France's precursor to the Web, to go dark 30/6/12",http://arstechnica.com/gadgets/2012/06/minitel-frances-precursor-to-the-web-to-go-dark-on-june-30/,,1340941799.0
21,4175140,comment,4174550.0,4174550.0,5,0,dinkumthinkum,,,"To all the people upset about IE8 being the last browser supported on XP ... Isn't that Microsoft's problem rather than JQuery's? Apparently, Microsoft is not interested in providing a modern Web experience to their users.<p>I don't really see the problem anyway. JQuery can move forward, and those that want to support IE8 have JQuery 1.9 and I'm sure there will be a cottage industry of people maintaining updates to support IE8 for the next 20 or 30 years. In the meantime, the rest of the world will be able to move on. Perhaps people could even use UserAgents to provide legacy experiences for the IE8 crowd ... multiple views ... what a concept.",1340941774.0
22,4175139,comment,4171013.0,4174976.0,2,0,zmmmmm,,,"I really don't disagree with anything you've said :-)<p>However a big point of difference is that Groovy's syntax, being 90% compatible with Java, is orders of magnitude more accessible than Clojure to the vast majority of developers.",1340941713.0
23,4175138,comment,4172261.0,4174702.0,1,0,markerdmann,,,"An order of magnitude? Do you really mean that you've seen iOS programmers spend 10x as long on something (e.g. 10 months vs. 1 month)?<p>Let's imagine a simple, specific example: you want to add a button that sends a message to the shared backend and displays an alert upon success. Let's walk through the code.<p>In your web app, you could add an HTML button, style it with CSS, and then use jQuery to send a request and define your success handler. Probably not more than 10 lines and a few minutes (depending on much time you spend with the CSS).<p>In your iOS app, you could add a button with Interface Builder, link it to a method on the relevant view controller that sends an NSUrlRequest, then add a delegate method that displays a UIAlertView when the response returns successfully. Again, not more than 10 lines. And no CSS, thank god. :-)<p>Where is the extra overhead that you're talking about coming from?",1340941702.0
24,4175137,comment,4174384.0,4174384.0,2,0,cageface,,,"I've just started doing consulting for the first time in my life, but it's all remote work which lets me spend all my free time here in lovely Nha Trang, Vietnam. It would appeal much less if I had to travel to client offices all the time.<p>It's too early to tell if this approach really has legs but if I can keep it up it's hard to imagine what would entice me back into a salaried job again.",1340941697.0
25,4175136,comment,4168170.0,4172703.0,1,0,mattgreenrocks,,,"Ah sorry, didn't mean to be condescending. My beef (obviously) is with the downward perception of ""not keeping up."" I see it as unnecessarily judgmental, and I dislike people sticking up for it.",1340941620.0
26,4175135,comment,4172821.0,4174879.0,-4,0,superskrull,,,The best $200 tablet you can buy is a refurb iPad 1.,1340941504.0
27,4175134,comment,4172786.0,4174970.0,2,0,mistercow,,,Mobile market != tablet market,1340941466.0
28,4175133,comment,4170963.0,4171540.0,1,0,eliben,,,"Hmm... right, it was something with a C in it, but not sure what! Come on! Don't you have a constructive comment?",1340941426.0
29,4175132,comment,4169847.0,4171664.0,1,0,nl,,,"Games companies <i>always</i> underpay. It's never financially worthwhile working in that field (except maybe in social gaming if you are in SV)<p>Taking any permanent job as a developer in Australia is almost always a bad move financially. You should be looking at contracting.<p>If you are prepared to work in enterprise software then rates are around $70-$90/hour for mid to high level developers (rates go higher for architect positions too). Contracts typically are 6 months, and almost always are renewed.<p>(These are Adelaide Java rates - East Coast rates are typically $5-10/hour higher, and I've heard Perth rates are higher still)",1340941387.0
30,4175131,comment,4174736.0,4174736.0,1,0,bacon,,,"<a href=""http://www.bonobos.com"" rel=""nofollow"">http://www.bonobos.com</a>",1340941378.0
31,4175130,comment,4173771.0,4173771.0,1,0,notJim,,,"I feel that eBay changed their business model to compete with Amazon, and now I have no idea what their value proposition is. In short, Amazon offers the same things, but with a much, much better experience. Compare [1] to [2]. Both offer the same thing (an iPod), and from a mulitude of sellers. But the Amazon version is cheaper and the page is much easier to understand.<p>[1]: <a href=""http://www.ebay.com/ctg/Apple-iPod-classic-7th-Generation-Black-160-GB-Latest-Model-/85890740?_refkw=ipod+classic&_pcatid=39&_odkw=macbook+air&_pcategid=73839&_osacat=0&_dmpt=Other_MP3_Players"" rel=""nofollow"">http://www.ebay.com/ctg/Apple-iPod-classic-7th-Generation-Bl...</a><p>[2]: <a href=""http://www.amazon.com/Apple-classic-Black-Generation-NEWEST/dp/B001F7AHOG/ref=sr_1_1?ie=UTF8&qid=1340940853&sr=8-1&keywords=ipod+classic"" rel=""nofollow"">http://www.amazon.com/Apple-classic-Black-Generation-NEWEST/...</a><p>eBay was originally a great place to get deals on used goods from their owners, but they mostly abandoned that model several years ago, and became a place to buy things from random sketchy stores. Several times when I've looked on eBay, I've found that many sellers were offering prices <i>greater than</i> normal retail, but with the added bonus [sarc.] of being a much bigger hassle.<p>Beyond that, auctions were kinda fun at first, I guess, but really, because of bidding wars, you often don't save any money, or at least you don't save enough for it to be worth waiting longer, and dealing with greater hassle.<p>For example, if you look again at the eBay page, it looks like if I buy an iPod at auction, I can expect to pay from $210-$220 for it--I don't understand why I would spend the extra time and effort when I'm ultimately only going to save about $10-$20, plus deal with the fact that I'm buying from some random.<p>The thing is, people are still interested in buying used stuff from other people (who are real people). Look at how popular and fun garage sales and flea markets are. There are a lot of challenges to doing this well online, which is why there's no clear winner in this space. (Craigslist is a little differentthey avoid a lot of these challenges since they're local.)",1340941352.0
32,4175129,story,,,1,0,shagerous,Taylormade RocketBallz RBZ Fers 4-9PAS,http://www.golfmagasins.com/Taylormade-RocketBallz-RBZ-Irons-16878.html,Taylormade RocketBallz RBZ Fers 4-9PAS,1340941350.0
33,4175128,comment,4171252.0,4171507.0,5,0,j_camarena,,,Hey stfu! .. haha.. im part of the program and i think it has changed the point of view of some chileans. By now i have done mentorship for two university students and im sure their life-path has changed.<p>One of them has already raised $16k (little but enough for a 2-months project).<p>The other one is still developing the project but at least is working on it :).<p>None of those guys was taking this seriously until they saw young people being part of Startup Chile program. This is just the people i have been in close contact with and im pretty sure there are lots of cases like this ones.,1340941343.0
34,4175127,comment,4172922.0,4175011.0,2,0,rblackwater,,,Correct. Microsoft's OEMs were the real customers and Google's corporate partners are the real customers. Users are the products.,1340941298.0
35,4175126,comment,4172871.0,4173004.0,1,0,freditup,,,I actually haven't been a huge fan of any yet. SublimeCodeIntel hardly works for me (I use Sublime mostly for Ruby). Is Sublime Linter any good for Ruby?,1340941287.0
36,4175125,comment,4174550.0,4174985.0,1,0,gilini,,,"What do you mean by ""comprehensive enough""? Can't you read the code?",1340941273.0
37,4175124,comment,4174284.0,4174284.0,2,0,ChrisNorstrom,,,Beautiful and much better. A little cold and sterile from all the white space but it's a step in the right direction. They'll iron things out over time.<p>ONE thing. Where are the Previous & Next Arrows for the main slideshow?,1340941099.0
38,4175123,comment,4172922.0,4173659.0,2,0,rblackwater,,,"This is great for you, but I think you are one of the outliers.",1340941079.0
39,4175122,comment,4174550.0,4174745.0,2,0,dinkumthinkum,,,"Why are XP users stuck on IE8? (I mean I think there are a myriad of options that are pretty reasonable). It doesn't cost anything or fairly little labor to upgrade to a real browser over the course of a couple years. How far do we take this, why don't we all support IE5? It's time to let it go.<p>You can either stick with JQuery 1.9 for as long as you want to support IE8 (hopefully not more than 10 or 20 more years).",1340941052.0
40,4175121,comment,4174550.0,4174550.0,3,0,elclanrs,,,"I think this is a good move from jQuery. Other popular software/services should do it too, and it'll be THE END of awful IE versions.<p>I still do support IE8 but it is a pain in the ass to have to work around stupid bugs...pseudo elements are not well supported, font rendering is subpar, no css3 support, sloooow JavaScript engine...and I could go on for ever.",1340941045.0
41,4175120,comment,4172786.0,4174490.0,2,0,mbrubeck,,,The restriction on executable pages is enforced by the kernel at the process level. This particular mechanism won't allow for enforcing diffeerent policiees for UIWebView code running in the same process as app code. If UIWebView could run JavaScript code in a separate process like Chrome then it might be possible.,1340941001.0
42,4175119,comment,4173773.0,4174668.0,17,0,oz,,,"Interesting, indeed. The comments on Crackberry are filled with people who were waiting it out, but have now decided to jump ship, mostly to Android.<p>Regarding the pricing, I see from the image that your USD50 plan gets you 1GB data <i>plus</i> unlimited talk and text. The USD17 here is only for the data; voice and text are priced separately. My USD40 plan gets me 165 minutes and 165 text messages, with a subsidised rate for anything exceeding that.<p>Jamaica has 2 mobile carriers, Digicel and LIME (formerly Cable & Wireless). How these two have competed is an absolutely fascinating look at regulation, branding and consumer behaviour .<p>Until 1962, Jamaica was a British colony. Hence, Cable & Wireless, a British company had a monopoly on telecommunications. Like any good capitalist knows, this led to <i>atrocious</i> service. I grew up in rural Jamaica, and we applied for a landline for <i>years</i> before we got it. C&W just didn't care, and, as Jamaican's are wont to do, we gave them our own name: ""Careless & Worthless."" (pronounced 'kayliss' [hard k] and 'wutliss' in Jamaican patois.)<p>In 2000 or 2001, the then People's National Party (PNP) government, under Technology Minister Phillip Paulwell, liberalized the telecoms sector, and granted a cellular license to the Irish-owned Digicel. Digicel launched in April 2001. 100 days later, they had 100,000 customers. Literally 1000 customers per day, in a country of population 2.8 million. (Take that, SociaLocoMobi startups :))<p>People <i>flocked</i> to Digicel. I mean, it was just amazing. Soon, people with C&W phones were few and far between. Digicel introduced GSM technology (as opposed to C&W's TDMA), per-second billing, Pay As You Go (you buy prepaid cards at retail stores, corner shops and street vendors.) They drove home their advantage with excellent marketing - they branded themselves as 'young' and 'hip' as opposed to the 'old' and 'stodgy' C&W. They sponsored football. They sponsored cricket. They sponsored track and field (They have sponsored Usain Bolt for years). Their coup de grace was the talent competition 'Rising Stars', - American Idol meets Jamaican music. It was, and is, a <i>phenomenal</i> success, and has launched the careers of major artists in Jamaica, such as Christopher Martin and Romain Virgo.<p>Digicel was, and still is mostly viewed as Jamaica's 'Mobile Messiah'. They 'saved' us from the eternal damnation of C&W.<p>Digicel was on top, and C&W was forced to respond.<p>C&W did this by upgrading to GSM in July 2003, and rebranding as 'bmobile'. For weeks, there were flyers in the shape of the power symbol on your laptop everywhere, with the cryptic message ""Get ready to be switched on."" No one knew what it was, until the public was invited to an event. 'Twas a huge event - airshow with stunts, the whole shebang. It signaled the start of an era where C&W would spend hundreds of millions of dollars in marketing trying, but failing, to regain market dominance. Quite simply, Jamaicans hated C&W. They replaced about 6 CEOs in a few years.<p>The kicker is that after this new rebranding, C&W provided better value. Calls were cheaper. Data (GPRS) was cheaper. But the public simply did not care. My older sister, for example, could not be <i>paid</i> to switch from Digicel, and many people share that sentiment. C&W, now bmobile, was in decline. But they would not bow out without a fight.<p>They rebranded as LIME (Landline, Internet, Mobile, Entertainment) in 2008, and introduced 3G. But they still could not compete, and continued to rack up losses.<p>But something was amiss, which was not widely known until late last year: When the telecom sector had been liberalised, the regulatory body, the OUR (Office of Utilities Regulation), had decreed that Digicel be granted favourable interconnect fees, so that C&W could not force them out by charging them exorbitant fees to connect to their network. However, Digicel was allowed to charge C&W very high interconnect fees. This was only supposed to last for a few years at most, but continued until a few weeks ago!<p>As a result of that disparity in interconnect fees, those with C&W phones found it very expensive to call Digicel subscribers, providing them with even more incentive to switch.<p>Late last year, the PNP was returned to power, and Phillip Paulwell reinstated as Technology Minister. One of the things he has done recently is to set a standard interconnect rate. LIME capitalized by slashing rates across the board, and Jamaicans rejoiced and are finally paying attention. Digicel responded by taking the OUR to court, arguing that procedure was breached. It is still before the courts, but the act has cast a negative light on Digicel. They responded a few days ago by launching the 'Sweet' plan with massively reduced call rates, but per-minute billing and reduced free offers. So the air is rife with the scent of competition, as both of them are gearing up to do battle, to the benefit of Joe Consumer.<p>A few days ago, when they launched the 'Sweet' plan in reaction to LIME's rate slash, they took their street team to middle of New Kingston, the business district, and had dozens of people dancing, and handing out flyers. Apparently, LIME got wind of it, and rounded up their own street team to make their presence felt. I'm told that due to the some police presence, they were not able to do so.<p>Very, very interesting times are head. And I'm <i>loving</i> it.<p>NB. I'm not a supporter of the PNP; but the facts are the facts - they did a better job than the Jamaica Labour Party (JLP) where telecoms are concerned.",1340940980.0
43,4175118,comment,4172871.0,4173977.0,1,0,desireco42,,,"Thanks for the tip, I will check it out.",1340940976.0
44,4175117,story,,,1,0,saberrabia,      ,http://www.shbabsmart.net/vb/showthread.php?t=31663,,1340940938.0
45,4175116,comment,4172922.0,4173673.0,2,0,azylman,,,"Were you a free user of Google App Engine? Unless you weren't, your comment is irrelevant. And if you weren't, you'd be in the minority of paying users who have customer service issues... For example, I, as a paying Google Apps user, have a 24/7 support line I can call.",1340940913.0
46,4175115,comment,4171797.0,4173813.0,7,0,rdl,,,"I think you mean integrity, not ingenuity.",1340940873.0
47,4175114,comment,4174384.0,4174878.0,1,0,msellout,,,"Consulting is a good way to end up as a ""Sr. Manager"" or ""Director"" at some mega-corp. If you like that kind of thing.",1340940832.0
48,4175113,comment,4174643.0,4174643.0,4,0,izak30,,,"Interesting concept, I have a couple questions:<p>* If you couldn't hire a strong sales team, what makes the team you just hired any good?\n* How do you handle things like company culture? For sales-oriented businesses, the salesperson is the first contact, and the face of the business to the customer, do you try to integrate anything? are you white-label or upfront that you're outsourced sales?\n* What about sales engineering? Sales can be technical, how is that handled?<p>I think that qualified lead-generation is slightly more interesting to me than getting sales. Warm leads would be fantastic.",1340940804.0
49,4175112,story,,,1,0,smcknight2,Ask HN: Dealing With Non-technical Founders,,"Hello,<p>I work at a startup where there is no technical founder and it's near impossible to sell the idea of taking time in rewriting or refactoring features.  The reason why I say we have to rewrite or refactor a lot of code is because we change direction so often, which results in just hacking things together.  So there is pressure of getting features done as fast as possible and scope change.To top it off, having unit tests has been frowned upon because it's development time that could be spent on producing something that will actually be used by the customer.  I can't be the only one that has this frustration, how do you sell maintainability and rewrites?",1340940710.0
50,4175111,comment,4172922.0,4174849.0,5,0,azylman,,,"I've also had experience like that when I was developing with one of their APIs (specifically, Blogger). Basically, it was when they were rolling out a brand new version of their Blogger API and the documentation was outdated.<p>I was trying to get it to work and one of their developers looked at my code and helped me get it running.",1340940702.0
51,4175110,comment,4172261.0,4174076.0,1,0,pm,,,"This is assuming the product you are developing is a consumer product with the intetion of marketing through an app store of some kind.<p>There are plenty of app markets for which an app store is only a method of distribution (the only one, really), and sales/marketing is handled in the traditional manner.",1340940657.0
52,4175109,comment,4174550.0,4174938.0,18,0,nowarninglabel,,,>A person that behind the times isn't going to buy anything on the internet anyway.<p>Do you actually have some data to back that up? Because all the data I've seen says the exact opposite to what you are saying.,1340940640.0
53,4175108,comment,4174612.0,4175085.0,1,0,diegogomes,,,"Well, i know it is a prototype. But a camera attached to a pair of glasses? I really expected more, even for a preview.",1340940639.0
