,ID,Type,Story,Parent,Points,Comments,Author,Title,URL,Content,Created
102,9972992,comment,9972275.0,9972275.0,0,0,CyberFonic,,,"Go is a compiled language and is easily used in a cross-compiled situation.  The executables are single image with no dependencies on external libraries.<p>Python is interpreted and deployment requires a large-ish runtime environment as well as making decisions about v2 vs v3.  You can use virtualenv to address these and related issues.<p>Personally, I like Go, but keep ending up using Python and JavaScript far more often.",1438225727.0
103,9972990,comment,9970844.0,9970844.0,0,0,efsavage,,,To me the value in a take-home test is in smoke testing what the applicant said they are familiar with.  We once accidentally hired someone once who talked the talk but didn&,
104,9972988,comment,9971412.0,9971880.0,0,0,chrisacree,,,From what I&,
105,9972986,comment,9971888.0,9972896.0,0,0,ikeboy,,,> How does this follow from what I said?<p>You said &quot;humans are not threatened by the former&quot;. Not threatened implies that they can&,
106,9972985,story,,,8,0,mcfunley,Targeting Broad Queries in Search,https://codeascraft.com/2015/07/29/targeting-broad-queries-in-search/,,1438225562.0
107,9972984,comment,9971946.0,9972932.0,0,0,onion2k,,,It wouldn&,
108,9972983,comment,9971867.0,9971867.0,0,0,robotlaunch,,,It&,
109,9972982,comment,9969890.0,9970272.0,0,0,lmg643,,,"I recently discovered the joys of ExcelDNA, which lets you do spreadsheet extensions using C",
110,9972981,comment,9969576.0,9972093.0,0,0,deciplex,,,"I made a game for Android phones a few years back that would instantiate, at peak, a few thousand agents that would roam around an artificial environment, devouring renewable resources, before (maybe) reproducing and eventually dying off. So these agent instances were being continually created and destroyed, and the GC lag absolutely killed performance and made the game totally unplayable. It was unplayable even on a Galaxy S2 - a reasonably high-performance phone at the time. Once I implemented object pooling to handle the creation and destruction of these agents, the game ran very smoothly on an S2, and I could even run the smaller simulations on an old HTC Magic I had lying around. It made an enormous difference.",1438225359.0
111,9972980,comment,9972860.0,9972860.0,0,0,dang,,,"Url changed from <a href=""http://en.wikipedia.org/wiki/Darwin_among_the_Machines"" rel=""nofollow"">http://en.wikipedia.org/wiki/Darwin_among_the_Machines</a>, since the original source is online.<p>More about Samuel Butler: <a href=""https://en.wikipedia.org/wiki/Samuel_Butler_(novelist)"" rel=""nofollow"">https://en.wikipedia.org/wiki/Samuel_Butler_(novelist)</a>. Has anyone here read his novels?",1438225329.0
112,9972979,comment,9970844.0,9972664.0,0,0,thedufer,,,I&,
113,9972978,comment,9970844.0,9972373.0,0,0,dntrkv,,,Putting any time constraints on a dev test is a bad idea in my opinion. It&,
