,ID,Type,Story,Parent,Points,Comments,Author,Title,URL,Content,Created
0,9548873,comment,9548323.0,9548781.0,0,0,mikeschinkel,,,+1,1431662394.0
1,9548872,story,,,11,1,Manishearth,Updates on Servo,http://blog.servo.org/2015/05/24/twis-32/,,1431662394.0
2,9548871,comment,9541381.0,9543132.0,0,0,Everlag,,,"In terms of events, isn&",
3,9548870,comment,9545647.0,9546533.0,0,0,Manishearth,,,Go&,
4,9548869,comment,9547208.0,9548232.0,0,0,ridgeguy,,,I was very curious about &quot;the only approved outdoor LINAC...&quot;.<p>I presume it&,
5,9548868,comment,9544455.0,9548719.0,0,0,anon4this1,,,"If the govt offers subsidies/handouts/contracts, then you take them.  It is simply good business, whether you need them or not.",1431662193.0
6,9548867,comment,9548323.0,9548749.0,0,0,cyri,,,I&,
7,9548865,comment,9548323.0,9548749.0,0,0,girvo,,,That&,
8,9548864,comment,9471287.0,9472656.0,0,0,coreycross,,,Best company video I&,
9,9548863,comment,9548267.0,9548776.0,0,0,jmenn,,,You may be interested in Matthew Kirschenbaum&,
10,9548862,comment,9547479.0,9547479.0,0,0,PebblesHD,,,The tone of this article seems to make out like vegetarianism isn&,
11,9548861,comment,9544455.0,9544455.0,0,0,anon4this1,,,"Luck?<p>You can become a millionaire or even a billionaire by luck.<p>Risking an entire 9 figure fortune in order to run both \n 1) a business that most at the time thought was impossible (mass produced electric cars)\n 2) a space company that most at the time thought was impossible to do without being a nation state<p>and managing to against the odds make both of them succeed and become 11 figure companies is not luck. it is immeasurable slog, vision and competence.<p>there are tens of thousands of people worth hundreds of millions and ~1500 billionaires on earth, can you name a single one taking anything like the risks and producing the results elon is producing?",1431661987.0
12,9548860,comment,9542132.0,9545159.0,0,0,dsacco,,,"With respect, this says more about you than it does about your lack of degree. In our field, not having a degree is no longer stigmatized.<p>I can immediately think of five people who dropped out of college (or never even attended) and now make $300k+ per year in salary. None of them are famous. None of them got rich with a startup. They just worked hard in places like Google. These are people I have met or worked with who followed a typical career progression to its logical mid-late career conclusion.<p>I don&",
13,9548859,comment,9545085.0,9548725.0,0,0,arikrak,,,Or if people are any indication..\n(though the economy depends on that),1431661965.0
14,9548858,comment,9548323.0,9548764.0,0,0,girvo,,,"Right, but that&",
15,9548857,comment,9544807.0,9544807.0,0,0,kaptain,,,The tragedy here is that the political climate of China will hamstring the usefulness of this achievement. Baidu&,
16,9548855,comment,9545085.0,9548624.0,0,0,arikrak,,,There were a whole bunch of articles a while ago about the rise of using SWAT teams for all sorts of arrests. Think from the officers&,
17,9548854,comment,9548323.0,9548837.0,0,0,shampine,,,"Our boilerplate does a pretty good job of hiding that we are using WordPress. The only way you can tell via source is W3 Total Cache writing out a comment to the bottom of the page. Oh and WordPress SEO (Yoast) is a dead giveaway too. We see nowhere near the number of bots that our non boilerplate sites do.<p><a href=""https://github.com/GunnJerkens/wp-boilerplate"" rel=""nofollow"">https://github.com/GunnJerkens/wp-boilerplate</a>",1431661779.0
18,9548853,comment,9544933.0,9548754.0,0,0,antiuniverse,,,Even treadmill desks are coming under fire now... it seems you just can&,
19,9548852,story,,,1,0,bootload,"While unemployment falls, unemployment of diverse segments rises",https://medium.com/diversify-tech/while-unemployment-falls-unemployment-of-diverse-segments-rises-331a48b5e4d6,,1431661713.0
20,9548851,comment,9545540.0,9545540.0,0,0,snaky,,,Maybe flexible context-aware mixing of the type systems (including an absence of the one) is the answer?<p>They said in Shen it&,
21,9548850,comment,9544455.0,9548536.0,0,0,levlandau,,,"&quot;Musk is no different from the huge number of people involved in startups except that he is investing more money. Many of us are investing all of our valuable time and money in risky ventures instead of saving and taking the rational path in life.&quot;<p>Seriously? Like Are you actually serious when you write this? You seriously believe that the <i>only</i> difference between Musk and the huge number of people working on startups is that he is investing <i>more</i> money?<p>You do not think that it has something to do with working on hard problems that nobody thinks are worthwhile until later on. You also do not think it has to do with him actually solving said hard problems. You also do not think it has anything to do with him being smart enough to manage multiple fields like a physics, computer science, engineering and design and have in depth discussions about rockets and space explorations at the same level as he can about electric cars and software? You also seriously believe that someone who is motivated by money would go and try to start a private rocket company that can deliver people to Mars and is reusable? Seriously? They wouldn&",
22,9548849,comment,9547939.0,9548445.0,0,0,hartror,,,It isn&,
23,9548848,comment,9545252.0,9545252.0,0,0,tonteldoos,,,"This seems really nice (and will work well with my wiki-ing everything lately).  However, as another poster pointed out, A$65 is somewhat steep for something that won&",
24,9548847,comment,9548323.0,9548784.0,0,0,gnaritas,,,"> Besides PHP serves the largest website on Earth (Facebook) and a good 20% or more of the rest (via Wordpres, Drupal et al).<p>Popular != good.  None of those points mean anything, PHP is still a badly designed language that lacks consistency and makes language designers feel like puking.  It&",
25,9548846,story,,,1,0,bootload,Fraudsters Locate a New Frontier,http://adexchanger.com/ad-exchange-news/fraudsters-locate-a-new-frontier/,,1431661553.0
26,9548845,comment,9548323.0,9548594.0,0,0,imakesnowflakes,,,"> modern PHP is a fine language.<p>I am sorry, but bolting on a ton of &",
27,9548844,comment,9544455.0,9547605.0,0,0,seesomesense,,,"&quot;With Jobs gone, we need a new hero-inventor to worship.&quot;<p>Like Jobs and Munk, it is even better if the &quot;hero-inventor&quot; did not invent a single thing.",1431661389.0
28,9548843,comment,9544933.0,9548555.0,0,0,hoopd,,,I can&,
29,9548842,comment,9548842.0,9548841.0,0,0,ppymou,,,Wrote this with friend as a learning project for golang. Any golang tips would be much appreciated.,1431661357.0
30,9548841,story,,,13,10,ppymou,Show HN: Godray – a simple ray tracer,https://github.com/LanJian/godray,,1431661352.0
31,9548840,comment,9544455.0,9548662.0,0,0,seesomesense,,,&quot;The Indian Space Research Organisation (ISRO) completed the Mars Orbiter Mission with a budget of just $74 million&quot;,1431661287.0
32,9548838,comment,9543144.0,9544971.0,0,0,logicchains,,,"I suspect if you compared the relative number of people studying those topics now to fifty years ago, there&",
33,9548837,comment,9548323.0,9548789.0,0,0,jbeales,,,It doesn&,
34,9548836,comment,9546382.0,9547621.0,0,0,Manishearth,,,Pedantry: Even C++ has a runtime (so does Rust); they&,
35,9548835,story,,,11,0,boynamedsue,Disrupters disrupted,http://www.economist.com/news/finance-and-economics/21651248-industry-specialises-spotting-potential-insurgents-faces-some-its,,1431660901.0
36,9548834,comment,9548323.0,9548665.0,0,0,PebblesHD,,,"well said. Personally I like the file based routing solution (Multiple scripts for individual tasks) where applicable, there are benefits to multi-function scripts but I like modularity. If i&",
37,9548833,comment,9548801.0,9548801.0,0,0,wwweston,,,">&quot;The black lungs of heavy smokers I would weigh once, then squeeze under cold running water for fifteen minutes until they became baby pink and tripelike, and then weigh again: the difference in the two figures, often a couple of pounds or more, was the weight of the tar and nicotine that quite possibly was the killer.&quot;<p>A few <i>pounds</i>? If you&",
38,9548832,comment,9545252.0,9548732.0,0,0,techdragon,,,Serious question: Does it work for anyone ?,1431660824.0
39,9548831,comment,9545540.0,9545540.0,0,0,white-flame,,,"In the introspective human experience, classification comes from observation.<p>First, we have a unique exemplar.  This is the first thing we see of whatever &quot;type&quot;.<p>Then, we notice a similarity of something else to the exemplar.  The exemplar defines the &quot;type&quot;, and this new object is classified as similar, usually with some amount of noted variance.<p>Once we notice a large number of similar observations, we tend to back away from a single exemplar, to a more nebulous classification defined by mostly-present similarities in that rough group.  The &quot;exemplar&quot; of the type is now a more vague ideal, not any particular instance.<p>This is the point at which we try to nail down exact types, to attempt to again make concrete the exemplar of the type, but fall short in the ways similar to what the author brings up.  The similarities we observed were because in some particular context, the similarities of the rough group of type members are important, while their differences are less relevant.  In another context, these differences might become more important, and the similarities binding the classified population together for the defined type are no longer relevant.<p>The &quot;type&quot; is NOT a feature of the object, but emerges in the combination of a cloud of objects with the context in which the type is useful.<p>One common example is defining &quot;car&quot;.  Is a pickup truck a car?  If not, what about an El Camino?  An 18-wheeler?  A van?  Minivan? A 3-wheeled vehicle?  Enclosed motorcycle variants?  Race cars?  Go-karts?  Remote controlled cars?<p>Across the contexts of personal transport, convenience, repairs, insurance, speed/handling performance, etc, the similarities between vehicle types vary.  Those vehicle instances which are of similar type in one context might not be of similar type in another context.  What is exactly meant by &quot;car&quot; with no additional context?<p>I do a lot of AI work, particularly rational and symbolic.  This needs to know, reason about, and explain particulars, not just return an unexplained impression of relevant associations as a lot of modern AI momentum deals with (successfully, I might add).  But the notion of a &quot;concept&quot; or a &quot;type&quot; is certainly contextual, and relates to how the cloud of potential exemplars offer important characteristics to the current context.  I have discarded the notion of explicit programming-language style &quot;type&quot; in my work, as far as the &quot;understanding&quot; part of AI goes, in favor of a more vague &quot;concept&quot; existing in a contextual cloud of exemplars, in pursuing a more hybrid classical/symbolic + modern/statistical AI approach.  (The underlying implementations dealing with generating and compiling source code still has distinct data types, though.)",1431660805.0
40,9548830,comment,9548323.0,9548771.0,0,0,thesimon,,,"Not OP, but <a href=""http://jekyllrb.com/"" rel=""nofollow"">http://jekyllrb.com/</a> and ghost are both great.",1431660754.0
41,9548829,comment,9548323.0,9548771.0,0,0,dotBen,,,"WP Engine (<a href=""http://WPEngine.com"" rel=""nofollow"">http://WPEngine.com</a>) laregly solves any of these lingering concerns, or makes them irrelevant.  It is also relied on by many, many Fortune 500&",
42,9548828,comment,9547939.0,9548172.0,0,0,kmtrowbr,,,"No kidding. The debate here is a pretty funny. Make things as RESTful as you can and, by all means add additional verbs where necessary (cancel, empty, etc). The point is for your API to be easy to understand and to use by making it more like human language.",1431660727.0
43,9548827,story,,,1,0,whoismyjavas,Writing a Combinatorics Module for Math.js,http://www.devanpatel.me/writing-a-combinatorics-module-for-math-js/,,1431660647.0
44,9548826,comment,9548053.0,9548360.0,0,0,saryant,,,United doesn&,
45,9548825,comment,9544145.0,9545948.0,0,0,baldfat,,,"For the person who down voted and think I am wrong:<p><a href=""http://www.gnu.org/philosophy/selling.en.html"" rel=""nofollow"">http://www.gnu.org/philosophy/selling.en.html</a>",1431660614.0
46,9548824,story,,,8,3,msoad,Ask HN: What it is like to join a startup founded by serial entrepreneurs?,,Have you worked for a startup founded by serial entrepreneurs that sold a couple of startups to big companies and started a new one with that money? Since they don&,
47,9548823,comment,9547125.0,9548779.0,0,0,wheaties,,,Ditto. Every time I take off and I&,
48,9548822,story,,,4,0,hippich,New Alzheimer’s treatment restores memory function in mice,http://www.sciencealert.com/new-alzheimer-s-treatment-fully-restores-memory-function,,1431660562.0
49,9548821,comment,9548197.0,9548361.0,0,0,lern_too_spel,,,It&,
50,9548820,comment,9544030.0,9546486.0,0,0,SamReidHughes,,,I got this email too.  I&,
51,9548818,comment,9547125.0,9548559.0,0,0,csirac2,,,"The technical limitation is the basic geometry of GPS. Satellites are at ~20,000km, aircraft at ~10km max. And you want 0.0003km resolution in altitude. We barely even have 0.003km in the lat/long plane, and it&",
52,9548817,comment,9548323.0,9548749.0,0,0,sluckxz,,,"Ghost is coming along very nicely.  From what I have followed from their development I have seen very thoughtful developers from the start.<p>edit to add\n<a href=""https://github.com/TryGhost/Ghost"" rel=""nofollow"">https://github.com/TryGhost/Ghost</a>",1431660375.0
53,9548816,comment,9548323.0,9548791.0,0,0,stephentmcm,,,For Mummy-blogger&,
54,9548815,comment,9548323.0,9548705.0,0,0,krapp,,,"One of the biggest strengths of Wordpress is also a fatal flaw - the flexibility of its plugin system, and how easy it makes finding and installing plugins and themes. Each is its own self-contained web application that runs with the same permissions as the application itself.<p>Yes, this applies to any open source application, but given how huge Wordpress&",
55,9548814,comment,9534310.0,9540742.0,0,0,gnaritas,,,And experience says the emotional one is more effective because most people are primarily emotional creatures.  Nice and assertive doesn&,
56,9548813,comment,9544455.0,9548698.0,0,0,mozumder,,,Doesn&,
57,9548812,comment,9546311.0,9547717.0,0,0,steveax,,,"Yeah, Benetech is a great outfit. I had the privilege of doing the front end work for the Bookshare.org website when they revamped it in 2007. Was a fun project and we got tons of good feedback during development from a terrific community of users. Highly recommend Bookshare.",1431660291.0
58,9548811,comment,9545659.0,9548324.0,0,0,cjensen,,,"You came close to the truth when you said &quot;Are there any surveys which suggest numbers of bees and wild bees have improved in Europe since the ban?&quot;<p>The European Ban is a gigantic experiment. Either it will clearly demonstrate that Neonicotinoides are a problem, or that they are a scapegoat.<p>The Europeans have a history of banning things without scientific evidence like BGH and GMO. In this case it&",
59,9548810,story,,,1,0,karlheinz_py,A simple demo showing how to encrypt a message using XOR,http://karlheinzniebuhr.github.io/en/2015/05/14/XOR-encryption-demo.html,,1431660229.0
60,9548809,comment,9547939.0,9548762.0,0,0,Programmatic,,,My first approach for this is to POST to a reboot/ resource which gives you a reboot/123 ID that you can continue to do a GET against to see the status of the reboot (did it start OK?  Is the machine back up?).,1431660201.0
61,9548808,comment,9548323.0,9548594.0,0,0,NDizzle,,,I was wary of the Wordpress auto update changes starting with I think 3.8.<p>Right out of the gate they updated the $post object in a way that broke existing installations.<p>That was what got me off wpengine and off wordpress entirely. I was tired of the updates breaking existing functionality in a way that made me have to think about it.,1431660190.0
62,9548807,story,,,1,0,Artemis2,"DigitalOcean responds to VENOM, the QEMU VM escape exploit",https://www.digitalocean.com/company/blog/update-on-CVE-2015-3456/,,1431660173.0
63,9548806,comment,9547939.0,9548563.0,0,0,arde,,,"Exactly. Action is imperative, not functional.",1431660144.0
64,9548805,comment,9544455.0,9544455.0,0,0,eellpp,,,"There are lots of point of views around the thoughts:<p>- He did not invent anything<p>- He had privileged background, education and luck<p>- He takes extreme risk but has background to fall upon\netc etc ... So he is not great or a hero.<p>The fact of matter is that he has a personality and attitude for getting things done. He dreams of something, faces extreme challenges but still pursues it and gets it done.\nWhat matters is this attitude of never giving up. The extreme odds against which the person fights, makes him stand apart. But people with similar attitude, fighting against extreme odds can be found in all walks of life. Whether we find that narrative interesting or not depends on &quot;our&quot; background/interest etc.<p>Example could be someone with no means for basic education and learns on his own to become a great mathematician(or a architect who turns desert into greenfield) or someone who becomes a great artist/sportsman/writer(basically excellence in anything) against extreme odds.<p>I bet people with this kind of attitude don&",
65,9548804,comment,9547939.0,9548297.0,0,0,coldtea,,,><i>One point of doing REST instead of RPC is because you shouldn&,
66,9548803,comment,9547539.0,9548518.0,0,0,NickNameNick,,,The nice thing about warm-blooded animals targeting a narrow body temperature range is that our genetic and protein structures can be much simpler.<p>A cold blooded animal has to have a wide selection of proteins to do the same job at different temperatures. A warm blooded animal needs just one.,1431659991.0
67,9548802,comment,9546451.0,9548060.0,0,0,pen2l,,,"xmms, audacious, etc.<p>When I went from win -> nix so many years, all I wanted was a music player with the interface that of winamp2. xmms gave that and I was happy.<p>But then I discovered mpd+ncmpcpp. Really great if you have large music collections, have been using it since.",1431659984.0
68,9548801,story,,,277,94,Petiver,"In 1962, a college student answers an ad: “Mortuary Assistant required”",http://laphamsquarterly.org/roundtable/my-first-mistake,,1431659982.0
69,9548800,story,,,3,0,npguy,Algorithms Are Eating the World,http://statspotting.com/algorithms-are-eating-the-world/,,1431659954.0
70,9548799,comment,9548323.0,9548647.0,0,0,punjabisingh,,,"The bugs are coming from everywhere.<p>In my view, the worst ones are the ones coming from core. They&",
71,9548798,comment,9547125.0,9548559.0,0,0,sokoloff,,,"The most unassailable answer is that the procedures were worked out before GPS equipped airplanes were in the fleet, and even today, GPS is not required equipment for flight in the flight levels (and many older jets are not equipped, especially older freighters).<p>Other reasons are: the transponders that ATC (and other aircraft) interrogate report pressure altitude (uncorrected, meaning using 29.92 inHg as the standard).<p>A sensitive altimeter can be had for a few hundred dollars and requires no electrical power (unless lighted) and basically no service throughout its life.<p>To your last point, anywhere it matters (below the flight levels), pilots are using a local altimeter setting on the altimeters, often from the ATIS (automated terminal[&quot;airport&quot;] information system) or from ATC. Of course, for takeoff, it doesn&",
72,9548797,comment,9544685.0,9544907.0,0,0,likeaboss,,,"Thanks, I have looked into that before making my own solution, we prefer self-hosted solution.",1431659710.0
73,9548796,comment,9546382.0,9547155.0,0,0,dbaupp,,,"Bindgen has a compiler plugin too: <a href=""https://github.com/crabtw/rust-bindgen",
74,9548795,story,,,1,0,rssems,The Net Awards 2015 – Voting Started,http://thenetawards.com,,1431659686.0
75,9548794,comment,9548323.0,9548323.0,0,0,cthalupa,,,"People always beat up on software that has security vulnerabilities.<p>The thing is, the auto update feature is not an affirmative defense for the criticism. There are probably plenty of legitimate defenses out there - developing secure software is quite obviously something that is hard to get right.<p>But offering auto-updating is only a defense against arguments claiming that updating WordPress is a pain in the ass, not people claiming that the codebase has lots of security flaws.<p>You also can&",
76,9548793,comment,9546162.0,9546162.0,0,0,leesalminen,,,Found a bug in the app that allowed me to get the pro version without paying. Email is in my profile if you want to chat. Would prefer to not make it public info :),1431659670.0
77,9548792,story,,,3,0,jgrosecl49,Angie: An AngularJS Inspired Node.js MVC,http://benderthecrime.github.io/angie,,1431659669.0
78,9548791,comment,9548323.0,9548582.0,0,0,coldtea,,,><i>Hosting a website is not a fun weekend project you get from Target/Walmart as a DIY kit.</i><p>Why? It&,
79,9548790,comment,9546311.0,9546716.0,0,0,social42,,,I&,
80,9548789,comment,9548323.0,9548717.0,0,0,edgarvaldes,,,What plugin are you using to &quot;hide&quot; Wordpress?,1431659539.0
81,9548787,comment,9545972.0,9548741.0,0,0,bobbles,,,"Exactly, you could have every window and door barricaded up with steel and someone could still come along, take some tiles off the roof and get in easily that way.",1431659517.0
82,9548786,comment,9548323.0,9548323.0,0,0,DigitalSea,,,I think Wordpress gets a lot of unfair blame. I often see the size of its code-base touted as one of the reasons to avoid its use. It seems the general consensus amongst a lot of developers out there is that Wordpress isn&,
83,9548785,comment,9547101.0,9547101.0,0,0,wodenokoto,,,How does it handle<p><pre><code>    <tag id=&quot;1&quot;> data </tag>\n\n?</code></pre>,1431659481.0
84,9548784,comment,9548323.0,9548674.0,0,0,coldtea,,,><i>WordPress&,
85,9548782,comment,9548323.0,9548765.0,0,0,8ig8,,,I&,
86,9548781,comment,9548323.0,9548765.0,0,0,jacques_chester,,,> <i>Most people</i><p>We in technology are not &quot;most people&quot;.,1431659297.0
87,9548780,comment,9544455.0,9547493.0,0,0,technomancy,,,"Compared to those stuck in poverty, computing can recover with relative ease from that kind of setback. Computing has boatloads of money and loads of momentum to overcome obstacles; people in poverty only have despair and oppression.",1431659264.0
88,9548779,comment,9547125.0,9547125.0,0,0,MichaelGG,,,I started studying to fly when I was 16. Judge preemptively revoked my driver&,
89,9548778,story,,,2,0,MichaelAO,Crazy Way to Paint Patterns on 3-D Objects Is Like a Cartoon Come to Life,https://www.fastcodesign.com/3046264/this-crazy-way-to-paint-patterns-on-3-d-objects-is-like-a-cartoon-come-to-life?partner=rss,,1431659248.0
90,9548777,comment,9544455.0,9548124.0,0,0,joesb,,,"With this logic, you are simply making argument that those making any pre-required invention is more important than any later invention.<p>Try making light bulb without glass blowing knowledge. \nTry making light bulb without electricity. \nTry making light bulb without food and water.<p>Of course, you can&",
91,9548776,comment,9548267.0,9548267.0,0,0,malchow,,,"Love to learn what biblio scholars think of the digital age. It strikes me that though we have mastered highly persistent and physically robust methods of data storage, the machine languages we actually consume and transact in shift so rapidly. . . digital data strikes me as actually far, far more delicate and ephemeral than ink on paper.",1431659214.0
92,9548775,comment,9546311.0,9546311.0,0,0,chanux,,,"There was this discussion on HN about the work of a guy who built an e-ook reader for his nearly bling uncle.<p><a href=""https://news.ycombinator.com/item?id=8177117"" rel=""nofollow"">https://news.ycombinator.com/item?id=8177117</a>",1431659175.0
93,9548774,comment,9546451.0,9547786.0,0,0,JohnTHaller,,,Considering that a good many &quot;music player&quot; are basically written atop browser rendering engines... they&,
94,9548773,story,,,4,2,uladzislau,Amtrak Says Shortfalls and Rules Delayed Its Safety System,http://www.nytimes.com/2015/05/15/us/amtrak-says-it-was-just-months-away-from-installing-safety-system.html,,1431659135.0
95,9548772,comment,9545085.0,9548624.0,0,0,sliverstorm,,,Sounds more like the old adage about how when you&,
96,9548771,comment,9548323.0,9548594.0,0,0,JonLim,,,Honest question: for the rest of us who can&,
97,9548770,comment,9548323.0,9548323.0,0,0,jqm,,,"Updating plugins often breaks things. For instance, I updated our AD plugin for a company blog a few days ago and no one could log in. I had to do some research and eventually the plugin was rolled back from backup.<p>Can&",
98,9548769,comment,9538258.0,9543129.0,0,0,dorfsmay,,,Weird for a service that wants to be universal and independent...,1431659109.0
99,9548768,comment,9546609.0,9547945.0,0,0,shoo,,,"I like your point about software for ML, vs software for decision making. I reckon there is a lot of existing software for decision making, but it is focused around particular domains/industries. A few months ago there was some news about a new startup offering experimental design as a service -- that&",
100,9548766,comment,9544939.0,9544939.0,0,0,aceperry,,,"Unfortunately, I can&",
101,9548765,comment,9548323.0,9548749.0,0,0,ceejayoz,,,"Most people would be fine with a static site generator like Jekyll and a third-party commenting system like Facebook or Disqus. As a bonus, it costs pennies to host such a thing on S3.",1431658966.0
