,ID,Type,Story,Parent,Points,Comments,Author,Title,URL,Content,Created
0,8171376,comment,8170318.0,8170318.0,3,0,monochromatic,,,> The patent behind all these lawsuits is not particularly innovative. It claims something about sending notifications after an emergency phone call. Here’s the gist from one of the figures . . . .<p>This is a little disingenuous. You know the patent doesn&,
1,8171375,comment,8171340.0,8171340.0,98,0,glurgh,,,"<a href=""http://toastytech.com/guis/ns08.html"" rel=""nofollow"">http://toastytech.com/guis/ns08.html</a><p>NextStep 0.8, &",
2,8171374,comment,8171340.0,8171340.0,4,0,bemmu,,,"In the Atari TOS screenshots, other icons such as arrows are black on white background.<p>If the icons in upper left and right are also like that, then the upper left icon is actually four little triangles pointing inwards and not an X. The one on the right is four little triangles pointing outwards.<p>(Or it could be an X)",1407902207.0
3,8171373,comment,8168701.0,8168701.0,1,0,avmich,,,"Esoterrorism is at the end of <a href=""http://codon.com/programming-with-nothing"" rel=""nofollow"">http://codon.com/programming-with-nothing</a> - nice FizzBuzz version...<p>What is YARV? :)",1407902197.0
4,8171372,comment,8171340.0,8171340.0,6,0,lukeh,,,Also: NEXTSTEP.,1407902084.0
5,8171371,comment,8168569.0,8171326.0,1,0,comex,,,"> Under a complex set of internal timing conditions and system events, software using the Intel TSX (Transactional Synchronization Extensions) instructions may result in unpredictable system behavior.<p>Yeah, that&",
6,8171369,story,,,81,6,digital55,"Hearing Music in Noise, Martin Hairer Wins the Fields Medal",http://www.simonsfoundation.org/quanta/20140808-in-mathematical-noise-one-who-heard-music/,,1407901909.0
7,8171368,comment,8169367.0,8170549.0,0,0,kamaal,,,Successful people in Individually dominated professions become successful due to their own efforts. That&,
8,8171367,comment,8170283.0,8170927.0,1,0,Pxtl,,,"Ceramic floors beat the glass bottle.  Also, they leave dents in hardwood floors.  Still worth using, just keep their limits in mind.",1407901799.0
9,8171366,comment,8166701.0,8169281.0,2,0,imrehg,,,"Geez, same TIL, and I didn&",
10,8171365,comment,8162942.0,8163714.0,1,0,phfez,,,"I tried to comment the other day, but apparently I met my quota for replies.... but I wanted to respond to this.<p>You are making assumptions incorrectly.  You are determining right from wrong, good from bad, and everything else for someone that you don&",
11,8171364,comment,8167539.0,8171115.0,1,0,corysama,,,"The HN community takes a rather strict approach when moderating comments that contribute noise to the conversation. &quot;Nice article!&quot; comments are routinely downvoted. As is sarcasm, witticisms, memes, references and other styles of comments that occur frequently but do not contribute to the discussion. It&",
12,8171361,comment,8171113.0,8171113.0,1,0,ck2,,,Isn&,
13,8171360,comment,8171039.0,8171039.0,5,0,w1ntermute,,,"The original publication from 2012, in <i>Science</i>: <a href=""http://www.sciencemag.org/content/337/6096/816.short"" rel=""nofollow"">http://www.sciencemag.org/content/337/6096/816.short</a><p>And the PDF: <a href=""http://genetics.wustl.edu/bio5491/files/2013/03/Jinek-et.-al.-2012.pdf"" rel=""nofollow"">http://genetics.wustl.edu/bio5491/files/2013/03/Jinek-et.-al...</a>",1407901584.0
14,8171359,comment,8167130.0,8171234.0,3,0,whyenot,,,"> that needs HTML?<p>I think you are setting the bar a little too high. It seems to me like there is quite a bit of mail that benefits from HTML. Superscripts, subscripts, italics, bold and colored text (used in moderation), inline images (used in moderation) can be really useful when discussing concepts that aren&",
15,8171358,comment,8170229.0,8170229.0,1,0,peterashford,,,Color me surprised.  People supporting the status quo have always been given credence they don&,
16,8171357,comment,8169591.0,8170684.0,1,0,enraged_camel,,,"I agree with your general sentiment, but I think this specific case is simply a tragedy of politics, specifically of someone higher up not wanting to appear &quot;soft on crime&quot; and therefore ordering their army of underlings to perform a full-blown investigation that lasted for what... days? weeks?<p>I really, really doubt that the individual police officers and investigators actually wanted to deal with this nonsense.",1407901491.0
17,8171355,comment,8170283.0,8170283.0,2,0,rdl,,,"Unmotivated product placement, but I&",
18,8171354,comment,8171219.0,8171219.0,2,0,HorizonXP,,,"I left Facebook/Instagram earlier this year. MPK is very family-friendly, I&",
19,8171353,comment,8168286.0,8169950.0,1,0,SamReidHughes,,,"> How do these links imply any misconduct, or anything other than disagreeing with feminists?<p>You&",
20,8171352,comment,8170283.0,8171285.0,1,0,icambron,,,> After that we&,
21,8171351,comment,8170283.0,8171285.0,3,0,bollockitis,,,> You need to conserve that vital energy for sleep. My son is almost 15 months. I&,
22,8171350,comment,8170569.0,8170880.0,1,0,lutusp,,,> But SA/V isn&,
23,8171349,comment,8171225.0,8171225.0,2,0,walterbell,,,"> is no longer a top 10 download, despite still being the second-highest grossing game on iPhone in the US.<p>Are current top 10 games using different monetization techniques than Candy Crush&",
24,8171348,comment,8168569.0,8171187.0,2,0,mschuster91,,,"If the guys on the label are American, then US regulations apply, too.<p>Even if not, the US stick their nose anywhere, even where it does not belong...",1407901296.0
25,8171347,comment,8168225.0,8169087.0,0,0,dsl,,,"Your comment comes across as very entitled and pretty damn jerky.<p>As someone inside of a large corporation working really hard (try pinning down the CTO of a 10k+ person company to sign legal docs sometime) to try and open source some of the amazing tools we have created so they can be used to make the internet a better place, nothing is more demotivating than people like you.",1407901254.0
26,8171346,comment,8170071.0,8171214.0,4,0,bunderbunder,,,I hope not.  It would be bad for both companies and the platform as well.  Microsoft has a proven track record of flat-out failing to execute in the spaces where Xamarin operates.,1407901246.0
27,8171345,comment,8169686.0,8169686.0,1,0,jeffdavis,,,What is the definition of &quot;efficient&quot; in this context?,1407901228.0
28,8171344,comment,8170071.0,8171287.0,2,0,romanovcode,,,If you&,
29,8171343,comment,8169102.0,8169102.0,1,0,chrismcb,,,The industry is obsessed with shipping the same way humans are obsessed with breathing,1407901141.0
30,8171341,comment,8170506.0,8170506.0,1,0,aaron987,,,This explains the problem I had with LastPass earlier today. None of my computers would let me log in for about a 10 minute period.,1407901079.0
31,8171340,story,,,704,202,viclou,X to close,https://medium.com/solve-for-x/x-to-close-417936dfc0dc,,1407901043.0
32,8171339,comment,8170071.0,8171322.0,8,0,romanovcode,,,I don&,
33,8171338,comment,8169686.0,8171161.0,1,0,gohrt,,,"Checking a series of logical statements is just arithmetic.<p>Generating a series of logical statements is only hard because the formal statements are not generated axiomatically, they are sourced from ill-understood human creativity. Once a formalism is <i>defined</i> it is trivial O(e^n) algorithm to generate all proofs of size n.<p><a href=""http://math.stackexchange.com/questions/324867/automated-proof-checking-machine"" rel=""nofollow"">http://math.stackexchange.com/questions/324867/automated-pro...</a>",1407901001.0
34,8171337,comment,8168651.0,8169213.0,1,0,ttflee,,,"Fragile contrasted with USB cables, perhaps. I have used several counterfeit lightning cables from Shenzhen, some of which just failed after about a month to half a year, the reason of which I guess was mechanical stress. The genuine Apple ones are still pretty solid and work fine, though. There may be some pretty tough requirements in the process of production or the materials.",1407900960.0
35,8171336,comment,8169367.0,8171276.0,8,0,mehrdada,,,"I am well aware of the quality of the schools in Iran and can directly compare it US schools, having gone to school in both countries. That Newsweek article is not surprising to me, but in some areas it is inaccurate in my opinion. You do see high quality individuals graduating from Sharif university, which is highlighted in the article, but concluding the school itself is &quot;successful&quot; or competitive is incorrect.  The fact of the matter is that there is a nationwide exam to enter college level education for all schools and you basically choose your school (and major) based on your rank in that exam. In that society, engineering majors, specifically Electrical Engineering majors, tend to have high status, so if you do well, you end up going to study EE at Sharif University, probably not because you are a fan of EE or you think Sharif is any good: it just has to be better than other schools.<p>The outcome of this is simple: you&",
36,8171335,comment,8167928.0,8167928.0,1,0,brogrammer90,,,The truth is there isn&,
37,8171334,comment,8170640.0,8171100.0,2,0,Perdition,,,She isn&,
38,8171333,comment,8169591.0,8171313.0,1,0,wavefunction,,,The person you&,
39,8171332,comment,8168569.0,8168569.0,2,0,filereaper,,,Here&,
40,8171331,comment,8160968.0,8162792.0,1,0,omaranto,,,Thanks! I&,
41,8171330,comment,8170429.0,8171298.0,1,0,lutusp,,,> I don&,
42,8171329,comment,8170283.0,8170977.0,3,0,pragmar,,,"Apparently, smoking related fires are deadly, but rarer than you&",
43,8171328,story,,,5,0,hornbaker,Scientists learn secret of how geckos cling to vertical walls,http://www.sciencerecorder.com/news/scientists-learn-secret-of-how-geckos-cling-to-vertical-walls/,,1407900623.0
44,8171327,comment,8169591.0,8170755.0,2,0,wavefunction,,,That&,
45,8171326,comment,8168569.0,8170168.0,1,0,yuhong,,,"This one has been updated: <a href=""http://www.intel.com/content/dam/www/public/us/en/documents/specification-updates/xeon-e3-1200v3-spec-update.pdf"" rel=""nofollow"">http://www.intel.com/content/dam/www/public/us/en/documents/...</a>",1407900547.0
46,8171325,comment,8170504.0,8170504.0,2,0,dang,,,This post was killed by user flags.,1407900543.0
47,8171324,story,,,10,0,soundsop,Some Hardware Transactional Memory Comments (2009),http://www.azulsystems.com/blog/cliff/2009-02-25-and-now-some-hardware-transactional-memory-comments,,1407900483.0
48,8171323,comment,8169897.0,8169897.0,2,0,unclesaamm,,,&,
49,8171322,comment,8170071.0,8170503.0,3,0,Ad_Nauseam,,,Why mono website built on Jekyll instead of .net with mono itself?,1407900429.0
50,8171321,comment,8169591.0,8171235.0,1,0,peterashford,,,"&quot;We should let Russia take a bit of Europe and buy the rest for pennies on the dollar.&quot;<p>You do realise that the EU is a larger economy than the US, right?",1407900428.0
51,8171320,comment,8170640.0,8171015.0,2,0,jessaustin,,,So apparently it&,
52,8171319,comment,8170283.0,8171292.0,3,0,cujo,,,"1 in 5?  That seems, well, like nonsense.",1407900415.0
53,8171318,story,,,3,0,alexissantos,This is Samsung's VR headset,http://www.theverge.com/2014/8/12/5996293/this-is-samsungs-vr-headset,,1407900388.0
54,8171316,comment,8170283.0,8171292.0,2,0,sliverstorm,,,Source? There&,
55,8171315,comment,8170283.0,8171076.0,4,0,x0x0,,,"And they where also exposed to high amounts of environmental lead, and we know how that turned out: higher crime, lower academic achievement, more teen pregnancies, etc.  Just because most of a society is exposed to something does not mean it&",
56,8171313,comment,8169591.0,8171235.0,1,0,peterashford,,,Wow.  That&,
57,8171312,comment,8168714.0,8171253.0,1,0,fdawg4l,,,Thanks for the tip!  Done.,1407900298.0
58,8171311,comment,8169367.0,8171301.0,3,0,lutusp,,,"Yes, and it&",
59,8171309,comment,8168714.0,8171259.0,1,0,fdawg4l,,,"<p><pre><code>  > 2. FBFatal has the same semantics as assert(), so that&",
60,8171308,comment,8170640.0,8170640.0,1,0,alayne,,,"Someone posted a video of part of a Mirzakhani lecture a few hours ago <a href=""https://www.youtube.com/watch?v=XMWJW-AVVCI"" rel=""nofollow"">https://www.youtube.com/watch?v=XMWJW-AVVCI</a>",1407900174.0
61,8171307,comment,8171219.0,8171219.0,1,0,brogrammer90,,,You can but the majority of your 23 year old coworkers will annoy the ever living shit out of you.  They may even implicitly put you first on the chopping block because not hanging out with them outside of work means you&,
62,8171306,story,,,2,0,houseofshards,Live Stream of the Perseid meteor shower [NASA],http://www.nasa.gov/watchtheskies/perseids-2014.html,,1407900107.0
63,8171305,comment,8169591.0,8169591.0,1,0,Houshalter,,,"What is the significance of this? I read the article and found it interesting, I just don&",
64,8171304,comment,8164615.0,8164615.0,1,0,alexanderss,,,I&,
65,8171303,comment,8130413.0,8133877.0,1,0,tekknolagi,,,"I am now starting to write some tests with libtap. If you are game, come help out! :D",1407899990.0
66,8171302,comment,8170071.0,8171078.0,3,0,edgyswingset,,,Did you give F,
67,8171301,comment,8169367.0,8171105.0,3,0,mhartl,,,"It is weird. Doing great mathematics is like writing great poetry in a language only a few hundred people can read. And yet, every once in a while a mathematical poem changes the world.",1407899932.0
68,8171300,comment,8170071.0,8171035.0,1,0,edgyswingset,,,"Sometimes a procedural approach is better for certain (in my opinion, limited) problems.  I&",
69,8171299,comment,8170318.0,8170318.0,4,0,funkyy,,,I love how Medium becomes my favourite &quot;time waster&quot;. I remember about buzz in media about how pointless Medium was but since some time majority of articles I found on major suggesting websites from Medium are extremely interesting.<p>When reading articles from Medium I feel like I am not only not wasting time but acquiring knowledge in extremely fast pace.,1407899874.0
70,8171298,comment,8170429.0,8170429.0,1,0,samspenc,,,I don&,
71,8171297,comment,8169686.0,8171250.0,4,0,Steuard,,,"If you were to sit down with a pile of beads and try to build a big HCP stack and a big FCC stack layer by layer, you&",
72,8171296,comment,8169884.0,8169884.0,1,0,alexanderss,,,Nice to hear from Jessica on this. I&,
73,8171295,comment,8167546.0,8171278.0,2,0,lutusp,,,"As with most things in software, speed can&",
74,8171294,comment,8170569.0,8170849.0,1,0,panzi,,,"Yeah, but as the Wikipedia article states: not even diamond is strong enough. So don&",
75,8171293,comment,8164245.0,8165355.0,1,0,TheLoneWolfling,,,/dev/urandom on Linux only has an internal state of 1024 bits [1]<p>As Python&,
76,8171292,comment,8170283.0,8171076.0,0,0,Alex3917,,,> And they turned out fine.<p>Except for that they didn&,
77,8171291,comment,8164806.0,8165995.0,1,0,mfalcon,,,"Me too, glad to help. My mail is in the profile.",1407899488.0
78,8171290,comment,8170569.0,8170794.0,1,0,panzi,,,I think it is mathematically proven that that&,
79,8171288,comment,8168651.0,8171055.0,3,0,freehunter,,,"I used the wireless charging on my Nokia Lumia for two years, every night. Loved it. Problem is, it&",
80,8171287,comment,8170071.0,8170071.0,3,0,DAddYE,,,"Interesting, how about performances of mono? The thing that attracts me to it is F",
81,8171285,comment,8170283.0,8170851.0,2,0,electromagnetic,,,If breast feeding isn&,
82,8171284,comment,8156786.0,8156982.0,1,0,lutusp,,,> The low denominator fractions make a lot of sense for a lot of people.<p>There&,
83,8171283,comment,8170242.0,8171031.0,2,0,alistairSH,,,"Irrelevant. I was calling the previous poster out for his Tesla nut-swinging.  Problems that render a new car inoperative are not &quot;minor&quot;, loaner car or not.",1407899136.0
84,8171282,comment,8169590.0,8169590.0,1,0,cdiamand,,,"This is great. Every few months I will spend a day on <a href=""http://reddit.com/r/battlestations"" rel=""nofollow"">http://reddit.com/r/battlestations</a> ogling workstations. This will hopefully scratch that itch in a more metered way.",1407899102.0
85,8171281,comment,8169591.0,8171235.0,4,0,megablast,,,"Well, what are you trying to say? Could they care less, or could they not care less?",1407899090.0
86,8171280,story,,,6,0,mayagc,'Internet of things' is the most over-hyped technology,http://www.theguardian.com/technology/2014/aug/12/internet-of-things-most-over-hyped-technology,,1407899089.0
87,8171279,comment,8168949.0,8171266.0,1,0,Hytosys,,,"Sorry, I should have mentioned water. But that bond is very strong, and the methods of breaking it are thus very poor.<p>Another compound worth mentioning is ammonia. A lot of the current hydrogen harvesting research revolves around ammonia. Unfortunately, ammonia is very scarce in nature and certainly soon exhaustible as a global fuel.",1407899084.0
88,8171278,comment,8167546.0,8167960.0,3,0,rectangletangle,,,"Python may be slow, but it&",
89,8171277,comment,8170318.0,8171186.0,1,0,coreyja,,,Can you elaborate or know where I could read more?,1407899046.0
90,8171276,comment,8169367.0,8170549.0,7,0,neves,,,I don&,
91,8171274,story,,,3,0,keegbelj,"If Video is Booming, Why are Revenues Evaporating?",http://www.mediaredefined.com/a-redef-original-if-video-is-b-668292818.html,,1407898960.0
92,8171273,comment,8168569.0,8170876.0,3,0,webkike,,,What do you mean? The BIOS is a configuration tool - it&,
93,8171271,comment,8169672.0,8169672.0,0,0,sssilver,,,Comic Sans killed it,1407898915.0
94,8171270,story,,,6,0,BruceIV,What would Donald Knuth do? [humour],http://www.johndcook.com/blog/2014/08/12/what-would-dondald-knuth-do/,,1407898830.0
95,8171269,comment,8168949.0,8169914.0,1,0,Hytosys,,,>my best layman&,
