,ID,Type,Story,Parent,Points,Comments,Author,Title,URL,Content,Created
0,8537237,comment,8514119.0,8535421.0,0,0,tvvocold,,,done,1414727992.0
1,8537236,comment,8533633.0,8533633.0,0,0,ghuntley,,,"re: &quot; how people get to express their ideas in such a clear and persuasive way&quot;<p><a href=""http://www.amazon.com/Pyramid-Principle-Logic-Writing-Thinking/dp/0273710516/"" rel=""nofollow"">http://www.amazon.com/Pyramid-Principle-Logic-Writing-Thinki...</a><p>Recommended reading, especially for anyone whom consults or writes proposals.",1414727956.0
2,8537235,comment,8536686.0,8537103.0,0,0,dshap,,,Doesn&,
3,8537234,comment,8537039.0,8537194.0,0,0,jsmeaton,,,"I agree with you. Just bought a new TV myself, and I&",
4,8537233,comment,8532261.0,8535371.0,0,0,kamaal,,,>>girl cant even do anything of her choice..<p>In India we have messed up things so badly we have scared away a lot of people from having girl kids. I&,
5,8537232,comment,8532625.0,8534117.0,0,0,velocitypsycho,,,Every email service I&,
6,8537231,comment,8535725.0,8537150.0,0,0,gordon_freeman,,,now let&,
7,8537230,comment,8536609.0,8537059.0,0,0,i_am_ralpht,,,Maybe the business week puff piece on Sundar (which somewhat atypically spent a page complaining about Andy)?,1414727819.0
8,8537229,comment,8536977.0,8537082.0,0,0,aosmith,,,"Well the difference is simple, most cell site simulators force unencrypted protocols...  There are android apps that supply this sort of information.",1414727814.0
9,8537228,comment,8537039.0,8537211.0,0,0,kibwen,,,Can you recommend any resources for getting started?,1414727772.0
10,8537227,comment,8536217.0,8536761.0,0,0,ghuntley,,,"re: &quot;but anyone who is serious about building for the enterprise should definitely study other enterprise SaaS companies&quot;<p>Can recommend <a href=""http://www.forentrepreneurs.com/saas-metrics-2/"" rel=""nofollow"">http://www.forentrepreneurs.com/saas-metrics-2/</a> as a good starting point.",1414727730.0
11,8537226,comment,8534489.0,8536880.0,0,0,imanaccount247,,,>A call to time(2) or gettimeofday(2) is hundreds of times faster in Linux than on OpenBSD<p>Got a link to those benchmarks?  Did anyone file a bug report?<p>>But commercially and at scale I run Linux<p>Wouldn&,
12,8537224,comment,8537039.0,8537039.0,0,0,p00b,,,"> I just bought a new TV...The only problem is that I’m now afraid to use it. You would be too — if you read through the 46-page privacy policy.<p>Wish I had the money to drop hundreds of dollars on a product, and figure out what it does afterward...",1414727559.0
13,8537223,comment,8536686.0,8537051.0,0,0,nathanvanfleet,,,Keep in mind that there are a lot more Frameworks other than just GUI related ones that aren&,
14,8537222,comment,8534717.0,8536843.0,0,0,eclipxe,,,Well played :-),1414727519.0
15,8537221,comment,8530819.0,8534783.0,0,0,adminprof,,,Thank you. I thought I was the only one who cared about getting the raw data out or was just missing something obvious. Why is it that hard to get the minute-by-minute data?,1414727514.0
16,8537220,comment,8537039.0,8537191.0,0,0,desdiv,,,"No, <i>tin</i> foil hats work just fine. That study is about <i>aluminium</i> foil hats. Decades of government propaganda has brainwashed everyone into conjuring up images of aluminium foil hats when they hear the phrase &quot;tin foil hat&quot;. /s",1414727510.0
17,8537219,story,,,2,0,nkurz,Andy Glew's CompArch wiki,https://sites.google.com/site/paulclaytonplace/andy-glew-s-comparch-wiki,,1414727483.0
18,8537218,story,,,1,0,nkurz,The History of Online Advertising,http://www.adpushup.com/blog/the-history-of-online-advertising,,1414727430.0
19,8537217,comment,8537039.0,8537193.0,0,0,eclipxe,,,"Thank you. I agree, this is just scaremongering.",1414727423.0
20,8537216,comment,8536686.0,8537096.0,0,0,coldtea,,,"Sure. People have been doing that since 2000.<p><a href=""http://www.puredarwin.org/"" rel=""nofollow"">http://www.puredarwin.org/</a>",1414727406.0
21,8537215,story,,,1,0,funkyy,"In the Best Conditions, iOS-Exclusive Vainglory Is a Top-Notch MOBA",http://techcrunch.com/2014/10/30/in-the-best-conditions-ios-exclusive-vainglory-is-a-top-notch-moba/,,1414727391.0
22,8537214,story,,,2,0,jkuria,"A STORY ABOUT PERSEVERANCE. Several Years Ago,",http://www.elizabethgilbert.com/a-story-about-perseverance-several-years-ago-my-uncle-nick-went-to-see-the/,,1414727352.0
23,8537213,comment,8536609.0,8537109.0,0,0,larrys,,,"&quot;Scott McNealy used to congratulate people getting promoted with &quot;One step up, one step closer to the door.&quot;&quot;<p>God knows when I hear things like that I thank my lucky stars I don&",
24,8537212,comment,8537166.0,8537166.0,0,0,Canada,,,"Clickbait, and bad title. Lockheed Martin claims no such thing.",1414727332.0
25,8537211,comment,8537039.0,8537039.0,0,0,click170,,,"The only reason I feel comfortable connecting things like consumer network-connected cameras, TVs, Bluray players, game consoles, or anything else &quot;Internet Ready&quot; to my network is because I perform outbound filtering, and it&",
26,8537210,comment,8534082.0,8534420.0,0,0,Direct,,,This and the paper above were extremely entertaining reads. To the point that I am downloading CHICKEN right now to start exploring. Thank you for those links.,1414727319.0
27,8537209,comment,8527932.0,8532273.0,0,0,coldtea,,,Now try that with dollars.,1414727223.0
28,8537208,story,,,2,0,bernardeli,SlimerJS meets Ruby = Yabbie,http://netengine.com.au/blog/slimerjs-meets-ruby-equals-yabbie/,,1414727156.0
29,8537207,comment,8530819.0,8536327.0,0,0,iamartnez,,,"I picked one up today. Impressions so far:<p>- Comfortable.\n- Looks nice, I like wearing it. Doesn&",
30,8537206,comment,8532261.0,8532565.0,0,0,coldtea,,,"><i>Like Cook points out, the US is still country in which gay people are subject to life-altering discrimination all the time.</i><p>And also a country where if you get that you can be settled for life with suing them for their houses and cars.<p>The thing is, this &quot;life-altering discrimination&quot; is not unique to gays in the US. You can get it by being different in all kinds of way. Seems like a lot more crackpots than usual (that what you&",
31,8537205,comment,8531915.0,8536718.0,0,0,bduerst,,,What?,1414727094.0
32,8537204,comment,8536686.0,8537135.0,0,0,jevinskie,,,"Yeah... once I find it on my old backups. =) Ironically, my script that produces git repos was not itself version controlled. Lesson learned (for the umpteenth time). I wasn&",
33,8537203,comment,8537039.0,8537039.0,0,0,lurchpop,,,"Went through this recently at Best Buy. The salesperson said by next year they may no longer carry any &quot;dumb&quot; tvs. Currently, those options are almost gone. I didn&",
34,8537202,comment,8536292.0,8536782.0,0,0,AlexandrB,,,"Wow, if I&",
35,8537201,comment,8537039.0,8537196.0,0,0,api,,,But since it&,
36,8537200,comment,8536609.0,8537170.0,0,0,nostrademons,,,"That could be an indication that building a viable mobile phone OS is <i>really, really hard</i>.<p>While I&",
37,8537199,comment,8533238.0,8533697.0,0,0,secabeen,,,"Generally, if you work for a large employer, you have some form of disability insurance that picks up after a month or three.  If you&",
38,8537198,comment,8534866.0,8535646.0,0,0,bkurtz13,,,Try Clojure,1414726871.0
39,8537197,comment,8537039.0,8537184.0,0,0,api,,,It&,
40,8537196,comment,8537039.0,8537167.0,0,0,Canada,,,"Yes, and any mobile phone. &quot;Ok Google&quot;<p>RMS was right all along. We need free software, or we will have no control over our computers. And our computers are going to be everywhere.",1414726832.0
41,8537195,comment,8537039.0,8537157.0,0,0,grimman,,,Searching seems to suggest it&,
42,8537194,comment,8537039.0,8537039.0,0,0,bruce511,,,I&,
43,8537193,comment,8537039.0,8537039.0,0,0,bduerst,,,This if a fluff piece.<p>They write an entire article on why we should be terrified but then they don&,
44,8537192,comment,8533238.0,8535971.0,0,0,secabeen,,,"The problem with this argument is that if we only relied on compassion, people who fit well into community norms would be taken care of, and those people who didn&",
45,8537191,comment,8537039.0,8537168.0,0,0,lotsofmangos,,,"But tin foil hats were really designed and promoted by the government to help them spy on the paranoid. <a href=""http://web.archive.org/web/20100708230258/http://people.csail.mit.edu/rahimi/helmet/"" rel=""nofollow"">http://web.archive.org/web/20100708230258/http://people.csai...</a>",1414726753.0
46,8537190,comment,8535080.0,8536497.0,0,0,atomical,,,And yet he&,
47,8537189,comment,8530819.0,8531763.0,0,0,Istof,,,it also has a much larger battery,1414726722.0
48,8537188,comment,8537039.0,8537039.0,0,0,0x0,,,Sounds like there would be a market for an openWRT-like firmware hack for these TVs!,1414726702.0
49,8537187,comment,8532261.0,8536315.0,0,0,snogglethorpe,,,... and the mention of downvoting was a small part of an otherwise excellent comment anyway!,1414726689.0
50,8537186,comment,8537039.0,8537128.0,0,0,smacktoward,,,"I think you overestimate how many people are even going to be aware that their shiny TV is doing 1% of this stuff.<p>Non-techie people assume a TV is a TV -- which is to say, a dumb video terminal. Even &quot;smart&quot; TVs are understood this way, in no small part because most people never bother interacting with their &quot;smart&quot; features. It&",
51,8537185,comment,8536757.0,8536859.0,0,0,azakai,,,"Yes, but to be fair, that is mostly emscripten&",
52,8537184,comment,8537039.0,8537039.0,0,0,sean_grant,,,Something I&,
53,8537183,comment,8537039.0,8537039.0,0,0,malkia,,,"1984, 30 years later.",1414726638.0
54,8537182,comment,8537174.0,8537179.0,0,0,ot,,,This.,1414726629.0
55,8537181,comment,8537039.0,8537168.0,0,0,api,,,"If anything, the tinfoil hat conspiracy wackos of yesteryear were far too conservative in their paranoid fever dreams. They&",
56,8537180,comment,8530819.0,8531396.0,0,0,Istof,,,"if you have the smart-phone that it is compatible with, they probably already have most of the information anyways",1414726518.0
57,8537179,comment,8537174.0,8537174.0,0,0,lnanek2,,,No,1414726483.0
58,8537178,comment,8537039.0,8537039.0,0,0,driverdan,,,So what happens if you just don&,
59,8537177,comment,8533238.0,8536324.0,0,0,Domenic_S,,,I agree that it&,
60,8537176,story,,,3,0,rahulvarshneya,5 Landing Page Must-Haves to Boost App Downloads,https://www.linkedin.com/pulse/article/20141030133902-2241112-5-landing-page-must-haves-to-boost-app-downloads?trk=mp-author-card,,1414726368.0
61,8537175,comment,8536686.0,8536686.0,0,0,bingeboy,,,This is a good step into making Star Trek law the real law.,1414726346.0
62,8537173,comment,8537039.0,8537039.0,0,0,dubfan,,,"I was in the market for a new TV last year, and I found it difficult to find one that wasn&",
63,8537172,comment,8533408.0,8536534.0,0,0,AlexandrB,,,I find I quickly become tolerant to the awakening and focusing effects of caffeine but not to the anxiety-inducing effects leading to increasingly anxious thought patterns.<p>Every time I start in on caffeine again because of a crunch I end up regretting it later.,1414726300.0
64,8537171,comment,8536757.0,8537066.0,0,0,Hemospectrum,,,"Well, the obvious one is your deployment options: You need to either compile binaries for the target platform, or ask the user to compile from source. As far as I know, you can&",
65,8537170,comment,8536609.0,8537081.0,0,0,mbca,,,Android is only a &quot;success&quot; insofar as being the only game in town for an open-source iOS competitor. I&,
66,8537169,comment,8534110.0,8535077.0,0,0,femtoduino,,,...I am able to send data about every 200ms or so. I haven&,
67,8537168,comment,8537039.0,8537039.0,0,0,joelrunyon,,,"> In the meantime, I’ll be in the market for a new tinfoil hat and cone of silence.<p>I know this is meant as a pseudo-joke and I know there are going to be a ton of comments here on why the guy is overreacting, but is the tin foil hat really useful anymore? We have demonstrated proof that things like this have been exploited on purpose in the past few years.<p>Instead of the tin foil being representative of the crazy person - it now almost seems like common sense. Is that scary to anyone else?",1414726276.0
68,8537167,comment,8537039.0,8537039.0,0,0,dsugarman,,,a lot of these are inherent on the laptop you wrote this with coupled with using the internet in general.,1414726252.0
69,8537165,story,,,2,0,ot,Apple Reverses Course on iOS 8 Notification Center Calculators,http://www.macrumors.com/2014/10/30/apple-reverses-course-on-calculator-widgets/,,1414726245.0
70,8537164,comment,8534717.0,8536766.0,0,0,saraid216,,,> The meaning of &,
71,8537163,comment,8537039.0,8537039.0,0,0,rickdale,,,I have one of the latest sony televisions. I think of the internet features as something for newbs. I would never even consider putting my tv on my network. It doesn&,
72,8537162,comment,8533408.0,8537053.0,0,0,hyperion2010,,,"Yep, that exact page is one of the reasons I stopped. I like to joke that I am an insect since caffeine is also a poison for many of them.",1414726158.0
73,8537161,comment,8536686.0,8537044.0,0,0,malkia,,,"Yup. Great idea. Along with &quot;github-backup&quot; like tool (I use this one - <a href=""https://github.com/joeyh/github-backup"" rel=""nofollow"">https://github.com/joeyh/github-backup</a>) then I could spend days browsing and reading :)",1414726138.0
74,8537160,comment,8534907.0,8537087.0,0,0,0x0,,,There&,
75,8537159,comment,8536638.0,8536638.0,0,0,flippyhead,,,Author here. Thanks so much for the interest! It&,
76,8537158,comment,8532261.0,8535722.0,0,0,function_seven,,,There&,
77,8537157,comment,8537039.0,8537039.0,0,0,mhb,,,No mention of which TV?,1414726065.0
78,8537155,comment,8534110.0,8535077.0,0,0,femtoduino,,,"The onboard barometer has a 10cm precision, but the 10-DoF IMU is incredibly accurate. The IMU components originate from the FreeIMU, uses for DIY drones and copters.",1414725983.0
79,8537154,comment,8532261.0,8535332.0,0,0,wicker,,,I completely agree with this interpretation. I&,
80,8537153,comment,8532261.0,8534291.0,0,0,vacri,,,It&,
81,8537152,comment,8537039.0,8537128.0,0,0,userbinator,,,Unfortunately a lot of people are not going to read the privacy policies or even care about what their TV is doing beyond &quot;it works&quot; and being drawn in by the promise of convenience and new features... it&,
82,8537151,comment,8536016.0,8536690.0,0,0,ufmace,,,It&,
83,8537150,comment,8535725.0,8536131.0,0,0,yuhong,,,"I asked about it on Quora: <a href=""http://www.quora.com/What-has-happened-to-Mark-Zuckerbergs-opinion-on-privacy-since-the-early-days-of-Facebook"" rel=""nofollow"">http://www.quora.com/What-has-happened-to-Mark-Zuckerbergs-o...</a>",1414725828.0
84,8537149,story,,,3,0,dak1,Tim Cook Coming Out Has Turned China into a Nation of 5th-Graders,http://www.foreignpolicy.com/articles/2014/10/30/iPhone_Tim_Cook_China_gay,,1414725813.0
85,8537148,story,,,1,0,akhatri_aus,Tail.sh Analytics and Tracking for Your Meteor App,https://tail.sh/,,1414725795.0
86,8537147,comment,8534110.0,8534944.0,0,0,femtoduino,,,We are leveraging a Bluetooth Cordova plugin to access the smart device&,
87,8537146,comment,8535725.0,8536986.0,0,0,NoodleIncident,,,"By the time they got around to building &quot;frankenstein PHP&quot;, it was way too late to switch languages. Before that, there was no time to switch.<p>The whole development process of Hack is interesting. It was very organic, if the stories I heard were true. Someone got it in their head to try compiling php to c++; they tested it and got a free 20% (ballpark) speedup of everything. Then they made a VM to make it faster and more efficient, and once they had that vm, it was easy to add small, useful features like &",
88,8537145,comment,8533843.0,8536042.0,0,0,icsa,,,&quot;noun&quot; in C:\nnoun(c){A z;if(c<&,
89,8537144,comment,8536038.0,8536845.0,0,0,tptacek,,,"In the 20+ year history of computer crime prosecution, outside of this disputed case, what is the next most likely case where a hacker effectively framed another hacker who was then successfully prosecuted for the offense?",1414725717.0
90,8537143,comment,8530819.0,8531637.0,0,0,firepacket,,,"Your communications can still be tapped, your location can still be tracked through cell towers, and remote malware can still turn your phone into a persistent bug.<p>I don&",
91,8537142,comment,8536686.0,8537103.0,0,0,madeofpalk,,,Oh lord.<p>Best demonstration of Poe&,
92,8537141,comment,8536686.0,8537080.0,0,0,0x0,,,Wild guess: while iOS&,
93,8537140,comment,8536638.0,8537023.0,0,0,pbnjay,,,um. I guess I retract my &quot;closed source&quot; comment and amend it to &quot;not open source&quot;. 234M .app seems pretty heavyweight - do you really need all these node packages in the bundle?<p>If I&,
94,8537139,comment,8531548.0,8531548.0,0,0,keeto1234,,,work hard !!!,1414725635.0
95,8537138,comment,8536757.0,8537066.0,0,0,kibwen,,,"The mechanisms that Rust uses to provide memory safety require more forethought than the various forms of garbage collection that other memory-safe programming languages use. If you can happily live with a garbage collector, then Rust may not appeal to you. If you&",
96,8537137,comment,8535080.0,8536497.0,0,0,tptacek,,,I&,
97,8537136,comment,8536757.0,8537066.0,0,0,na85,,,"Well depending on who you ask, one flaw might be that there&",
98,8537135,comment,8536686.0,8537044.0,0,0,voltagex_,,,That&,
99,8537134,story,,,1,0,jordanpg,Serial podcast sub-reddit,http://www.reddit.com/r/serialpodcast/,,1414725447.0
100,8537133,comment,8527861.0,8536253.0,0,0,iambrakes,,,I do too a little. So I left that wording out of our rewritten license. Like the beginning of ours says &quot;We&,
101,8537132,comment,8530819.0,8536804.0,0,0,Encosia,,,I&,
102,8537131,comment,8536686.0,8537094.0,0,0,0x0,,,"You have to look for the vulnerable code, not just the version string. Supposedly it has already been patched.",1414725402.0
103,8537130,comment,8532261.0,8534779.0,0,0,MartinCron,,,<i>Straight people don&,
104,8537129,comment,8536292.0,8536767.0,0,0,bunderbunder,,,You&,
105,8537128,comment,8537039.0,8537039.0,0,0,uptown,,,I think the always watching/listening thing is the major hurdle a lot of these devices are going to have to overcome before a lot of people feel comfortable inviting them into their homes.,1414725360.0
106,8537127,comment,8531131.0,8532171.0,0,0,sfiles,,,"I think trying not to fall into the category of &quot;smartwatch&quot; is the point, marketing tactic if you will. The smartwatch is the new wave, and the companies you would expect are jumping on board. By not marketing as a smartwatch they set themselves apart, yet have some of the key functionality people are looking for",1414725337.0
107,8537126,comment,8535746.0,8535746.0,0,0,keeto1234,,,I would get rid of jerks,1414725315.0
108,8537125,comment,8533843.0,8536168.0,0,0,icsa,,,"The same could be said for writing a document in Chinese, Arabic or Hebrew. They all look like &quot;line noise&quot; until you make an effort to learn them.<p>&quot;For that matter, I suppose it&",
109,8537123,comment,8532261.0,8535036.0,0,0,judk,,,Being proud of who you are and the eay you live is different from being proud of an arbitrary superficial difference between you and others.<p>Proud to be White is leagues worse than proud to be American or Christian or Irish.,1414725227.0
110,8537122,comment,8533350.0,8535336.0,0,0,spankalee,,,"Apologies, but we don&",
111,8537120,comment,8534298.0,8536166.0,0,0,beagle3,,,"Or, as Telsa is rumored to have remarked: &quot;If Edison spent a little more time thinking, he wouldn&",
112,8537119,comment,8536977.0,8536977.0,0,0,enmbl,,,Yes,1414725135.0
113,8537118,comment,8536016.0,8536016.0,0,0,slipperyp,,,Call me a nitpicker and you&,
114,8537117,story,,,2,0,uptown,Moon Orbiter Spies NASA Spacecraft Impact Crater,http://news.discovery.com/space/moon-orbiter-spies-nasa-spacecraft-impact-crater-141028.htm,,1414725084.0
115,8537116,comment,8532261.0,8536190.0,0,0,greendestiny,,,I tend to think most people look on something like that as an opportunity to score a win for what they believe in rather than genuine concern at his actions as CEO. Some of the decision to let him resign must have come from the lack a successful strategy to respond to it though.,1414725081.0
116,8537115,comment,8535744.0,8535744.0,0,0,septerr,,,I really appreciate the clarity with which this article described the issue. I had read an article by someone from Netflix few months (I think) ago about this and did not get the clear understanding this article provided.,1414725080.0
117,8537114,comment,8534717.0,8535972.0,0,0,SamReidHughes,,,"If anything was in bad taste, it was the pull request itself.  You don&",
118,8537113,comment,8534325.0,8534325.0,0,0,v2vz,,,@luweilu can you list the payout table/probabilities?  Just curious if there&,
119,8537112,comment,8537039.0,8537039.0,0,0,socceroos,,,Yep. This is reason ,
120,8537111,comment,8532261.0,8536297.0,0,0,judk,,,The whole concept of &quot;bloodline&quot; is fundamentally racist.,1414725027.0
121,8537110,story,,,1,0,msekeris,"Identity, a Neurobiological Perspective",http://hplusmagazine.com/2014/10/28/identity-neurobiological-perspective/,,1414725000.0
122,8537109,comment,8536609.0,8537061.0,0,0,ChuckMcM,,,"I expect it might be more unpleasant for wannabe Andys. But I agree it was unremarkable. Scott McNealy used to congratulate people getting promoted with &quot;One step up, one step closer to the door.&quot; That captured the balancing act between climbing the ladder versus being pushed off of it because someone else wanted your spot. I think Andy will be much happier in his new role, and it isn&",
123,8537108,comment,8534717.0,8534717.0,0,0,mkr-hn,,,The author has obviously never seen furry Twitter. One of my favorite communities. Maybe it helps that most people make a fresh account for it. It&,
124,8537107,comment,8533843.0,8536238.0,0,0,avmich,,,The more relevant part is comparison with math notation. No whitespaces and line breaks there.,1414724951.0
125,8537105,comment,8515398.0,8516070.0,0,0,Schwolop,,,But my preference is _really_ to see no ads.<p>What you cite as &quot;my preference&quot; is really &quot;what the advertising backend has deduced I&,
126,8537104,comment,8536292.0,8536968.0,0,0,themartorana,,,You&,
127,8537103,comment,8536686.0,8537072.0,0,0,knodi123,,,"When I comment out code, I add a timestamp of when I disabled it.  Then, when I come across commented code with a timestamp more than 6 months old, I go ahead and delete it.  Best of both worlds!",1414724814.0
128,8537102,story,,,76,0,mmastrac,Fern Frozen in Time by Volcanic Flow Reveals Stunning Detail,http://blogs.scientificamerican.com/artful-amoeba/2014/10/30/fern-frozen-in-time-by-volcanic-flow-reveals-stunning-detail/,,1414724766.0
129,8537101,comment,8531131.0,8531192.0,0,0,Istof,,,that killing feature is very power hungry which is probably why others didn&,
130,8537100,comment,8534835.0,8537012.0,0,0,mike_ivanov,,,"You see, I know <i>exactly</i> what this page describes ;-)",1414724737.0
131,8537098,comment,8536947.0,8536947.0,0,0,api,,,"Democrats tend to be better on social issues and no worse on most other things.<p>Republicans make hay out of being for economic freedom, low taxes, etc., but history shows they don&",
132,8537097,comment,8532261.0,8536701.0,0,0,judk,,,"Wow, that puts the anti Semitic and anti communist roots of Nazism way back in 1919. Such a long slow buildup, and nothing stopped it.",1414724685.0
133,8537096,comment,8536686.0,8537051.0,0,0,pwnna,,,"Does this mean if you compile this and get it to work, you can get something like XFCE or KDE running on it?",1414724621.0
134,8537095,comment,8532261.0,8536974.0,0,0,zak_mc_kracken,,,"Here, educate yourself:<p><a href=""http://old.richarddawkins.net/articles/582913-mother-teresa-s-legacy-is-under-a-cloud"" rel=""nofollow"">http://old.richarddawkins.net/articles/582913-mother-teresa-...</a>",1414724563.0
135,8537094,comment,8536686.0,8536686.0,0,0,ahmett,,,"And the good old shellshocked bash version 3.2 <a href=""http://opensource.apple.com/source/bash/bash-94.1.2/version.h"" rel=""nofollow"">http://opensource.apple.com/source/bash/bash-94.1.2/version....</a>",1414724540.0
136,8537093,comment,8534829.0,8535803.0,0,0,zmitri,,,Mixtape Weezy is my jam,1414724509.0
137,8537092,comment,8536292.0,8536799.0,0,0,joesmo,,,"From the police actions and ruling in this case, I&",
138,8537091,comment,8536609.0,8536994.0,0,0,isomorphic,,,"...an open-source BigDog with a locked bootloader, and green felt outer cladding.",1414724471.0
139,8537090,comment,8537039.0,8537039.0,0,0,walterbell,,,"Display projectors are more flexible, easier to secure and it&",
