,ID,Type,Story,Parent,Points,Comments,Author,Title,URL,Content,Created
54,4175107,comment,4172261.0,4174702.0,2,0,randomdata,,,"Does that not come with a big ""it depends""?<p>If you're trying to duplicate a document-centric interface on iOS (without using UIWebView), you are in for a lot of work. Similarly, if you are trying to duplicate an application-centric interface in the web browser, you are in for a lot of work.<p>There is overlap, of course. If your solution is document-centric you can simply use UIWebView on iOS. If your solution is application-centric, there are a number of Javascript frameworks that look a lot like UIKit in design. This should reduce the difference as the tools end up being similar, no matter what the target. Cappuccino even lets you use much of the Apple toolchain, including Interface Builder, while targeting the browser.<p>If each platform gets its own independent solution, it is going to largely depend on the complexity handed down by the designers. If the web version comes with less design complexity then it will naturally be easier to implement.",1340940625.0
55,4175106,comment,4173773.0,4174999.0,3,0,JimmyL,,,"WhatsApp has the cross-platform compatibility, but I find it horribly slow and inconsistent compared to BBM.<p>When I send something with WhatsApp, I know it will probably get there, but I'm not sure when, in what order, or at what relative time - and it takes a while to figure that out. When I send something with BBM, I know that it will either get there instantly or not at all, and I know that right away. For me, the latter is better.",1340940613.0
56,4175104,story,,,1,0,dreamdu5t,Font Rendering Philosophies of Windows and OS X,http://damieng.com/blog/2007/06/13/font-rendering-philosophies-of-windows-and-mac-os-x,,1340940595.0
57,4175103,comment,4172373.0,4172832.0,3,0,samsoffes,,,Browsers are everywhere :),1340940523.0
58,4175102,story,,,1,0,jabbawock07,SEO Philippines,http://www.seophilippines.net/,SEO Philippines offers a wide range of SEO services and online marketing to improve your online visibility. Our expert SEO specialist team develop a unique search engine optimization strategy tailored specifically for your website and services. See your traffic soar and your sales hit new highs as your website is one of the first to appear in Google.,1340940496.0
59,4175101,comment,4172373.0,4172699.0,3,0,samsoffes,,,Thanks Sam :),1340940475.0
60,4175100,story,,,1,0,redbottomshoes,"Red Bottom Shoes, Christian Louboutin Replica Store, 75% OFF | Free Shipping",http://www.redbottomsshoesfakeonline.com/,,1340940473.0
61,4175099,comment,4174284.0,4175050.0,11,0,dreamdu5t,,,"This is intentional. Windows uses font hinting which attempts to align the anti-aliased font to whole pixels vertically and sub-pixels horizontally. This is done to maintain readability at small sizes. Apple doesn't use this type of font hinting and applies sub-pixel anti-aliasing proportionately.<p>See this comparison of the two methods in detail: <a href=""http://damieng.com/blog/2007/06/13/font-rendering-philosophies-of-windows-and-mac-os-x"" rel=""nofollow"">http://damieng.com/blog/2007/06/13/font-rendering-philosophi...</a>",1340940465.0
62,4175098,comment,4174550.0,4175041.0,3,0,gilini,,,"That's so much BS. Like supporting old browsers is that hard/expensive.<p>Everyone keeps saying that, but I have <i>never</i> ever seen numbers to back it up.<p>Letting it all blow up in the user's face is not an option to me. And I do business with publicity agencies, they don't give a fuck about this stuff, as far as they know everyone owns the latest macbook.",1340940460.0
63,4175097,comment,4171797.0,4174313.0,2,0,pacmon,,,"For me, it's not about what they may/may not have done. What enrages me is how the government has behaved. The level of force was ridiculous (i mean - helicopters... for a video pirate!?). Not to mention they stole lots of legitimate data and have barely provided a means to <i>some</i> people to retrieve their data. Which wouldn't have happened at all if the MAFIAA had it their way.",1340940460.0
64,4175096,story,,,1,0,wangyong2008614,ChinaJiaho.com: Cheap Car Gps Navigator Online Store from China,http://www.chinajiaho.com/4-3-Inch-LCD-Windows-CE-6-0-Core-GPS-Navigator-w-FM-Transmitter---Built-in-4GB-Memory_p3433.html,,1340940425.0
65,4175095,comment,4172373.0,4173296.0,0,0,samsoffes,,,Mobile web.,1340940414.0
66,4175094,comment,4171058.0,4174808.0,1,0,DeepDuh,,,"""Hey, how about the public pool today.""<p>""WARNING: Usage of public pools during hot weather is deprecated. Misuse may lead to a degradation of your insurance policy. At short-term-alpha memory, synapse group ",
67,4175093,story,,,1,0,aminak924,Add Wicker Furniture to Your Garden,http://www.greenpartyus.com/add-wicker-furniture-to-your-garden,"One really cool addition to your garden, you should look into is wicker furniture. Its practical, it catches the eye, and it is not expensive. Seems like a no-brainer to me.",1340940379.0
68,4175092,story,,,1,0,clbrook,Opower:  a new experience for utility customers,http://opower.com/what-is-opower,,1340940346.0
69,4175091,comment,4174284.0,4175036.0,1,0,jameswyse,,,"Only took a couple of seconds for me in Australia, though I'm on fibre.",1340940342.0
70,4175090,comment,4174284.0,4175036.0,1,0,xwowsersx,,,That's just you. Loads in 1 second flat here in NY.,1340940295.0
71,4175089,comment,4174435.0,4174435.0,9,0,jwilliams,,,"The other risk I've seen in Chinese manufacturing is duplication of your design. Some vendors will manufacture a larger run and then place the float on the black market. This is particularly true for smaller orders.<p>I know of at least one niche electronics manufacturer - they have the parts made in China, but they load the firmware back in Australia. They've gone to great lengths to make the device useless without the firmware. It's a bit of a pain shipping-wise, but gives them some security.",1340940295.0
72,4175088,comment,4161958.0,4167308.0,1,0,clavoie,,,"Yeah, the australian company called Where 2. Keyhole (another acquisition) quickly became Google Earth. YouTube, DoubleClick, Urchin (Google Analytics).<p>Google's been surprisingly good at making acquisition flourish (and has had some examples on how not to do it... DodgeBall anyone?)",1340940281.0
73,4175087,comment,4174284.0,4174284.0,1,0,tarellel,,,"Very nice finally something from MS that looks great. The simplicity and clean, clear, and crisp look is definitely a win for me. But it's to little to late, everyone's shifted a lot of their focus to Apple and Google.<p>BTW I think it's hilarious that they're using modernizer on their site, maybe it's the best choice they've got to cover up some of their own mistakes.",1340940269.0
74,4175086,comment,4174284.0,4174391.0,3,0,justindocanto,,,This was what I was going to point out. Great responsive design. Now if only their operating system was as sleek and as this ;),1340940238.0
75,4175085,comment,4174612.0,4174612.0,1,0,majorlazer,,,"Post starts with:<p><i>Ive been following every single article, video, or meme mentioning Google Glass since its first demo video a few months ago. Google promised a lot; Glasses were meant to be something like an augmented brain. It would offer contextual information, interactivity, quick reference, and much more. And now I feel betrayed. Why?</i><p>And ends with:<p><i>We all know that this is a really early prototype and are willing to see (and buy) something as revolutionary as the iPhone. In the end, the most intelligent move of the day was releasing the early version of the product only to developers (with a US$1,500 price tag), to gain the necessary feedback and try to get things working while surfing on the huge PR wave.</i><p>You just answered your own question.",1340940230.0
76,4175084,comment,4174835.0,4174963.0,1,0,brodney,,,An app and/or desktop client and I would probably switch to this full time. Definitely a cool idea.,1340940223.0
77,4175083,comment,4174643.0,4174643.0,1,0,kurtvarner,,,"><i>Elastic has started to field interest from venture capital firms looking to provide funding, Efti says, but for now the company is focusing on the business.</i><p>Good for them. It's refreshing to see a company grow organically with their own reinvestment.",1340940220.0
78,4175082,comment,4174643.0,4174643.0,2,0,kurtvarner,,,"><i>The headcount growth has been purely from Elastics own reinvested revenues.</i><p>><i>Elastic has started to field interest from venture capital firms looking to provide funding, Efti says, but for now the company is focusing on the business.</i><p>Good for them. It's refreshing to see a company grow organically with their own reinvestment.",1340940219.0
79,4175081,comment,4174550.0,4174868.0,2,0,yuhong,,,"I think it is MS's fault for taking years to speed up pace of browser development. DOM2 (important for jQuery) and XHTML are at least 10 years old now, and both are not supported by IE8 and took until IE9 to support.",1340940205.0
80,4175080,story,,,1,0,tracyhou,Dresses For Wedding Found In The Leading Marketplace.,http://www.onlybrides.com.au/,"OnlyBrides.com.au is a creative wedding dresses online store! Our team can customize your own bridal wedding gowns, bridesmaid dresses and special dresses in any color, size and style according to their requirements",1340940168.0
81,4175079,comment,4174612.0,4175006.0,1,0,jarin,,,"Funny enough, my porn client called me about that seconds after he saw that video.",1340940147.0
82,4175078,comment,4171252.0,4174908.0,3,0,rblackwater,,,"If you are a developer and you have not encrypted your IP on a laptop you are going to leave by itself, well, your shareholders would probably be pretty disappointed.",1340940129.0
83,4175077,comment,4172922.0,4173806.0,-2,0,shasta,,,"What?  When I met Jeff Barr from Amazon, she was a woman.",1340940120.0
84,4175076,story,,,1,0,jamesturner,Bicycle Frames,http://www.yoeleo.com/frames.html,,1340940114.0
85,4175075,comment,4174435.0,4174435.0,13,0,unreal37,,,"Sadly these guys wrote an identical blog post a year ago about how their previous manufacturer was unprofessional. The new one was supposed to be top notch, since they met him in person and toured the factory before signing.<p><a href=""http://www.kickstarter.com/projects/cwandt/pen-type-a-a-minimal-pen/posts/122492"" rel=""nofollow"">http://www.kickstarter.com/projects/cwandt/pen-type-a-a-mini...</a>",1340940112.0
86,4175074,story,,,1,0,tracyhou,Y Combinator: Bookmarklet,http://ycombinator.com/bookmarklet.html,,1340940105.0
87,4175073,comment,4174435.0,4174710.0,11,0,ars,,,A copy to make it easier to read:<p>Project Update ,
88,4175072,story,,,1,0,joshma,Siri vs. Google Search (Jelly Bean) ,https://www.youtube.com/watch?v=kDsOtdRtG0Q&feature=g-u-u,,1340940077.0
89,4175071,comment,4174612.0,4174612.0,1,0,jarin,,,"I know we've all read about the exciting ""external brain"" aspects of augmented reality in books like Accelerando, but sheesh guys, we have to start SOMEWHERE.<p>If I have to buy 10 pairs of Google Glass to light a fire under Apple, Qualcomm, and Valve's asses to get the immersive AR glasses I always wanted I will gladly do so.",1340940066.0
90,4175070,comment,4172922.0,4172922.0,1,0,visa,,,"Guys checkout how much google pays to its employees <a href=""http://www.visasquare.com/visa-greencard/salary/google-inc-31830.html"" rel=""nofollow"">http://www.visasquare.com/visa-greencard/salary/google-inc-3...</a>",1340940017.0
91,4175069,comment,4174612.0,4174965.0,1,0,wallflower,,,"> ""I wonder what they are using the send the image feed, surely not 3G or even LTE...<p>They showed today how they had multiple people on the roof with portable microwave dishes, hand aiming at each individual skydiver, with redundant backup alternative RF. The first skydiver released smoke to let his tracker know his position.",1340940002.0
92,4175068,comment,4174298.0,4174298.0,2,0,jws,,,"Looks like he escaped his remaining pair of $58M golden handcuffs. Well done! Enjoy!<p><i>and will be granted an additional 100,000 shares in 2014 should he stay with company</i> <a href=""http://www.macrumors.com/2011/04/27/apple-svp-bob-mansfield-sells-off-99-of-aapl-shares/"" rel=""nofollow"">http://www.macrumors.com/2011/04/27/apple-svp-bob-mansfield-...</a>",1340939993.0
93,4175067,comment,4173773.0,4174190.0,1,0,isthatso,,,> They were ready to ship QNX when they were bought<p>I've no idea where you're getting that but when they QNX was not ready to ship anything on mobile back then. They've been building the whole ecosystem around the core QNX system.,1340939911.0
94,4175066,comment,4174550.0,4175035.0,1,0,yuhong,,,"Yea, MS has in general never released new versions of IE for a version of Windows that entered extended support, and the extended support phase lasts for <i>five years</i>!",1340939869.0
95,4175065,comment,4174550.0,4174693.0,6,0,Zarel,,,"You do realize that IE 10 will be supported by jQuery 2.0, right?",1340939853.0
96,4175063,comment,4170959.0,4170959.0,1,0,sarla999,,,goodbye facebook. why?,1340939818.0
97,4175062,comment,4174835.0,4175046.0,1,0,monsterix,,,"We let users write letters directly from the browser and send it to anyone on email. You can put hand-draw signature on your letters using mouse/touchscreen, draw, sketch, collage etc.<p>Sorry, we're a bit early-on into our product, couldn't meet expectations :-(",1340939810.0
98,4175060,comment,4172261.0,4174486.0,1,0,wallflower,,,"Unfortunately once you get into heavy picture viewing, you need to go to OpenGL. In fact, almost all of the top selling custom launchers and live wallpapers are OpenGL.",1340939709.0
99,4175059,comment,4174643.0,4174785.0,3,0,andrewdumont,,,,
100,4175058,comment,4169847.0,4170323.0,2,0,onetwothreefour,,,"Why would an Australian company want to hire ""B"" and ""C"" grade devs, let alone import them?<p>Wow, this thread is misinformed. There's plenty of world class ""A"" grade talent in Sydney. Some of those people leave, some of those people stay. You just have to know where to look.<p>Funnily enough, not everyone wants to move to the US, because if you're not a founder of a tech company, there's very little reason to leave Sydney for SF.",1340939678.0
101,4175056,comment,4172837.0,4172837.0,4,0,cnp,,,"This is quite nearly the PERFECT book, one that every web developer should read front to back.",1340939669.0
102,4175055,story,,,3,0,kellysutton,Making a New Type of Activity Feed,http://layervault.tumblr.com/post/26117253199/making-a-new-type-of-activity-feed,,1340939645.0
103,4175054,story,,,1,0,jmacofearth,What is Uber.la? (Social Media Marketing Site - name),http://uber.la/about/,,1340939619.0
104,4175053,comment,4174612.0,4174612.0,3,0,drivebyacct2,,,"Since you asked, yes, you are crazy for looking at the video broadcast to the Hangout and thinking that it's indicative of the UI available on the HUD. Or that because they didn't show a feature that it's not planned, even for v1.<p>There have been public mentions and acknowledgements of some of the features that you call out as missing. You're, plainly, uninformed.",1340939557.0
105,4175052,comment,4174550.0,4174868.0,1,0,yuhong,,,And MS will technically support IE8 for Win7 with security updates till 2020 for the same reason IE6 on XP is still supported until 2014 (and IE 5.01 on Win2000 was supported until 2010).,1340939551.0
106,4175051,comment,4174419.0,4174419.0,2,0,dreamdu5t,,,Thank you for posting this... whoever you are.,1340939534.0
107,4175050,comment,4174284.0,4174284.0,3,0,billpatrianakos,,,"It looks great actually! What kills ,e about Microsoft though is that, especially recently, they've done a great job in making their sites, OS, and software quite pretty but they <i>still</i> after all this time have absolutely horrendous font rendering in Windows which kills every design they come out with. I'm a developer who uses a Mac as my primary machine, Linux as a secondary machine and in the past month has been forced to use Windows at my new job. I wasn't happy about it but it turns out I've gotten just about as productive with it as any other platform. But the problem is that now, 4 weeks in, I get terrible eye strain and the whole system looks ugly because fonts are jagged except at really large sizes. It's ironic that this new site looks awesome on my iPad and Mac but not so much on their own OS, Windows. Why can't they fix that already?",1340939514.0
108,4175049,comment,4174550.0,4174992.0,3,0,Silhouette,,,"I appreciate the reply, but I can't help noticing that you didn't actually answer my question.",1340939507.0
109,4175048,story,,,3,0,spudlyo,The Measured Man,http://www.theatlantic.com/magazine/archive/2012/07/the-measured-man/9018/,,1340939503.0
110,4175047,comment,4173522.0,4173522.0,2,0,MarkMc,,,"Several problems:<p>1. Not very robust - it keeps forgetting the Google passwords I've typed in<p>2. Why do I need to enter two Google passwords - my 'main' password AND an application-specific password?<p>3. Not very easy to use.  For example, where's the option to see my browsing history on Chrome for iPhone?",1340939467.0
111,4175046,comment,4174835.0,4174835.0,3,0,timaelliott,,,"I have no idea what your product does and I'm not inclined enough to sign-up (especially with my facebook account) to find out more.<p>Why is ""@bubbles"" all over the place? You don't even own the Twitter handle.",1340939435.0
112,4175044,comment,4174540.0,4174574.0,2,0,yoonminn,,,so a product with good brand and following has not much value without the original founders and teams ?  Can't the product be run by a different team and company?<p>There are many situations where another company could see value in buying a product that the acquirer is no longer interested in maintaining.,1340939316.0
113,4175043,comment,4174075.0,4174613.0,1,0,da02,,,This is hilarious and insightful. I feel stupid for not seeing this while reading the OP article.<p>(Why the throwaway account?),1340939283.0
114,4175042,story,,,1,0,iskander,How does Microsoft's Kinect recognize body parts? [pdf],http://research.microsoft.com/pubs/145347/BodyPartRecognition.pdf,,1340939237.0
115,4175041,comment,4174550.0,4174977.0,7,0,gnaritas,,,"I the cost of maintaining apps exceeds their value as customers, then they're going to lose support.  Don't forget supporting these old broweres isn't free, cheap, or easy.",1340939209.0
116,4175040,story,,,2,0,auston,How get a return on your effort at a startup,http://abunsen.ruhoh.com/returns/,,1340939202.0
117,4175039,comment,4173336.0,4173336.0,1,0,jzd131,,,"haha, love the comment. I was a Management consultant and I felt the exact same way, the only way out for me was to start my own company - SaleMove. It is a lot harder, but yet much more rewording",1340939200.0
118,4175038,comment,4174835.0,4174835.0,4,0,dylanz,,,"I spent time going through each page ""and"" reading through these HN comments and I still don't know what the product does.  Great graphics, but I didn't grok what the product was in the first 10 seconds (and still don't after 2 minutes).",1340939135.0
119,4175037,comment,4171797.0,4174507.0,5,0,tptacek,,,"You keep coming back to ""generalized knowledge doesn't comprise red-flag knowledge"", and I keep coming back with specific examples of red-flag knowledge. For instance, I can name the <i>actual title</i> of a copyrighted movie the Mega staff pushed onto the site. It was _Taken_, produced by Luc Besson. How did they know it was there, you might ask? <i>Because they put it there.</i><p>Admittedly these issues are for the courts to decide, not message boards, but come on: by all the evidence available to us message board peons, these guys were a bunch of crooks.",1340939134.0
120,4175036,comment,4174284.0,4174284.0,1,0,damian2000,,,"Nice look, but, slow as hell to load. 15 seconds before anything appeared. Maybe because I'm in Australia. (my net connection is around 5mbit so its not that).",1340939106.0
121,4175035,comment,4174550.0,4174660.0,1,0,harshreality,,,"<i>IE8... released in 2009</i><p>Microsoft is the only major browser vendor to believe that a 3-year-old browser is acceptable on a supported OS (XP).  Google, Mozilla, Apple, Opera support XP with their latest browsers.<p>I agree it's too soon to drop support for IE8, but I'd love to see more pressure put on MS for leaving XP+IE users stuck with a second rate browser.",1340939106.0
122,4175034,comment,4174612.0,4174979.0,1,0,jiggy2011,,,The gopro is way bigger and afaik it doesn't connect to the internet and stream.,1340939078.0
123,4175033,comment,4173773.0,4174166.0,1,0,Spooky23,,,"The web browser. I loved my BB, but ditched it when it became clear to me that they didn't take browsing seriously.",1340938978.0
124,4175032,comment,4174612.0,4175024.0,1,0,jiggy2011,,,And the Gopro logo all over their suits..,1340938976.0
125,4175031,comment,4174612.0,4174612.0,1,0,ascendant,,,This is not something that's going to market next week. These are prototypes and it's obviously got some way to go.,1340938974.0
126,4175030,comment,4170963.0,4171321.0,1,0,powerslave12r,,,That made me sadder than it should have.,1340938974.0
127,4175029,comment,4167711.0,4171280.0,1,0,falling,,,"I'm not everyone, I have my own opinions.",1340938969.0
128,4175028,comment,4171797.0,4174763.0,3,0,tptacek,,,A PR firm. It's like you can't even get your mind around the idea that there are people who don't see this issue your way.,1340938896.0
129,4175027,story,,,1,0,grecs,Crypto Cracked but Two-Factor Authentication Remains Safe,http://www.novainfosecportal.com/2012/06/28/crypto-cracked-but-two-factor-authentication-remains-safe/,,1340938862.0
130,4175026,comment,4174075.0,4174075.0,1,0,datalus,,,"It's a long life and at 25, you've still got a ways to go :)",1340938814.0
