,ID,Type,Story,Parent,Points,Comments,Author,Title,URL,Content,Created
105,10285409,comment,10283247.0,10285323.0,0,0,geofft,,,"Well, if you want to draw partisan lines on content, all of those are seemingly big-government actions (which is natural, for things that government would want to propagandize): governmental policies to influence the market to behave in certain ways, intervention in foreign wars, and centralized, taxpayer-funded healthcare that was controversial within the Republican ranks.<p>This is metapolitics, designed to poison the well about all government actions and support conservative/libertarian positions in general. It&",
106,10285408,comment,10284587.0,10285240.0,0,0,pash,,,"Yes, I recognize that the definition you gave is far and away the most common one, even among policy wonks. The original definition seems still to have currency mostly among economists.<p>But the definition I gave is indeed the original one, and it is not a generalization. A tax may be progressive in your sense but not in the original sense: a luxury tax on yachts, for instance, is progressive in your sense, but not in the original sense if it is assessed at a fixed rate [0].<p>The OED&",
107,10285407,comment,10285007.0,10285155.0,0,0,aianus,,,We&,
108,10285406,comment,10284185.0,10285379.0,0,0,falsedan,,,We generate a huge amount of IP at work in a (similar to) engineering effectiveness role. Even the dumbest tools we come up with could be spun off into an ok-ish start-up.<p>I guess it&,
109,10285405,comment,10284634.0,10284634.0,0,0,Cyph0n,,,"I interned there last year. They use a Windows 7 image that is preloaded with drilling software built in-house. Most of the newer software seemed to be written in .NET.<p>They have some really awesome tech, especially from an electronics point of view. Some of their newer MWD (measurement while drilling) tools have state of the art sensors for every physical phenomenon known to man. The drilling operator can therefore &quot;see&quot; everything. The electronics systems that go downhole can withstand insane temperatures (125C), shocks, and RPM.",1443326456.0
