,ID,Type,Story,Parent,Points,Comments,Author,Title,URL,Content,Created
0,10285530,story,,,4,0,LeoNatan25,New formula makes liquid flow batteries organic,http://arstechnica.com/science/2015/09/new-formula-makes-liquid-flow-batteries-organic/,,1443329983.0
1,10285528,comment,10282852.0,10282852.0,0,0,digi_owl,,,And the discussion descends into the exact kind of security absolutism that he was warning about...,1443329866.0
2,10285527,comment,10284285.0,10285318.0,0,0,happycube,,,CEDatum can grade and often repair stylii at least.<p>Another big problem is that people who don&,
3,10285526,comment,10284383.0,10285396.0,0,0,mahyarm,,,So how did turkey happen?,1443329755.0
4,10285525,comment,10284000.0,10285399.0,0,0,nnutter,,,Another fun way to test is to press with your nail compared to pressing with your finger tip.,1443329656.0
5,10285524,story,,,1,0,walterbell,Quebec dairy farmers panicked over Trans-Pacific deal,http://www.cbc.ca/news/canada/montreal/canada-election-2015-trans-pacific-partnership-dairy-1.3245455,,1443329647.0
6,10285521,comment,10284688.0,10285339.0,0,0,GauntletWizard,,,But that&,
7,10285520,story,,,5,4,walterbell,Why Windows 10 is the most secure Windows ever,http://www.computerworld.com/article/2984449/security/why-windows-10-is-the-most-secure-windows-ever.html,,1443329433.0
8,10285519,comment,10284302.0,10284302.0,0,0,tikhonj,,,"Reminds me of the amusing &quot;Watergategate&quot;[1] sketch from the British comedy show &quot;The Mitchell and Webb Look&quot;. I mean, the joke is sort of in the title, but it&",
9,10285518,comment,10285374.0,10285374.0,0,0,ClintEhrlich,,,It&,
10,10285517,comment,10284185.0,10285332.0,0,0,powerfulninja,,,Why? Because Twitter as a company hasn&,
11,10285516,comment,10284189.0,10284984.0,0,0,dang,,,"It seemed less substantive, and we often switch to original sources in cases like this (as the guidelines mention, they&",
12,10285515,story,,,1,0,walterbell,"Provisioning a Development Environment with Packer, Part 1 (2014)",http://blog.endpoint.com/2014/03/provisioning-development-environment.html,,1443329367.0
13,10285513,comment,10284000.0,10285399.0,0,0,bontaq,,,"That was a truly confusing experience the first time I clicked when the machine was off.  The click was a lie, yet I swore I felt mechanical travel.",1443329290.0
14,10285512,story,,,2,0,HostFat,Cypherpoker – Mental Poker,,Code: https://github.com/monicanagent/cypherpoker<p>Blog: http://patrickbay.ca/blog/?p=650<p>Blog2: http://www.torontocitylife.com/2015/09/19/totally-mental-poker/<p>Reddit: https://np.reddit.com/r/cypherpoker/,1443329264.0
15,10285511,comment,10285151.0,10285469.0,0,0,sigmaml,,,"> I think the frame of reference is the programmer intent.<p>Sure.  However, that is secondary.  The sort of mistakes that you mention can be caught during code review or unit testing, completely independently of what the actual user requirement is.  This post, evidently, does not involve such a case.<p>> The code is doing what the programmer intended, even if that is not what the user wanted.<p>Your perspective appears to be inside-outward.  It may be helpful during a performance appraisal, but does the business no good!<p>Edit: inside-out --> inside-outward.",1443329256.0
16,10285510,comment,10285374.0,10285489.0,0,0,CamperBob2,,,Can you elaborate on why you feel its conclusion is necessarily bogus?,1443329246.0
17,10285509,comment,10284638.0,10285251.0,0,0,userbinator,,,I don&,
18,10285508,comment,10275991.0,10279455.0,0,0,jhamar,,,No sarcasm . . . How is it not possible to survive for a year for 50k? . . . We do not need an office or need to hire any employees - we just need some hustling cash! . . . where are you guys from?,1443329211.0
19,10285507,comment,10284470.0,10284470.0,0,0,csense,,,I&,
20,10285506,comment,10284299.0,10284299.0,0,0,nevi-me,,,If I hadn&,
21,10285505,comment,10284587.0,10285230.0,0,0,euroclydon,,,"This does happen: Drug Dealers, Iran.",1443329176.0
22,10285504,story,,,2,0,nreece,How Assassin's Creed recreated 1868's most powerful city,http://www.theage.com.au/digital-life/games/experiencing-victorian-london-in-assassins-creed-syndicate-20150925-gjurig.html,,1443329160.0
23,10285503,comment,10284000.0,10284000.0,0,0,digi_owl,,,"This article is a demonstration of what i mean with how Apple get attention in media that other tech companies does not. His one article about another phone in the archive is at first glance about the Moto X Pure, yet it quickly ends up talking about phone ergonomics in general.<p>And other than iPhone he his articles are about biology in various forms, even when supposedly bringing up Pixars (memory).",1443329142.0
24,10285500,comment,10284130.0,10285327.0,0,0,mahranch,,,Did you read your link? The numbers &quot;<i>were self-reported by \nshark fin vendors in the Guangzhou</i>&quot;. Hardly scientific and it&,
25,10285499,comment,10284299.0,10284791.0,0,0,HarveyKandola,,,"See my comment above, but take a look at Countersoft Gemini. Enterprise flavored, all-in-one type approach that can be self-hosted.<p>The gotcha? Runs on Windows Server which probably doesn&",
26,10285498,comment,10284202.0,10285459.0,0,0,wutbrodo,,,I think that stretches the definition a little too far. A warning sign of that type is different from textual symbols in that it&,
27,10285496,comment,10275991.0,10276085.0,0,0,jhamar,,,NJ - 15 minutes from NYC - 50k will be used for some growth hacks and living expenses at my dad&,
28,10285495,comment,10284130.0,10285465.0,0,0,adamnemecek,,,Value of life in Africa isn&,
29,10285493,comment,10284185.0,10285488.0,0,0,rhizome,,,"Nice one, I&",
30,10285492,comment,10284000.0,10285312.0,0,0,digi_owl,,,I don&,
31,10285491,comment,10284383.0,10284383.0,0,0,AnotherXen,,,"Sorry, what does this have to do with Startup/Hacker culture?<p>I suppose someone wanted to make the oft-stated point of how archaic and backwards Saudi Arabia appears from our cultural perspective. Perhaps capitalizing on this latest bout of online xenophobia towards &quot;Islamic-looking&quot; minorities.<p>Either way, a waste of space on the Hacker News homepage.",1443328830.0
32,10285490,comment,10285151.0,10285283.0,0,0,rasz_pl,,,>not really a bug<p>Imagine a car turning off traction control in a pouring rain every time you stop at the lights because &,
33,10285489,comment,10285374.0,10285374.0,0,0,jwm4,,,"In other words, it&",
34,10285488,comment,10284185.0,10285332.0,0,0,meeper16,,,Twitter != anything related to true software engineering. Twitter == majordomo wrapper.,1443328728.0
35,10285487,comment,10284202.0,10285005.0,0,0,hardcoreluddite,,,"&quot;Any one language cannot solve all the problems in the programming world and so it gets to the point where you either keep it simple and reasonably elegant, or you keep adding stuff. If you look at some of the modern desktop applications they have feature creep. They include every bell, knob and whistle you can imagine and finding your way around is impossible. So I decided that the shell had reached its limits within the design constraints that it originally had. I said ‘you know there’s not a whole lot to more I can do and still maintain some consistency and simplicity’. The things that people did to it after that were make it POSIX compliant and no doubt there were other things that have been added over time. But as a scripting language I thought it had reached the limit.&quot;<p>From an interview with Steve Bourne in 2009.<p><a href=""http://www.computerworld.com.au/article/279011/a-z_programming_languages_bourne_shell_sh/"" rel=""nofollow"">http://www.computerworld.com.au/article/279011/a-z_programmi...</a>",1443328725.0
36,10285486,story,,,5,0,spking,The Sharing Economy Attracts Older Adults,http://nytimes.com/2015/09/26/your-money/the-sharing-economy-attracts-older-adults.html?smprod=nytcore-iphone&smid=nytcore-iphone-share&_r=1&referer=http://t.co/lAcQayS7Uu,,1443328690.0
37,10285485,comment,10283990.0,10283990.0,0,0,eggy,,,"I used to worry over having unread books around, but now I prefer a library of unread books from which I can browse and pick. A library of books already read is just for show, or just takes up space if you are not referencing them or re-reading them. Tsundoku is the way you should keep your library, but preferably not on the floor and nightstands. Guilty:)",1443328665.0
38,10285484,story,,,1,0,eplanit,"September 27 / September 28, 2015 – Total Lunar Eclipse – Where and when to see",http://www.timeanddate.com/eclipse/lunar/2015-september-28,,1443328643.0
39,10285483,comment,10284299.0,10285049.0,0,0,HarveyKandola,,,"If you are after &quot;enterprise&quot; grade solutions that cover the core of issue management, tasking, ticketing and testing -- take a look at Countersoft Gemini.<p>We compete routinely with Jira and win deals by providing fully loaded 50mb zipped solution that runs on Windows servers, integrates with AD/Outlook/Exchange, etc., custom Apps Framework and obligatory RESTful API. Just the things that &quot;demanding enterprises&quot; look for.<p>No idea if this helps you.",1443328629.0
40,10285482,comment,10285397.0,10285397.0,0,0,greenyoda,,,"This is a republication of the original, previously discussed: <a href=""https://news.ycombinator.com/item?id=10218915"" rel=""nofollow"">https://news.ycombinator.com/item?id=10218915</a>",1443328589.0
41,10285481,comment,10284664.0,10284664.0,0,0,gohrt,,,">  Today, Costco alone sells more stuff every year than Amazon by far.<p>Perspective",1443328552.0
42,10285480,comment,10284664.0,10285441.0,0,0,gohrt,,,Costco prints the unit cost on every price tag. That&,
43,10285479,comment,10284508.0,10285460.0,0,0,carbocation,,,"> Lastly, I&",
44,10285478,story,,,69,16,rnhmjoj,Dex UI: futuristic interface built with openFrameworks,http://nnkd.org/dexui/,,1443328459.0
45,10285477,story,,,2,0,waqasaday,PM Narendra Modi's Talk at Digital Technology Dinner in San Jose,https://www.youtube.com/watch?v=4krn8K2JWMs&feature=youtu.be&t=1h15m19s,,1443328434.0
46,10285476,comment,10284202.0,10285182.0,0,0,chillacy,,,"Yea, but try charades with a chinese speaker over IRC (or some language without any shared linguistic history)... suddenly charades with hand gestures is easier. The parent comment&",
47,10285475,story,,,10,0,grej,"The most popular type of home in every major American city, charted",http://www.washingtonpost.com/news/wonkblog/wp/2015/09/21/the-most-popular-type-of-home-in-every-major-american-city-charted,,1443328405.0
48,10285474,comment,10282941.0,10282941.0,0,0,sharemywin,,,there&,
49,10285473,comment,10284028.0,10284028.0,0,0,monopolemagnet,,,"Having supported Windows in production in wild, real world environments and worked in security research....<p>Windows has a giant attack surface because of the sheer  indefinitely-legacy-compatible, multiverse-sized codebases of unsafe, unprovable, low-level code in C/C",
50,10285472,comment,10281399.0,10284428.0,0,0,karjaluoto,,,"Clarity is microconsulting and allows users to tap advice by paying for it, by the minute.<p>Officehours is more of a community. If you need a hand with something, you can ask someone—no charge. And when someone needs your help, you can return the favor.<p>So, similar in function, but philosophically quite different.",1443328361.0
51,10285471,comment,10283790.0,10283790.0,0,0,rnovak,,,"This is my opinion, and it may be a personal one, but from an engineering standpoint, I think you should learn both. I think learning multiple languages can only benefit you (if Python 2 vs 3 can even be considered different languages).<p>When I first started learning to program, I thought of every problem in terms of C++ (the first language I learned).<p>It wasn&",
52,10285470,comment,10284000.0,10285449.0,0,0,muddi900,,,"Apple did advertise universal apps AND games, but all the devices have different control interfaces.",1443328339.0
53,10285469,comment,10285151.0,10285443.0,0,0,smegel,,,"I think the frame of reference is the programmer intent. If he/she intended to check for equality but wrote:<p><pre><code>    if (x = 42) {\n</code></pre>\nThen that is most certainly a bug.<p>If a bit of text was supposed to be blue but came out green, maybe because the person writing the requirements doc got it wrong, it is hardly a bug in the code. The code is doing what the programmer intended, even if that is not what the user wanted. That&",
54,10285468,comment,10284634.0,10284634.0,0,0,eggy,,,They could go with Lisp :)<p>Ada or ATS-Lang would be good for such mission-critical applications with various modules needing to keep it safe. The DoD and aerospace already use Ada for such purposes. Just please don&,
55,10285467,comment,10284383.0,10285316.0,0,0,nestlequ1k,,,Another one of the many horrifying things I saw in the article was the concept of an &quot;Exit Visa&quot; which I hadn&,
56,10285466,comment,10284299.0,10285248.0,0,0,structural,,,Upsource is good for browsing. We&,
57,10285465,comment,10284130.0,10285451.0,0,0,aianus,,,"The price is not zero, it&",
58,10285464,comment,10284688.0,10285362.0,0,0,tbrownaw,,,"The control against companies staying undervalued for too long is acquisitions. Plus of course, it&",
59,10285463,comment,10284672.0,10285209.0,0,0,davnicwil,,,"> It is not even a car. Originally land speed records had the power delivered at the wheels. Strapping a second hand jet engine and some Norwegian rocket to some glorified hand-cart is cheating.<p>Yeah, this is a major thing that dampens the interest in the record for me. At this extreme the land speed record seems rather arbitrary, because it&",
60,10285461,comment,10284185.0,10284185.0,0,0,bozoUser,,,Sometimes(read: most of the times) the tech debt and other code issues arise from the last min requirements although as dev. we try make sure the code is robust enough to absorb these changes seldom this happens.<p>What I have seen is effective for me is to sit down with pen and paper and describe the problem at hand and then think about the solution write up.,1443327998.0
61,10285460,comment,10284508.0,10284508.0,0,0,noname123,,,"From what I understand, the Broad patents are free to license for academic community and not free for industry.<p><a href=""https://www.broadinstitute.org/partnerships/office-strategic-alliances-and-partnering/information-about-licensing-crispr-cas9-syste"" rel=""nofollow"">https://www.broadinstitute.org/partnerships/office-strategic...</a><p>&quot;Broad Institute, MIT, and Harvard University partners have made CRISPR-Cas9 technology broadly available to the research community. Broad Institute is working with AddGene, a non-profit plasmid repository, to offer Zhang lab CRISPR plasmids and reagents ... in addition we have non-exclusively licensed many industry partners for development of research tools and reagents and will continue to do so.&quot;<p>The reagent/CRISPR toolkit link here (can anyone just sign up and order the reagents?): <a href=""https://www.addgene.org/CRISPR/"" rel=""nofollow"">https://www.addgene.org/CRISPR/</a><p>I&",
62,10285459,comment,10284202.0,10284202.0,0,0,doctorstupid,,,"People are noting counterexamples where pictures are more efficient, such as warning symbols which are resilient to cultural translation. However, I would argue that such cases are actually forms of text. By &",
63,10285457,comment,10284672.0,10285209.0,0,0,vacri,,,"From over here in the antipodes, I&",
64,10285456,comment,10285117.0,10285117.0,0,0,cing,,,"A great open-source spectrometer built the same way is available from PublicLab here: <a href=""http://store.publiclab.org/products/desktop-spectrometry-kit-3-0"" rel=""nofollow"">http://store.publiclab.org/products/desktop-spectrometry-kit...</a> (or you can just build it yourself using their designs on the Wiki). PublicLab also has a repository for spectra so you can calibrate and compare with others.",1443327926.0
65,10285455,comment,10284383.0,10285423.0,0,0,grej,,,Thanks. Edit made,1443327806.0
66,10285454,comment,10285150.0,10285150.0,0,0,jasondrowley,,,I&,
67,10285452,comment,10284028.0,10285280.0,0,0,nuxi7,,,Same reason unix systems typically did the same with theirs (albeit on port 111)<p>Its not very useful if other machines can&,
68,10285451,comment,10284130.0,10285438.0,0,0,adamnemecek,,,That&,
69,10285450,comment,10280282.0,10283231.0,0,0,ScottBurson,,,Let&,
70,10285449,comment,10284000.0,10285367.0,0,0,chvid,,,"Why the down votes? This is an honest question.<p>It is a classical critism of context menus that they are hidden and their presence needs to be learned. This problem obviously gets worse here as the context menu is only present in the latest hardware.<p>From a business perspective it makes sense: You are selling a package and the extra software feature is given to those pay for the update. But whether it is good design - that is another question.<p>And as a curiosity: Context menus are used much less in Mac OS than Windows. There is only a single button on an Apple laptop and Apple went on for decades with the one-button mouse for their desktop computers, only to introduce a multi-button mouse very late.",1443327643.0
71,10285448,comment,10284383.0,10284383.0,0,0,nestlequ1k,,,This travel guide can be summed up with a simple word: &quot;Don&,
72,10285447,comment,10285398.0,10285398.0,0,0,voltagex_,,,I&,
73,10285446,story,,,1,0,kareemm,We’ve Got This Whole Unicorn Thing All Wrong,https://medium.com/the-wtf-economy/we-ve-got-this-whole-unicorn-thing-all-wrong-3f3d108cc71d,,1443327588.0
74,10285444,comment,10285117.0,10285388.0,0,0,p1mrx,,,"White LEDs are just blue LEDs with a yellow phosphor, so the spectrum usually has a blue hump, and a red-green hump:<p><a href=""http://www.soundandvision.com/content/led-vs-cfl-bulbs-color-temp-light-spectrum-and-more"" rel=""nofollow"">http://www.soundandvision.com/content/led-vs-cfl-bulbs-color...</a>",1443327536.0
75,10285443,comment,10285151.0,10285414.0,0,0,sigmaml,,,"> But I agree that code is only a bug if it does not do what was originally intended, if the original design was bad, and the code correctly implemented that bad design, there is no bug.<p>The frame of reference for determining if something is a bug or not is the requirement specification, not design.  If the design incorrectly or inadequately addresses the requirement, that is a bug as well.  There isn&",
76,10285442,comment,10284383.0,10285316.0,0,0,cheepin,,,"Quick exercise: What country worse represents human rights than Saudi Arabia? Their &quot;Committee for the Propagation of Virtue and the Prevention of Vice&quot; is seriously 1984-esque.<p>It really seems like you can be executed for literally anything, and if the government doesn&",
77,10285441,comment,10284664.0,10284664.0,0,0,daxelrod,,,"Transcript: <a href=""http://www.npr.org/templates/transcript/transcript.php?storyId=443519599"" rel=""nofollow"">http://www.npr.org/templates/transcript/transcript.php?story...</a><p>This is fascinating for me because I just shopped at Costco for the first time yesterday.<p>It was completely overwhelming. I was lost in a huge store with no signage. The large packages of merchandise meant my usual heuristics for whether something was a good price went out the window. Everything was utilitarian, streamlined, and huge.<p>Now I understand that it was deliberately designed this way.",1443327460.0
78,10285440,comment,10284508.0,10284729.0,0,0,Turing_Machine,,,The standard argument for patents is that patents require that the method be disclosed. Otherwise discoveries are kept as trade secrets rather than being published for anyone to use after the patent expires.,1443327334.0
79,10285439,comment,10285151.0,10285401.0,0,0,vezzy-fnord,,,"At least in the case of the Linux kernel, Google is actually around the 9th or 10th largest corporate contributor. [1] I&",
80,10285438,comment,10284130.0,10285070.0,0,0,gizmo686,,,"It would increase supply of ivory, and therefore drive down the price, making it less profitable to hunt wild elephants.",1443327313.0
81,10285437,comment,10284886.0,10284886.0,0,0,bjwbell,,,Reading this makes me afraid of writing C code all over again.<p>Undefined behavior is almost impossible for a programmer to 100% of the time detect (not that this particular regehr post is on UB).,1443327298.0
82,10285436,comment,10284383.0,10285316.0,0,0,lucaspiller,,,"> * &quot;Drug possession is punishable by death&quot;<p>The same is true in the US by law, but it isn&",
83,10285434,comment,10284202.0,10284202.0,0,0,nnethercote,,,"After this sentence:<p>&quot;This blog post is likely to take perhaps 5000 bytes of storage, and could compress down to maybe 2000; by comparison the following 20-pixel-square image of the silhouette of a tweeting bird takes 4000 bytes:&quot;<p>in my browser I see a little broken image icon which represents a missing picture. How apt.",1443327245.0
84,10285433,comment,10284383.0,10285227.0,0,0,joesmo,,,"It might not be a bad idea to stop trading with them and publicly condemn certain things about their society, especially their treatment of women. I assume this will happen as soon as we&",
85,10285432,comment,10285374.0,10285374.0,0,0,mrdrozdov,,,"Nate Silver has made similar observations about the previous two elections. Essentially, that you can choose which news that you want to see, and it may not be the reflective aggregate of reality.<p>Although, I don&",
86,10285431,comment,10285398.0,10285398.0,0,0,colejohnson66,,,"From the last time this was posted: <a href=""http://i.imgur.com/FECDNDc.png"" rel=""nofollow"">http://i.imgur.com/FECDNDc.png</a>",1443327177.0
87,10285430,story,,,2,0,lcuff,New Neuroscience Reveals 4 Rituals That Will Make You Happy,http://www.bakadesuyo.com/2015/09/make-you-happy-2/,,1443327167.0
88,10285429,comment,10283327.0,10283327.0,0,0,muddi900,,,"Man newsletters are making a comeback, but the only one I am subscribed to is Warren Ellis&",
89,10285428,story,,,1,0,chapulin,Is this robotic dog creepy or cute?,http://fusion.net/story/203579/robopet-chip-dog-ai/,,1443327113.0
90,10285427,story,,,3,0,voltagex_,Full Reddit Submission Corpus now available (2006 thru August 2015),https://www.reddit.com/r/datasets/comments/3mg812/full_reddit_submission_corpus_now_available_2006/,,1443327007.0
91,10285426,comment,10284321.0,10284718.0,0,0,monopolemagnet,,,Higher viscosity filler fluid and/or a ferro-binding compound to dampen the &quot;springy&quot; vibrations and ferro &quot;spikes&quot;?<p>Btw: Comes off a labor of love and insanely-awesome attention to design and detail.  Outstanding.  Kickstarter/indiegogo/lockitron selfstarter page yet? :),1443326978.0
92,10285425,comment,10284587.0,10285122.0,0,0,sulam,,,"$200K = $20K / yr over 10 years. An $800K mortgage, depending on interest rates, can easily cost $4000/month, or almost $50K / yr.<p>If you can&",
93,10285424,comment,10284299.0,10285049.0,0,0,nwatson,,,"At my workplace (going on two years at a startup) we were saddled with bad I.T. (every service was accessed by its IP address, no DNS lookup), hosted TeamSite/Sharepoint for engineering document management (with absolutely no imposed organization or hierarchy (though P.M. kept their stuff together well there) most things ended up being thrown around in email), Bugzilla, and Subversion.<p>After some organization changes -- long time coming -- we switched to hosted Confluence, JIRA, BitBucket/git.  The transition has taken some time but communication is going so much more smoothly since.<p>Confluence especially has been great.  Designs/how-tos/best-practices are so easy to write.  Permanent records of discussions and decisions are so easy to track.  I made sure to collaborate with a few others to establish the skeleton of our Confluence -- without a good skeleton it would devolve to chaos.  But Confluence is so much better than Word docs floating around ... and I haven&",
94,10285423,comment,10284383.0,10285316.0,0,0,hristov,,,There is no UN Human Rights Commission. That was disbanded back in 2006. There is a UN human rights council. The current president of the UN human rights council is a German named Joachim Rücker.,1443326811.0
95,10285422,story,,,1,0,katiey,Paid-for adblockers also cutting “whitelist” deals with publishers,http://boingboing.net/2015/09/25/paid-for-adblockers-also-cutti.html,,1443326786.0
96,10285421,comment,10283327.0,10283570.0,0,0,nickpsecurity,,,Google&,
97,10285420,comment,10284185.0,10285379.0,0,0,gull,,,What if the tools support the money train to generate 100x more money?,1443326721.0
98,10285419,comment,10284587.0,10285346.0,0,0,natrius,,,How can yesterday&,
99,10285417,comment,10284638.0,10285263.0,0,0,noonespecial,,,Why? They didn&,
100,10285416,comment,10284185.0,10285379.0,0,0,lockes5hadow,,,Which is why tools and process always become such excellent &,
101,10285415,comment,10285151.0,10285401.0,0,0,adventured,,,They have tens of thousands of engineers and work with vast amounts of open source software. Only a few other companies are of comparable scale in terms of sheer software engineering. I think it&,
102,10285414,comment,10285151.0,10285283.0,0,0,smegel,,,"I thought that too, but then<p>> that an endpoint that is not moving any traffic cannot use the lack of errors as information in its feedback loop.<p>I think the bug is that it was counting something when it should have not been, which would have violated both the design and intent even at the time it was written.<p>But I agree that code is only a bug if it does not do what was originally intended, if the original design was bad, and the code correctly implemented that bad design, there is no bug.",1443326593.0
103,10285413,comment,10283327.0,10285208.0,0,0,nickpsecurity,,,Linux didn&,
104,10285411,comment,10284672.0,10285209.0,0,0,bane,,,"I suspect the answer to many of your parts sourcing questions is that this is a very British project, and there&",
