,ID,Type,Story,Parent,Points,Comments,Author,Title,URL,Content,Created
107,10157531,comment,10149811.0,10155437.0,0,0,nitrogen,,,"11th grade welding class in a mixed rural/suburban area, as an example.  Too specific?",1441170370.0
108,10157530,comment,10155421.0,10156872.0,0,0,exodust,,,Probably from all the people entering bogus emails in anger and retaliation at your company&,
109,10157529,comment,10157279.0,10157399.0,0,0,dahart,,,That sorta goes hand-in-hand with &quot;There shall be no use of dynamic memory allocation after task initialization.&quot; Which in my experience is the harder rule to deal with. It&,
110,10157528,comment,10155421.0,10157482.0,0,0,kbenson,,,I suspect that&,
111,10157527,comment,10154565.0,10156760.0,0,0,ddoscampaign,,,"If Snowden or IS uses this service, it&",
112,10157526,comment,10154290.0,10155990.0,0,0,PhasmaFelis,,,That is the engineering prototype. See paragraph ,
113,10157525,story,,,1,0,Sami_Lehtinen,Batching HTTPS REST Requests in App Engine,http://googlecloudplatform.blogspot.com/2015/09/Batching-HTTPS-REST-requests-in-App-Engine.html,,1441170263.0
114,10157524,comment,10155421.0,10157055.0,0,0,exodust,,,There are better ways to tell you about the app that don&,
115,10157523,comment,10153164.0,10153164.0,0,0,lazzlazzlazz,,,"I love it, especially the singular &quot;G&quot;. Wonderfully clean and modern - even though I didn&",
116,10157522,comment,10142019.0,10150833.0,0,0,marvy,,,thanks!,1441170235.0
117,10157521,comment,10154300.0,10157286.0,0,0,schoen,,,I read someone&,
118,10157520,comment,10156227.0,10156227.0,0,0,yakult,,,"Alternative explanation for the spike in freshmen interest: the engineering/cs classes are 95% men where I am.  Liberal arts has more even mix.<p>Not only is stem widely considered harder and requires crazier time commitments, it also exacts a toll on your sex life.  These are young people at the peak of their productive cycles and this is a very large consideration.",1441170199.0
119,10157519,comment,10156420.0,10156420.0,0,0,nv-vn,,,They recently started blocking XMPP ports which is quite an annoyance. I literally can&,
120,10157518,story,,,1,5,CaiGengYang,How to Start Hacking?,,"Ok, so I feel like I need to get something done. I want to create a &quot;hack&quot; --- how , where do I start?<p>I downloaded Python 3.4.3 and learned how to open its IDLE ... what can I do next ?",1441170120.0
121,10157517,comment,10156492.0,10156492.0,0,0,zdw,,,"So, is this code still available?",1441170094.0
122,10157516,comment,10155421.0,10156917.0,0,0,exodust,,,"When 100% of people find those intrusive pop-ups annoying, the &quot;standard&quot; then is not so much belonging to Google, but shared by all.",1441170080.0
123,10157515,comment,10152867.0,10157034.0,0,0,boundlessdreamz,,,"I think it is quite popular for VoIP and it is also part of WebRTC and hence supported by Chrome and Firefox<p><a href=""https://en.wikipedia.org/wiki/Opus_(audio_format)",
