,ID,Type,Story,Parent,Points,Comments,Author,Title,URL,Content,Created
0,8727895,comment,8724464.0,8727462.0,0,0,nitrogen,,,<i>super unreasonable steps for normal users to take.</i><p>Only because people have &quot;forgotten&quot; how to build offline apps.,1418191161.0
1,8727894,comment,8727245.0,8727584.0,0,0,fineIllregister,,,They do. Type up a bill and mail it to your Congresspeople.<p>I don&,
2,8727893,comment,8727026.0,8727434.0,0,0,ehPReth,,,That video player is amazing! What is it?,1418191143.0
3,8727892,comment,8727245.0,8727853.0,0,0,skndr,,,"For this analogy, a bill should actually be a pull request and a signed law is a merged request. I think the problem is that an &",
4,8727891,comment,8727825.0,8727825.0,0,0,MichaelCrawford,,,The Portland Rescue Mission as well as Portland&,
5,8727890,comment,8725273.0,8726311.0,0,0,hkarthik,,,In the limited research that I&,
6,8727888,comment,8727585.0,8727585.0,0,0,CyberFonic,,,"If the company I worked for hired a STA without appropriate coal face experience, I would quit.  Simple as that.  Any system such a person designs is almost certain to end up being a death march project.<p>Any management who would hire such a person would also be suspected of gross incompetence.<p>As you say it was only a bad dream.  Hope you never have to face such a reality.",1418191044.0
7,8727887,story,,,55,27,wallflower,How One Woman's Discovery Shook the Foundations of Geology,http://mentalfloss.com/article/60481/how-one-womans-discovery-shook-foundations-geology,,1418191043.0
8,8727886,comment,8713677.0,8716820.0,0,0,timcederman,,,Netflix and videoconferencing in &,
9,8727884,comment,8726707.0,8727871.0,0,0,jack-r-abbit,,,Doh! I totally forgot about that part. LOL,1418190934.0
10,8727882,comment,8726707.0,8727808.0,0,0,michaelbuddy,,,"seems like responses here were assuming you meant the french press somehow had chemicals, but you&",
11,8727881,comment,8726707.0,8727721.0,0,0,jack-r-abbit,,,"It might be a turn off to ship your coffee with instructions on how to cut the top off a 2.0 K-cup. But if your K-cups just needed an &quot;adapter&quot;[1] then many consumers would probably not think twice about it. We use adapters all the time to make one thing work with another.<p>[1] <a href=""https://www.gourmet-coffee.com/Keurig-DRM-Freedom-Clip.html"" rel=""nofollow"">https://www.gourmet-coffee.com/Keurig-DRM-Freedom-Clip.html</a>",1418190874.0
12,8727880,comment,8726707.0,8727808.0,0,0,BrainInAJar,,,that&,
13,8727879,comment,8727840.0,8727840.0,0,0,MichaelCrawford,,,You could do kernel and embedded work.  Actually there&,
14,8727878,comment,8724727.0,8726127.0,0,0,kbenson,,,In what ways do you not find Perl self consistent?  There&,
15,8727877,comment,8716425.0,8716614.0,0,0,known,,,"Rape is a hate crime in India\n<a href=""http://india.blogs.nytimes.com/2012/10/16/as-india-responds-to-latest-rapes-the-unanswered-question-is-why/"" rel=""nofollow"">http://india.blogs.nytimes.com/2012/10/16/as-india-responds-...</a>",1418190769.0
16,8727876,comment,8723728.0,8727123.0,0,0,tizzdogg,,,"My point, and one of the lessons of this book, is that the things we see in nature are actually NOT that complex. Sure, they are endlessly varied and superficially very complicated, but the rules that govern them are pretty simple. We&",
17,8727875,comment,8724047.0,8727643.0,0,0,logicallee,,,"Oh, suuuuuure, some kind of magic mathematics company run by a reclusive genius who got a Ph.D. from Cal Tech when he was twenty, and/or college dropout and/or megalomanaic bald silicon valley mogul.<p>answer for those following along: all of the above :)",1418190651.0
18,8727874,comment,8726707.0,8727508.0,0,0,pandaman,,,"They could have used thermo-sensitive ink (using same technology that fax paper used some time ago), on a hot cup it would have automatically destroyed itself. However, they very likely don&",
19,8727873,comment,8708161.0,8713858.0,0,0,nitrogen,,,If they&,
20,8727872,comment,8714846.0,8715330.0,0,0,known,,,The culprit allegedly paid 5000 rupees to Delhi Police and got &quot;Character&quot; Certificate.,1418190561.0
21,8727871,comment,8726707.0,8727775.0,0,0,jfeser,,,"AFAIK, the original reason for the DRM was to prevent other companies from selling K-cups, so it would need a way to validate each cup, not just prevent reuse.",1418190506.0
22,8727870,comment,8726707.0,8726707.0,0,0,jonalmeida,,,"I have a strange need to watch Star Wars now..<p>Jokes aside, this is a neat hack but I wonder if it would be possible to remove the DRM check from the electronics side itself. I don&",
23,8727869,comment,8726328.0,8727237.0,0,0,PhantomGremlin,,,I believe the British phrase that best describes the professor is &quot;wanker&quot;. Very similar to jerk. :),1418190417.0
24,8727868,comment,8727314.0,8727768.0,0,0,michaelochurch,,,Right. Belly fat is stored there because a central location is best for the body (although it was sufficiently rare in our evolutionary ascent to afford 40 pounds of belly fat that our bodies didn&,
25,8727867,story,,,1,0,egarbugli,Why Vontu Chose to Wait for the “Right” Early Customer,http://leanb2bbook.com/blog/why-vontu-chose-to-wait-for-the-right-early-customer/,,1418190345.0
26,8727866,comment,8726707.0,8726707.0,0,0,michaelbuddy,,,"Keurig adding DRM was equivalent to a plea to be hacked.  But I was thinking, Keurig probably doesn&",
27,8727865,comment,8727314.0,8727314.0,0,0,michaelochurch,,,I&,
28,8727864,comment,8726707.0,8727300.0,0,0,jdpage,,,"It has the Imperial March from Star Wars as the background music, which was definitely a bad idea.",1418190196.0
29,8727863,comment,8727862.0,8727862.0,0,0,romaincointepas,,,"Hi HN,<p>I&",
30,8727862,story,,,11,6,romaincointepas,Show HN: Beautiful digital art on Google.com every day,http://getexhibits.co/,,1418190152.0
31,8727861,story,,,3,0,bernardlunn,The TCP/IP of Money Mirage ,,,
32,8727860,story,,,8,10,vnagpal,Ask HN: Idea management,,"Hi there , i am looking for a portal or app which can be used for idea management/ wiki, here is the functionality that i would need.\n* 5-10 people should be able to collaborate.\n* anyone should be able to tag and it should be searchable \n* we should be able to link the research with the particular idea<p>please feel free to suggest anything that you think might be useful. \nThanks :)",1418190051.0
33,8727859,comment,8727314.0,8727314.0,0,0,scriptman,,,This sounds a lot like Taleb&,
34,8727858,story,,,189,56,danielsiders,Atlas by Hashicorp,https://atlas.hashicorp.com,,1418190041.0
35,8727857,story,,,1,0,MichaelCrawford,On Refactoring C++ Code – How I Learned to Stop Debugging and Get My Code Right,http://www.warplife.com/tips/code/c++/refactoring/memory-management/raw-buffers.html,,1418190031.0
36,8727856,comment,8724727.0,8727531.0,0,0,pwr22,,,Whatever ;),1418189872.0
37,8727855,comment,8726516.0,8726516.0,0,0,gamechangr,,,Go to Meet ups and you will get an introduction.,1418189843.0
38,8727854,comment,8723728.0,8723728.0,0,0,kristopolous,,,couldn&,
39,8727853,comment,8727245.0,8727765.0,0,0,pan69,,,"Sorry, I don&",
40,8727852,comment,8726707.0,8727827.0,0,0,billhendricksjr,,,Why? Being serious. If you know something&,
41,8727851,comment,8727026.0,8727831.0,0,0,retrogradeorbit,,,Listen for &quot;graininess&quot; in the 8 bit undithered sound as the voice gets quieter. You should be able to make that out. That&,
42,8727850,comment,8727696.0,8727845.0,0,0,smt88,,,That&,
43,8727849,comment,8679471.0,8682578.0,0,0,brc,,,It&,
44,8727848,comment,8727696.0,8727696.0,0,0,smt88,,,<i>&quot;where there won&,
45,8727847,story,,,3,0,debjanimitra,Ask HN: What do you think of this accessibility widget I built?,,Here&,
46,8727846,comment,8697527.0,8703584.0,0,0,MichaelCrawford,,,"some kinds of sysadmin are easily done remotely.  So is tech support.  It depends on whether the job requires access to the console, or opening the case to install cards.<p>If you&",
47,8727845,comment,8727696.0,8727702.0,0,0,Jeremy1026,,,Base62 encoded incremental IDs,1418189643.0
48,8727844,comment,8726056.0,8727803.0,0,0,alayne,,,There&quot;s no efficiency requirement on atomicity. Who said we need POSIX filesystem semantics anyway? Is it so important we should trade scalability? Obviously that wasn&quot;t the s3 design choice.,1418189642.0
49,8727843,comment,8725398.0,8727447.0,0,0,ihnorton,,,Yup - Anchorage International is the 2nd busiest cargo hub in the US (after Memphis).,1418189639.0
50,8727842,story,,,15,1,sjkaliski,HashiCorp Announces Atlas and Raises $10M,http://techcrunch.com/2014/12/09/hashicorp-announces-new-devops-management-tool-and-10m-in-funding/,,1418189619.0
51,8727841,comment,8727026.0,8727741.0,0,0,retrogradeorbit,,,I&,
52,8727840,story,,,9,10,_RPM,What kind of companies hire C developers,,I like C and systems programming. How hard would it be to find a job doing this after I graduate next year with my CS degree?,1418189595.0
53,8727839,comment,8724727.0,8725399.0,0,0,peteretep,,,Exactly. Perl&,
54,8727838,comment,8727806.0,8727806.0,0,0,ernestipark,,,"Ryan Carson blogged about the 4-day work week at Treehouse: <a href=""http://ryancarson.com/post/21708810513/4-day-week"" rel=""nofollow"">http://ryancarson.com/post/21708810513/4-day-week</a>",1418189514.0
55,8727837,comment,8726707.0,8726707.0,0,0,hw,,,"Anyone else waiting for the Arist? <a href=""https://www.kickstarter.com/projects/236195807/arist-brews-coffee-like-the-best-baristas-anytime"" rel=""nofollow"">https://www.kickstarter.com/projects/236195807/arist-brews-c...</a><p>I have a feeling if it&",
56,8727835,comment,8726018.0,8726018.0,0,0,PhantomGremlin,,,"Or, you could just go buy your own equipment and save the $8/mo that Comcast charges you for a modem. Exactly as the article points out:<p><pre><code>   “Go buy your own modem and router/gateway,\n   and save yourself both the headache of not\n   being able to control your own devices—and\n   Comcast&",
57,8727834,comment,8727026.0,8727787.0,0,0,skelsey,,,"Yeah, if you are going to spend money, spend it on the reproduction side. A nice set of speakers will make you feel like you&",
58,8727833,comment,8727026.0,8727504.0,0,0,spopejoy,,,"Finally a gender-bias I can get behind.<p>That is, this finally proves women are smarter. Or at least less likely to spend 3-figure sums on an interconnect cable.",1418189419.0
59,8727832,comment,8723789.0,8725407.0,0,0,throwawaymsft,,,In JSON the server would have returned account as an array with 2 elements. In XML you are left to figure that out for yourself. It&,
60,8727831,comment,8727026.0,8727518.0,0,0,gcb0,,,"i found this <a href=""http://www.audiocheck.net/audiotests_dithering.php"" rel=""nofollow"">http://www.audiocheck.net/audiotests_dithering.php</a><p>and honestly, i can easily tell the samples with dither because they added a LOT of white noise. the original and 8bit non-dither to me practically the same.",1418189346.0
61,8727830,story,,,2,0,aburan28,Silk Road’s Ulbricht Accused of Six Murder for Hire Plots,http://www.bloomberg.com/news/2014-12-10/silk-road-s-ulbricht-accused-of-six-murder-for-hire-plots.html,,1418189339.0
62,8727829,comment,8727245.0,8727584.0,0,0,RoboTeddy,,,I bet we&,
63,8727828,comment,8711761.0,8725756.0,0,0,MichaelCrawford,,,Amazon&,
64,8727827,comment,8726707.0,8727479.0,0,0,notduncansmith,,,I&,
65,8727826,story,,,1,0,joeyespo,The “Psychological” Speed of Mobile Interfaces,https://medium.com/ui-collection/the-psychological-speed-of-mobile-interfaces-df25276295dd,,1418189243.0
66,8727825,story,,,1,1,ernestipark,Ask HN: What non-profits might the HN crowd be interested in?,,A lot of people are starting to make their year end donations. I thought it&,
67,8727824,comment,8723548.0,8723834.0,0,0,webXL,,,"As much as I loathe the immorality and idiocy of these programs, there is no reason to lose all historical perspective.<p>> This stuff would make Gestapo, KGB and Stasi proud.<p>A big difference is that those groups tortured and killed many of their own subjects for their political dissidence. In this case, the CIA tortured (albeit counterproductively) to protect its citizens, and there was a free press to uncover and help stop these programs for the most part.",1418189203.0
68,8727823,story,,,4,0,bosky101,The 4 finalists of CRM Idol 2014 (UserVoice won '13),http://crmidol.com/finalists,,1418189173.0
69,8727822,comment,8724727.0,8726626.0,0,0,kamaal,,,"A full answer will look like a book.<p>The short answer, is that the comparison isn&",
70,8727821,comment,8724047.0,8726837.0,0,0,CurtMonash,,,Niven & Pournelle&,
71,8727820,comment,8727245.0,8727617.0,0,0,bhousel,,,"Git blame, for starters.",1418189075.0
72,8727819,comment,8724317.0,8725218.0,0,0,MichaelCrawford,,,I look at their source.<p>The ones I actually tried appear to have only been implemented as far as required to crack the author&,
73,8727818,comment,8727245.0,8727728.0,0,0,jsprogrammer,,,"Yeah, let&",
74,8727817,comment,8726707.0,8727791.0,0,0,cdingo,,,"The Aeropress has been BPA free for years now.<p><a href=""http://www.aeropress.ca/faq/"" rel=""nofollow"">http://www.aeropress.ca/faq/</a>",1418188993.0
75,8727816,comment,8727026.0,8727613.0,0,0,retrogradeorbit,,,"This makes no sense to me. Please explain. The difference between 24 and 16 is 8, not 4 for one.<p>Are you saying the &quot;16-bit&quot; sample files actually had noise added to the least significant 4 (8?) bits? This is not dithering. Dithering is adding noise BEFORE truncation. A dithered 16 bit rendering of 24 bit audio will only be 16 bit. An undithered 16 bit rendering of 24 bit audio will also only be 16 bit.",1418188991.0
76,8727815,comment,8722303.0,8722445.0,0,0,frozenport,,,Unless your &,
77,8727814,comment,8723728.0,8726800.0,0,0,fsloth,,,Dude... it&,
78,8727813,comment,8723789.0,8724467.0,0,0,blt,,,"yes, I don&",
79,8727812,story,,,1,0,frakkingcylons,Default '/r/videos' subreddit CSS modified to redirect users to a Twitch channel,,"If you visit /r/videos right now (05:20 UTC), the custom subreddit style has been changed such that clicking anywhere directs a user to a Twitch channel (http://www.twitch.tv/alisha12287).<p>Screenshot: http://cl.ly/image/1m1k0B0c2t2n/Image%202014-12-09%20at%2011.21.52%20PM.png",1418188937.0
80,8727811,comment,8727245.0,8727772.0,0,0,jsprogrammer,,,I think you&,
81,8727810,comment,8723548.0,8727755.0,0,0,bdevani,,,It requires voting. and being informed. voting for publicly funded limited campaigns. and being active in the courts,1418188904.0
82,8727809,comment,8725988.0,8726623.0,0,0,mc32,,,"I think one of the problems reading the critique is that her points are buried in too much ranting and wild exaggerations, so it&",
83,8727808,comment,8726707.0,8727191.0,0,0,esaym,,,"Strangely, I heard somewhere recently that french press coffee has toxins in it that would normally be filtered out by the paper filter...",1418188893.0
84,8727807,comment,8726707.0,8727754.0,0,0,billhendricksjr,,,"Agree, nut punching not required for re-usable cups. I have yet to see someone actually use them, though, and I&",
85,8727806,story,,,18,17,daenz,Ask HN: Are companies open to a 4-day work week?,,I&,
86,8727805,comment,8726707.0,8726865.0,0,0,esaym,,,"Agreed. Solution, get a popcorn popper and head over to sweetmaria&",
87,8727804,comment,8727245.0,8727679.0,0,0,toomuchtodo,,,"Also, have the entire thing versioned/archived into the Internet Archive.",1418188729.0
88,8727803,comment,8726056.0,8727777.0,0,0,sysk,,,"Efficiency is important if the operation needs to be atomic though. POSIX for example requires rename to be an atomic operation. <a href=""http://en.wikipedia.org/wiki/Rename_(computing)"" rel=""nofollow"">http://en.wikipedia.org/wiki/Rename_(computing)</a>",1418188650.0
89,8727802,comment,8726805.0,8726999.0,0,0,dkuntz2,,,Than why did you qualify it with &quot;only&quot;?,1418188649.0
90,8727801,comment,8718596.0,8719804.0,0,0,FeeTinesAMady,,,I&,
91,8727800,story,,,2,0,walterbell,Librem 15: A Free/Libre Software Laptop That Respects Your Essential Freedoms,https://www.crowdsupply.com/purism/librem-laptop/new-hardware-options,,1418188533.0
92,8727799,comment,8726056.0,8727556.0,0,0,jasonkostempski,,,I&,
93,8727798,comment,8724100.0,8725709.0,0,0,slowmovintarget,,,Which is what&,
94,8727797,comment,8724727.0,8726626.0,0,0,esaym,,,"I thought of a few troll-worthy comments, but then moved on to others. Few things came to me though later that are less abrasive so I guess I&",
95,8727796,story,,,3,0,shaananc,Pirate Bay Still Online,https://thepiratebay.cr/,,1418188425.0
96,8727794,story,,,1,0,busterc,Quantum Teleportation Reaches Farthest Distance Yet,http://t.space.com/all/27947-farthest-quantum-teleportation,,
97,8727792,comment,8721379.0,8721483.0,0,0,chrismcb,,,"I used an attorney, because I wanted to make sure we did everything we needed. But you don&",
98,8727791,comment,8726707.0,8727262.0,0,0,nyolfen,,,"long story short, transparent plastic containers tend to imbue their contents with a chemical called bisphenol-a (aka bpa), which is a compound similar to estrogen which may impact human physiology in a wide array of ways[0], or chemicals that are structurally related that aren&",
99,8727790,comment,8724760.0,8725906.0,0,0,gear54rus,,,And that is exactly why they should never even be allowed to handle something they don&,
100,8727789,comment,8720244.0,8721470.0,0,0,MetaCosm,,,"The reason astroturfing is &quot;bad&quot; is because it is beyond rational debate, look up the laws... they are about personal testimonials primarily.  &quot;I went to this car shop and they did an awesome job.&quot; &quot;This one silly trick made me cancer free&quot;.<p>Compare that to this post, it isn&",
101,8727788,comment,8727245.0,8727772.0,0,0,johnnyg,,,"And even more on this.<p>We citizens are abstracted from the process of making law now. There is no meaningful way through the hole to participate as it stands today.<p>The barrier of a pull request would be high, but it would be like water breaking over a dam. What we need is a punch through and then iterations and use to smooth the edges and make participation easier and available to an ever wider group.<p>We basically need what has happened with OSS to be what happens in government.<p>I&",
102,8727787,comment,8727026.0,8727534.0,0,0,gcb0,,,"not really. headphones range a lot within the frequencies you DO hear.<p>also, the weight vs outside sound isolation ratio varies with price.<p>those are all observable and measurable things.<p>speakers, they also vary on those audible frequencies, but after you are past $150 per speaker you are only dealing with quality after very loud volumes.<p>over $3000 for a home system? just be honest with yourself and confess you are buying the prettiest furniture that match your decor.",1418188229.0
103,8727785,story,,,1,0,ghosh,Computerised espionage: The spy who hacked me,http://www.economist.com/news/international/21635044-malicious-computer-code-making-spooks-job-easier-ever-spy-who-hacked-me?fsrc=scn/tw/te/pe/ed/thespywhohackedme,,1418188142.0
104,8727784,comment,8725140.0,8725140.0,0,0,yzzxy,,,This company seems extremely scummy. You may remember them from the &quot;let&,
105,8727783,story,,,1,0,ghosh,Tell Obama: Stop Mass Surveillance Under Executive Order 12333,https://act.eff.org/action/tell-obama-stop-mass-surveillance-under-executive-order-12333,,1418188117.0
106,8727782,comment,8709212.0,8712741.0,0,0,bdunbar,,,"He was with a rifle company, in mortar squad.  The company was over-run during an attack, at night: Marines in fighting holes, bad guys running around in the open, a very chaotic situation.<p>To eradicate the enemy, and save his company, he pointed the tube of his mortar straight up, dropped a shit-load of rounds down the tube, one at a time.  The rounds went up (pretty far, but I no longer recall how high up they go) and came back down all over the place.<p>Risky, but Marines, generally, were in their holes, the bad guy were not, and so were more exposed to blast and shrapnel.",1418188100.0
107,8727781,comment,8727026.0,8727613.0,0,0,hackinthebochs,,,Dithering is known to increase the perceived dynamic range of music. As an example try listening to a song in foobar in 8bit output mode then 8bit dithered.,1418188088.0
108,8727780,story,,,2,0,joeyespo,3 reasons your marketing needs a better design focus – Crew Blog,http://blog.pickcrew.com/3-reasons-marketing-needs-better-design-focus/,,1418188079.0
109,8727779,comment,8726707.0,8727397.0,0,0,nyolfen,,,why wouldn&,
110,8727778,comment,8726707.0,8726707.0,0,0,hasenj,,,"Why use a coffee machine anyway? I never got the point of them. The coffee they make tastes bad anyway.<p>Just use a good old ibrik. It costs $3 to $10 depending on size and where you buy it from. The more expensive ones will probably cost $30?<p><a href=""https://www.youtube.com/watch?v=v2DyulKd6vw"" rel=""nofollow"">https://www.youtube.com/watch?v=v2DyulKd6vw</a>",1418187957.0
111,8727777,comment,8726056.0,8727532.0,0,0,alayne,,,Is directory rename an operation that needs to be efficient though? Probably not.,1418187939.0
112,8727776,comment,8725222.0,8725222.0,0,0,jaequery,,,I don&,
113,8727775,comment,8726707.0,8727575.0,0,0,jack-r-abbit,,,"Instead of starting with each machine having the entire list of numbers, wouldn&",
114,8727774,comment,8727245.0,8727245.0,0,0,campers,,,"He needs to add a repo for his Hour of Code effort!\n(<a href=""http://www.wired.com/2014/12/obama-becomes-first-president-write-computer-program/"" rel=""nofollow"">http://www.wired.com/2014/12/obama-becomes-first-president-w...</a>)",1418187832.0
115,8727773,comment,8727245.0,8727765.0,0,0,iancarroll,,,It&,
116,8727772,comment,8727245.0,8727617.0,0,0,johnnyg,,,I&,
117,8727771,comment,8725222.0,8725748.0,0,0,rurounijones,,,"To be honest that issue seemed like a troll due to the phrasing and, based on the reaction, a pretty successful one.",1418187777.0
118,8727770,story,,,7,0,k4jh,Big Bang may have created mirror universe,http://www.pbs.org/wgbh/nova/next/physics/big-bang-may-created-mirror-universe-time-runs-backwards/?utm_source=facebook&utm_medium=pbsofficial&utm_campaign=nova_next,,1418187760.0
119,8727768,comment,8727314.0,8727612.0,0,0,geoka9,,,"Also:<p>&quot;Walking around with a 40-pound backpack has the opposite effect of carrying an extra 40 pounds of belly fat.&quot;<p>Actually walking around with a 40-pound backpack is a bad idea, as compared to carrying the weight at the level of your belly (all other things being equal) because the risk of back damage is much higher.",1418187689.0
120,8727767,comment,8725845.0,8725845.0,0,0,maxack,,,This looks great. Any plans to include a scss or less version?,1418187684.0
121,8727766,comment,8725845.0,8726654.0,0,0,roywiggins,,,"An option to increase text size in the interface is probably going to be even better than allowing zoom, since it will reflow the text and not require the user to scan left and right around the zoomed-in text.",1418187683.0
122,8727765,comment,8727245.0,8727744.0,0,0,jey,,,"And it reveals a complete misunderstanding/misuse of GitHub Issues: the issue is filed <i>after</i> the law has been passed and signed into effect, so the issue is &quot;opened&quot; only <i>after</i> we would have closed the issue, and it appears that it will never get closed.",1418187678.0
123,8727764,comment,8726707.0,8726942.0,0,0,hasenj,,,-10 minutes you spend on breaking the DRM,1418187623.0
