,ID,Type,Story,Parent,Points,Comments,Author,Title,URL,Content,Created
0,10157647,comment,10157161.0,10157608.0,0,0,jamesk_au,,,Amy&,
1,10157646,comment,10157418.0,10157418.0,0,0,_Marak_,,,I&,
2,10157645,comment,10156240.0,10156240.0,0,0,praptak,,,"The internet therapy site is www.prokrastinera.se. Seems Swedish-only. Next round starts October 13th.<p>The article itself is at <a href=""http://www.invent-journal.com/article/S2214-7829(15)00024-X/pdf"" rel=""nofollow"">http://www.invent-journal.com/article/S2214-7829(15)00024-X/...</a>",1441173557.0
3,10157644,comment,10152809.0,10157602.0,0,0,PudgePacket,,,Minimum requirement of knowing Mandarin is interesting.,1441173512.0
4,10157643,comment,10152809.0,10152809.0,0,0,sdpy,,,"DiabetesLab | <a href=""https://diabeteslab.org"" rel=""nofollow"">https://diabeteslab.org</a> | Trento, Italy and Gdansk, Poland | ONSITE or REMOTE (anywhere in the world)<p>We are hiring engineers to help people with type 1 diabetes to exercise safely and keep blood glucose levels stable by analyzing diabetes-related data. Personal experience with type 1 diabetes is particularly welcome. (But it&",
5,10157642,comment,10155421.0,10155750.0,0,0,kristopolous,,,all mine go straight to bobby tables.,1441173446.0
6,10157641,comment,10153132.0,10156951.0,0,0,Zardoz84,,,"You should look to  the Roman Pantheon building  <a href=""https://en.m.wikipedia.org/wiki/Pantheon,_Rome"" rel=""nofollow"">https://en.m.wikipedia.org/wiki/Pantheon,_Rome</a>",1441173326.0
7,10157640,comment,10157496.0,10157614.0,0,0,flashman,,,"The phone could use a transmitter with circular geometry - a wire loop, for instance. It could be part of the case; I assume the magnetic field is unaffected by human touch, unlike the iPhone 4&",
8,10157639,comment,10147628.0,10157541.0,0,0,Dylan16807,,,It clearly says a &quot;full-sky image&quot; would take 1500 monitors.  Which is a pretty image but nowhere near as impressive as the actual detail level.,1441173318.0
9,10157638,comment,10157018.0,10157018.0,0,0,hyc_symas,,,&quot;Put one statement conditionals on same line as condition: if (rc < 0) goto fail;&quot;<p>This is bad advice. A source-level debugger only works in source line numbers; if you ever need to set a breakpoint to find out when an error condition occurs you need to be able to set it on the action statement &quot;goto fail&quot; and not be bothered by the breakpoint tripping every time the if() gets evaluated.<p>Always separate the conditional from the statement.,1441173300.0
10,10157637,comment,10157418.0,10157620.0,0,0,ddoscampaign,,,Top-down configuration (as opposed to discovery like UDDI) via something like zookeeper or dns solves this problem.  And APIs shouldn&,
11,10157636,story,,,2,0,Baobei,Startup = Crocodile skin,https://medium.com/@95100blog/friends-and-frenemies-8506da9d8e3d,,1441173132.0
12,10157635,comment,10147426.0,10151509.0,0,0,sogen,,,"I was browsing Angelist and saw a dismal number of them.\nThanks, will dive into this treasure!",1441173096.0
13,10157632,comment,10156240.0,10156587.0,0,0,erikb,,,"Well, if you have read the article then you should know yourself already that this might not work. Instead maybe a better way would be to approach your emotional state, make it real, with a pop-up when the plugin sees you are procrastinating. Instead of asking &quot;what should you do right now&quot; better ask &quot;How do you feel right now? Why don&",
14,10157631,comment,10155793.0,10157354.0,0,0,sanxiyn,,,Debian rustc package is built against Debian LLVM 3.6 package. All Rust tests do pass.,1441172947.0
15,10157629,comment,10153127.0,10153127.0,0,0,qCOVET,,,I am always intrigued by the topic of turbulence and its implications in weather prediction. One of the key challenges of weather prediction is our inability to understand / predict atmospheric turbulence...most importantly &,
16,10157628,comment,10155251.0,10155251.0,0,0,bambax,,,"> <i>The shift to online communication, textual interactions separated from accompanying physical practices, has had a persistent and egregious warping effect on language</i><p>The phone was the first change. To this day I hate speaking to people on a phone because if I don&",
17,10157627,story,,,6,1,petrohi,Connect Telegram to other chat systems,https://sameroom.io/blog/announcing-support-for-telegram/,,1441172864.0
18,10157626,comment,10157418.0,10157418.0,0,0,ddoscampaign,,,"Hopefully, they&",
19,10157625,comment,10156240.0,10156918.0,0,0,Joeri,,,"Instead of limiting your web browsing, I&",
20,10157624,comment,10152809.0,10156565.0,0,0,giis,,,How to apply? email-id or link ?,1441172752.0
21,10157623,comment,10153132.0,10155109.0,0,0,csixty4,,,"Glad you got out of it so quickly. I spent five years in Pick at the turn of the century and it set my career back quite a bit.<p>Just out of curiosity, how did you get out and what are you working on these days?",1441172736.0
22,10157622,comment,10156492.0,10156492.0,0,0,executesorder66,,,When was this published?,1441172711.0
23,10157621,comment,10152811.0,10152811.0,0,0,hackersaurav,,,"Location: Bangalore, India<p>Remote: Maybe<p>Willing to relocate: Yes<p>Technologies: Javascript, C++, Java, Node.js (expressjs, sailsjs), Spring MVC<p>Resume: <a href=""http://registry.jsonresume.org/434c996d"" rel=""nofollow"">http://registry.jsonresume.org/434c996d</a><p>Email: saurav1991@gmail.com",1441172708.0
24,10157620,comment,10157418.0,10157552.0,0,0,charlieflowers,,,"That was my 1st reaction too ... but hold on. If you design the 2 components to be non-chatty and have robust error handling, then it can be safe to make it location transparent.<p>In other words, the problem in the past was, we designed it as if it would be used locally, then we naively made it remote. But now, we&",
25,10157619,comment,10152313.0,10152313.0,0,0,rwhitman,,,I find it curious that this is from a guy that stars in the world&,
26,10157618,comment,10154349.0,10154349.0,0,0,Animats,,,"Yes, you can do that.  You can write x ∈ 𝕀 ∧ x ≥ 0 to express &quot;unsigned x&quot;. This allows some useful operations on type propositions.  But it doesn&",
27,10157617,comment,10157018.0,10157574.0,0,0,userbinator,,,I wouldn&,
28,10157616,story,,,2,0,msravi,Competition Commission of India's Report on Google,http://www.livemint.com/Companies/5D4c8f9kKB41IyL99Rfm4H/Why-did-CCI-write-Google-a-bad-report-card.html,,1441172620.0
29,10157615,comment,10157018.0,10157443.0,0,0,fit2rule,,,"I concur .. another good book that will teach you more about C in a productive way, is &quot;Expert C Programming- Deep C Secrets&quot;:<p><a href=""http://www.amazon.com/Expert-Programming-Peter-van-Linden/dp/0131774298"" rel=""nofollow"">http://www.amazon.com/Expert-Programming-Peter-van-Linden/dp...</a>",1441172593.0
30,10157614,comment,10157496.0,10157496.0,0,0,zyxley,,,"> Researchers noted that a limitation of this technique is that magnetic fields require circular geometries in order to propagate through the human body. Devices like smart watches, headbands and belts will all work well using magnetic field human body communication, but not a small patch that is stuck on the chest and used to measure heart rate, for example. As long as the wearable application can wrap around a part of the body, it should work just fine with this technique, researchers explained.<p>Wait, so how do you get the data anywhere useful? At some point to connect to a phone or whatever it&",
31,10157613,story,,,2,0,oliverdamian,Wire cutters: well made student cgi animation short film,https://vimeo.com/jackanders/wirecutters,,1441172535.0
32,10157612,story,,,9,0,pilingual,A Cambrian Explosion of Robotics?,http://spectrum.ieee.org/automaton/robotics/robotics-hardware/is-a-cambrian-explosion-coming-for-robotics,,1441172526.0
33,10157611,comment,10152810.0,10152810.0,0,0,mvid,,,SEEKING WORK - San Francisco - Remote OK - Travel Possible<p>Experienced software developer with a history in startups.<p>Proficient in:<p><pre><code>  * Python  [&,
34,10157610,comment,10150807.0,10156315.0,0,0,jsnell,,,You&,
35,10157608,comment,10157161.0,10157161.0,0,0,IsaacL,,,"I quit my job about 4 months ago feeling the onset of burnout. I was completely useless for most of that time but have just recently managed to get back into creative work.<p>By the way, look up comments by the Hacker News user ahoyhere (Amy Hoy). It was her comment on the physical causes of burnout that motivated me to quit when I did. I think that nipped in the bud something that could have become much worse.<p>You mention you keep working because of &quot;shame&quot; and &quot;having to pay the bills&quot;. Hypothetical situation: if you had another medical condition, say a heart attack, and your doctor ordered you to take 3 months in bed, could you do it? Live off savings, move in with your parents, etc?<p>If you&",
36,10157607,comment,10152811.0,10152811.0,0,0,dandruffhead,,,"Location: Kuala Lumpur, Malaysia<p>Remote: yes<p>Willing to relocate: yes<p>Technologies: Python, JavaScript, Java, C",
37,10157606,comment,10157018.0,10157550.0,0,0,analognoise,,,This! C99 is old enough to drive; I don&,
38,10157605,story,,,5,2,ishikaalani,Three FinTech Startups,http://www.forbes.com/sites/yoavvilner/2015/06/18/3-fintech-startups-youll-hear-about-soon-enough/2/,,1441172411.0
39,10157604,comment,10157018.0,10157419.0,0,0,userbinator,,,That&,
40,10157603,comment,10155421.0,10156150.0,0,0,exodust,,,Google isn&,
41,10157602,comment,10152809.0,10152809.0,0,0,jpatokal,,,"Google Cloud Platform | <a href=""http://cloud.google.com/"" rel=""nofollow"">http://cloud.google.com/</a> | Sydney, Tokyo, Zurich, Seattle, San Francisco | ONSITE, VISA<p>The Google Cloud Platform team is hiring Technical Solutions Engineers worldwide.  Half our job is to help our customers design, deploy and troubleshoot the latest and greatest in Google Cloud products: Compute Engine (IaaS), Container Engine (Kubernetes), App Engine (PaaS), Managed VMs (Docker), BigQuery and Dataflow (big data), and many more; the other half is to ensure that our customers can accomplish their goals without even needing to contact us.<p>We need engineers who understand the Cloud, programming (Python, Go, Java, JavaScript...), networking, troubleshooting and have people skills.  We offer a stellar team moving at the speed of a startup, cutting-edge technology at Google scale, big-company benefits and visa/relocation support.  You do <i>not</i> need to be familiar with Google&",
42,10157601,story,,,2,0,mercer,Archimedes's Chronophone (2007),http://lesswrong.com/lw/h5/archimedess_chronophone/,,1441172311.0
43,10157600,story,,,143,40,tim_sw,Buffett FAQ,http://buffettfaq.com/,,1441172297.0
44,10157599,comment,10155089.0,10157375.0,0,0,ddoscampaign,,,"Any idea how this is done at scale, on C cancer cell lines x W compounds?",1441172256.0
45,10157598,comment,10153116.0,10156978.0,0,0,jkosai,,,"> An interesting problem may be how to maximize enjoyment per reading hour given a functionally unlimited library: something like a cross between spotify and tinder for books, perhaps: present random high-interest page of a book.<p>This would make a great extension to Goodreads. I now wonder about sampling vocabulary and structure of various texts in order to match with your highest-rated books.",1441172240.0
46,10157597,comment,10155421.0,10157593.0,0,0,hobarrera,,,Those don&,
47,10157596,comment,10153653.0,10153653.0,0,0,hoers,,,"<a href=""http://pastebin.com/ZXGppXuv"" rel=""nofollow"">http://pastebin.com/ZXGppXuv</a>",1441172229.0
48,10157595,comment,10155251.0,10155251.0,0,0,bambax,,,"> <i>The French equivalents for here and there are ici and là respectively. But if I point to a pen and say, “The pen is here,” the French equivalent is not “Le stylo est ici,” but “Le stylo est là.” In French, là is always used to refer to a specific place or position, while in English here or there can both work.</i><p>Well... it depends.<p>If both speakers are in front of a pen and one points to the pen she&",
49,10157594,comment,10153164.0,10155533.0,0,0,wpeterson,,,"Interestingly enough, LukeW is now doing product/design for Google.",1441172172.0
50,10157593,comment,10155421.0,10155421.0,0,0,amolgupta,,,what about the companies who dont have a mobile web version? All they have is a page to install app when opened on mobile? Do they show the desktop version or kill that page? eg. Flipkart and Myntra,1441172143.0
51,10157592,comment,10152809.0,10152809.0,0,0,trez,,,"Relink - <a href=""http://www.relinkdevice.com"" rel=""nofollow"">http://www.relinkdevice.com</a> | Nancy, France  | REMOTE or ONSITE<p>Relink is a hardware start-up building a connected frame which helps people with dementia and their caregiver in their daily lives. We are going to be the Apple for the non-autonomous people.<p>---- Android dev ----<p>What we are looking for :<p>- android skills. We are building a platform so you will have to know your android stuffs.<p>- social interest. We are here to help these people.\nTechnology: Android, MeteorJs, PubNub<p>---- Growth Hacker ----<p>What we are looking for :<p>- facts. You know your stuffs and there are proofs.<p>- social interest. We are here to help these people.<p>You can be either on site or remote.\nInterested? Send me a short email to anthony (dot) tresontani (at) relinkdevice (dot) com",1441172126.0
52,10157591,story,,,2,0,zdw,"Hello Community, by Orkut Buyukkokten",http://hello.com,,1441172073.0
53,10157590,comment,10154663.0,10155381.0,0,0,downandout,,,"This is the case in California, which will cover many of the people that would use this.  As long as there is no rake, the game is legal.  If you&",
54,10157589,story,,,1,0,qCOVET,Seven reasons a “vote” for BIP100 is a bad idea,https://www.bridge21inc.com/blog/seven-reasons-a-vote-for-bip100-is-a-bad-idea/,,1441172043.0
55,10157588,comment,10146082.0,10146082.0,0,0,gonewest,,,"For convenience I ended up with two aliases: &quot;dm&quot; for &quot;docker-machine&quot;, and &quot;dmenv&quot; for &quot;eval $(docker-machine env dev)&quot;.<p>But before all that, I simply downloaded and used the docker toolbox installer for OS X.  I opted to skip the Kitemaric install because why? Otherwise it did the right thing with existing virtualbox install, found and imported my existing boot2docker vmdk, etc.",1441172038.0
56,10157587,story,,,100,34,kanche,"Telepat: Real-Time, Open Source Data Sync",http://telepat.io/,,1441172029.0
57,10157586,comment,10157018.0,10157442.0,0,0,tmuir,,,"I do mostly embedded programming, which is overwhelmingly dominated by C.  The reason I think C will probably never be replaced as the dominant low level language is inertia.  Every microprocessor manufacturer knows they have to provide drivers, libraries, and board support packages for their parts.  If they don&",
58,10157585,comment,10155972.0,10156811.0,0,0,hackuser,,,>> I&,
59,10157584,comment,10157355.0,10157535.0,0,0,executesorder66,,,I&,
60,10157583,comment,10157279.0,10157508.0,0,0,nitrogen,,,"If the compiler in question does tail call optimization (or even if not), maybe one could write a cleanup function that takes the place of the <i>goto</i> block, but this looks pretty ugly with all the parameters:<p><pre><code>    int cleanup(void *ptr1, char *ptr2, struct foo *ptr3, int *ptr4, union xyz *ptr5, int ret)\n    {\n      free(ptr1);\n      // etc.\n      return ret;\n    }\n\n    // later...\n      if(fail1) {\n        return cleanup(a, b, c, d, e, -1);\n      }</code></pre>",1441171888.0
61,10157582,comment,10156492.0,10157517.0,0,0,pdw,,,"<a href=""https://www.cs.cmu.edu/afs/cs/project/mach/public/src/i386.mdos.src.tar.Z"" rel=""nofollow"">https://www.cs.cmu.edu/afs/cs/project/mach/public/src/i386.m...</a>",1441171829.0
62,10157580,comment,10155421.0,10155750.0,0,0,shaftway,,,god@heaven.mil,1441171753.0
63,10157579,comment,10153391.0,10156441.0,0,0,argonz,,,"This is a common misconception, linking socialism with top-down bureaucratic control (what is this passage really is about).<p>from google define:\n&quot;a political and economic theory of social organization which advocates that the means of production, distribution, and exchange should be owned or regulated by the community as a whole.&quot;<p>In my opinion &quot;regulation by the community&quot; is what is important, eg. there are private coops. This regulation is consensus-driven by the workers and people involved, direct action, locality etc.., it&",
64,10157578,comment,10155421.0,10156010.0,0,0,rhizome,,,"Also probably because like Spotify, they are paying every penny they get for royalties.",1441171713.0
65,10157577,comment,10153116.0,10155594.0,0,0,holri,,,Is ethic a taste?,1441171683.0
66,10157576,comment,10157018.0,10157018.0,0,0,deathanatos,,,> Use `signed char` for strings<p>If you&,
67,10157575,comment,10155440.0,10155440.0,0,0,lukegiuliani,,,"&quot;Most important skill to be a writer: Commitment&quot;. Same for composing, same also true for entrepreneurship.",1441171574.0
68,10157574,comment,10157018.0,10157542.0,0,0,mieko,,,I&,
69,10157573,comment,10157018.0,10157220.0,0,0,userbinator,,,<i>For memory allocation you often don&,
70,10157572,comment,10153116.0,10157386.0,0,0,jqm,,,My musical tastes have changed with age. I don&,
71,10157571,comment,10157018.0,10157289.0,0,0,nitrogen,,,"There are a few good reasons to reimplement <i>malloc()</i>, but of course it needs to be done very very carefully.  For example, with a naive buddy list allocator it is (or was, in 2007) possible to more than triple allocation throughput vs. <i>malloc()</i>, but one loses many of <i>malloc()</i>&",
72,10157570,comment,10155801.0,10157001.0,0,0,hyperbovine,,,> so everything is more or less &quot;invasive&quot;.<p>That&,
73,10157569,comment,10152809.0,10152809.0,0,0,Maxious,,,"Digital Transformation Office - Sydney/Canberra, Australia - Full time ONSITE<p>We’re making Australian Government services simpler, faster, clearer and more humane. Making life a little easier for a huge number of Australians, every day. And we need smart, capable and dedicated people to help us do it.<p>Positions available:<p>- Interaction Designer<p>- Ethical Hacker<p>- User Researcher<p>- Web Ops Engineer<p>- Technical Architect<p>- Product Manager<p>- Delivery Manager<p>- Developer<p>- Designer<p>Full details of each position at <a href=""https://www.dto.gov.au/"" rel=""nofollow"">https://www.dto.gov.au/</a>",1441171386.0
74,10157568,story,,,4,0,nreece,Popcorn Time Users in Crosshairs of Anti-Piracy Group,https://torrentfreak.com/75000-popcorn-time-users-in-crosshairs-of-anti-piracy-group-150825/,,1441171383.0
75,10157565,comment,10144583.0,10144583.0,0,0,anilgulecha,,,"Hi, this is cool!<p>One question: do arrow keys not take from one contenteditable to another (once you reach the end of the first one, and presee the down key)",1441171319.0
76,10157564,comment,10153132.0,10157307.0,0,0,cnvogel,,,"As late as 2008 or so, when leaving university, there was still a PC running DOS for it&",
77,10157563,comment,10155421.0,10156103.0,0,0,exodust,,,Yes but that&,
78,10157562,comment,10152867.0,10152867.0,0,0,sitkack,,,"What Mozilla should do is patent the hell of out everything they are currently developing. One way out is a MAD style codec arms race. You <i>have</i> to get the other side to capitulate, to tap out. If you have no patents you have no leverage. The problem with the licensing &quot;authorities&quot; is that they are borg like in that hundreds of orgs have put patents in the pool. Nocking out a patent or two won&",
79,10157561,comment,10152735.0,10152735.0,0,0,zyxley,,,"Unrelated to this specific survey, but as somebody unfamiliar with Angular, having both angular.io and angularjs.org with neither making the version difference clear at a glance is confusing as heck.",1441171184.0
80,10157560,comment,10157018.0,10157458.0,0,0,SamReidHughes,,,Valgrind isn&,
81,10157558,story,,,79,38,vsbuffalo,SDSL – Succinct Data Structure Library for C++,https://github.com/simongog/sdsl-lite,,1441171100.0
82,10157557,comment,10157018.0,10157548.0,0,0,viraptor,,,Valgrind / asan / clang-analyzer on their own take care of most of the issues listed under memory management.,1441171060.0
83,10157556,comment,10156227.0,10157424.0,0,0,jhanschoo,,,"In my opinion, the humanities, despite being around for longer than STEM, are still nascent. The tools and models and perspectives we use today are still too inexpressive to solve problems beyond special cases, and we still have a hard time figuring out the boundaries of these special cases themselves. The systems that the humanities investigate are much more non-linear and complex than the systems STEM investigates, and so the conclusions are much less reliable.",1441171049.0
84,10157555,comment,10157018.0,10157487.0,0,0,nitrogen,,,It can also turn a single memory access into two memory accesses if the structure and the pointer can&,
85,10157554,story,,,2,0,bpolania,"The Accelerator Boom: Bubble, or New Form of Post-Corporate Work?",http://bankinnovation.net/2015/08/survey-the-boom-in-accelerators-is-sign-of-bubble-or-a-new-form-of-post-corporate-work/,,1441171008.0
86,10157553,comment,10157418.0,10157418.0,0,0,hurrycoward,,,"Non-distributed Microservices?<p><a href=""http://fmontesi.blogspot.com/2015/06/non-distributed-microservices.html"" rel=""nofollow"">http://fmontesi.blogspot.com/2015/06/non-distributed-microse...</a>",1441170985.0
87,10157552,comment,10157418.0,10157418.0,0,0,hartror,,,"> The most critical thing is being able to use any services locally or remotely without knowing the difference or changing the code.<p>I thought we all agreed CORBA style location transparency was a bad idea?<p><a href=""https://en.wikipedia.org/wiki/Common_Object_Request_Broker_Architecture",
88,10157551,comment,10155421.0,10155638.0,0,0,exodust,,,"> &quot;Usually the app is infinitely better than the mobile web&quot;<p>Can you provide an example of an app that is infinitely better than its mobile website?<p>If you can just provide one example, and not any of the tech giants. One example where there&",
89,10157550,comment,10157018.0,10157183.0,0,0,nitrogen,,,<i>This is because there is no byte type by default in C.</i><p>There is in C99 and newer: <i>int8_t</i> or <i>uint8_t</i>.,1441170914.0
90,10157548,comment,10157018.0,10157018.0,0,0,okasaki,,,> Immediately clear pointers after freeing<p>This can be misleading...<p><pre><code>    void foo(char *buf) {\n        ...\n        free(buf); \n        buf = NULL;\n    }\n\n    void bar() {\n        char *b = malloc(123);\n        foo(b);\n\n        // b isn&,
91,10157547,comment,10152872.0,10154737.0,0,0,lukifer,,,"I mean by default. There are tools available for all platforms, but the user has to seek them out.",1441170777.0
92,10157546,comment,10110155.0,10146226.0,0,0,smeehee,,,This seems loosely equivalent to Google&,
93,10157545,comment,10155421.0,10157180.0,0,0,lern_too_spel,,,I also see non-YouTube videos embedded in search. I believe they&,
94,10157544,story,,,1,0,petethomas,Seattle might try something crazy to let Uber drivers unionize,http://www.washingtonpost.com/news/wonkblog/wp/2015/08/31/seattle-might-try-something-crazy-to-let-uber-drivers-unionize/,,1441170771.0
95,10157543,comment,10148179.0,10157236.0,0,0,mirimir,,,"The best path to strong security has always been hardware isolation, right? So now that we have mass-market microcomputers, why bother with VMs? What do you think of Tinfoil Chat[0]? The notebook form factor could contain several microcomputers, with optical isolation, or even outright air gapping. But closed-source hardware and firmware is still problematic :(<p>[0] <a href=""https://github.com/maqp/tfc-otp"" rel=""nofollow"">https://github.com/maqp/tfc-otp</a>",1441170751.0
96,10157542,comment,10157018.0,10157471.0,0,0,nitrogen,,,<i>I think the C standard library would be easier to work with if they would&,
97,10157541,comment,10147628.0,10149404.0,0,0,chrismcb,,,It isn&,
98,10157540,comment,10153164.0,10153164.0,0,0,gauravagarwalr,,,"In some places the favicon is not completely updated, as of this writing: <a href=""http://google.co.in/favicon.ico"" rel=""nofollow"">http://google.co.in/favicon.ico</a>",1441170689.0
99,10157539,comment,10154527.0,10157308.0,0,0,deadalus,,,morality is subjective,1441170664.0
100,10157538,story,,,1,0,skreuzer,Wolfram Data Drop,https://datadrop.wolframcloud.com/,,1441170630.0
101,10157537,comment,10155089.0,10157086.0,0,0,jane_is_here,,,"&quot;So is Polybia-MP1 another game changer in the Cancer world?&quot;<p>No.\nHN has been suckered yet again by a PR release.<p>These are similar to and around as reliable as the PR releases that claim to revolutionise the internet, cars, plastics, toothpaste or condoms.",1441170612.0
102,10157536,comment,10152809.0,10154463.0,0,0,jlisam13,,,thanks for the heads up,1441170602.0
103,10157535,comment,10157355.0,10157355.0,0,0,PhilWright,,,The linked page is devoid of any interesting content. What are we supposed to do with this link?,1441170582.0
104,10157534,comment,10155089.0,10155089.0,0,0,jane_is_here,,,"Read the primary source.<p>Abstract:\n<a href=""http://www.cell.com/biophysj/abstract/S0006-3495(15)00768-7"" rel=""nofollow"">http://www.cell.com/biophysj/abstract/S0006-3495(15)00768-7</a><p>Full text:\n<a href=""http://www.cell.com/biophysj/fulltext/S0006-3495(15)00768-7"" rel=""nofollow"">http://www.cell.com/biophysj/fulltext/S0006-3495(15)00768-7</a><p>Please do not go off on a tangent after reading brain dead PR releases meant for the masses. These are the scientific world&",
105,10157533,comment,10151334.0,10156338.0,0,0,dang,,,"<a href=""https://news.ycombinator.com/newsguidelines.html"" rel=""nofollow"">https://news.ycombinator.com/newsguidelines.html</a>",1441170457.0
106,10157532,story,,,1,0,eao197,SObjectizer-5.5.8: a tool for working with actors in C++ updated,http://eao197.blogspot.com/2015/09/progc11-sobjectizer-v558-released.html,,1441170380.0
