,ID,Type,Story,Parent,Points,Comments,Author,Title,URL,Content,Created
132,9301893,comment,9301724.0,9301724.0,0,0,vidyesh,,,"This article misses a vital point. Its now been more than 85 straight days without using fossil fuel for power.[1]<p>[1]<a href=""http://www.sciencealert.com/costa-rica-powered-with-100-renewable-energy-for-75-days"" rel=""nofollow"">http://www.sciencealert.com/costa-rica-powered-with-100-rene...</a>",1427868662.0
133,9301891,comment,9300349.0,9301513.0,0,0,avital,,,"Some people use Angular in Meteor and seem to prefer it over a MEAN stack. <a href=""http://angularjs.meteor.com"" rel=""nofollow"">http://angularjs.meteor.com</a>",1427868632.0
134,9301890,comment,9299169.0,9301887.0,0,0,tempestn,,,The reference to (insane early-80s) interest rates was fun too.,1427868613.0
135,9301889,comment,9296857.0,9300359.0,0,0,nl,,,"Some argue that the washing machine was the greatest invention of the industrial revolution[1], because it freed up the time traditionally spent by half the worlds population to do more productive tasks, such as learn to read.<p>Female literacy levels is a good leading indicator of social and economic development[2].<p>[1] <a href=""http://www.businessinsider.com.au/hans-rosling-washing-machine-2014-1"" rel=""nofollow"">http://www.businessinsider.com.au/hans-rosling-washing-machi...</a><p>[2]] <a href=""http://en.wikipedia.org/wiki/Socioeconomic_impact_of_female_education"" rel=""nofollow"">http://en.wikipedia.org/wiki/Socioeconomic_impact_of_female_...</a>",1427868604.0
136,9301888,comment,9300279.0,9300729.0,0,0,mc32,,,"People should sure stop eating rice, then.  Rice is very water intensive, and nutritionally most rice consumed is quite underwhelming.",1427868569.0
137,9301887,comment,9299169.0,9299169.0,0,0,tempestn,,,"I enjoyed this line: &quot;The new machines will require different disk-operating systems, and may therefore inspire another DOS war. [...] many people suspect that IBM will wage a counteroffensive with a DOS <i>of its own</i>.&quot;<p>Close, but not quite! As it turned out, choosing to not exactly make a DOS of its own had rather large consequences for the computing landscape...",1427868525.0
138,9301885,comment,9295606.0,9300752.0,0,0,api,,,"Start with buckets but add exponential growth. The Pacific will be empty in short order.<p>1 bucket, 2, 4, 8, 16, 32, 64, ...",1427868438.0
139,9301884,story,,,1,0,esolyt,Google Play install counts broken for several major apps,https://play.google.com/store/apps/details?id=com.zeptolab.thieves.google,,1427868425.0
140,9301883,comment,9296857.0,9296857.0,0,0,zaroth,,,"Those branded face-plates are magnetic and swappable... right?!<p>Also, knowing Amazon, they will pack a Prime box and ship it with just that one *$%! bottle of laundry detergent or an envelope with just the pack of razors. Short press for &quot;some time in the next week&quot;, long press for &quot;tomorrow&quot;, and 12-rapid-clicks for &quot;I&",
141,9301882,comment,9300349.0,9301849.0,0,0,primigenus,,,If you&,
142,9301881,comment,9296857.0,9297943.0,0,0,zaroth,,,"&quot;Siri, I need laundry detergent. And twinkies. Lots of twinkies.&quot;<p>There is a better solution than spreading branded landfill buttons across your house!",1427868399.0
143,9301880,story,,,3,0,prostoalex,"Gary Dahl, Inventor of the Pet Rock, Dies at 78",http://www.nytimes.com/2015/04/01/us/gary-dahl-inventor-of-the-pet-rock-dies-at-78.html?smid=fb-nytimes&smtyp=cur&bicmp=AD&bicmlukp=WT.mc_id&bicmst=1409232722000&bicmet=1419773522000,,1427868390.0
144,9301879,comment,9296431.0,9299887.0,0,0,milspec,,,"Unless refusing orders would mean somebody else jails you, no you haven&",
145,9301877,comment,9297935.0,9300174.0,0,0,Mikeb85,,,> Why would people want to pay JUST for a fucking browser?<p>Because there&,
146,9301876,comment,9296857.0,9297943.0,0,0,tzs,,,"For things you regularly buy (but not regularly enough to set up a subscription), you can speed that up quite a bit by going to your order history, and using the search field there that searches just within your past orders. Find a prior order for that product and use the &quot;But It Again&quot; button.",1427868308.0
147,9301875,comment,9301298.0,9301298.0,0,0,mattetti,,,Excuse my pedantry but these aren&,
148,9301874,comment,9300959.0,9300959.0,0,0,doctorpangloss,,,"If you want to see more of the game but find it too cumbersome to buy, I started by just watching it on Twitch[0].<p><a href=""http://www.twitch.tv/directory/game/Bloodborne"" rel=""nofollow"">http://www.twitch.tv/directory/game/Bloodborne</a>",1427868192.0
149,9301873,comment,9297789.0,9298652.0,0,0,api,,,It&,
150,9301872,comment,9301297.0,9301503.0,0,0,pbreit,,,The only one I remember was Gmail and it was brilliant. It was something like 2GB of storage which at the time was mind-boggling. And they added the cool ticker which continuously added even more storage.<p>Lots of us really believed it was a 4/1 joke.,1427868163.0
151,9301870,comment,9300703.0,9301856.0,0,0,whalesalad,,,Completely agree.,1427868137.0
152,9301869,comment,9299002.0,9299002.0,0,0,venomsnake,,,"Good thing - due to kickstarter and steam we are slowly returning to the golden days - all the best games of the last few years (not the most polished, just the best) are not AAA blockbusters. Outside of AAA we see a lot of new properties, no sequels, innovation and risk taking.<p>Also what are doing on HN instead of plowing trough Pillars of Eternity ...",1427868109.0
153,9301868,comment,9300349.0,9300349.0,0,0,curiously,,,here&,
154,9301867,story,,,1,0,cole14,Hackathons – Software Improv,http://blog.chris-cole.net/2015/04/01/hackathons-software-improv/,,1427868028.0
