,ID,Type,Story,Parent,Points,Comments,Author,Title,URL,Content,Created
131,7061910,comment,7058850.0,7058850.0,4,0,kayoone,,,"Love Anandtech, clutter free straight to the point review with the stuff that matters.<p>Boils down to: Kaveri itself is a nice evolution from the previous APUs and offers healthy performance gains and the lower end model matches performance of previous top APUs at lower power consumption. CPU performance is largely unchanged and they wont be able to challenge Intel with the Bulldozer architecture which will be around until 2015.\nIts a very nice APU for Desktops that need some gaming/gpu chops, but nothing revolutionary as the Intel CPUs with integrated Iris Pro are in the same league when it comes to GPU performance and even outperform the Kaveri in many benchmarks.<p>HSA (Heterogenous System Architecture) has a lot of potential and could be a model for the future, if that works out with the market adopting remains to be seen though.",1389766051.0
132,7061909,comment,7061830.0,7061830.0,7,0,plaxis,,,"But the supply is 28,310,185,834 DOGE.",1389765973.0
133,7061908,comment,7061830.0,7061830.0,17,0,untog,,,To everyone that dismisses this as a joke currency - how is it different from bitcoin?,1389765961.0
134,7061907,comment,7061785.0,7061785.0,1,0,yadongwen,,,nice work. great if can read and send contact info like fb/email..,1389765912.0
135,7061906,comment,7058401.0,7058401.0,1,0,levlandau,,,If all startups face the same problem then the strongest startup wins. Simply naming a risk that all startups face and then saying the strongest startups in their respective domains are more at risk isn&,
136,7061905,comment,7061830.0,7061830.0,9,0,ulam2,,,"Much progress, WoW!",1389765829.0
137,7061904,story,,,2,0,lelf,Record wind power levels trigger energy price fall across Europe,http://www.clickgreen.org.uk/news/international-news/124090-record-wind-power-levels-trigger-energy-price-fall.html,,1389765810.0
138,7061903,story,,,1,0,naren87,15 African technology startups to watch in 2014,http://edition.cnn.com/2014/01/14/business/14-african-startups-to-watch-in-2014/,,1389765798.0
139,7061902,comment,7056542.0,7057004.0,1,0,cast-blu,,,"Not sure if this is useful but code just check out one of the examples on codepen and click the little gear in the JS panel. They link to the famous lib there <a href""https://s3-us-west-1.amazonaws.com/demo.famo.us/befamous/famous.lib.j"" rel""nofollo"">https://s3-us-west-1.amazonaws.com/demo.famo.us/befamous/fam...</a>",1389765785.0
140,7061900,comment,7060385.0,7060854.0,3,0,rahimnathwani,,,"Did you quote that hourly rate to the client ($200/ph and I expect it will take x hours), or did you quote a total for the deliverable?<p>What was the source of the client?  If they went looking for a &",
141,7061899,comment,7061360.0,7061701.0,1,0,zem,,,that looks awesome!,1389765700.0
142,7061898,comment,7061830.0,7061830.0,1,0,nostromo,,,Isn&,
143,7061897,comment,7061830.0,7061875.0,27,0,msgilligan,,,You can go out and make aarondfcoin just like you can go out and make a viral video.,1389765684.0
144,7061896,comment,7058401.0,7061747.0,2,0,toomuchtodo,,,Which is why you look for the flights DEPART->ARIVE->DON&,
145,7061895,comment,7060386.0,7060386.0,1,0,xname,,,Watching the video. First I liked it..... Then I hated it. It&,
