,ID,Type,Story,Parent,Points,Comments,Author,Title,URL,Content,Created
80,2825044,comment,2825016.0,2825016.0,1,0,sorbus,,,"A paid version with more features seems like a safe way to go; moving into the freemium model, somewhat. If not enough people buy it, you can always fold the features into the free version (though be careful about that; people who do buy a paid version may feel ripped off if the free version has all the same features). Other than that, you can always put a donate buttons somewhere, though I'm not sure how effective that would be.",1312006271.0
81,2825043,comment,2825032.0,2825032.0,2,0,mindcrime,,,"Disclaimer: I'm not an expert on this, although I have been doing a lot of reading / studying on social network analysis and network science lately.  But just to throw some ideas out and provide some food for thought:<p><i>Extrapolating from this fact, shouldn't the patterns (and hence the logic) within social networks hold meaning?</i><p>Probably, yeah.<p><i>What would be the equivalent of running ""pulses"" through the social graph?</i><p>Depends on how you see the analogy.  Research on ""diffusion of innovations""[1] could relate to this... the idea being that the introduction of a new ""thing"" (a technology innovation) is your ""pulse"" and its spread through the network is the analogue of the neural network processing.  Also possibly related would be the idea of ""information cascades"" in networks[2].  Seems like there's something of a parallel between some of the SNA / Network Theory stuff and the Spreading Activation[3] stuff as well.<p>I don't know about trying to treat the social network as an analogue of a neural network, but the Social Network Analysis[4] folks certainly study the flow of information through a network.  You might poke around the journals and forums on that, or the Network Science[5] and/or Complex Adaptive Systems[6] people and see if anybody is doing anything related.<p>[1]: <a href=""http://en.wikipedia.org/wiki/Diffusion_of_innovations"" rel=""nofollow"">http://en.wikipedia.org/wiki/Diffusion_of_innovations</a><p>[2]: <a href=""http://en.wikipedia.org/wiki/Information_cascade"" rel=""nofollow"">http://en.wikipedia.org/wiki/Information_cascade</a><p>[3]: <a href=""http://en.wikipedia.org/wiki/Spreading_activation"" rel=""nofollow"">http://en.wikipedia.org/wiki/Spreading_activation</a><p>[4]: <a href=""http://en.wikipedia.org/wiki/Social_network",
82,2825042,comment,2824780.0,2824780.0,6,0,henry_flower,,,"The course has the requirement: ""A solid understanding of probability and linear algebra will be required.""<p>Can anybody advise some books or online resources that one can use for 2 month to prepare himself for the course? Thanks.",1312006190.0
83,2825041,comment,2821443.0,2821443.0,2,0,ashishgandhi,,,"""Im a big Android fanboy and proud PC owner.""<p>How are both related except being not-Apple? Almost as if you are supposed to pick sides - one being Apple and the other not-Apple. Use what suits you. Doesn't matter who makes it.<p>""... but I worry about the future.""<p>The author's mom is much happier with an iPhone and the author suggests that everything works. Also a friend is mentioned who uses a Nexus S which is ""a pleasure to use"". Given how things are it's reasonable to say a stock Android will always exists which Google launches with every new Android release. So what's the worry about?",1312006143.0
84,2825040,comment,2821552.0,2824974.0,1,0,prodigal_erik,,,"Yeah, it's a titanic game of chicken between the dominant parties. As <i>The Economist</i> put it, ""biggest unforced error in history still on schedule"".<p><a href=""http://www.economist.com/blogs/freeexchange/2011/07/democracy-america"" rel=""nofollow"">http://www.economist.com/blogs/freeexchange/2011/07/democrac...</a>",1312006133.0
85,2825039,story,,,1,1,jabo,Show HN: Get a bunch of friends and move the blue squares onto the gray squares.,http://pixza.com/lite,,1312006092.0
86,2825038,comment,2821552.0,2824110.0,1,0,funthree,,,<i>Apple and Google are not foreign corporations</i><p>You said it.,1312006069.0
87,2825037,comment,2824328.0,2825034.0,1,0,jazzychad,,,"true, however guidelines are just that. and sometimes rules are meant to be broken.",1312005938.0
88,2825036,comment,2818974.0,2822028.0,1,0,burgerbrain,,,"<i>""As a rule academics, writers, artists and critics...""</i><p>And in the real world, you are an asshole.  It's not namecalling, it's an assessment of your character.",1312005927.0
89,2825035,comment,2821443.0,2824442.0,3,0,kooshball,,,"I think it's quite interesting to see google go the same route as MS did with Windows and Windows Mobile which is allow the OEM to customize to make money, while letting user satisfaction drop. At the same time, WP7 is a total different strategy to tightly control the hardware and give a much greater user experience while the OEMs have less and less control.",1312005899.0
90,2825034,comment,2824328.0,2824593.0,1,0,bignoggins,,,but the tab bar is within apple's design guidelines. it also makes navigation a whole lot easier because you don't have to go back to the springboard.,1312005854.0
91,2825033,story,,,1,0,deepmishra,Pressure Measurement,http://www.tekscan.com/body-pressure-measurement,Tekscan.com Body Pressure Measurement System (BPMS) is a pressure mapping tool for measuring interface pressures and pressure distribution between the human bodies.,1312005822.0
92,2825032,story,,,7,5,chrisrxth,[Opinion|Idea] Using the Social Graph as an Artifical Neural Network (ANN),,"So the basic concept behind artificial neural networks is to have a graph with input and output nodes. You send logic through the graph, as a series of pipes. The logic within the graph (each node serves as I/O) processes the input values and provides output values based on the graph structure. You create the graph by training/conditioning the neural network - thus creating the logic.<p>What would come of applying this theory to social networks (and other occurrences of graph patterns throughout the internet)?<p>The reason that neural networking works is that the structures in the graph fundamentally represent patterns outside of the graph; effectively their logic mimics external mathematical patterns - they are a simplification of the information that the network digests as it is conditioned.<p>Extrapolating from this fact, shouldn't the patterns (and hence the logic) within social networks hold meaning? What would be the equivalent of running ""pulses"" through the social graph?<p>There would be two ways to do this.<p>1. Internally - create a simple algorithm that uses the logic held in the social graph to process inputs and outputs. For example, you might send an array of integers through a subgraph of Faceboook and get some other integers out from different end nodes within the subgraph. (With internal graph processing, you'd need access to the database, so only the social network would have the ability to run analytics like this.)<p>2. Externally - literally send a piece of information (an email that get's forwarded from one person (node) to the next, a tweet retweeted, or a hyperlink referenced) through the social work and follow it's path through the network. It's ending point would effectively be a function of it's starting point, and it's ending quality (for example, if the email was somehow changed by the end), would also be a function of it's starting point.<p>What could be made of such analytics? Are people already doing this? (I assume they are... I can't be the first one who thought of this.)<p>Btw, this is only my second post, so looking forward to getting familiar with the hacker community and hello. Let me know if this post was too long to be enjoyable.",1312005776.0
93,2825031,comment,2824780.0,2824857.0,9,0,ecounysis,,,"Either that or there is a shortage of available AI engineers, so they are using this to identify and cull potentially good people that for one reason or another cannot or have not attended a Stanford caliber school.",1312005770.0
94,2825030,comment,2819922.0,2819922.0,1,0,ryanto,,,exit;,1312005723.0
95,2825029,story,,,1,0,rummy33,Best Online Rummy Games with immense Offers,http://www.rummy3.com/online-rummy-games,"Online Rummy made a latest features of many Rummy Games provide for Online Rummy Lovers.Play Rummy games and get lovely deposit bonus,earn real cash prizes and be a fan in face book page get a good promo chips.You have not play interested in unknown persons then you referfriends in Classic Rummy and enjoy every movement.",1312005700.0
96,2825028,comment,2824318.0,2824615.0,3,0,jvdongen,,,"If, as the article implies, the same user gets the same identifier across all KISSmetrics customers they ARE (implicitly) sharing customer activity between customers.<p>As the article states, customer A and B could simple put the information they each have about identity XYZ together. Without KISSmetrics having to be involved any further than in providing and maintaining the unique identity to each customer separately.<p>Even if it was not the intent of KISSmetrics for this to be possible (which I've a hard time believing), the chosen implementation makes it possible.",1312005687.0
