,ID,Type,Story,Parent,Points,Comments,Author,Title,URL,Content,Created
130,6531792,comment,6531647.0,6531769.0,3,0,brymaster,,,"Coincidentally, <a href=""http://www.forbes.com/sites/alexknapp/2012/05/18/nikola-tesla-wasnt-god-and-thomas-edison-wasnt-the-devil/"" rel=""nofollow"">http://www.forbes.com/sites/alexknapp/2012/05/18/nikola-tesl...</a>",1381474861.0
131,6531791,comment,6531052.0,6531276.0,1,0,roryokane,,,"Direct link to the changelog you quote: <a href=""http://backbonejs.org/",
132,6531790,comment,6528693.0,6528693.0,6,0,tribeofone,,,"I was on a bus over from Montreal, we were all in a big room after they had emptied the bus. One guy was born in Cuba and was Canadian now. The border guard asked him how he got to Canada? The guy says &",
133,6531789,story,,,1,0,andosa,Mac shipments continue to shrink as Apple loses ground in US PC market,http://appleinsider.com/articles/13/10/09/mac-shipments-continue-to-shrink-as-apple-loses-ground-in-us-pc-market,,1381474836.0
134,6531788,comment,6530536.0,6530871.0,4,0,pmarca,,,In our case that isn&,
135,6531787,comment,6531610.0,6531610.0,0,0,rgbrenner,,,"why is alaska so large? The entire state population is only 780k.. so even if it were 100%, it should only be about two dots<p>Edit: also it says this data was published by the world bank in 2011",1381474817.0
136,6531786,comment,6531610.0,6531665.0,3,0,tadfisher,,,Fun fact: over 80% of Canadians live within 100 miles of the US border.,1381474800.0
