,ID,Type,Story,Parent,Points,Comments,Author,Title,URL,Content,Created
0,8317734,comment,8316467.0,8317212.0,1,0,x0x0,,,I&,
1,8317733,comment,8313702.0,8315635.0,1,0,captn3m0,,,Sorry about that. We&,
2,8317732,story,,,3,0,andyjohnson0,A Challenge from Freeman Dyson,http://rjlipton.wordpress.com/2014/09/09/a-challenge-from-dyson/,,1410767884.0
3,8317731,comment,8315863.0,8315863.0,1,0,jasonwen,,,I completely agree. Most information is nice to know but not actionable at all. It&,
4,8317730,comment,8317358.0,8317696.0,20,0,throwaway876876,,,You&,
5,8317729,comment,8317617.0,8317689.0,9,0,skidoo,,,"Politics make strange bedfellows. That said, I think that ideologically, all of these men are absolutely on the same page...<p>of persons who will never in their lifetimes be invited to any White House gala. And good for them.",1410767849.0
6,8317728,story,,,2,0,dkarapetyan,Our entire universe is a simulation for a weather prediction program,http://www.reddit.com/r/WritingPrompts/comments/2gfoky/wp_our_entire_universe_is_a_simulation_for_a/,,1410767845.0
7,8317726,comment,8317617.0,8317712.0,3,0,sschueller,,,I guess MI6 would make that declaration.,1410767825.0
8,8317724,comment,8313720.0,8313720.0,1,0,chris123,,,"This is interesting because I was wondering why so many of these startup videos seemed so similar (not in a good way, IMHO, but that&",
9,8317723,comment,8316467.0,8317417.0,1,0,x0x0,,,"The death rate from the current ebola is approximately 50%.  While that sucks, what patients have to lose is both a 50% chance of living and their right not to be a playground for medical experimentation.<p>edit: and just who vets the people/companies who get to offer drugs to desperately ill people?  Does anybody with $1k to buy needles get to make a sign and advertise curative injections?  I&",
10,8317722,comment,8316837.0,8316837.0,4,0,tazjin,,,Sounds like rubish to me.,1410767793.0
11,8317721,comment,8317714.0,8317714.0,2,0,AliAdams,,,A more explanatory tweet (if that isn&,
12,8317720,comment,8317617.0,8317673.0,3,0,Indyan,,,"As far as I know, this is the first time Snowden is directly penning an article. He even has a staff page [1] now on The Intercept. This is interesting because to me because &quot;At the NSA I routinely came across the communications of New Zealanders in my work&quot; is much more impactful than &quot;Snowden stated that he routinely came across the communications of New Zealanders in his work as an NSA Analyst&quot;.<p>[1]: <a href=""https://firstlook.org/theintercept/staff/edward-snowden/"" rel=""nofollow"">https://firstlook.org/theintercept/staff/edward-snowden/</a>",1410767747.0
13,8317719,comment,8315880.0,8316190.0,5,0,teddyh,,,I stand most corrected.,1410767688.0
14,8317717,comment,8317617.0,8317684.0,1,0,nodata,,,It won&,
15,8317716,comment,8317680.0,8317680.0,1,0,poseid,,,nice! inspired by ipod?,1410767628.0
16,8317715,comment,8317617.0,8317684.0,3,0,vonklaus,,,I think a large amount of people don&,
17,8317714,story,,,6,2,AliAdams,Instant.io: End to end browser based web torrent,http://instant.io,,1410767615.0
18,8317713,comment,8317617.0,8317686.0,7,0,sschueller,,,"Alternate: <a href=""http://new.livestream.com/accounts/1473236/events/3389825/player?width=640&height=360&autoPlay=true&mute=false"" rel=""nofollow"">http://new.livestream.com/accounts/1473236/events/3389825/pl...</a>",1410767606.0
19,8317712,comment,8317617.0,8317707.0,2,0,adamnemecek,,,Bond villains according to whom?,1410767586.0
20,8317711,story,,,4,0,webista,ECMAScript 6 modules: the final syntax,http://www.2ality.com/2014/09/es6-modules-final.html?m=1,,1410767585.0
21,8317710,comment,8317617.0,8317707.0,15,0,jacquesm,,,"Glenn Greenwald a Bond Villain?<p><a href=""http://en.wikipedia.org/wiki/Glenn_Greenwald"" rel=""nofollow"">http://en.wikipedia.org/wiki/Glenn_Greenwald</a><p>I see no preference for white furry felines and plenty of journalistic awards. He&",
22,8317709,comment,8316680.0,8316680.0,1,0,acesubido,,,"&quot;..., talk to businesses. I could give you a vague fact pattern to ask about (a problem which is amenable to a solution with code) but people seem to get hung up on that so I&",
23,8317708,comment,8316665.0,8316665.0,0,0,yardie,,,I just threw out my Dreamcast after finding it in my parent&,
24,8317707,comment,8317617.0,8317617.0,4,0,idlewords,,,We have got to get a halfway respectable public face for this movement. These are Bond villains.,1410767355.0
25,8317706,story,,,2,0,borcunozkablan,C++ array out of bound,http://stackoverflow.com/questions/1239938/c-accesses-an-array-out-of-bounds-gives-no-error-why,,1410767320.0
26,8317705,comment,8317092.0,8317092.0,3,0,lam,,,"The article is not accurate in some places. E.g., some coin cells are rechargeable such as the LIR2032.",1410767303.0
27,8317704,comment,8315224.0,8317114.0,1,0,Beltiras,,,No it doesn&,
28,8317702,comment,8317358.0,8317358.0,6,0,wldlyinaccurate,,,"This company makes millions upon millions of dollars from selling surveillance malware to (by the looks of the customer list) anyone who will pay.<p>If I were to set up a company which sold similar products at similar prices, I would expect the FBI to come knocking at my door very quickly.",1410767221.0
29,8317700,comment,8317364.0,8317364.0,1,0,BruceM,,,I posted an explanation of how Dylan&,
30,8317699,story,,,5,0,networked,Mustache.tcl,https://github.com/ianka/mustache.tcl,,1410767193.0
31,8317698,comment,8317358.0,8317629.0,2,0,philangist,,,Ha. What AV do you use?,1410767173.0
32,8317697,comment,8316811.0,8317230.0,1,0,mobiuscog,,,"A good reference may be the Mio: <a href=""http://www.dcrainmaker.com/2014/01/mio-link-first-look.html"" rel=""nofollow"">http://www.dcrainmaker.com/2014/01/mio-link-first-look.html</a>",1410767169.0
33,8317696,comment,8317358.0,8317679.0,4,0,ogijaoijfawje,,,"Snowden is milking the attention as well. Look at the livestream going on right now, he&",
34,8317695,comment,8315023.0,8316705.0,2,0,qbrass,,,It&,
35,8317694,comment,8316467.0,8316670.0,1,0,Dolimiter,,,Are those cumulative figures? A bit misleading if so.,1410767074.0
36,8317693,comment,8317617.0,8317678.0,0,0,skidoo,,,Truth is stranger than fiction.,1410767069.0
37,8317692,comment,8317358.0,8317660.0,3,0,Dylan16807,,,Got anything that doesn&,
38,8317691,comment,8317359.0,8317656.0,2,0,prostoalex,,,It&,
39,8317690,comment,8316559.0,8317273.0,2,0,coldtea,,,Not that much. Machintosh wasn&,
40,8317689,comment,8317617.0,8317617.0,19,0,davidw,,,One of these three things is not like the others.,1410766986.0
41,8317687,comment,8314931.0,8315509.0,1,0,lawnchair_larry,,,"You might want to watch that interview again, because what you&",
42,8317686,comment,8317617.0,8317617.0,12,0,drinchev,,,Ironically it&,
43,8317685,comment,8316559.0,8316559.0,1,0,TaoloModisi,,,"Jobs: I actually lost $250,000,000 in one year when the stock went down. [laughs]<p>Playboy: You can laugh about it?<p>Jobs: I’m not going to let it ruin my life. Isn’t it kind of funny? You know, my main reaction to this money thing is that it’s humorous, all the attention to it, because it’s hardly the most insightful or valuable thing that’s happened to me in the past ten years.<p>I believe that Jobs laughed because- the value of starting or investing in a business is in making meaning first; by making meaning you are looking to change the world. Starting or investing in a business on the sole purpose of making money,  means that if you don&",
44,8317684,comment,8317617.0,8317617.0,4,0,ericHosick,,,"Will any of this really make any difference? I feel that, in the long run, it won&",
45,8317683,story,,,2,0,radmuzom,How to Succeed in Silicon Valley Without Really Trying,http://www.newrepublic.com/article/119350/amicus-app-how-tech-investors-are-failing-due-diligence/,,1410766866.0
46,8317682,comment,8317358.0,8317657.0,1,0,Dylan16807,,,Who cares if they&,
47,8317681,comment,8312793.0,8312793.0,1,0,argonaut,,,"That sounds right, and if you&",
48,8317680,story,,,5,3,neoberg,Show HN: CSS3 Rotate Menu,http://codepen.io/neoberg/full/jiqAs,,1410766801.0
49,8317679,comment,8317358.0,8317657.0,14,0,DanBC,,,The releases are outside Snowden&,
50,8317678,comment,8317617.0,8317617.0,4,0,ogijaoijfawje,,,"Snowden is a controlled pawn, though even he might not know it. This is all too....Hollywood.<p>Edit: Feel free to downvote as much as you like, the points don&",
51,8317677,comment,8317359.0,8317359.0,3,0,Syssiphus,,,Ah damn. I saw Robert Smith and LARD and thought the singer of The Cure wrote an article about the death of Jello Biafra&,
52,8317676,comment,8315223.0,8315660.0,1,0,wodenokoto,,,Because normal users with 3-400 friends don&,
53,8317675,comment,8316518.0,8316518.0,2,0,bcx,,,"At first I thought this title was a poorly timed April Fools Joke.<p>I would imagine there are only a few decisions the founders make that ever come down to votes based on shares.  Off the top of my head: Selling the company, firing the CEO, electing a new board, diluting existing shareholders, dividends.<p>The impact of this decision is probably heavily based on how often Felicis has a big enough stake to be a factor in shareholder voting.",1410766624.0
54,8317674,comment,8316559.0,8317600.0,3,0,coldtea,,,"A computer is a general purpose machine, with capabilities for business, clerical work, arts (graphics, multimedia etc), entertainment (games, web tv, media distrubution) and of course communications.<p>A car, by now, is just a car. It&",
55,8317673,comment,8317617.0,8317617.0,13,0,vonklaus,,,"Link to the article Snowden authored earlier today about the subject :\n<a href=""https://firstlook.org/theintercept/2014/09/15/snowden-new-zealand-surveillance/"" rel=""nofollow"">https://firstlook.org/theintercept/2014/09/15/snowden-new-ze...</a><p>EDIT: The segment has ended. You can view the video by skipping to 21:54 at the following link:\n<a href=""https://www.youtube.com/watch?v=Pbps1EwAW-0",
56,8317671,comment,8317358.0,8317657.0,1,0,XorNot,,,"Like Julian Assange repurposing wikileaks donations into the Julian Assange sexual assault defense fund?<p>Whatever you may think of the allegations, it has become extremely blurry as what the money donated to wikileaks&",
57,8317670,comment,8316559.0,8317639.0,2,0,ricket,,,"10 years. Interview is dated 1985, Windows 95 is obviously 1995.",1410766544.0
58,8317669,comment,8316467.0,8317535.0,4,0,kijin,,,"Villages that quarantined themselves during the Plague were left completely to their own devices. Back then, you couldn&",
59,8317668,comment,8315996.0,8316592.0,4,0,pjmlp,,,"Generics appeared in programming languages with CLU back in 1974 followed by many others, C++ was hardly the first language to get them.<p>The first version of STL was actually done in Ada.<p>Don&",
60,8317667,comment,8317358.0,8317358.0,1,0,orblivion,,,I hope Norton is updating their database accordingly.,1410766529.0
61,8317666,comment,8316467.0,8317058.0,1,0,djcapelis,,,"That is documented fact in Liberia right now, especially in Monrovia.<p>This release from WHO sharply highlights this issue: <a href=""http://who.int/mediacentre/news/ebola/8-september-2014/en/"" rel=""nofollow"">http://who.int/mediacentre/news/ebola/8-september-2014/en/</a>",1410766526.0
62,8317665,story,,,3,0,cpeterso,"Android One Is Launching in India, but It’s a Big Deal for Everyone",http://recode.net/2014/09/14/android-one-is-launching-in-india-but-its-a-big-deal-for-everyone/,,1410766521.0
63,8317664,comment,8317358.0,8317657.0,12,0,vasco,,,You realize that you sound like propaganda yourself?,1410766491.0
64,8317663,comment,8311757.0,8317127.0,2,0,Dylan16807,,,They&,
65,8317662,comment,8316811.0,8316811.0,1,0,girzel,,,"Seems like, if you&",
66,8317661,comment,8317359.0,8317359.0,14,0,Zarkonnen,,,"Interesting article, but perpetuates the misunderstanding of that Sinclair&",
67,8317660,comment,8317358.0,8317591.0,8,0,sp0rk,,,"Most definitely.  Here is an example:\n<a href=""http://1337day.com/exploit/22519"" rel=""nofollow"">http://1337day.com/exploit/22519</a>",1410766347.0
68,8317659,comment,8317359.0,8317649.0,2,0,latch,,,I&,
69,8317658,comment,8315996.0,8316836.0,2,0,pjmlp,,,Because they focus on Java and C++ on their arguments while forgetting other languages.,1410766312.0
70,8317657,comment,8317358.0,8317358.0,4,0,ogijaoijfawje,,,"I know many love to consider Snowden and Assange &quot;heroes&quot;, but I think these two are people we should think outside the box on. Are they acting in the interest of everyone, themselves, or another party? The releases, interviews, and otherwise that get released seem very scripted and controlled. The propaganda machine is skilled and there may be unseen benefits to these leaks.",1410766267.0
71,8317656,comment,8317359.0,8317359.0,8,0,rwmj,,,You can buy lard in every UK supermarket.,1410766259.0
72,8317655,story,,,1,0,prostoalex,"Yo Still Kicking with More Than 100M Yos Sent, Roughly 15 per Second",http://techcrunch.com/2014/09/14/yo-100m/?ncid=rss&utm_source=feedburner&utm_medium=feed&utm_campaign=Feed%3A+Techcrunch+%28TechCrunch%29,,1410766229.0
73,8317654,story,,,1,1,wanghq,Ask HN: Do you write Airbnb review frankly?,,"Right now, I am living in a house I found on Airbnb. The host is very nice and the housing is very good. But not everything is perfect. I feel it&",
74,8317653,comment,8315996.0,8317019.0,7,0,pjmlp,,,"C++ currently compiles slowly due to lack of modules.<p>Eiffel, Ada, D, Modula-3, Active Oberon, FreePascal, Delphi... enjoy fast native code compilers and do have generics.",1410766215.0
75,8317652,comment,8315996.0,8317564.0,0,0,jesstaa,,,"You could also spend that developer time trying to untangle code reuse between various components, or the more subtle breakages caused by changes that don&",
76,8317651,comment,8315880.0,8315880.0,2,0,lkozma,,,"If someone is interested, here are two further nice articles about the man, written by a close friend and collaborator:<p><a href=""http://www.cs.uchicago.edu/files/tr_authentic/TR-2001-11.ps"" rel=""nofollow"">http://www.cs.uchicago.edu/files/tr_authentic/TR-2001-11.ps</a><p><a href=""http://www.cs.uchicago.edu/files/tr_authentic/TR-2001-03.ps"" rel=""nofollow"">http://www.cs.uchicago.edu/files/tr_authentic/TR-2001-03.ps</a>",1410766074.0
77,8317650,story,,,1,1,cdnpal,NginAd 1.0 Release with Open Source Code,http://www.nginad.com/,,1410766047.0
78,8317649,comment,8317359.0,8317359.0,1,0,nazgulnarsil,,,Similar: popcorn used to primarily be cooked in coconut oil. Then we had the campaign against saturated fat and theatres switched to vegetable oils. Decades later we discover that the MCTs in coconut oil are awesome for cardiovascular risk.,1410765966.0
79,8317648,comment,8317640.0,8317640.0,1,0,ajayksagar1,,,Whats the range of the product?,1410765964.0
80,8317647,comment,8315996.0,8317638.0,2,0,pjmlp,,,"In the comments, where the flaws about the document are pointed out.",1410765894.0
81,8317646,comment,8315996.0,8317081.0,5,0,pjmlp,,,"Any language with modules and generics and production quality native code compiler, does enjoy fast compilation speed.<p>It is a good sell when the audience only knows about C++ compilation issues.",1410765815.0
82,8317645,comment,8316230.0,8316373.0,2,0,hnha,,,youtube-dl can handle spiegel.de,1410765795.0
83,8317644,comment,8317441.0,8317441.0,18,0,fragmede,,,"&quot;instant.io: drop a file or files on the browser, it generates a torrent, and you become the first seeder just send the info hash to a friend and they&",
84,8317643,story,,,1,0,beamcalcs,"I'm greedy about many things, but not money",http://www.beamcalculation.co.uk/im-greedy-many-things-money/,,1410765777.0
85,8317642,story,,,2,0,hoaproject,"Hoa\\Websocket, simple, fast and complete WebSocket servers and clients",https://github.com/hoaproject/Websocket,,1410765771.0
86,8317641,story,,,1,0,rahimnathwani,Variable Interest Entities in China (2012) [pdf],http://www.chinaaccountingblog.com/vie-2012septaccountingmatte.pdf,,1410765714.0
87,8317640,story,,,4,2,yeban,"Very high accuracy, low latency gesture control",http://www.producthunt.com/posts/nimble-2,,1410765669.0
88,8317638,comment,8315996.0,8317536.0,3,0,kmontrose,,,It doesn&,
89,8317637,comment,8316230.0,8316884.0,3,0,hnha,,,how can the government not do the same to Apple&,
90,8317636,comment,8315996.0,8317240.0,0,0,pjmlp,,,Simple languages shift complexity to the programmer&,
91,8317635,comment,8316022.0,8317142.0,2,0,rahimnathwani,,,That&,
92,8317634,comment,8314354.0,8314354.0,1,0,minusSeven,,,meh this is very early days and so making and comments about the future of the game is very stupid.,1410765615.0
93,8317633,comment,8312131.0,8313587.0,1,0,atmosx,,,Because Google&,
94,8317630,comment,8316811.0,8317259.0,1,0,yaeger,,,"Someone should tell EA about this. They already claimed to be working on bringing game apps to the watch...<p>The first thing I thought was, other than tic tac toe, what game could you possibly display on a display that small?<p>I also think, a watch like that is good first and foremost as a quick check on what going on regarding your phone in our pocket.<p>But for this usecase, I think the price point of this watch is a bit much. I would love to have my watch buzz when getting a new text on my phone. And with a quick glance I can see if it is important or not without having to take my phone out of my pocket. This would be neat. But I don&",
95,8317629,comment,8317358.0,8317534.0,1,0,philtar,,,My AV deleted it as soon as it was extracted.,1410765490.0
96,8317628,comment,8316467.0,8317269.0,2,0,Padding,,,"That you have been downvoted is very telling of the crowd that CS people are. We pretend to be all rational professionals on our high horses, decorated with degrees and what not..<p>And yet, when something manages to hit us on an emotional level we falter.<p>What Afforess said is a statement of fact and relevant to the discusssion. Thus it&",
97,8317627,comment,8311844.0,8316873.0,1,0,errordeveloper,,,"Lol, supposedly mine wasn&",
98,8317626,comment,8315467.0,8317017.0,1,0,MaysonL,,,"&quot;Debt&quot; includes the Treasury securities held by Social Security and Medicare trust funds, I believe.",1410765454.0
99,8317625,comment,8314766.0,8314766.0,2,0,krat0sprakhar,,,Refreshing to see Rust being used in graphics intensive projects. Would be great if the author could share his experience using Rust.,1410765422.0
100,8317624,comment,8317071.0,8317408.0,2,0,prawn,,,"Agree. I have an esky that I use a few times a year. I have never wished for compartments, a blender, a speaker or anything like that. I just wish it could fit a bottle of champagne standing vertically.",1410765382.0
101,8317623,comment,8316467.0,8316866.0,1,0,zvrba,,,"Related; an example of efficient government action: <a href=""http://en.wikipedia.org/wiki/1972_outbreak_of_smallpox_in_Yugoslavia"" rel=""nofollow"">http://en.wikipedia.org/wiki/1972_outbreak_of_smallpox_in_Yu...</a><p>Somehow I don&",
102,8317622,comment,8316230.0,8317399.0,3,0,erkkie,,,"While not necessarily <i>technically impossible</i>, it&",
103,8317621,comment,8316757.0,8317516.0,1,0,Strilanc,,,So... don&,
104,8317620,story,,,2,0,bernardlunn,Wealthfront Betterment – fighting wrong war as Modern Portfolio Theory is flawed,http://fintech4us.wordpress.com/2014/09/15/wealthfront-vs-betterment-battle-of-the-robo-advisers-to-win-the-wrong-war-because-modern-portfolio-theory-is-past-its-sell-by-date/,,1410765254.0
105,8317619,comment,8316230.0,8316230.0,1,0,zby,,,This crashes my shockwave flash plugin - should I start to be paranoid?,1410765228.0
106,8317618,comment,8315863.0,8316307.0,3,0,icelancer,,,"The light is ridiculous. It should read the code in models that have a text display, instead of needing to go to Autozone and rent an OBD code reader. It&",
107,8317617,story,,,271,151,vonklaus,"LIVE NOW: Glenn Greenwald, Assange, and Kim Dot Com in NZ",http://kim.com/,,1410765137.0
108,8317616,comment,8314354.0,8314354.0,1,0,asdz,,,you sell your game.\nnow I should quit,1410765132.0
109,8317615,comment,8317420.0,8317420.0,1,0,gcb4,,,can anyone with even the most rudimentary knowledge of programming not shun those texts as the most idiotic kind of hog wash?<p>it all sounds like a propaganda to make the lay man think that military drones can have morals or something.,1410765112.0
110,8317614,comment,8317441.0,8317605.0,1,0,MzHN,,,"Also some further details on the instant.io + whiteboard app<p><a href=""https://botbot.me/freenode/webtorrent/2014-09-11/"" rel=""nofollow"">https://botbot.me/freenode/webtorrent/2014-09-11/</a>",1410765014.0
111,8317613,comment,8317071.0,8317521.0,2,0,Padding,,,"> How is it a success if he burns through the money and fails to bring the product to market in a meaningful way?<p>A lot of regular people &quot;burn through money&quot; and fail to deliver any sort of value in the process of their daily job. We consider them successful to some extent, right?<p>How is raising funds but failing to deliver any different compared to one of those more conventional members of society? And having raised $13m allows you to be one of those &quot;less productive&quot; workers for the rest of your live.<p>> unless the inventor runs away with the money<p>Well, he doesn&",
112,8317612,story,,,4,0,dmagee,Kim Dotcom and the NZ govt. deal,http://www.nzherald.co.nz/nz/news/article.cfm?c_id=1&objectid=11324988 ,,1410764947.0
113,8317611,comment,8316757.0,8317584.0,2,0,Strilanc,,,Any quantum state that doesn&,
114,8317610,comment,8315616.0,8315616.0,1,0,yellowapple,,,"I really like this, and am considering incorporating it in quite a few sites at this particular moment; so far so good implementation-wise.<p>A <i>huge</i> plus that makes up for the lack of pre-IE9 Internet Explorer support is the fact that this seems to fail gracefully; since it&",
115,8317609,comment,8317358.0,8317358.0,16,0,girvo,,,"So, it seems the NSW police here in Australia are a customer and use this.<p>Ignore for a moment whether it&",
116,8317608,comment,8316559.0,8317091.0,1,0,clarky07,,,"fwiw, people have been saying that about electric cars for literally decades. perhaps this time really is different. if tesla ever makes a care normal people can afford it might happen.<p>the battery tech is still a ways off though. right now they are only really good for commuting, and lots of people still like to travel, or at least have the option to.",1410764887.0
117,8317607,story,,,1,0,hongkonggong,Growth hacking as a book publisher,https://medium.com/@FEProctor/growth-hacking-as-a-book-publisher-5b96eeb75f89,,1410764860.0
118,8317606,comment,8316811.0,8317286.0,1,0,bluthru,,,Circles are the worst shape if you want to minimize width and height.,1410764717.0
119,8317605,comment,8317441.0,8317441.0,7,0,abdullahkhalids,,,"Github: <a href=""https://github.com/feross/webtorrent"" rel=""nofollow"">https://github.com/feross/webtorrent</a>",1410764693.0
120,8317604,comment,8317364.0,8317364.0,3,0,huhtenberg,,,"At the risk of stating obvious - <i>typeof</i> is a gcc-ism, not a part of the C standard.",1410764676.0
121,8317603,comment,8317358.0,8317468.0,2,0,zby,,,And they all use gmail?!?!?!,1410764658.0
122,8317602,story,,,2,0,train_robber,A Cambrian Explosion in AI Is Coming,http://techcrunch.com/2014/09/13/a-cambrian-explosion-in-ai-is-coming/,,1410764626.0
123,8317600,comment,8316559.0,8317285.0,1,0,boomlinde,,,The Macintosh was just a computer.,1410764477.0
124,8317599,comment,8317364.0,8317364.0,3,0,lispm,,,About the Common Lisp section:<p>Using <i>fresh</i> symbols is not enough. GENSYM creates uninterned symbols - those are not interned in a package. Thus referencing them in user code is not possible.<p>Shadowing &,
125,8317598,comment,8317358.0,8317587.0,16,0,atmosx,,,Just don&,
126,8317597,story,,,1,0,kwaimind,Show HN: App to Phone Calling Using JavaScript,http://tutorial.sinch.com/js-calling-tutorial/?utm_source=hackernews&utm_medium=link&utm_campaign=hackernews,,1410764407.0
