,ID,Type,Story,Parent,Points,Comments,Author,Title,URL,Content,Created
136,7506583,comment,7503882.0,7504672.0,3,0,porker,,,> there&,
137,7506582,comment,7506447.0,7506548.0,1,0,ekianjo,,,"I know what bounce rate means, but is that measurement really meaningful ? How is it measured and how do you determine exactly the root cause of that bounce rate?",1396335837.0
138,7506581,comment,7506297.0,7506297.0,28,0,apsec112,,,"I am a big supporter of gay rights (and am myself bisexual), but I oppose this sort of thing, for reasons explained very well by the venerable Scott Alexander:<p>&quot;Constitutional freedom-of-speech is a necessary but not sufficient condition to have a “marketplace of ideas” and avoid de facto censorship. But people also have to understand that the correct response to “idea I disagree with” is “counterargument”, not “find some way to punish or financially ruin the person who expresses it.” If you respond with counterargument, then there’s a debate and eventually the people with better ideas win (as is very clearly happening right now with gay marriage). If there’s a norm of trying to punish the people with opposing views, then it doesn’t really matter whether you’re doing it with threats of political oppression, of financial ruin, or of social ostracism, the end result is the same – the group with the most money and popularity wins, any disagreeing ideas never get expressed.<p>Atheists may one day be the group with the most money and popularity, but that day isn’t today and right now it’s neither moral nor in our self-interest to encourage using greater resources to steamroll opponents. It’s certainly not in gay people’s self-interest either. Why shouldn’t companies owned by Christians fire all gay people on the grounds that they are promoting sin? Right now it’s because we have a mutual truce in which we agree businesses should employ people based on their skills and merit rather than to reward their political allies and punish their political opponents. Once you undermine that, gay people are in a pretty precarious position.<p>So I would turn your own hypothetical scenario in Part 2 of your post back on you. Suppose Robertson had indeed, been a gay rights supporter – or a gay person! – who said on national news he thought everyone should stand up for gay rights. But his company was going for the fundie demographic and decided to fire him for his statement. Would you be so quick to attack everyone who was disappointed in this action, so eager to stand up for the right of companies to fire anyone they disagree with?&quot;<p><a href=""http://slatestarcodex.com/2013/12/28/a-comment-i-posted-on-what-would-jt-do/"" rel=""nofollow"">http://slatestarcodex.com/2013/12/28/a-comment-i-posted-on-w...</a>",1396335811.0
139,7506580,comment,7503842.0,7505382.0,2,0,DanBC,,,"Those screen shots are not from 4Chan, but from some other chan using similar software.",1396335771.0
140,7506579,story,,,1,0,avalore,Ask HN: How to style node-webkit app,,How does everyone go about styling node-webkit (or similar) apps for desktop?\nI&,
141,7506578,comment,7502583.0,7502583.0,2,0,GazNewt,,,Where&,
142,7506577,comment,7505535.0,7505861.0,4,0,troels,,,This is mine:<p><pre><code>    ,
143,7506576,comment,7506135.0,7506536.0,1,0,shin_lao,,,I think it&,
144,7506574,comment,7506388.0,7506388.0,1,0,lonewanderer,,,"Hi itzsouloflol, i am italian and i am an entrepreneur/freelancer developer.<p>I have been through that situation, maybe some years ago, but i know what you are facing, at least in part.<p>I can&",
145,7506573,comment,7496968.0,7505856.0,1,0,V-2,,,It&,
146,7506572,comment,7503496.0,7503818.0,1,0,dingaling,,,">Newer cars are kind of a pain in the butt to see out of the back. Why? Because of the roof strength requirements.<p>Partly, but mainly because of what the designers like to call &",
147,7506571,comment,7506361.0,7506361.0,23,0,tdicola,,,"This looks neat for people that want a cheap board to hack on embedded Linux.  However for serious control of signal generation, acquisition, PWM, servos, etc. you really don&",
148,7506570,comment,7501212.0,7503326.0,2,0,einhverfr,,,"In addition, &quot;requested by the Department of Defense&quot; strikes me as a big warning.",1396335627.0
149,7506569,story,,,1,0,subwiz,StaGen: Static site generation framework using StringTemplate 4 and Markdown,https://github.com/wiztools/stagen/wiki/Tutorial,,1396335622.0
150,7506568,comment,7501519.0,7503504.0,2,0,axman6,,,"Proof? Even informed speculation?<p>Apple have made several aquisitions in the last few years to give them the technology they need to make these sorts of developments. Even if some of the tech had been stolen, it would require a lot of work to put it into practice.<p>I know I&",
