,ID,Type,Story,Parent,Points,Comments,Author,Title,URL,Content,Created
119,10944000,comment,10942505.0,10943967.0,0,0,IshKebab,,,"The antennas are not just for show. Having multiple antennas allows you to increase bandwidth, reliability and range.<p><a href=""https://en.wikipedia.org/wiki/MIMO"" rel=""nofollow"">https://en.wikipedia.org/wiki/MIMO</a><p><a href=""https://en.wikipedia.org/wiki/Antenna_diversity"" rel=""nofollow"">https://en.wikipedia.org/wiki/Antenna_diversity</a><p><a href=""https://en.wikipedia.org/wiki/Beamforming"" rel=""nofollow"">https://en.wikipedia.org/wiki/Beamforming</a>",1453363582.0
120,10943999,comment,10930072.0,10941025.0,0,0,ars,,,"There is no yearly accounting. The treaty is that countries deliver first-class postage letters and packages for free, for each other.<p>The idea was that there is an equal amount of packages shipped each way, so the post office makes up the difference in packages sent. That used to be true, and now isn&",
121,10943998,comment,10932988.0,10943948.0,0,0,mcpherrinm,,,If you&,
122,10943997,comment,10942752.0,10943858.0,0,0,baby,,,Yup. I don&,
123,10943996,comment,10943592.0,10943592.0,0,0,tempestn,,,Forget &quot;in disguise&quot;.  It&,
124,10943995,comment,10942196.0,10942468.0,0,0,duncan_bayne,,,I&,
125,10943994,comment,10943582.0,10943949.0,0,0,adrianN,,,People drive because there is no public transport and there is no public transport because everybody drives. Making parking really expensive and funneling the money into improved public transport would probably change the situation.,1453363531.0
126,10943993,comment,10942479.0,10943774.0,0,0,krkoch,,,"I think AVR32 is dead (also UC3, AP7 died years ago). I&",
127,10943992,comment,10939359.0,10939359.0,0,0,herbst,,,I can change team but not retry a different password? I am stuck in the registration process ...<p>Well that sucks :/,1453363508.0
128,10943991,comment,10942196.0,10942196.0,0,0,cmurf,,,Police as the highwayman.,1453363467.0
129,10943990,comment,10938593.0,10939083.0,0,0,ryan-allen,,,I block ads after years of holding out because they have become too intrusive. I don&,
130,10943989,comment,10942752.0,10942752.0,0,0,cmcginty,,,"Well, I agree that Q-Tips have the potential to do more harm then good, but this probably the extreme 1% of cases. I think the key takeaway is never try to reach back to your ear drum, and don&",
131,10943988,comment,10942671.0,10943911.0,0,0,SignMeTheHELLUp,,,Doesn&,
132,10943987,comment,10942314.0,10943964.0,0,0,hellofunk,,,"To me, a more compelling question is if Orkut would have succeeded if Facebook had never been invented?",1453363398.0
133,10943986,comment,10942196.0,10943487.0,0,0,winter_blue,,,"We need constitutional limitations on state power.<p>The U.S. constitution[1] must be amended to enumerate and accord the states a limited specific set of rights, and all other rights must be reserved for the people.<p>[1] Alternatively, individual state constitutions could be amended to have an enumerate powers clause added to them -- but I doubt those deep red Republican &quot;conservative&quot; and &quot;small government&quot; states would want to limit the power of the state to abuse marginalized groups. Conservative hypocrisy is unnerving.",1453363394.0
134,10943985,comment,10935920.0,10942040.0,0,0,kenOfYugen,,,"In previous work [1] we followed the Linux kernel documentation [2] and the guidelines published by IBM ITSO [3].<p>[1] <a href=""http://link.springer.com/article/10.1007/s00607-014-0394-9"" rel=""nofollow"">http://link.springer.com/article/10.1007/s00607-014-0394-9</a><p>[2] <a href=""http://www.cyberciti.biz/files/linux-kernel/Documentation/networking/ip-sysctl.txt"" rel=""nofollow"">http://www.cyberciti.biz/files/linux-kernel/Documentation/ne...</a><p>[3] <a href=""https://lenovopress.com/redp4285.pdf"" rel=""nofollow"">https://lenovopress.com/redp4285.pdf</a>",1453363351.0
135,10943984,comment,10943582.0,10943969.0,0,0,tempestn,,,In Seattle you&,
136,10943983,comment,10942196.0,10943645.0,0,0,LordKano,,,I hadn&,
137,10943982,comment,10942314.0,10943035.0,0,0,sago,,,> Hacker news for X<p>Isn&,
138,10943981,comment,10934666.0,10942806.0,0,0,pjmlp,,,"Xerox controlled the whole stack, they invented it for their systems.<p>So these workstations where an whole stack OS.<p>You can read about their implementations on the links I provided before.<p>Additionally, you can get the original Smalltalk-80 from from Stephane&",
139,10943980,story,,,98,25,shashashasha,The Digital Materiality of GIFs,http://digitalmateriality.com/,,1453363258.0
140,10943979,comment,10932988.0,10943848.0,0,0,jk563,,,I think envious is the word you&,
141,10943978,comment,10943582.0,10943939.0,0,0,ars,,,"Have you ever driven in NY? Anyone who drives a car there needs to, rather than wants to.<p>So I was mocking the idea that making things harder for people who already have no choice about driving is a good idea.<p>It&",
