,ID,Type,Story,Parent,Points,Comments,Author,Title,URL,Content,Created
0,4125603,story,,,1,0,francois580,Vakantie: goedkoop naar Walibi - Richting Vakantie,http://www.richting-vakantie.be/vakantie-goedkoop-naar-walibi/,,
1,4125602,comment,4125210.0,4125459.0,1,0,fishbacon,,,From what I have heard everything is up-scaled to match the native resolution so things that are not optimized for the new displays just looks kinda bad.,1340009977.0
2,4125601,comment,4124320.0,4125313.0,1,0,paganel,,,"> Philosophy-savvy scientists may even deny doing so, but their day-to-day conversation and casual remarks tell another story. Most scientists definitely believe there is a single absolute unshifting reality below it all and they are outlining it.<p>I find that actually quite sad. From a man who actually died for his ""scientific"" convictions (<a href=""http://en.wikiquote.org/wiki/Giordano_Bruno",
3,4125600,comment,4125530.0,4125593.0,5,0,densh,,,IMO the correct way is to include subset of JRE that's actually required for given application. This can lead to relatively small total application size and deployments that do not require any knowledge of java and java world from end user. Having one JRE for all apps on the system is nice but it's usually not needed.,1340009945.0
4,4125599,comment,4125198.0,4125198.0,3,0,rlpb,,,"A contrarian anecdote may help expose an article being false or misleading in itself. For example: a review written by the manufacturer itself, or astroturfing.<p>First we must determine the validity of the article existing in itself and any motivations or biases in it. For this, contrarian anecdotes are useful. This article seems to miss this point.<p>Once we can accept the article at face value, then we may hit the biases described.",1340009934.0
5,4125598,comment,4125198.0,4125582.0,11,0,retrogradeorbit,,,Are you actually arguing against giving anecdotes weight by using... anecdotes?,1340009903.0
6,4125597,comment,4125210.0,4125488.0,2,0,dbaupp,,,Works fine for me on Firefox Nightly too.,1340009826.0
7,4125596,story,,,4,0,nreece,"Companies in ""Boring"" Niches Creating Great Content",http://www.seomoz.org/blog/companies-in-boring-niches-creating-great-content,,1340009823.0
8,4125595,comment,4124382.0,4125283.0,1,0,suby,,,"They've removed all visual cues that let you know what things do.  You'd have no way of knowing that clicking the bottom left takes you to metro if someone or something doesn't tell you.  If you click on the bottom right corner, you minimize all windows -- There's a visual cue for this in windows 7.  The button still exists, but they've removed this visual cue in Windows 8, and I have no idea why.  I'm really baffled by it.",1340009805.0
9,4125594,comment,4125530.0,4125530.0,11,0,wiradikusuma,,,"Anyone using JavaFX? I remember it came out as a Flash/Flex contender, but didn't make the cut (which is too bad, I kinda like the language). Considering Adobe pushing HTML5, I find it weird Oracle still pushing Java for Rich Internet Applications.",1340009717.0
10,4125593,comment,4125530.0,4125530.0,29,0,bni,,,"The Java way has always been: To run this, click on the .bat file or type java -jar myapp.jar. And some people wonder why Java has been such a failure on the desktop.<p>This should have been in Java from the beginning, instead of outsourcing this functionality to third parties (Mainly Windows only installer applications that sucks, and also isnt used that much).<p>That said, I think it is misguided to include a JRE in the bundle. The correct way would be something like OS X Lion has, promt the user if Java is not installed. and then do a more or less automatic install of Java, in the system.",1340009716.0
11,4125592,comment,4124382.0,4125396.0,2,0,lmm,,,Not for those of us with conventional jobs.,1340009682.0
12,4125591,story,,,1,0,sherazam,Disable MS Excel Compatibility Checker & Enhanced XML Map Properties,http://www.aspose.com/blogs/aspose-products/aspose-cells-product-family/archive/2012/06/14/disable-compatibility-checker-in-excel-and-avail-useful-enhancements-using-aspose.cells-for-.net-7.2.2.html,"The long awaited version of Aspose.Cells for .NET 7.2.2 has been released. It allows disabling Microsoft Excels Compatibility Checker in this release. We have also added support for adding quotes around your data when saving to CSV format, as one of our customers asked us to. We have added some other useful enhancements around the Subtotals feature. The XML Map properties will now be retained when re-saving the template file. We have also improved the Formula Calculation Engine and Pivot Table rendering features and fixed a few issues they had. The Excel-to-PDF feature is further improved for shapes rendering.",1340009680.0
13,4125590,comment,4124397.0,4125236.0,1,0,potkor,,,"Hmm, wouldn't it be less practical to do that with large CHP plants (vs small ones)? Here in Europe district heating\nCHP plants are generally run by utilities.",1340009659.0
14,4125589,story,,,1,0,RudeBaguette,"Index's new 350M fund for early stage ""European"" startups",http://www.rudebaguette.com/2012/06/18/index-ventures-350m-fund/?utm_source=hackernews&utm_medium=hackernews&utm_campaign=hackernews,,1340009648.0
15,4125588,comment,4125555.0,4125555.0,2,0,afsina,,,In my old 16 inch notebook I cannot notice pixels at all. And font rendering is just fine. Ok I have an eye problem but still I fail to see the point of having very high resolution on a small screen. What is the catch?,1340009643.0
16,4125587,comment,4123512.0,4123512.0,0,0,earnon,,,"The industry will never come up with a cure because there's more money in chronic treatments.<p>At the same time, why do we even need diabetes technology? Just go on a low-carb diet. My grandma was borderline diabetic a year ago. She was getting very worried, so I was finally able to convince her to try it and now her test results are great.<p>Even if you're a type I diabetic, this will manage your symptoms although it won't cure you. Check out ""Good Calories Bad Calories"" by Gary Taubes.",1340009520.0
17,4125585,comment,4123707.0,4124263.0,4,0,ZeroGravitas,,,"These real life mysteries were probably part of the inspiration for Lost.<p><a href=""http://en.wikipedia.org/wiki/Numbers_station"" rel=""nofollow"">http://en.wikipedia.org/wiki/Numbers_station</a>",1340009352.0
18,4125583,comment,4121698.0,4121866.0,1,0,chalst,,,"Quite.  Given that the PC market, which I believe is the source of their highest margin sales, seems to be shrinking, perhaps high-handedness with potential allies is not the wisest course of action.",1340009304.0
19,4125582,comment,4125198.0,4125452.0,37,0,loup-vaillant,,,"Let's take an example, since they seem to work best: vaccines.<p>Vaccines protect you from the risk of contracting particular diseases, some of which are crippling, lethal, or incurable.  Plus, most are extremely effective: once you take your shots, you are effectively immune. That's good.<p>There is a downside however.  Sometimes, vaccines have side effects.  Most side effects are quite benign, but if you're unlucky enough, they can be crippling, lethal, or incurable.  That's bad.<p>From a medical point of view, vaccines are a net good (let's leave aside logistic considerations, or the effort required to go to the doctor).  When you look at the stats, you stand a much better chance at life and health if you take the shot.  Even for relatively minor illnesses like the flu.<p>Now, let's say someone post a heartbreaking comment about how her 9 year old daughter died of a vaccine shot, with all the gory details about the suffering, how she couldn't participate in her school's festival, the size of the coffin I'm quite sure there <i>are</i> stories of the kind.  Given the sheer amount of readers here, maybe one of you will more or less directly relate to that.  My apologies to those who do.<p>Nevertheless, what makes a good story doesn't necessarily make good evidence.  When you know of reliable statistics, and you read a contrarian anecdote, you should shift your belief in the direction of the anecdote by a precise amount, which is almost always tiny.  What your brain will actually do behind you back however, is shifting your belief by a <i>significant</i> amount, often crossing the ""reasonable doubt"" line.  That's not rational, but that's what will happen.  Nameless statistics feel abstract, remote.  An anecdote on the other hand feels concrete, real, close.  Worse, you can spend far more time reading about the salient anecdotes than learning about the end results of reliable, but boring, scientific studies.<p>Another example: you don't win the lottery.  Period.  You don't know of any close family of friend that ever did.  But maybe one of you readers do.  Maybe that one could comment and say ""Hey, but my cousin <i>did</i> win the lottery!"".  Would that prove me wrong?  Not at all.  It's just that when the sample size is huge enough, even the tiniest chance can actualize.",1340009224.0
20,4125581,comment,4125198.0,4125479.0,5,0,jessedhillon,,,"In your example, A is not relating a statistical or experimental finding, but instead dispensing commonsense knowledge which happens to be objectively false. It's not what the OP is talking about.",1340009196.0
21,4125580,comment,4124275.0,4124275.0,3,0,jcfrei,,,"if you're buying art and putting it on display in your home - don't think about the narrative of the artist. think about the narrative the buyer might have had, when he saw the picture. I believe most people who spend a lot of money do so because they want to express something about themselves.",1340009164.0
22,4125578,comment,4125555.0,4125555.0,1,0,vetler,,,"I kind of want Retina display, but I made a promise to myself that my next laptop would be a Linux laptop. Perhaps I could run Linux on a Macbook Pro, but it would look like this: <a href=""http://www.omgubuntu.co.uk/2012/06/what-does-ubuntu-look-like-on-a-retina-display-bad"" rel=""nofollow"">http://www.omgubuntu.co.uk/2012/06/what-does-ubuntu-look-lik...</a><p>How long until other desktop environments catch up?",1340009140.0
23,4125577,comment,4124382.0,4125126.0,1,0,lmm,,,If you delete things from the start menu there's no way left to find them (other than rummaging through your whole hard drive for executables). Things I want to launch often go in quick launch or on the desktop; the start menu is always the interface of last resort.,1340009134.0
24,4125576,comment,4123923.0,4124255.0,2,0,kamjam,,,"Well, that's the same value the big pharma's put on human life when it can't afford their high priced drugs, so I don't see anything not smart about it.",1340009098.0
25,4125575,comment,4123941.0,4125415.0,8,0,toemetoch,,,"IMO BeOS was to operating systems what Opera is to browsers. Innovative, good ideas, efficient, ... but few people use it.<p>I remember demo-ing BeOS to a friend by opening a ton of videos at the same time. He replied that Windows did that as well, until he tried it and the system was trashing after the 3rd video. The ""pauze"" button in the copy/paste progress bar ... a revelation.",1340009091.0
26,4125574,comment,4125210.0,4125488.0,1,0,creamyhorror,,,"Woops, my bad! I'll just skip it then...",1340009045.0
27,4125573,comment,4124320.0,4124656.0,2,0,paganel,,,"> I haven't left philosophy because everyone in it is stupid, as this article seems to suggest. I left philosophy because after all my reading, note-taking, class-discussioning, and debate tournamenting, I never felt like I'd made any progress, and that mattered to me personally. At the end of the day, the questions that were hard to answer were still unsolved, and the gray ethical areas were still gray. This is why I don't do philosophy, and I why I found the science bug.<p>I get your point, but for all intents and purposes that's one of the things that makes philosophy great, i.e. the fact that Heraclitus's sayings are as actual today as they were 2,500 years ago. You'll also have to agree that deciding once and for all (or ""proving"" by scientific means) what makes as taking ""moral"" decisions, or if ""morals"" even exist at all, or what makes us not kill each other once we've stopped believing in gods etc.,  is better left ""unresolved"", because this ""philosophical quest"" is what makes us humans.",1340008978.0
28,4125572,story,,,1,0,designingmall,"Valuable HTML5/CSS3 Resources, Tools and Cheat Sheets",http://www.designingmall.com/2012/06/valuable-html5css3-resources-tools-and-cheat-sheets/,,1340008966.0
29,4125571,comment,4125555.0,4125555.0,2,0,daurnimator,,,The intro/overview are a complete load of codswallop... Touting increases in DPI as game changing couldn't be farther from the truth.<p>Nevermind the painting of apple as innovators.,1340008951.0
30,4125570,comment,4123923.0,4124959.0,1,0,kamjam,,,"Out of interest, what kind of healthcare reforms are you talking about? Something like they have in the US, via paid insurance, or something like they have in the UK with ""free"" healthcare for all via the NHS?<p>If it's the latter, with a population of 1.2 billion, this would surely bankrupt India?",1340008840.0
31,4125569,comment,4124382.0,4124448.0,2,0,jpswade,,,"> These Ribbon toolbars are packed with small user elements and are fiddly to use with a mouse, and even more fiddly  at times bordering on impossible to use  when driven with a finger.<p>He contradicts himself, I stopped reading.",1340008761.0
32,4125568,story,,,1,0,couponcode2grab,"Take 40% off, Selected favorite pets products. ",http://couponcodes2grab.com/coupon/myfavoritepetshop.com/84606,"Take 40% off, Selected favorite pets products. Coupons, myfavoritepetshop.com Coupon Codes,My Favorite Pet Shop Promotional Codes, printable coupons and online coupons Save money with Coupon Codes, Promotional Codes, and Free Shipping Deals",1340008714.0
33,4125567,story,,,1,0,cjllhyx,"Red Bottom Shoes, Christian Louboutin Replica Store, 75% OFF | Free Shipping",http://www.redbottomshoesreplica.com/,,1340008709.0
34,4125566,story,,,1,0,chotuchandra3,Brain and Language Brain and Language Brain and Language ,http://petitto.gallaudet.edu/~petitto/index/ http://petitto.gallaudet.edu/~petitto/index/ http://petitto.gallaudet.edu/~petitto/index/ ,"Dr. Laura Ann Petitto is a Cognitive Neuroscientist and a Developmental Cognitive Neuroscientist widely famous for her discoveries about the begotten foundations of communication.\nPetitto is the communicator of over 100 pedantic articles, the winner of 3 major awards for her spectacular teaching, and the acquirer of over 25 multinational prizes and awards for her \nscientific discoveries, including the 1998 Guggenheim Award for her ""outstandingly distinguished achievements in the past and extraordinary promise for coming accomplishment in the department of Neuroscience.""",1340008691.0
35,4125565,story,,,4,0,anons2011,Google reveals 'terrorism video' removals,http://www.bbc.co.uk/news/technology-18479137,,1340008660.0
36,4125564,comment,4124397.0,4125209.0,2,0,mkramlich,,,"that sounds like the Crash Only Software paper, but with respect to power sources",1340008571.0
37,4125563,comment,4124183.0,4125001.0,6,0,masklinn,,,"> That's not an operator, that's a lambda. The end result is the same, but semantically it's very different.<p>It's not, actually. In most functional languages  including F",
38,4125562,comment,4125471.0,4125471.0,1,0,piyush_ranjan,,,Interesting!,1340008475.0
39,4125561,comment,4125198.0,4125198.0,5,0,pgsandstrom,,,"Are people joking when they defend anecdotal stories with ""once this anecdotal story proved to be true and the study was faulty""?<p>The proposition that the article makes is not that anecdotal stories must be false, but that they might influence the reader more than they should. Thus they should not be encouraged.",1340008474.0
40,4125560,story,,,1,0,allcheckseo,Wave City Centre,http://www.allcheckdeals.com/project-wave-city-centre-noida.php,Wave Infratech is coming up with his new residential project Wave City Center located at Sector 32 Noida.,1340008467.0
41,4125559,story,,,1,0,call2hireindore,"Computer On Hire In Indore, Computer On Rent In Indore",http://www.call2hire.co.in/computer on rent/indore,"Computer On Hire In Indore, Computer On Rent In Indore , Computer Rental In Indore , Computer In Indore , Computer Suppliers In Indore, Computer Suppliers in Indore , Computer Suppliers Indore ,Computer Dealers In Indore",1340008463.0
42,4125558,comment,4125530.0,4125533.0,6,0,densh,,,"Nothing has been said about packaging for Android or iOS. From the info that's actually in the article -- currently it targets desktop applications.<p>From my point of view, iOS is extremely improbable target unless Apple changes their application requirements. Currently they do not allow use of any 3rd party JIT on iOS and Java is all about JIT.<p>Moreover JavaFX doesn't even run on Android or iOS at the moment (even without this new kind of packaging).",1340008459.0
43,4125557,story,,,1,0,webstralia,Sharepoint development Australia | sharepoint development melbourne,http://ezinearticles.com/?Advantages-on-SharePoint-Development&id=7103537,To know the Advantages on SharePoint Development - read this article\nhttp://ezinearticles.com/?Advantages-on-SharePoint-Development&id=7103537,1340008454.0
44,4125556,comment,4122783.0,4122783.0,1,0,edwinyzh,,,No! No national internets! I've already paying an extra $10/month just to read blog posts (mainly IT-related) those are blocked by that e<i></i>l gov (Great Firewall).,1340008402.0
45,4125555,story,,,24,44,basil,Retina MacBook Pro Review: The Age of the High-Resolution PC,http://stevestreza.com/2012/06/17/retina-macbook-pro/,,1340008390.0
46,4125554,story,,,1,0,sophiawestcott,Bad Credit Auto Loans,http://www.getaautoloan.com/bad_credit_auto_loans.html,If you are looking online auto car loan finance for bad credit and poor credit situation then visit our website and get auto loan with bad credit or poor credit.,1340008326.0
47,4125553,comment,4124191.0,4124191.0,2,0,benjaminlotan,,,after reading a nice post. i want some nice simple way to tell you i enjoyed reading and appreciate it... i'm down with kudos.,1340008308.0
48,4125552,story,,,2,0,nikunjk,"A month later, fallout from Facebook IPO persists",http://www.usatoday.com/tech/news/story/2012-06-16/facebook-ipo-chill/55654700/1?csp=34money&utm_source=dlvr.it&utm_medium=twitter&dlvrit=110940,,1340008305.0
49,4125551,comment,4125530.0,4125533.0,3,0,vetler,,,"What's the connection to Android and iOS here, isn't it just packaging?",1340008299.0
50,4125550,story,,,1,0,sneakerfire,Louis Vuitton Online Store Offer Cheap Louis Vuitton Bags,http://www.louisvuittondiscount360.com/,,1340008293.0
51,4125549,comment,4125247.0,4125333.0,29,0,saurik,,,"This, for the record, is an interesting example of the kind of ""misaligned incentives"" that happen when users demand to receive unlimited value for a fixed payment: by correcting that pricing mistake, we now have regained a political ally.",1340008280.0
52,4125548,story,,,1,0,pietrofmaggi,Apple Games Disassembly Project - Ultima 1,https://groups.google.com/forum/?fromgroups,,
53,4125547,comment,4122924.0,4122924.0,1,0,andreif,,,"Earlier discussion: <a href=""http://news.ycombinator.com/item?id=3896441"" rel=""nofollow"">http://news.ycombinator.com/item?id=3896441</a>",1340008258.0
54,4125546,comment,4125530.0,4125530.0,12,0,sgt,,,"Finally - why did this come now, and not 4-5 years ago? I apologize for asking such a question, but it's the first thing that comes to mind. Principally I do like JavaFX, and this approach will work - given that these binary bundles don't end up like 80MB monsters.",1340008188.0
55,4125545,story,,,2,1,vivekaggarwal,The Secret of a Successful Programming Language? A Really Great Beard,http://www.wired.com/wiredenterprise/2012/06/beard-gallery/?viewall=true,,1340008178.0
56,4125544,comment,4122321.0,4123553.0,1,0,daurnimator,,,Because startups don't have the ability to train.<p>There's little use in hiring someone that doesn't have the skill you need: all you could hope to do is pay them to sit there for a couple of months reading and practising before you can set them onto your actual product.,1340008127.0
57,4125542,comment,4123707.0,4125302.0,4,0,kaybe,,,"This frequency is protected because there is a gap in the absorption spectrum of our atmosphere. This is not the same for every atmosphere, so other planets will have different gaps (unless the composition of gases is similar enough), and thus it won't make too much sense right now to single out this frequency for other civilisations. AFAIK we don't broadcast, because it would interfere with astronomic measurements.",1340008116.0
58,4125541,story,,,1,0,pckeyboard,Laptop Keyboard,http://www.keyboardshop.in/keyboard-india-b.php/157+laptop-keyboard,,1340008115.0
59,4125540,story,,,1,0,itvindianews10,"Star Infranet, Using Video To Recover From A Google Algorithm Update ",http://www.expressleak.com/star-infranet/star-infranet-using-video-to-recover-from-a-google-algorithm-update/,"Dr. Melody King, VP of marketing at Treepodia, recently wrote an article called Pushing Back on Google Penguin: How to Improve SEO with Video Links.",1340008101.0
60,4125539,story,,,1,0,Aujose,Transportation Department Takes Aim at Distracted Driving,http://www.ezdrivingtest.com/blog/2012/06/18/transportation-department-takes-aim-at-distracted-driving-18june2012/,"The Department of Transportation will spend another $2.4 million to combat cell phone use while driving, Transportation secretary Ray LaHood announced today. The department also issued a detailed plan pressing for states to pass laws and the auto industry to adopt technology to reduce distracted driving nationwide. The Blueprint for Ending Distracting Driving and the departments Phone in One Hand, Ticket in the Other enforcement program are the latest actions aimed at what LaHood called an epidemic of distracted driving, which is responsible for 3,000 deaths annuallywith teens and young drivers being at particularly high risk. The $2.4 million layout will expand the pilot program Phone in One Hand, Ticket in the Other to California and Delaware in the fall. The program will examine whether increased police enforcement coupled with paid media and news media coverage can significantly reduce distracted continue",1340007978.0
61,4125538,comment,4125424.0,4125424.0,3,0,robfitz,,,Index is one of the very top firms globally & it's super exciting that more founders here (in Europe) will have access to Index-level support at the earliest stages. Congrats to all involved!,1340007970.0
62,4125537,comment,4122794.0,4122794.0,2,0,hackrocket,,,"Can anybody recommend a good US CPA and an accountant with experience in working with tech startups?<p>If you are looking for a lawyer I received good recommendations for:<p>- Ryan Roberts @ <a href=""http://startuplawyer.com/contact"" rel=""nofollow"">http://startuplawyer.com/contact</a><p>- Scott Edward Walker @ <a href=""http://walkercorporatelaw.com/"" rel=""nofollow"">http://walkercorporatelaw.com/</a><p>- Grellas Shah LLP @ <a href=""http://www.grellas.com/"" rel=""nofollow"">http://www.grellas.com/</a>",1340007894.0
63,4125536,comment,4123445.0,4125427.0,3,0,unimpressive,,,"I would wager a combination of bad curriculum, theory over actual programming, and people who followed the sunk costs fallacy to a career they didn't want.",1340007827.0
64,4125535,comment,4124275.0,4124275.0,3,0,tintin,,,"Art is expression and communication. Some get touched by the message, some don't. If some people like to pay big bucks for art, just let them.<p>Some might say Tracey Emin is a bad artist. But I think here message is very clear: pain from being raped and losing 2 kids. It's a sad message.<p>Like Hugh MacLeod (gapingvoid) I like to say: ""Worrying about Commercial vs. Artistic is a complete waste of time."".",1340007765.0
65,4125534,comment,4124382.0,4124674.0,1,0,mythz,,,"Same, it's a magnitude times more productive than hunting down program's through nested menus with your mouse.",1340007639.0
66,4125533,comment,4125530.0,4125530.0,-1,0,Mitt,,,"The posting is about JavaFX, but in reality it will be a general mechanism for JVM apps. Oracle is doing this preparation, so that your JVM apps (Java, Clojure, Scala, etc.) can run under Android and iOS.",1340007559.0
67,4125532,story,,,1,0,draegtun,The Power of Networks (animated presentation of talk by Manuel Lima),http://www.thersa.org/events/video/animate/rsa-animate-the-power-of-networks,,1340007549.0
68,4125531,comment,4124382.0,4125451.0,1,0,stdgy,,,"I'm troubled by the invisible UI stuff, including the hot corners. And I'm worried because knowledge of these features is required to operate the system at a basic level. That's kind of frightening. Not insurmountable, but frightening.<p>I think OSX's interface elements are more approachable than these hidden elements, given his(and most people's) prior experience. If you've used Windows, you're not going to be a stranger to drop down menus or desktop like icons (a la the dock).<p>And I agree that the invisible user interface elements will be a nightmare for IT people around the world. But to be frank, I don't want to restrict change to things that make IT folks happy ;) (Of course, I'm not a company worth a few hundred billion dollars whose livelihood depends on enterprise acceptance...)<p>I'm interested in seeing how long it will take for these 'new' UI concepts, where screen edges and corners are elements to be touched and modified, to sink into the general consciousness. It seems to have sunk into the OSX world rather quickly. Now it's time to see how the other 90% cope with it.",1340007507.0
69,4125530,story,,,111,80,Mitt,Java is preparing to co-bundling and native binaries,https://blogs.oracle.com/talkingjavadeployment/entry/native_packaging_for_javafx,,1340007495.0
