,ID,Type,Story,Parent,Points,Comments,Author,Title,URL,Content,Created
70,4125529,story,,,1,0,beerglass,What if Beethoven gave your commencement speech?,http://bigthink.com/experts-corner/what-if-beethoven-gave-your-commencement-speech,Full story here - http://bigthink.com/experts-corner/what-if-beethoven-gave-your-commencement-speech?page=all,1340007452.0
71,4125528,comment,4125198.0,4125474.0,7,0,flyinRyan,,,">even prevailing wisdom.<p>Especially prevailing wisdom, since it is least likely to be questioned normally.",1340007421.0
72,4125527,comment,4124246.0,4124628.0,1,0,jodosha,,,"I know, that's a pain. Unfortunately, Redis (Store) doesn't provide a solution for that.",1340007398.0
73,4125526,comment,4124275.0,4124275.0,1,0,cdooh,,,If creativity were anything but random someone would have figured out the algorithm by now - Dilbert,1340007384.0
74,4125525,comment,4125210.0,4125492.0,21,0,tiles,,,"Calling it ""Tron"" saves a byte ;)",1340007358.0
75,4125524,comment,4123707.0,4124627.0,1,0,evride,,,Like in Howard the Duck?,1340007345.0
76,4125523,comment,4123923.0,4123923.0,2,0,ajays,,,"An article that provides more background on the whole Indian drug patent stuff: <a href=""http://www.medicusmundi.ch/mms/services/bulletin/bulletin200201/kap02/13gerster.html"" rel=""nofollow"">http://www.medicusmundi.ch/mms/services/bulletin/bulletin200...</a>\nIt's about 10 years old, but still has good information for those interested.",1340007309.0
77,4125522,story,,,3,0,ryannielsen,Intel Reveals Neuromorphic Chip Design,http://www.technologyreview.com/view/428235/intel-reveals-neuromorphic-chip-design/?ref=rss,,1340007283.0
78,4125521,story,,,2,0,MarinaSprava,Death by boilerplate: Iterating over lines in a file in Java,http://blog.jelastic.com/2012/06/18/death-by-boilerplate-iterating-over-lines-in-a-file-in-java-vs-scala-ruby-groovy/,,1340007261.0
79,4125520,story,,,1,0,umacsoft,How to Recover Photos for T-Mobile myTouch,http://www.umacsoft.com/mac-data-recovery/ipod-music-recovery.html,,1340007220.0
80,4125518,comment,4123923.0,4124279.0,11,0,ajays,,,"On the other hand: the rest of the world has benefited a lot from the Indian pharma industry's growth. The same companies that you're criticizing are actually subcontracted by Bayer, etc. to produce their products so they can be sold in the developing world. If Indian did not produce these medicines, they would not be available to the poor at all. So at least they're saving lives that the developed world wasn't interested in saving.<p>Secondly: historically, Indian pharma growth was stunted due to old British laws. Once the industry was unshackled, it grew at a breathtaking rate, mostly by building generic variants of well-known drugs. This has allowed the Indian pharma industry to develop enough local expertise about formulation, manufacturing and distribution. Now they're moving up the food chain by patenting new drugs. Ranbaxy Labs, for example, is busy filing patents[1].<p>You can't expect the domestic industry to just sprout up organically. The Indian government never spent much money on R&D, so there wasn't much local drug research. But now that they're under the same patent regime, the Indian industries will have to figure out a way to survive.<p>Having said all this: please don't assume that Western drug companies' hands are clean. They are busy trawling the jungles of Amazon (among other places) to find new compounds, often taking knowledge from local shamans, etc. without any respect for their ""IP"".<p>[1] <a href=""http://www.financialexpress.com/news/ranbaxy-tops-third-world-patents-list/122766/"" rel=""nofollow"">http://www.financialexpress.com/news/ranbaxy-tops-third-worl...</a>",1340007134.0
81,4125517,comment,4124382.0,4125131.0,4,0,LinXitoW,,,"One thing that is pretty useful is the multi-monitor support. You get a taskbar for every monitor. Apart from that, though, Windows 8 has added absolutely nothing to my experience.",1340007102.0
82,4125516,story,,,2,0,dyc,"Congressman Tim Ryan (D) advocates mindfulness, kindness and compassion",http://www.youtube.com/watch?v=q6xSLBfFios,,1340007098.0
83,4125514,comment,4114301.0,4114517.0,1,0,mark_integerdsv,,,"Disagree.<p>The secret to a happy marriage is a dishwasher, two if you have room and means.",1340007014.0
84,4125513,comment,4122924.0,4125328.0,2,0,revenz,,,This is a wrapper around PYQT which is a wrapper around webkit in QT. So if those things are supported in QT and PYQT there is hope.,1340007008.0
85,4125512,comment,4124397.0,4125152.0,3,0,stickfigure,,,I had to upvote you just because I'm still pissed at 365 Main dropping power to our entire cage five years ago.,1340007000.0
86,4125511,comment,4124275.0,4125455.0,9,0,its_so_on,,,"I don't know man, I probably wouldn't even want <i>forks</i> (picking something of ""obvious"" utility) in my house if I were the ONLY one in the world who knew about them.  What would guests think?  That I'm some kind of weird food-impaler, maybe a closet Sadist.  If people didn't use forks, choosing to have forks wouldn't be a foregone conclusion at all.  Even all by myself.<p>You entirely undervalue the social context of objects, including objets d'art.",1340006989.0
87,4125510,comment,4124382.0,4124563.0,1,0,DeepDuh,,,"While I agree with you that MS Office has -in general- the most features of any common WYSIWYG document suite (note: that's just how I categorize this kind of software), Word isn't really the best example for it. Pretty much any feature in Word can be matched with LibreOffice and most can be matched with iWorks Pages (while the later is worlds simpler to use). What distinguishes MS Office the most IMO are:<p>1) smart art in PowerPoint<p>2) most of the data analysis and pivot table tools in Excel<p>3) powerful and mature, albeit cumbersome scripting support (VBA)<p>These features are important for a multitude of reasons, but for those who only need a good word editor, MS Office is certainly not a necessity anymore.",1340006964.0
88,4125509,story,,,1,0,iProject,"Renren Chief: Facebook Poke Doesn't Work in China, Prefer to Steal Veg",http://thenextweb.com/asia/2012/06/18/renren-ceo-facebook-poke-doesnt-work-in-china-but-mobile-and-pinterest-type-services-are-key-focus/,,1340006963.0
89,4125508,comment,4124382.0,4125466.0,-2,0,karlshea,,,They do when that sweet financial aid check comes around.,1340006927.0
90,4125507,comment,4124397.0,4124814.0,1,0,TazeTSchnitzel,,,"Yup, similar file association nonsense can happen on Windows too (and it is a right PITA to fix)",1340006863.0
91,4125506,comment,4125505.0,4125505.0,1,0,maruz,,,We base our decisions on assumptions about cause-effect relationships between things. This can harm you in high uncertainty and complex environment like startups.\nCausality is a mind process that is severely flawed. This post explains why and suggests some countermeasures.,1340006841.0
92,4125505,story,,,1,1,maruz,Do you trust causality too much?,http://mariocaropreso.com/post/25351865939/dont-trust-cause-effect-relationships,,1340006831.0
93,4125504,story,,,2,0,iProject,"Google: Government Takedown Requests up 103% in US, 49% in India",http://thenextweb.com/google/2012/06/18/google-government-takedown-requests-up-103-in-us-49-in-india-4-new-countries-on-transparency-report/,,1340006815.0
94,4125503,comment,4122794.0,4122914.0,1,0,maruz,,,Do you know how I can pay myself a salary from my US incorporated C-Corporation if I am in EU?,1340006799.0
95,4125502,comment,4121698.0,4124110.0,2,0,Orva,,,"No sane open source driver developer would agree to NDA in order to write driver. You wouldn't be able to contribute any other driver project (in that specialty area, which might be vast) until your NDA ends.<p>And of course, device driver would tell people all the secrets that NDA forbids you to disclose.",1340006798.0
96,4125501,story,,,1,0,puyherbal,Obat Herbal Penyakit Batu Ginjal,http://xamthon.net/obat-herbal/obat-herbal-penyakit-batu-ginjal/,Tahukah anda apa obat herbal penyakit batu ginjal yang sangat tepat dan terbebas dari bahan kimia? Jelly gamat luxor adalah jawabannya. Perlu anda ketahui bahwa jelly gamat luxor dudah teruji secara klinis dapat dijadikan sebagai obat herbal penyakit batu ginjal dan ampuh untuk mengobati penyakit batu ginjal.,1340006768.0
97,4125500,story,,,2,0,iProject,Innovators changing the game for Internet infrastructure,http://gigaom.com/cloud/10-innovators-changing-the-game-for-internet-infrastructure/,,1340006730.0
98,4125499,story,,,1,0,heigy,Obey T-Shirts  Obey Sale  Obey Icon Face Christmas Tee Shirts Black for Men ,http://www.supremecampcap.com/obey-icon-face-christmas-tee-shirts-black-for-men,,1340006720.0
99,4125498,comment,4124382.0,4125215.0,2,0,seabee,,,"Not sure whether you're removing drivers or ejecting hardware, but Device Manager is still in the control panel and Eject Hardware is where it always was. I wasn't aware of any other way you could do it, past or present.",1340006644.0
100,4125497,story,,,1,0,iProject,Assimilate UK The British Music Industry Now Controls Your Internet,http://techcrunch.com/2012/06/18/assimilate-uk-the-british-music-industry-now-controls-your-internet/,,1340006628.0
101,4125496,story,,,1,0,touristmayday,Algarvissimo scooter rental Aljezur,http://www.algarvissimo.com/scooter-aljezur/,,1340006621.0
102,4125495,comment,4122937.0,4124457.0,1,0,Auguste,,,"Not sure if money's an option for you, but I don't think you'll find anything with 5-6 drives at this price. At AUD $280, it's cheaper than a lot of 2-drive NAS' out there.",1340006611.0
103,4125494,comment,4124320.0,4124320.0,1,0,Vlaix,,,"I doubt being well versed in philosophy is relevant to most scientists nowadays, at least from a practical standpoint.\nAs I heard Michel Serres put it a couple years ago :  Today's society produces ignorant technicians and cultivated [put any word describing someone that can't count up to two]  (roughly translated from the original French). And they do fine by it, apparently.\nBut it is damageable to ignore some fundamentals, from Pythagoras to Descartes (regarding science).<p>As I think about it, it comes to me that whether philosophy is or isn't necessary isn't relevant.\nEmpirical necessity doesn't sums up human aspirations, and music or poetry play in the same field.\nPhilosophy is a way or structuring certain angles of thinking, and that's pretty cool.\nAs a developer I have absolutely no use of Heidegger or saint Thomas in my activity, but I'm glad they exist.",1340006574.0
104,4125493,comment,4123707.0,4124383.0,1,0,johnconroy,,,"nah, pretty sure it's aliens",1340006569.0
105,4125492,comment,4125210.0,4125210.0,9,0,groaner,,,"Is this supposed to be Tron or Snake?  I distinctly remember Tron being a multiplayer game, with the mechanics such that moving along a wall or trail increases your speed, putting you in position to cut off the other players and make them crash.",1340006547.0
106,4125491,comment,4124275.0,4124906.0,2,0,jarin,,,"I'm not sure that art has to create beauty. I can understand why a statue of Jesus submerged in piss is art (it makes a statement and is intended to shock and disgust), but flowerpots on pedestals doesn't evoke any emotion aside from disdain for people who consider it art.",1340006497.0
107,4125490,story,,,1,0,945801152,"Lida DaiDaihua Capsule (old package, original, effective )",http://www.lida-daidaihua-slimming.net/lida-daidaihua-slimming-diet-capsule2918.html,"Lida DaiDaihua Capsule (old package, original, effective )With modern technology, it is made of the extracts from the plants growing in Yunnan, the kingdom of green vegetation,",1340006427.0
108,4125489,comment,4124382.0,4124523.0,2,0,azernik,,,"I don't know about Windows 8, but Unity's applications are well-tagged with appropriate search terms. For example, typing either ""monitor"" or ""display"" brings the Display shortcut (which includes screen resolution settings) to the top, while typing either ""background"" or ""desktop"" will bring the ""Appearance"" shortcut (which lets you change desktop background) to the top.",1340006417.0
