,ID,Type,Story,Parent,Points,Comments,Author,Title,URL,Content,Created
0,10944125,comment,10943582.0,10944092.0,0,0,mschuster91,,,Because HN is full of urban hipsters whose viewport is limited to their city.,1453366737.0
1,10944124,story,,,1,0,edwinjm,"Ninth Planet May Exist Beyond Pluto, Scientists Report",http://www.nytimes.com/2016/01/21/science/space/ninth-planet-solar-system-beyond-pluto.html,,1453366694.0
2,10944123,comment,10934052.0,10942133.0,0,0,rahimnathwani,,,The FDCPA doesn&,
3,10944122,comment,10942196.0,10943881.0,0,0,tajen,,,And that&,
4,10944121,comment,10937633.0,10940722.0,0,0,lucaspiller,,,> most UK banks won&,
5,10944120,comment,10930072.0,10944062.0,0,0,Freak_NL,,,"Most vendors on AliExpress only sell such low-cost items in lots, so you could, for example, only buy these buttons by the dozen. Although that still means you end up with a margin that is <i>ridiculously</i> instead of <i>ludicrously</i> small.",1453366630.0
6,10944119,comment,10938640.0,10940276.0,0,0,DrScump,,,<p><pre><code>  ...the ATF comes knocking at the buyer&,
7,10944118,story,,,1,0,cspence,Pomello (YC W15) Is Hiring a Front-End Developer – Build Better Company Cultures,,"WHAT IS POMELLO \nWe are passionate about helping companies build a better employee experience. To us, this means understanding and driving authentic company cultures from the ground up to build a great workplace that results in a high performing team. We  combine research-backed methodology to capture data about employee values and motivators. We then use this data to create analytics that empower managers and employees to perform better. Pomello is YC-backed and seed-funded.<p>WHY POMELLO \nYou want to work on a big problem. You are an enthusiastic self starter and want to grow your career and skill-set. You are customer focused and want to see the impact of your work. You want to work on a small team with big ambitions, and have fun while getting good work done.<p>THE ROLE \nFrontend Developer and UX/UI Designer--We are looking for a frontend developer with a knack for simple design. You will be responsible for the look and feel of the entire product. We are looking for someone who can balance speed and risk in \nthe development process. Most importantly, you should be able to adapt to changing priorities, and enjoy high levels of autonomy and accountability.<p>HERE ARE A FEW OF THE THINGS YOU WILL WORK ON \nData Visualization--Make predictive analytics easily understandable and actionable.\nDesign of enterprise analytics dashboard and interactions (think mixpanel)\nMobile app product extension<p>REQUIRED SKILLS: \nFront-end development experience \nStrong knowledge of HTML/CSS/Javascript/JQuery<p>BONUS SKILLS: \nDesign/UI/UX work \nExperience with a modern front-end javascript framework, such as AngularJS \nExperience with Node.js \nExperience with responsive web development / optimizing for both desktop and mobile users",1453366617.0
8,10944117,comment,10930072.0,10944062.0,0,0,cconcepts,,,"So that people who need a 3-cent button use the service, are impressed by it and become higher margin customers later on.",1453366615.0
9,10944116,comment,10939786.0,10939786.0,0,0,hungls,,,"Good framework, and easy to use. I think this is a good choice to build a small website",1453366549.0
10,10944115,story,,,1,0,pravj,An appeal to end the suffering in Syria: UNICEF,https://medium.com/@UNICEF/an-appeal-to-end-the-suffering-in-syria-44d803e494b,,1453366472.0
11,10944114,comment,10943821.0,10944102.0,0,0,ori_b,,,"Yes, I&",
12,10944113,comment,10936793.0,10943339.0,0,0,Arnt,,,"No single passive adversary gets all three. The information moves from the phones to *.whispersystems.org, then in a big fat stream to Google, then from Google to the recipient phones.",1453366406.0
13,10944112,comment,10943582.0,10944007.0,0,0,afarrell,,,Comprehensive sex education and access to contraception generally decreases rates of teen pregnancy. People still object to those two things in the name of avoiding teen pregnancy.,1453366393.0
14,10944111,comment,10930072.0,10943320.0,0,0,smarx007,,,"This is the reason why I love HN - again, a comment that shines more light on a question than the original post itself.",1453366350.0
15,10944109,comment,10942196.0,10943890.0,0,0,ghayes,,,The latter might take awhile. See Florida v Harris (2013) [0]<p>> Harris ... challenge[d] the dog&,
16,10944106,comment,10943582.0,10943814.0,0,0,rahimnathwani,,,"&quot;Sometimes the parked cars are a nice buffer between the street and pedestrians.&quot;<p>Sure, but the current design of the sidewalk has to accommodate a car door opening at any point, as someone could park anywhere.  When roads are no longer used for parking, sidewalks could be lined with a narrow strip of trees or something, with a gap every 100m for cars to load/unload passengers.",1453366226.0
17,10944105,comment,10941940.0,10942542.0,0,0,toxicFork,,,"I have restarted using Twitter recently; after not using it for years.<p>The content you see depends entirely on who you choose to follow. I only follow the people who regularly publish awesome content, initiate discussions, and have a positive outlook on things. Also some credible news sources, and add a few personal idols like Elon Musk.<p>I did see some people become toxic, start bullying and so on, I unfollow them, or make another decision, depending on the circumstances.<p>It feels like you make your own community on Twitter. You need to moderate it too.",1453366200.0
18,10944104,comment,10937704.0,10942483.0,0,0,bainsfather,,,"Ah, that was way too subtle for me - the number of hn posters who argue weird (imo) positions means that I need a  sarcasm tag to know someone&",
19,10944103,comment,10939306.0,10942947.0,0,0,rplnt,,,"> Planet X is at aphelion, difficult to find with the Milky Way as a (stunning) backdrop.<p>I would have assumed that planets are easier to detect when they have a backdrop? That the light can be blocked, partially blocked, bent, .. Isn&",
20,10944102,comment,10943821.0,10944090.0,0,0,ndesaulniers,,,> The test for spawning threads is fine when I run it under &,
21,10944101,comment,10936332.0,10941742.0,0,0,ck2,,,The man enjoys making things die by his own hands.<p>He eagerly looks forward to being able to do it again.<p>He doesn&,
22,10944100,story,,,2,0,adventured,China Mulls Answer to Bitcoin with Digital Currency Study,http://www.bloomberg.com/news/articles/2016-01-21/chinese-central-bank-studies-prospect-of-own-digital-currency,,1453366081.0
23,10944099,comment,10942314.0,10942314.0,0,0,polemic,,,Minor point: &quot;open source&quot; is not open source because you have the source. It&,
24,10944098,comment,10943582.0,10943924.0,0,0,danielrhodes,,,"No, in fact neighborhood groups generally get upset if new housing goes up without parking as it is believed the new residents will put additional pressure on public parking spots.",1453365990.0
25,10944097,comment,10884893.0,10886073.0,0,0,givehimagun,,,I haven&,
26,10944096,comment,10943582.0,10943931.0,0,0,lis,,,"Random data point: There were 342 cars registered per 1000 citizens in Berlin in 2014 [0]. Same in other (large) cities I have lived in in Europe.<p>Typically, using the public transport in Berlin will be much quicker than taking the car.<p>[0] Sorry, article in German (and BZ..): <a href=""http://www.bz-berlin.de/berlin/immer-mehr-autobesitzer-aber-weniger-fahrer"" rel=""nofollow"">http://www.bz-berlin.de/berlin/immer-mehr-autobesitzer-aber-...</a>",1453365985.0
27,10944095,comment,10942479.0,10942479.0,0,0,gshrikant,,,This is surprising news to me. An analog with the microprocessor market would be Intel buying AMD!<p>I love Microchip&,
28,10944094,comment,10884893.0,10885684.0,0,0,givehimagun,,,I went as far as pulling the node_modules directory from production and perfectly matching the node version on my local machine.  Linux -> linux and the app won&,
29,10944093,comment,10942752.0,10943230.0,0,0,xuhu,,,I have no idea what you mean. Doctors have been recommending flossing one&,
30,10944092,comment,10943582.0,10943862.0,0,0,nitrogen,,,Meta: What&,
31,10944091,comment,10941940.0,10943676.0,0,0,seszett,,,"> <i>Well, Twitter is alerting about &",
32,10944090,comment,10943821.0,10944084.0,0,0,ori_b,,,There&,
33,10944089,comment,10942505.0,10943170.0,0,0,kozukumi,,,"Agreed, I don&",
34,10944088,comment,10943821.0,10944084.0,0,0,umanwizard,,,"Ah, no. OSX is the worst-documented system I&",
35,10944087,comment,10929970.0,10940480.0,0,0,x1024,,,"Every page weighs 4+MB, because the page-specific content on the page weighs more than 4MB. There&",
36,10944086,story,,,2,0,elvidence,Responding to eDiscovery Requests,https://www.elvidence.com.au/responding-to-ediscovery-requests/,,1453365718.0
37,10944085,comment,10942671.0,10943076.0,0,0,huula,,,Completely agree! Hope Meteor community would seriously consider this.,1453365665.0
38,10944084,comment,10943821.0,10944077.0,0,0,ndesaulniers,,,What I&,
39,10944083,comment,10943582.0,10943758.0,0,0,natrius,,,Ride-hailing apps will eventually take on urban storage as well. Want to avoid carrying something around? Press a button in an app. Want to use the thing you left? Press a button in an app. Want your stuff to head home with you? Press a button in an app.,1453365590.0
40,10944082,comment,10942196.0,10943577.0,0,0,cmurf,,,"Shitty little podunk towns, man. Just like the article.<p>Few decades ago, shortly after moving from Kansas, I drove home for Thanksgiving. I saw a speedtrap many miles in advance, passed it, and miles later I see, in the rearview mirror, a cop cross the median and he bridged the gap with ungodly speed. At no time was he going my speed. He pulls me over, claims I was going 15 over using the pace method. He comes back with a ticket, but it has radar checked. I pointed out this discrepancy and said I won&",
41,10944081,comment,10943582.0,10944020.0,0,0,nitrogen,,,Restaurants don&,
42,10944080,comment,10938593.0,10942711.0,0,0,Animats,,,"Yes, except that Yahoo is a monetized zombie search engine. They resell Bing, with their own ads.",1453365486.0
43,10944079,comment,10940845.0,10941243.0,0,0,vbezhenar,,,Redux has good tools. You can restore your state after hot-reloading your changed JavaScript code. You can do time-traveling to restore your app state in any point of time (using new code) but old state. IMO that&,
44,10944078,comment,10942294.0,10943239.0,0,0,tokenizerrr,,,> this was primarily Notebook and Server focused<p>Do you perhaps mean something else here? Notebook and Desktop focused maybe?,1453365463.0
45,10944077,comment,10943821.0,10943821.0,0,0,ori_b,,,"> <i>Anyways, I’ve been learning some interesting things about OSX that I’ll be sharing soon.</i><p>Nice, that should be amusing to read. OSX is a very strange system -- it has two system call APIs (BSD, and Mach), which respectively have some very odd holes. Some of the OSX syscalls return values split between 32 bit registers instead of in a single 64 bit register, while others don&",
46,10944076,comment,10942671.0,10942965.0,0,0,huula,,,"+1. Meteor should try to optimize their build time (for example, when I just changed one JS file, there&",
47,10944075,comment,10930072.0,10942544.0,0,0,Animats,,,"The Universal Postal Union was classically focused on international letter mail, back when that mattered.  Until 1969, there were no terminal delivery charges, much like the early days of the Internet when there were no peering charges.  Each country had to deliver within its own country for free.  But because letter traffic tended to be roughly equal in both directions, this wasn&",
48,10944074,story,,,1,0,myautsai,Free Web Performance and DevOps Reports – O'Reilly Media,http://www.oreilly.com/webops-perf/free/,,1453365368.0
49,10944073,comment,10943582.0,10943949.0,0,0,vlehto,,,Helsinki: with bus and train 45min to work. It&,
50,10944072,comment,10937633.0,10942552.0,0,0,mikaelm,,,"Hey PeterisP,  what does the EU payment servies directive specify as max send time and for what cases, can you give more exact reference? Thanks.",1453365339.0
51,10944071,comment,10939681.0,10944064.0,0,0,theocean154,,,"more explanation is in the paper in the comments below, this is just a simple way of visualizing how it works",1453365284.0
52,10944070,story,,,11,4,wanda,“ I hate your single page app ”,https://medium.com/@stilkov/why-i-hate-your-single-page-app-f08bb4ff9134,,1453365189.0
53,10944069,story,,,3,0,tamersalama,Trends in Ruby - analyzing rubygem stats for 2015,https://infinum.co/the-capsized-eight/articles/analyzing-rubygems-stats-v2015,,1453365173.0
54,10944068,story,,,2,0,pilooch,Deep learning for Elasticsearch,https://www.elastic.co/blog/categorizing-images-with-deep-learning-into-elasticsearch,,1453365166.0
55,10944067,comment,10943582.0,10943984.0,0,0,Symbiote,,,The weather isn&,
56,10944066,comment,10903892.0,10910696.0,0,0,duncan_bayne,,,"Thanks for the discussion. I can only assume the downvotes were from people who disagreed with my argument, and chose to express their disagreement that way. I&",
57,10944064,comment,10939681.0,10939681.0,0,0,theocean154,,,"rearranged my repo, here is the scalable, pipelined way of doing this, it ends up being an insertion sort with the benefit of small fanout (for lower energy), better scalability (faster due to lower fanout and shorter critical path with pipelining), and maintains O(1) throughput (no fill/drain cycle).<p><a href=""https://github.com/theocean154/dau/blob/master/docs/part_sort_block_diagram.pdf"" rel=""nofollow"">https://github.com/theocean154/dau/blob/master/docs/part_sor...</a>",1453365023.0
58,10944063,comment,10936565.0,10939982.0,0,0,ygra,,,"The limit is usually address space fragmentation and at one point not being able to find a piece of memory large enough for an allocation. Depending on the allocation patterns this may happen around 3 GiB but for some applications even around 1.7 GiB already. VS gets unbearably slow around 2 GiB memory, though, most likely because the native allocator has to piece together all free pieces of memory again and in the managed part the GC probably has fun trying to compact memory.",1453365010.0
59,10944062,comment,10930072.0,10943682.0,0,0,tempestn,,,Then why would they sell the 3-cent buttons?,1453364968.0
60,10944061,comment,10942196.0,10943146.0,0,0,gspetr,,,An american friend of mine once told me that when his brother graduated from a police academy they told him: &quot;Now you&,
61,10944060,story,,,2,1,charlieflowers,Ask HN: How do you use Docker in production? (Update),,"This was asked almost a year ago (https://news.ycombinator.com/item?id=8470206), but a year is a long time in thsi space. Would love to get some updated answers.",1453364957.0
62,10944059,comment,10939681.0,10942070.0,0,0,theocean154,,,"The benefit of my way is that you get pipelining (which lets you maintain O(1) throughput without having a fill/flush cycle), as well as better scaling (due to said pipelining) and better energy usage due to smaller fanout.",1453364923.0
63,10944058,comment,10942752.0,10943858.0,0,0,nibnib,,,Most ear buds are larger and don&,
64,10944057,comment,10939681.0,10942045.0,0,0,Jaxan,,,"You can sort strings also in linear time with a trie (for example). This requires O(n) time, where n is the total length of the input (i.e. sum of lengths of strings).",1453364829.0
65,10944056,comment,10942752.0,10943216.0,0,0,iSnow,,,"Yes, I never used Q-tips all my life until I had to use earplugs to sleep in a rather noisy environment. Those caused itching and I used Q-tips to scratch the ear canal.<p>Since then, I must confess I am addicted. I tried to wean myself from Q-tips use, but I can&",
66,10944055,comment,10944008.0,10944008.0,0,0,arkadiyt,,,Downloading executables over http always leads to a good time.,1453364796.0
67,10944054,comment,10943968.0,10943968.0,0,0,heraclez,,,Where else are there iOS App Development Centers?,1453364793.0
68,10944053,comment,10942196.0,10943935.0,0,0,jacquesm,,,"Well, at least now you too have at least one good reason to run one.",1453364771.0
69,10944052,story,,,1,0,gpresot,Apple to Create First European iOS Development Center,http://www.theverge.com/2016/1/21/10805340/apple-ios-development-center-europe-italy,,1453364765.0
70,10944051,comment,10941310.0,10943628.0,0,0,dmichulke,,,"Yes, you get less people but the prices go up even more because &quot;restrict growth&quot; is the same as &quot;reduce future supply&quot;",1453364653.0
71,10944050,comment,10938813.0,10939078.0,0,0,on_and_off,,,"and in order to be vulnerable, you need to change the default keyring settings.  \nNexus devices for example are unaffected since they have the right configuration.  \nIt is unclear how many Android devices, if any, are affected.<p>Not to mention that a lot of computation is necessary in order to exploit this bug ...",1453364650.0
72,10944049,comment,10944031.0,10944031.0,0,0,MoD411,,,You should inspect your browser&,
73,10944048,story,,,2,0,AliCollins,Is Hyperloop the future of high-speed travel?,http://www.bbc.co.uk/news/technology-35361093,,1453364622.0
74,10944047,comment,10943781.0,10943781.0,0,0,japhyr,,,If you&,
75,10944046,comment,10923143.0,10928594.0,0,0,vincentbarr,,,If you&,
76,10944045,comment,10942314.0,10942314.0,0,0,onion2k,,,There&,
77,10944044,comment,10942505.0,10943255.0,0,0,IshKebab,,,Embedded chips (i.e. microcontrollers) won&,
78,10944043,story,,,3,0,vmorgulis,"Vera++: a Programmable Tool for Verification, Analysis and Transformation of C++",https://bitbucket.org/verateam/vera/wiki/Home,,1453364472.0
79,10944042,comment,10930072.0,10941211.0,0,0,itaysk,,,Same here in Israel.. Also a mystery for me,1453364462.0
80,10944041,comment,10943582.0,10943582.0,0,0,lucaspiller,,,"What about car sharing schemes such as Car2Go, Zipcar, etc, where you pay just for the amount of time you use the car? Unlike autonomous cars, these are available now and proven to be successful.<p>Here in Rome Car2Go have over 600 cars, so you are usually no more than 5 minutes walk from one. You can also leave it anywhere in the &",
81,10944040,comment,10942671.0,10944021.0,0,0,SignMeTheHELLUp,,,"> Large projects are never simple<p>I disagree. When designed correctly, large projects are simple to work on individual features and only complex when observed in aggregate as as complete system.<p>> Chasing a magic bullet can temporarily make it look like you&",
82,10944039,comment,10930300.0,10930300.0,0,0,herbst,,,Why Java and Ruby?,1453364284.0
83,10944038,comment,10939359.0,10939359.0,0,0,datashaman,,,"I cannot log in with slack, I confirm slack team, and authorize access, redirects to home and nothing. Try it again, exactly the same thing. Disabled adblocker, same thing.<p>Also, I was expecting to receive an email invite to your Slack team. That hasn&",
84,10944037,comment,10930124.0,10930124.0,0,0,AstralStorm,,,It is fine and dandy until you get to cooperate (e.g. share task lists) or especially use machines not configured by yourself. The productivity is a third or less then in my experience.<p>Then it&,
85,10944036,comment,10937277.0,10940956.0,0,0,foxylion,,,I use this every day and the performance is not that bad. You wouldn&,
86,10944035,comment,10942196.0,10943518.0,0,0,baddox,,,Even if it&,
87,10944034,comment,10936565.0,10937896.0,0,0,tajen,,,"I pay twice the price of the hardware to be able to use Mac OS X, which is stable. Except, since 10.10, it kernel-panics once a week. I&",
88,10944033,story,,,1,0,trengrj,Why Use Make (2013),http://bost.ocks.org/mike/make/,,1453364164.0
89,10944032,comment,10932378.0,10932378.0,0,0,herbst,,,"I hoped its real :/ Looks good, would love to run this as WM/DM on my linux.",1453364163.0
90,10944031,story,,,1,1,muhammadsackib,HTTP request via POSTMAN is not generating the same result as done by browser,,"https://dbill.ptcl.net.pk/PTCLSearchInvoice.aspx<p>The portal linked above belongs to an ISP local to me which is for viewing bills online. The ISP provide only web client to view the bill, I want to build other clients too, for this purpose I will have to wrap the functionality provided by the web portal above in an RESTful API.<p>To achieve this, first thing I am trying to do is to make a post request to the above URL using POSTMAN so that I may test things. But the problem is, I am not getting the desired result using POSTMAN. When I submit to the above url via browser, I come to view the bill; but via POSTMAN, I get the form back which I submitted. Can anybody help me with this please, you can use the following phone number details to view a demo bill<p>Phone no. 6201032<p>Account ID. 1556667104",1453364084.0
91,10944030,comment,10938593.0,10939757.0,0,0,imtringued,,,The problem with that approach is that you put everything behind a wall. Only the &quot;rich&quot; will have access to information. I wouldn&,
92,10944028,comment,10939576.0,10941195.0,0,0,IshKebab,,,"> But it might be too late to matter. Cortex-M0 eats the low end, M4 the mid end, and the phone SoCs the high end.<p>You know Atmel makes Cortex M chips too right? They&",
93,10944027,comment,10941530.0,10942998.0,0,0,sysk,,,Does that mean that Google will stop maintaining the project?,1453364053.0
94,10944026,comment,10940849.0,10942127.0,0,0,jholman,,,Wouldn&,
95,10944025,comment,10942671.0,10942671.0,0,0,dfischer,,,"I said more in the other thread, but I&",
96,10944024,comment,10935920.0,10942621.0,0,0,mickael,,,"You will know soon, as we are working on such a higher load benchmark. From existing production service thought we expect very good result, especially as the test server was not fully loaded.",1453363998.0
97,10944022,comment,10942752.0,10943458.0,0,0,adrianN,,,I&,
98,10944021,comment,10942671.0,10943988.0,0,0,pavlov,,,Large projects are never simple and fun. Blaming it on tools is too often just scapegoating.<p>Chasing a magic bullet can temporarily make it look like you&,
99,10944020,comment,10943582.0,10943758.0,0,0,learc83,,,Do you refuse to go to restaurants because you&,
100,10944019,comment,10930072.0,10942041.0,0,0,iSnow,,,Even the envelope and the time to pack the button would completely destroy any profit. Even in China.,1453363917.0
101,10944018,comment,10935920.0,10942076.0,0,0,mickael,,,"We manage to load the server properly with Tsung (<a href=""https://github.com/processone/tsung"" rel=""nofollow"">https://github.com/processone/tsung</a>) but for a more heavy load we may need to add one more Tsung server.",1453363903.0
102,10944017,comment,10942752.0,10943271.0,0,0,scottlocklin,,,"Should I blow my nose, or does the giant honking sharp boogers that form in there have some purpose which it would be unwise to meddle with?",1453363899.0
103,10944016,comment,10929015.0,10943830.0,0,0,sohkamyung,,,"You may also enjoy this: &quot;The Last Question&quot; converted into comic form [1]<p>[1] <a href=""https://imgur.com/gallery/9KWrH"" rel=""nofollow"">https://imgur.com/gallery/9KWrH</a>",1453363888.0
104,10944015,comment,10942196.0,10943487.0,0,0,duncan_bayne,,,Of course civics aren&,
105,10944014,comment,10942505.0,10944000.0,0,0,jrockway,,,"The post I replied to linked to this: <a href=""http://www.amazon.com/dp/B016EWKQAQ"" rel=""nofollow"">http://www.amazon.com/dp/B016EWKQAQ</a><p>You do not need your antennas to look like that, that&",
106,10944013,comment,10935920.0,10942508.0,0,0,mickael,,,"Actually, Elixir support comes from API changes to be more Elixir friendly (for example order of parameter to be &quot;pipe&quot; friendly). This is also about submitting the component on hex.pm package manager to be easily integrated in Elixir mix tool. And finally, this is about writing some part in Elixir. For some projects we are even starting writing code directly in Elixir.",1453363805.0
107,10944012,comment,10942671.0,10942891.0,0,0,SignMeTheHELLUp,,,React won. And that&,
108,10944011,comment,10937277.0,10943166.0,0,0,everythingcli,,,Do you have any material I can read up on to this?,1453363777.0
109,10944010,comment,10930072.0,10943155.0,0,0,bb8bb8,,,Dell&,
110,10944009,comment,10943131.0,10943131.0,0,0,Houshalter,,,That&,
111,10944008,story,,,4,3,somecoder,"Soundnode Desktop SoundCloud App Built with NW.js, Angular.js and Soundcloud API",http://www.soundnodeapp.com/,,1453363730.0
112,10944007,comment,10943582.0,10943924.0,0,0,tempestn,,,> object in the name of affordable housing to building new housing<p>Doesn&,
113,10944006,comment,10942671.0,10943629.0,0,0,SignMeTheHELLUp,,,Getting fired also &quot;syngerzies&quot; well with a pure javascript approach.,1453363696.0
114,10944005,comment,10942196.0,10943854.0,0,0,duncan_bayne,,,I&,
115,10944004,comment,10942671.0,10942671.0,0,0,pedalpete,,,"I just started with Meteor a few weeks ago, and thought it was absolutely amazing as a prototyping tool. I figured I&",
116,10944003,comment,10942506.0,10943243.0,0,0,scottlocklin,,,"While the article is interesting, the title of this article is kind of rubbish; there is vast evidence of pre-8000bc mesolithic warfare in Europe and North Africa.<p><a href=""https://en.wikipedia.org/wiki/Prehistoric_warfare"" rel=""nofollow"">https://en.wikipedia.org/wiki/Prehistoric_warfare</a>\n<a href=""https://en.wikipedia.org/wiki/Cemetery_117"" rel=""nofollow"">https://en.wikipedia.org/wiki/Cemetery_117</a>",1453363647.0
117,10944002,comment,10942196.0,10943765.0,0,0,duncan_bayne,,,Just like the Police here - sitting on their arses is what passes for working ;-),1453363594.0
118,10944001,comment,10942294.0,10943497.0,0,0,pjmlp,,,gcc was largely ignored until UNIX vendors started to sell the development tools instead of bundling them with the OS.<p>The majority of FOSS users are actually people that don&,
