,ID,Type,Story,Parent,Points,Comments,Author,Title,URL,Content,Created
124,6366196,comment,6364997.0,6365854.0,3,0,x0x0,,,nonono<p>the lawyers get $10k <i>for each of us</i><p>we get an expiring in one year coupon for a free ice cream cone with purchase of $20,1378890320.0
125,6366195,comment,6364141.0,6366012.0,2,0,indrax,,,I don&,
126,6366194,comment,6365329.0,6365329.0,1,0,nagarjun,,,"I think the iPhone 5S Fingerprint Reader is revolutionary because it is invisible: <a href=""http://t.co/AfQSFqAjBy"" rel=""nofollow"">http://t.co/AfQSFqAjBy</a>.",1378890272.0
127,6366193,story,,,1,0,mavtrevor,How to use Google Keyword Planner for Keyword Research,http://www.netmediablog.com/how-to-use-google-keyword-planner-for-keyword-research,,1378890166.0
128,6366192,comment,6365329.0,6365329.0,4,0,T-zex,,,Nokia designers should be proud of themselves for setting a colorful plastic case trend for the smart phone market and even influencing the iPhone.,1378890166.0
129,6366191,comment,6364481.0,6365856.0,3,0,crocowhile,,,What happens in the gmail web interface?,1378890145.0
130,6366190,comment,6365329.0,6365329.0,1,0,greyman,,,I am curious to see how those two will sell. I can&,
131,6366189,comment,6365329.0,6366115.0,2,0,ubernostrum,,,"If the expensive device is something people will buy and be carrying with them anyway for other purposes (phone calls, SMS, apps, etc.), then they have no motivation to additionally buy the cheap photo/video-only device and carry that with them.<p>It&",
132,6366188,comment,6361264.0,6365847.0,1,0,lutusp,,,That&,
133,6366187,comment,6365353.0,6365353.0,3,0,joseflavio,,,"In my opinion there are 2 main issues with Biometrics:\n- The first is that it may identify you with precision but it can not tell your will, so basically, you can force someone to use the sensor.\n- The second issue is that it does not allow you to give authorization to a third party in exceptional situations.",1378890033.0
134,6366186,comment,6361558.0,6362586.0,1,0,lewispollard,,,I didn&,
135,6366185,story,,,3,0,commanderj,Massive list of flat design resources,http://www.webdesignerdepot.com/2013/09/the-ultimate-guide-to-flat-design/,,1378890020.0
