,ID,Type,Story,Parent,Points,Comments,Author,Title,URL,Content,Created
53,550044,comment,549969.0,550018.0,0,0,ryanmnly,,,"So you are asking if there is a correlation between mental health and worries about bugs in your code? Given the fact that coding leads to watching the sun rise from your desk chair, the hope that this particular algorithm saves the world, and a disturbing reliance on Totino's pizza rolls as sustenance, I would say yes, the connection between mental health and code is not a coincidence.",1239066651.0
54,550043,comment,549492.0,549719.0,0,0,electromagnetic,,,"When I enter ""123 bank street"" it hits Ottawa, not New York. If I'm even remotely zoomed into my area, it suggests Bank Street in Toronto.",1239066571.0
55,550042,story,,,1,0,winanga,One in 10 Americans on food stamps,http://money.cnn.com/2009/04/02/news/economy/food_stamps.reut/index.htm,,1239066526.0
56,550041,comment,549780.0,549783.0,0,0,patio11,,,"It is impressively more readable than some legacy Perl code I've had the misfortune of working with.  That being said, just on a quick once-over for aesthetics I'm not left thinking ""Ahh, modern Perl sure looks less painful than modern Ruby or modern Python.""<p>I don't even write Python, but looking at it has never given me a seizure.  Not that your code is seizure-inducing, mind you.",1239066486.0
57,550038,comment,549847.0,549847.0,0,0,systemtrigger,,,"I like how it prompted me to add more items to the filter which updated the search results which seem to come from all over the culinary web. I can see how this is already a useful service. Forgive my ignorance, Are you the first mover in this space or are others already doing recipe search by ingredients? I was a little frustrated with the search result display: I had to scroll down a page or two of whitespace but I assume you'll work on that in good time. I'm also feeling unloved by the way each search result appears because the list of external links makes me feel like I'm on a parked site. My frustration was that for every recipe I still needed to visit the grocery store to get more ingredients - that said it may be because my cupboard is too bare. I wonder if for the paid service it might work a bit better if you approached the whole site from an ad-free perspective. What if the search results didn't drive away traffic to the source sites but revealed the full recipes on your site? Only your paying customers would get to see the entire recipe while freeloaders could see just the list of ingredients? Or you could give away some recipes in their entirety for free while making a percentage of the search results opaque to all but your customers. If you're wanting to flip this maybe you could sell or license to a foodie site. I don't know what restrictions the sites you're getting these recipes from place on their APIs (which is I assume how you're getting the data) but these are my initial thoughts based on a cursory visit. Good v1, I think you should keep working on it. And don't listen to me too much, you might well have an ad model that works.",1239066323.0
58,550037,comment,549923.0,550020.0,0,0,andrewljohnson,,,"Ok, thanks for the heads up. I was able to reproduce this bug in Safari 3.0.2, and I'll fix it.<p>I think the root of the problem is ReallySimpleHistory. I'm using RSH for hash links, and I think the library is busted in Safari 3.x and past :(",1239066313.0
59,550036,comment,549567.0,549886.0,0,0,rms,,,They don't always look at demos.<p>I'm guessing they watched every video though.,1239066286.0
60,550035,comment,549110.0,549265.0,0,0,tokenadult,,,Why are his motives more important to us than the accuracy of the statement?,1239066270.0
61,550034,comment,546743.0,549329.0,0,0,trapper,,,"<a href=""http://en.wikipedia.org/wiki/Optimization_(mathematics)",
62,550033,comment,549852.0,550019.0,0,0,Kaizyn,,,"You must not read much mainstream media.  Nearly every piece contains little nuggets like the one(s) you mention.  It isn't just Time; they all do it.  Not surprisingly, newspapers are struggling with their readers now leaving in droves.",1239066225.0
63,550032,comment,549998.0,549998.0,0,0,tokenadult,,,"Cool. A press interview with Richard Rusczyk about his work before he founded the Art of Problem Solving website.<p><a href=""http://www.artofproblemsolving.com/Forum/index.php"" rel=""nofollow"">http://www.artofproblemsolving.com/Forum/index.php</a><p>Rusczyk always has something interesting to say.",1239066143.0
64,550031,comment,549609.0,549725.0,0,0,knightinblue,,,Good explanation. But how does blocking google help them make more money?,1239066092.0
65,550030,comment,549689.0,549689.0,0,0,tlrobinson,,,It's official: Twitter is the new IRC.<p><i>edit: except Twitter is currently down. I guess that's the equivalent to a netsplit.</i>,1239066012.0
