,ID,Type,Story,Parent,Points,Comments,Author,Title,URL,Content,Created
0,7620441,comment,7620050.0,7620219.0,1,0,ricardobeat,,,"Too fast. Truncating the Y-axis makes more of the relevant data visible, it&",
1,7620440,comment,7617720.0,7620105.0,2,0,dredmorbius,,,"I suspect the powersat evolved as a mission justification:  so, we can conceive of human-habitable structures in space, but why would we do that.  From Heppenheimer&",
2,7620439,comment,7619956.0,7620352.0,8,0,ChrisGaudreau,,,Piketty&,
3,7620438,comment,7616910.0,7620023.0,1,0,personlurking,,,"You got it, more than a Reddit-style thing, I think a location based wikitravel is what my original idea was leaning towards.",1398074234.0
4,7620437,comment,7618657.0,7618973.0,1,0,mattip,,,"Just like parents do not forget teenage years rather the experience of being a teenager is much different, so programming evolves and changes. But your point is still true, while non-programmers can appreciate the result, it is a job for professionals at thge top of their game.",1398074232.0
5,7620436,comment,7618971.0,7619914.0,2,0,quaunaut,,,"However you also have the luck of having a computer, being interested in computers, and being able to further than interest. Do you think you would&",
6,7620435,comment,7618871.0,7620369.0,4,0,Timmmmmm,,,Yeah pretty sure that&,
7,7620434,comment,7617653.0,7617653.0,1,0,ilovecookies,,,"Been using linux distros and ubuntu 12.04 for about 2 years now. Linux is the shit but ubuntu sucks IMO. Very poor customization possibilites. Heavily reliant on python 2.7. Very bad support for other window managers than unity, dont ever try to mess with multiple window managers on ubuntu, it will ruin your week. With WAY FASTER alternative systems such as arch, funtoo, gentoo, knoppix and even debian. I have a hard time understanding how ubuntu could have gained the traction it has among developers.",1398074136.0
8,7620433,comment,7618428.0,7618953.0,1,0,gonzo,,,OpenBSD has several side-channel attacks possible against it&,
9,7620432,story,,,1,0,neverminder,Announcing Play 2.3-M1,https://groups.google.com/forum/,,
10,7620431,comment,7618001.0,7618135.0,1,0,ssijak,,,"Thanks for the reply! I implemented some of the suggested changes. As for the input and button, I thought it was obvious that the green bar is the input field, I added some java script that focuses field with blinking cursor if you click register without entering email.",1398074065.0
11,7620430,comment,7620422.0,7620422.0,1,0,matt42,,,"And the javascript source code is : <a href=""https://angulardart.org/dart/examples.dart.js"" rel=""nofollow"">https://angulardart.org/dart/examples.dart.js</a>",1398074028.0
12,7620429,comment,7618871.0,7620395.0,7,0,ekr,,,If I remember correctly (haven&,
13,7620428,comment,7618406.0,7618609.0,1,0,dllthomas,,,It&,
14,7620427,comment,7620390.0,7620390.0,9,0,the_ed,,,I figure this is just the name for the legal entity and does not necessarily mean a change in branding?,1398073963.0
15,7620426,comment,7618971.0,7619932.0,1,0,belorn,,,"A every increasing wealth inequality destroys incentives to work hard. The song sixteen tons encapsulate the feeling workers get when they just get &quot;another day older and deeper in debt&quot;.<p>With wealth being hereditary entitlement to one group that increasingly get more wealthy, we end up with everyone else being in more debt to them each passing day. The debt bondage model simply moves from being about a mine, and becomes the model of the country.",1398073941.0
16,7620425,story,,,3,1,itsbalamurali,7 Reasons Why You Will Never Do Anything Amazing With Your Life.,http://raymmar.com/7-reasons-youll-never-do-anything-amazing-life/,,1398073935.0
17,7620424,comment,7619956.0,7620352.0,8,0,czr80,,,"So the thesis is that technological progress relies on us incentivizing people with the hope of extreme wealth?<p>Seems unlikely - for one counter-example, a large part of progress in society rests on investment in basic research, and most of the scientists engaged in that work have no real expectation that they will get rich.",1398073922.0
18,7620423,comment,7619117.0,7620037.0,4,0,userbinator,,,"<i>Five</i> buttons, all for spaces? That would already be a sign to me that whoever designed that UI wasn&",
19,7620422,story,,,1,3,matt42,AngularDart hello world demo loads 2MB of JavaScript,https://angulardart.org/demo/,,1398073912.0
20,7620421,comment,7619319.0,7620074.0,4,0,pkuki,,,"You can also use Scala:\n<a href=""https://github.com/pkukielka/stronghold-defense"" rel=""nofollow"">https://github.com/pkukielka/stronghold-defense</a><p>The main problem which you will get with languages like Scala , Clojure and other functional languages on JVM is a lot of garbage generated during the execution. And garbage collector on Android isn&",
21,7620420,story,,,1,0,neverminder, Dangerous Depths: German Waters Teeming with WWII Munitions,http://www.spiegel.de/international/germany/dangers-of-unexploded-wwii-munitions-in-north-and-baltic-seas-a-893113.html,,1398073883.0
22,7620419,story,,,3,0,Aissen,Planned obsolescence,https://plus.google.com/+MehdiKrit/posts/RCwwonVxBH4,,1398073765.0
23,7620417,comment,7618049.0,7620356.0,2,0,luser,,,"Ah, there is the thing most people don&",
24,7620416,comment,7617653.0,7617653.0,1,0,apapli,,,"I really want to use Ubuntu for personal use, but still really miss it not having MS Office natively available.<p>I know this comment may seem lame here on HN but I just don&",
25,7620415,comment,7620194.0,7620194.0,1,0,RighteousFervor,,,I&,
26,7620414,story,,,1,0,sshravan,Machine Learning vs Statistics?,http://stats.stackexchange.com/questions/6/the-two-cultures-statistics-vs-machine-learning,,1398073686.0
27,7620412,comment,7616910.0,7616910.0,1,0,curlyreggie,,,"This might be trivial. One of my friends is a serious blogger (she has around 7-8 blog sites on various topics she writes). Why not a simple blog aggregator to post in blogs into the site you wish?<p>E.g., You want to blog for tumblr, create a post here and then it gets auto-posted to tumblr directly.<p>Of course, the API issues and permissions are another headache to worry about.",1398073677.0
28,7620411,story,,,1,3,alansparrow,Should I drop out?,,"Hello,\nI am a student major in Computer Engineering and I am in 3rd year now. I have been following Hackernews for a long time because I am interested in technology and start up. I really love learning practical technologies which I can see their  result immediately. Gradually, what I am self-learning  are divergent from what I am taught in my university (I am self-learning iOS game development, Node.js... and I think you have already known what our university is teaching us). This makes me headache because my time is limited, I feel I cannot do both well. Therefore, I consider drop out and focus on self-learning. Does anyone have the same experience? Can you share what you did then? Thank you.",1398073642.0
29,7620410,story,,,288,95,neverminder,The ticking time-bomb at the bottom of the Baltic Sea,http://www.economist.com/blogs/easternapproaches/2013/11/baltic-sea,,1398073579.0
30,7620409,comment,7619234.0,7619587.0,2,0,dredmorbius,,,Biofuels simply aren&,
31,7620407,comment,7619283.0,7619536.0,1,0,duncan_bayne,,,I&,
32,7620405,story,,,2,0,frade33,/r/science won't allow it so here 're my questions [part2],http://pastie.org/9097166,,1398073398.0
33,7620403,comment,7616910.0,7617099.0,1,0,curlyreggie,,,Good Idea. But I&,
34,7620402,comment,7619117.0,7619802.0,2,0,drdaeman,,,"Not really. FLOSS is about being in control of your software (being able to legally modify and distribute things), not making any guarantees about software behavior (including security).<p>Indeed, source code availability (much weaker than FLOSS) is very useful in software analysis. Nonetheless, while in most cases this is just tedious and boring work, one can still validate proprietary binary blobs. Obviously, that only applies to countries where reverse engineering is legal.",1398073354.0
35,7620399,story,,,10,0,iElectric2,Weenerd – web weechat relay built using react.js,https://github.com/kiberpipa/weenerd,,1398073200.0
36,7620398,story,,,1,0,chintan39,Birthde,https://www.birthde.com,,1398073177.0
37,7620397,comment,7619104.0,7619104.0,2,0,rebel,,,My guess is that the recent &,
38,7620396,comment,7615399.0,7620102.0,3,0,CHY872,,,"In the UK (exclusively, I think), the sockets have gates - in [1] you&",
39,7620395,comment,7618871.0,7619724.0,1,0,Flow,,,"Thank you for this really interesting comment.<p>I wonder if the lead could leave the body, and if the effects it had are somewhat reversed over time, for those that lived in environments with much traffic.<p>Do you have any idea about this?",1398072920.0
40,7620394,comment,7619439.0,7619439.0,4,0,james1071,,,"Translation:he wants everyone to work hard, to pay them little and fire them when he needs to cut costs some more.",1398072917.0
41,7620392,comment,7618657.0,7618853.0,1,0,watwut,,,"More the just frameworks change. More importantly, if you did not coded for 10 years, it is only that what you remember is outdated. It is also that what you remember is an idealized high level version of what it really was.<p>That kind of manager that bases his decisions on quick google searches without understanding whole system is the worst kind of manager. If there are trade offs involved and possible bad consequences in the context of your database, your search will ignore that.<p>Ultimately, &quot;In rails 7, you can&",
42,7620391,comment,7618871.0,7620027.0,1,0,thaumasiotes,,,"> Air pollution from cars kills 50,000 a year in the UK [0]. Apparently closer to 200,000 a year in the US.<p>So just to be clear... you&",
43,7620390,story,,,57,68,paukiatwee,Nokia phones to be renamed Microsoft Mobile,http://zeenews.india.com/business/news/technology/nokia-phones-to-be-renamed-microsoft-mobile_98151.html,,1398072814.0
44,7620389,comment,7616566.0,7620290.0,1,0,jokoon,,,> The very core of Marx political agitation was aimed at getting the members of the working classes to understand that their self interests were separate from those of the bourgeoisie.<p>That&,
45,7620388,comment,7618871.0,7619585.0,2,0,troels,,,"Prisons were initially invented as correction facilities, rather than instruments of punishment. Before this, crime was mostly dealt with by physical punishment.",1398072664.0
46,7620387,comment,7618871.0,7619992.0,2,0,bnegreve,,,I genuinely don&,
47,7620386,comment,7616910.0,7617219.0,0,0,raldi,,,(sound of crickets),1398072583.0
48,7620385,comment,7617653.0,7618105.0,1,0,fulafel,,,"They were never going to &quot;exclude X&quot; at this stage, it was just about switching the default on supported hardware. Fortunately.",1398072566.0
49,7620384,story,,,1,0,r4um,Notes On Concurrent Ring Buffer Queue Mechanics ,http://psy-lob-saw.blogspot.in/2014/04/notes-on-concurrent-ring-buffer-queue.html,,1398072528.0
50,7620383,comment,7617653.0,7618225.0,1,0,1_player,,,"For some older Radeon cards (such as my 6630HD Mobile) I would recommend the open-source driver instead of Catalyst, as the performance is noticeably greater.",1398072527.0
51,7620381,story,,,44,11,ziodave,The new schema.org actions: What they mean for personalisation on the Web,http://terraces.wordpress.com/2014/04/16/the-new-schema-org-actions-what-they-mean-for-personalisation-on-the-web/,,1398072459.0
52,7620379,story,,,2,0,ziodave,IntelliJ IDEA 13.1.2 Update is Available,http://blog.jetbrains.com/idea/2014/04/intellij-idea-13-1-2-update-is-available/,,1398072427.0
53,7620378,comment,7618871.0,7620004.0,2,0,coldtea,,,"All other things being equal, maybe. But:<p>1) A prison is far more easily sold to the population that  hospitalization or cures (&quot;what, you mean we&",
54,7620377,comment,7618871.0,7619990.0,4,0,mendicantB,,,"Statistics is the means of testing whether or not something is evidence.<p>I understand what you meant, it&",
55,7620376,comment,7618406.0,7618406.0,2,0,a-saleh,,,"As a q/a by profession, I allways wonder, how to have some better assurances  that the software I have does what it is supposed to.<p>I believe I have even incidentaly reimplemented quick-check on several occasions.<p>When we were working in Clojure for a little while, I wondered if it might be possible to combine contracts and logic programming, to verify that contracts don&",
56,7620375,story,,,1,0,sirwanqutbi,CNAME Flattening at CloudFlare: Get naked domains for your PaaS applications,http://sirwan.me/application-development/how-to-get-custom-domain-and-naked-domains-for-your-openshift-application/,,1398072256.0
57,7620374,comment,7620332.0,7620363.0,1,0,ugdev,,,What we already did is: set up a pre-registration (~1k mails atm).\nWe&,
58,7620372,comment,7619439.0,7619721.0,1,0,randomhero,,,I totally agree with you too... &quot;startup&quot; term is becoming an umbrella to cover up bad decisions or situations nowadays for founders. &quot;Startup&quot; should be a phase and a culture for companies. It should not be the excuse of bad days...,1398072213.0
59,7620371,comment,7617653.0,7619491.0,3,0,fulafel,,,Dell has some support for the corporate E models but not that solid (eg touchpad support took ages to arrive).,1398072199.0
60,7620370,comment,7618971.0,7620127.0,1,0,belorn,,,"It all depend. Slaves sometimes competed with each other in order to get favors from the slave owner. In reference to the slave owner, they could never earn enough to be free but if they might work hard enough to get food for the day, so was it meaningless to work hard?<p>Ever heard the song sixteen ton? How meaningful is the work in such situation?",1398072174.0
61,7620369,comment,7618871.0,7619724.0,9,0,mixmax,,,If the theory is true it could also account for the fact that violent crime is more abundant per capita in urban areas compared to rural areas since lead from gasoline will obviously be more abundant in cities with lots of cars per square mile compared to rural areas with very few cars.<p>Here&,
62,7620368,comment,7618871.0,7619690.0,2,0,klipt,,,"South Africa only phased it out completely in 2006: <a href=""http://www.southafrica.info/services/consumer/clean_fuel081205.htm"" rel=""nofollow"">http://www.southafrica.info/services/consumer/clean_fuel0812...</a>",1398072157.0
63,7620367,comment,7618871.0,7619732.0,6,0,thaumasiotes,,,This has been studied. Gains from the Flynn effect don&,
64,7620365,comment,7619956.0,7620256.0,2,0,yummyfajitas,,,"Your second point is an interesting theory, but seems unstable. What if one capital owner decides to consume a smaller amount of his wealth, and thereby increase his share of the economy?<p>Eventually he would rule the world.",1398072059.0
65,7620364,story,,,1,0,sport6810,The Ultimate Reference Guide To Create A PayPal Invoice,http://www.blogsmartguide.com/the-ultimate-reference-guide-to-create-a-paypal-invoice.html,"This is a step by step guide with detailed screenshots, to understand the process of creating an invoice in PayPal.",1398072018.0
66,7620363,comment,7620332.0,7620332.0,2,0,morituri,,,"Sure your long term target group is everyone, but you need to start with one niche group.  Your partner can get the ball rolling in user recruitment.  You should have a basic site up with your key product proposition and collect emails.  \n- He can speak to different groups of people (a class of students, an interest group etc) to get them onboard in one go.  \n- He can start doing business development - find marketing partners, sponsors, distribution partners, etc.",1398071995.0
67,7620362,comment,7618818.0,7618818.0,1,0,jpalomaki,,,"I imagine there could be an opportunity for AirBNB/Über style service here. Maybe not for individuals, but for companies that are anyways offering office space for rent and who already have reception facilities (for giving access) etc. Or maybe even hotels? Re-decorate few rooms to serve specifically this purpose (remove beds etc).<p>The main challenge I can think of is related to getting access to the space. With this kind of service I would not be interested in making appointments with somebody to get access to the place. Too much trouble if I only plan to spend couple of hours there.<p>Would be also easy to tie additional services to the experience. If there&",
68,7620361,story,,,1,0,jaksprats,SegundoNet: Secondary Cell Network Using Google Fiber as Backhaul,http://slidesha.re/1i8amDh,"I am sharing a concept of mine called SegundoNet\nslides: http://slidesha.re/1i8amDh\nblog: http://jaksprats.wordpress.com/2014/04/21/segundonet-a-secondary-cell-network-built-cheaply/<p>It is a secondary cellular network using GoogleFiber for its Backhaul & TV WhiteSpace (and other unlicensed spectrum) coordinated via Cognitive Radio as spectrum. It is a pretty cool and very doable concept, enjoy :)\uFEFF",1398071973.0
69,7620360,comment,7617653.0,7620165.0,2,0,fulafel,,,"They used to have a disable option for the search stuff in the privacy settings, did they take it out?",1398071910.0
70,7620359,comment,7615399.0,7619115.0,1,0,misnome,,,Just not a metal one.,1398071885.0
71,7620358,comment,7619956.0,7620328.0,1,0,yummyfajitas,,,Downward volatility hurts you more than upward volatility helps you (on average). That&,
72,7620357,comment,7617720.0,7617720.0,1,0,hypertexthero,,,"[Don Davis](<a href=""http://www.donaldedavis.com/"" rel=""nofollow"">http://www.donaldedavis.com/</a>), one of the illustrators whose work appears here, was part of the team of artists gathered to provide the visual effects for [Cosmos](<a href=""http://hypertexthero.com/logbook/2014/03/cosmos/"" rel=""nofollow"">http://hypertexthero.com/logbook/2014/03/cosmos/</a>).<p>[Some of his recollections](<a href=""http://www.donaldedavis.com/PARTS/SAGAN.html"" rel=""nofollow"">http://www.donaldedavis.com/PARTS/SAGAN.html</a>) of working with Sagan.",1398071833.0
73,7620356,comment,7618049.0,7620092.0,2,0,barry-cotter,,,What happened in 2011? And the wage suppression agreement has made a mockery of the idea that management at Google take &quot;Don&,
74,7620355,comment,7619283.0,7620247.0,2,0,duncan_bayne,,,Let&,
75,7620354,comment,7619956.0,7620342.0,2,0,yummyfajitas,,,"Yes, that&",
76,7620353,comment,7619956.0,7619956.0,3,0,wazoox,,,"There is a very extensive (60 pages or so) analysis of the book in french here:<p><a href=""http://www.les-crises.fr/piketty-le-capital-1/"" rel=""nofollow"">http://www.les-crises.fr/piketty-le-capital-1/</a><p><a href=""http://www.les-crises.fr/piketty-le-capital-2/"" rel=""nofollow"">http://www.les-crises.fr/piketty-le-capital-2/</a><p><a href=""http://www.les-crises.fr/piketty-capital-3/"" rel=""nofollow"">http://www.les-crises.fr/piketty-capital-3/</a><p>Check the unforgiving and long conclusion here:<p><a href=""http://www.les-crises.fr/piketty-capital-4/"" rel=""nofollow"">http://www.les-crises.fr/piketty-capital-4/</a>",1398071609.0
77,7620352,comment,7619956.0,7620277.0,1,0,alnafie,,,One of the best and most accessible pieces I&,
78,7620351,comment,7620071.0,7620318.0,1,0,1rae,,,I think the article is a few months old already. It came out before all the drama.,1398071507.0
79,7620350,story,,,1,0,3rd3,Ask HN: Did the Google search results get worse during the past months?,,"Since a couple of months it seems to be more often the case that I have to put the search terms in quotes to get exactly what I want. Google seems to ignore parts of the query more often, assumes that I misspelled something or it does not highlight the right parts in the search results. Is this a problem for everyone or just me?",1398071494.0
80,7620349,story,,,1,0,DiabloD3,TSA gaining insight from Sandia human behavior studies,http://phys.org/news/2014-04-airport-officers-tsa-gaining-insight.html,,1398071485.0
81,7620348,story,,,1,0,the_ed,No Dropbox: syncing with Bittorent Sync and a Raspberry Pi,http://nerd.vasilis.nl/keep-stuff-sync-safe/,,1398071453.0
82,7620346,story,,,2,0,AndrewDucker,Das Kapital for the Twenty-First Century? A review by James K. Galbraith,http://yanisvaroufakis.eu/2014/04/03/das-kapital-for-the-twenty-first-century-a-review-of-t-pikettys-new-book-by-james-k-galbraith/,,1398071313.0
83,7620345,comment,7619858.0,7620021.0,2,0,ipedrazas,,,"&quot;Cards with chips are still somewhat rare&quot;<p>Do you mean in the States, right? Cards with chips are the default in most european countries...",1398071207.0
84,7620344,comment,7619956.0,7620060.0,3,0,bayesianhorse,,,The businessmen of Germany from 1935 eventually got to use slave labor to build lucrative weapons... Quite a few corporations and individuals survived the war.,1398071171.0
85,7620343,comment,7618406.0,7619158.0,1,0,dllthomas,,,"Ideally, we should minimize the code in any given path to assurance, but maximize the number of independent paths to assurance (modulo resource constraints).",1398071119.0
86,7620342,comment,7619956.0,7619956.0,1,0,bayesianhorse,,,"Maybe I am naive, but if g is the growth rate of an economy, and r the growth rate of a smaller part of it, doesn&",
87,7620341,comment,7619319.0,7619319.0,1,0,tosinaf,,,It&,
88,7620340,comment,7616346.0,7616346.0,1,0,kwhitefoot,,,Actually for low rate communication in a disaster zone store and forward text messaging via mobile telephones would surely work more easily and could be combined with the mesh to enable greater coverage.,1398070961.0
89,7620339,story,,,1,0,goblin89,Python's setdefault Considered Harmful,http://xion.org.pl/2012/01/28/pythons-setdefault-considered-harmful/,,1398070931.0
90,7620338,comment,7618818.0,7619559.0,5,0,adrianhoward,,,If it&,
91,7620337,comment,7619319.0,7620074.0,3,0,terhechte,,,"You can use any of the JVM languages with libgdx, such as Clojure, Scala, Kotlin even JRuby [1]<p>[1] <a href=""https://github.com/mickey/libgdx-jruby-exemple"" rel=""nofollow"">https://github.com/mickey/libgdx-jruby-exemple</a>",1398070856.0
92,7620336,comment,7616346.0,7616346.0,1,0,kwhitefoot,,,This is what Internet was supposed to be from the beginning; a reliable network with multiple paths between nodes so that the removal of even a large number of edges would not prevent packets getting through.,1398070840.0
