,ID,Type,Story,Parent,Points,Comments,Author,Title,URL,Content,Created
0,2622609,comment,2622558.0,2622558.0,5,0,yannis,,,"You can run the charts through Google's closure locally\n<a href=""http://closure-library.googlecode.com/svn/trunk/closure/goog/demos/serverchart.html"" rel=""nofollow"">http://closure-library.googlecode.com/svn/trunk/closure/goog...</a><p>All the routines are public, there is no need to go through the API.",1307300390.0
1,2622608,comment,2622166.0,2622526.0,3,0,msie,,,"Yeah I really hated this post. Starts off with a flame-baiting title. Then resorts to very qualified statements to support it. After reading it I'm wondering if it matters at all and I'm feeling dumb all throughout the discussion. :-(<p>Update: Aarghh, it's just aggravating to read an academic stirring up the pot over some point of theoretical purity. And I love theory too. ;-)",1307300319.0
2,2622607,comment,2621371.0,2622361.0,1,0,kristofferR,,,"Ah, sorry. I misintrepreted the information on Wikipedia about the issue<p><a href=""http://en.wikipedia.org/wiki/Disneyland_with_the_Death_Penalty"" rel=""nofollow"">http://en.wikipedia.org/wiki/Disneyland_with_the_Death_Penal...</a>",1307300273.0
3,2622606,comment,2622271.0,2622596.0,2,0,chrisjsmith,,,Yeah but you only need to spend 15 on the computer to fire the web browser up on now.,1307300260.0
4,2622605,comment,2621371.0,2621874.0,5,0,mcantor,,,"Travel and worldliness are both interesting subjects to many hackers.  I'm sure that a less notable hacker moving to Singapore wouldn't attract quite so much attention, but you should notice that most of this thread isn't about Mr. Sivers: it's about Singapore.",1307300247.0
5,2622604,comment,2622196.0,2622562.0,2,0,richcollins,,,"The niceness is in the Javascript, not HTML.  HTML is made for text layout, not stateful UIs.",1307300229.0
6,2622603,comment,2616948.0,2616948.0,1,0,tnc,,,"Thumbs up for the counter feature:<p>""Cassandra also has distributed counters now.  With counters, you can count stuff, and counting stuff rocks.""",1307300218.0
7,2622602,comment,2622493.0,2622493.0,4,0,coliveira,,,"Google adsense has stopped being relevant a long time ago... Specially for technical subjects, since most tech people just blog these ads anyway.<p>Moreover, to be successful with Google adwords, one needs to have a lot of money to tweak the campaigns. The system created by Google is so complicated, that only spammers and big corporations have enough money to win the game.",1307300215.0
8,2622601,comment,2622271.0,2622578.0,7,0,chrisjsmith,,,ARM is like that now (which was ironically invented by Acorn in the UK for the UK education market).,1307300199.0
9,2622600,comment,2622196.0,2622564.0,1,0,richcollins,,,"I like cappuccino the framework but not Objective-J the language.  It mostly takes the bad parts of Objective-C and puts them on top of Javascript (with the exception of ""forward"")",1307300170.0
10,2622599,story,,,20,3,meeech,Your friends are liars,http://blog.happystuffapp.com/your-friends-are-liars-aka-the-truth-doesnt-h,,1307300170.0
11,2622598,comment,2622196.0,2622562.0,4,0,bonch,,,"People have been predicting web-based desktop development for 15 years now, and it never happens. Netscape even wanted to replace the Windows 95 shell. Apple tried to push web apps for third-party iPhone development, and people didn't want it. There are just too many advantages to native performance and development, not to mention that Javascript isn't the sanest language in the world (to be expected since it was hacked together in 10 days at Netscape).",1307300132.0
12,2622597,comment,2622238.0,2622376.0,1,0,nextparadigms,,,"Didn't Facebook trademark ""facebook"", ""book"" and I think ""face"", too?",1307300110.0
13,2622596,comment,2622271.0,2622271.0,4,0,benblack86,,,"A 15 computer sounds cool, but programming can be done in your web browser. Just write some javascript and let the whole world instantly see your creation.",1307300092.0
14,2622595,comment,2622196.0,2622570.0,5,0,richcollins,,,Which is more cumbersome?<p><pre><code>    //Objective-C\n    \n    ,
15,2622594,story,,,2,1,agnesberthelot,Apple store in Germany defaced with huge Windows logo | Technically Incorrect,http://news.cnet.com/8301-17852_3-20069023-71/apple-store-in-germany-defaced-with-huge-windows-logo/,,1307300084.0
16,2622593,story,,,47,6,sled,Starting a Game,http://www.eddiescholtz.com/entry/starting-a-game,,1307300061.0
17,2622592,comment,2622250.0,2622577.0,3,0,evangineer,,,"joeyh's git repo for this neat hack:<p><a href=""http://git.kitenet.net/?p=oldusenet.git;a=summary"" rel=""nofollow"">http://git.kitenet.net/?p=oldusenet.git;a=summary</a>",1307299987.0
18,2622591,story,,,1,0,Maro,Short story: what happens if Christmas is privatized?,http://www.socialistreview.org.uk/article.php?articlenumber=9150,,1307299936.0
19,2622589,comment,2621158.0,2621812.0,1,0,bhickey,,,"Hm. I should clarify. Runs of Z or S don't prevent lines, but they do guarantee that you'll always leave an eye. It is the accumulated eyes that prevent line formation and lead to a loss.",1307299826.0
20,2622588,comment,2622196.0,2622565.0,1,0,richcollins,,,"Objective-C does have performSelector, but its awkward to use.  It lacks the ability to easily add slots to objects and you often have to work with C types.<p>Perhaps ""expressive"" would be a better distinction.  Javascript is a much more expressive language, meaning that I have to do a lot less work to accomplish the same end.",1307299788.0
21,2622587,story,,,2,0,lyudmil,The Naipaul test: Can you tell an author's gender based on their writing alone?,http://www.guardian.co.uk/books/quiz/2011/jun/02/naipaul-test-author-s-sex-quiz,,1307299786.0
22,2622586,story,,,2,0,randomwalker,Productivity and performance hacks,http://arvindn.livejournal.com/132233.html,,1307299783.0
23,2622585,comment,2619760.0,2620282.0,2,0,mattgreenrocks,,,"Yes! Most problems don't require you to grind away for hours on end. If I don't get anywhere within 45 minutes or so, I'll just walk away. The unconscious mind is a wonderful tool, but it needs breathing room to do its work, it seems.",1307299721.0
24,2622584,comment,2622196.0,2622196.0,1,0,equark,,,"Javascript + HTML5 is a a pretty ideal view layer, but MS almost certainly will need to provide a higher level story like GWT to satisfy their developers and support large teams.  Google has shifted entirely to GWT over hand-coded javascript for their applications.  It seems unlikely that MS would have worse tooling than Google, particularly given that MS can leverage their development tools (.NET + future compiler as a service).<p>Is there any information on what development model MS is thinking about?",1307299713.0
25,2622583,comment,2622166.0,2622316.0,3,0,alok-g,,,"Maybe you got me closer to the answer, and you certainly seem to have more experience on this subject than I do.  I am still missing some part of the picture, so let me ask:<p>Types:  You think about the problem up-front to the best you can.  Most likely you later change the interface.  The compiler now breaks the code and forces you to fix it.<p>Dynamic:  You are flexible, which means you can start your work without having to think up-front (Q1:  How is this good?).  Later when you change the interface (which may exist only in your mind, but it does as far as the modules are to interact with each other in some way at all), the code still breaks but the compiler won't tell you.<p>In either case, as you said ""you have to fix them anyway"".  So Q2:  How is compiler not being able to complain about broken code (and possibly unit tests finding it) helping?<p>One comment here cited an example where one can get away without introducing errors while still changing the type (""f(g(x)"").  But that is readily achieved with statically typed languages like C++ as well.",1307299705.0
26,2622582,comment,2622271.0,2622550.0,4,0,chrisjsmith,,,Didn't know that.  Interesting!  Thanks for pointing it out.,1307299631.0
27,2622581,comment,2622288.0,2622551.0,10,0,Sniffnoy,,,...that is not what the incompleteness theorem says.,1307299620.0
28,2622580,comment,2622558.0,2622558.0,3,0,tnc,,,Its very good to have an alternative to google charts. Your license should cover commercial use.,1307299609.0
29,2622579,comment,2619760.0,2620523.0,3,0,mattgreenrocks,,,"> Life is far too grand, far too complex, to be spent just coding.<p>Much wisdom here.<p>The workaholic personality type can be prone to overworking in order to compensate for other areas of life that aren't quite going their way. I've been that person, but I don't plan on returning to it. In these cases, its much more fruitful to fix the problem than it is to mask it. It just happens that working too much is socially-approved escapism.",1307299600.0
30,2622578,comment,2622271.0,2622559.0,3,0,coliveira,,,"I was reading another day about the PDP 11, and it is incredible how it looked much easier to program than an x86. Maybe we should go back in time and try to learn some of the forgotten tricks.",1307299600.0
31,2622577,comment,2622250.0,2622250.0,10,0,joeyh,,,"Here's my announcement post, which is, I hope, worth reading\nfor some context of what's going on in 1981 ""now"":<p><a href=""http://kitenet.net/~joey/blog/entry/announcing_olduse.net/"" rel=""nofollow"">http://kitenet.net/~joey/blog/entry/announcing_olduse.net/</a><p>Also, if you see a blank box where the newsreader should be, yeah, inviting the whole web in to run tin on my server is not a completely scalable thing. nntp.olduse.net is where it's at.",1307299589.0
32,2622576,story,,,111,37,apievangelist,"The Good, the Bad, and the Ugly of REST APIs",http://broadcast.oreilly.com/2011/06/the-good-the-bad-the-ugly-of-rest-apis.html?utm_source=feedburner&utm_medium=feed&utm_campaign=Feed%3A+oreilly%2Fnews+%28O%27Reilly+News+and+Commentary%29,,1307299551.0
33,2622575,comment,2622202.0,2622504.0,3,0,rokhayakebe,,,"How can you make daily deals algorithm based?<p>Simply ask to click a box if they agree to discount a sale price by 50%, and share the remaining 50% with Google.",1307299484.0
34,2622574,comment,2622481.0,2622481.0,1,0,ccpcakes,,,I like this idea.  Are there any Hacker News admins looking at this post?,1307299391.0
35,2622573,comment,2620876.0,2621289.0,1,0,pyre,,,"Ketosis talks about converting fatty acids to energy (when your body runs out of glucose/glycogen). It says nothing about creating vitamins and minerals out fat+sugar+salt.<p>If your body could get all the essential nutrients out of nothing but carbs and/or fats, then malnutrition would be a fictitious condition, as would be scurvy (Vitamin C deficiency).",1307299381.0
36,2622572,comment,2621976.0,2621976.0,1,0,coliveira,,,"Nice ideas, but I feel that the examples are a little too basic: speaking and exercising are what I consider to be indispensable for everyone, almost something like brushing your teeth in the morning.",1307299370.0
37,2622571,comment,2621371.0,2621800.0,1,0,yaix,,,"Sure. Its not genetic or anything. Critical views towards authority have developed in the West in the past 500 years, with the rise of protestantism (as in ""you talk to God yourself and not through some father figure mediator"") and later through Enlightenment (as in ""use your brain, goddamit!""). It took us quite a while and quite a bit of luck, too, to get where we are today.<p>Most of those things did not happen elsewhere. Hence my comment above.",1307299369.0
38,2622570,comment,2622196.0,2622556.0,1,0,bonch,,,Objective-C is already a dynamic language. Its ability to drop to low-level C at will makes it too flexible and powerful to abandon for something slow and cumbersome like Javascript.,1307299365.0
39,2622569,comment,2622006.0,2622473.0,1,0,xpaulbettsx,,,"Not sure, but totally agree - I'll try to file a bug.",1307299356.0
40,2622568,comment,2621371.0,2622499.0,4,0,samtp,,,I see you've never been to Baltimore,1307299322.0
41,2622567,comment,2622006.0,2622476.0,3,0,xpaulbettsx,,,"It doesn't work on an iPad yet. It's our first web Office release, it's still a little rough, but it's definitely something we're putting a lot of engineering work behind to improve.<p>However, you don't actually <i>need</i> Silverlight to use it (I'm not sure what they're using it for), I've used it on Chrome in Ubuntu and it worked just as well. Any new'ish browser should work.",1307299319.0
42,2622566,comment,2621844.0,2622394.0,1,0,SoftwareMaven,,,We would likely have no way of knowing if the hackers were going after the IP. Sony just may have that security right.,1307299311.0
43,2622565,comment,2622196.0,2622556.0,3,0,Zev,,,"By ""dynamic"" do you mean ""interpreted""? Because Objective-C is a pretty dynamic and flexible language, otherwise.",1307299307.0
44,2622564,comment,2622196.0,2622556.0,1,0,programminggeek,,,"Have you looked at this?<p><a href=""http://cappuccino.org/"" rel=""nofollow"">http://cappuccino.org/</a><p>It's basically Cocoa on javascript using Objective-J",1307299264.0
45,2622563,comment,2622271.0,2622462.0,2,0,iuguy,,,"With Duke Nukem going gold, it can only be a little longer<i>.<p></i>for values of little not exceeding Braben's lifetime.",1307299203.0
46,2622562,comment,2622196.0,2622196.0,4,0,programminggeek,,,"It makes perfect sense that HTML5/JS would overtake traditional UI frameworks on the client side. Doing Win32, Java Swing, etc. was a horrible experience compared to the relative niceness of HTML/JS.<p>Adobe Flex/AIR was probably the best client UI dev experience I've had. MXML and Actionscript 3 is VERY similar to HTML/JS. Given the benefits of so many platforms moving towards HTML/JS as a kind of common language for UI development, these are exciting times.",1307299185.0
47,2622561,comment,2601949.0,2602059.0,1,0,tree_of_item,,,"Adding lots of GPUs and CPUs doesn't make that not true. Those processing units still work by executing a series of instructions, they just do some fancy things with regards to the order of instructions and communication between units.<p>It may be more productive to think of things in terms of a more abstract, functional model of computing, but in the end, for anything to actually <i>happen</i>, that abstract model must be translated in to some series of instructions. I think that's what the quote was trying to get at.",1307299165.0
48,2622560,comment,2622250.0,2622250.0,13,0,antirez,,,"What's sad is that there is no serious replacement for usenet in the internet of today. Usenet was a place where top talents of the world used to talk together with amateurs on the more disparate topics. Back then the internet was for an elite, and that sucked as universal access to the net is really important, but at the same time it is sad to see most of the internet reflecting the fact that today it is a ""mass"" thing.",1307299160.0
49,2622559,comment,2622271.0,2622549.0,4,0,chrisjsmith,,,Agreed entirely.  It's one of the things that has been annoying me for years.  The x86 ISA is an utter mess - totally non-orthogonal.  Why we keep worshipping it I don't know.<p>The last innovation was Forth on a Chip if you ask me.,1307299156.0
50,2622558,story,,,141,28,city41,"Show HN: Google Charts done in Canvas, side project",http://www.mattgreer.org/post/1yokulIntro,,1307299054.0
51,2622557,story,,,48,5,ph0rque,3d Printed Rocket Engine Takes Flight,http://blog.reprap.org/2011/06/paul-breed-of-unreasonable-rocket-fame.html,,1307299052.0
52,2622556,comment,2622196.0,2622196.0,4,0,richcollins,,,"We don't need ""modern"" UI frameworks we need well designed UI frameworks.  HTML isn't designed for stateful UIs.  I'm hoping that Cocoa will eventually move away from Objective-C and towards a more dynamic (expressive) language (Javascript would be great).",1307299039.0
53,2622555,comment,2622250.0,2622536.0,14,0,beej71,,,"> Also, a decent newsreader is still ahead of all modern browser-based software by a mile when it comes to following many discussion threads. For me, nothing today compares with trn.<p>You're far from the only one who feels this way.  I'm not quite sure why it is, but I think it's because trn's tree is basically drawn ""orthogonally"" (if I might use that word), with siblings stacked vertically, and children moving off to the right.<p>A ""normal"" newsreader uses the standard indented list, which gives the whole thread a ""meandering set of diagonals"" shape, and has a less strong visual connection between siblings (which is an important connection, because they're all replying to the same parent.)<p>So I was just looking for a screenshot of trn for people who didn't know what it looked like, and I found this blog entry talking about exactly this (with screenshot):<p><a href=""http://cafbit.com/entry/the_lost_art_of_threaded"" rel=""nofollow"">http://cafbit.com/entry/the_lost_art_of_threaded</a>",1307299037.0
54,2622554,comment,2622238.0,2622324.0,26,0,yaix,,,"I would call you, because I am a human being and not a lawyer zombie.<p>If you don't care or mis-interpret my ""being friendly"" as ""I don't really care"", well then its your own fault (and cost).<p>But claiming that anybody serious would immediately run for a lawyer is... well, a really pessimistic view on society.<p>>> ""We will take such steps as the law requires.""<p>Yikes! How about ""thanks for telling me, I'll check and get back to you, maybe we can find some level of agreement.""",1307298930.0
55,2622553,comment,2622481.0,2622481.0,1,0,hammock,,,"Rather than working top down approach, how about a greasemonkey script that hides the comments you dont like?",1307298900.0
56,2622552,comment,2621844.0,2622125.0,1,0,InclinedPlane,,,"Indeed. The smart folks were protecting against SQL injection and similar exploits 10 and 15 years ago. Today, there's absolutely zero excuse.",1307298852.0
57,2622551,comment,2622288.0,2622288.0,-3,0,shin_lao,,,"Or you could use Gdel's incompleteness theorems and say the universe cannot be a computer (as we understand it) because computers (as we understand them) are part of the universe and therefore cannot describe the universe.<p>Then the discussion could go on and you could reach a definition of ""computer"" vague enough to be able to say ""the universe is a computer"".",1307298852.0
58,2622550,comment,2622271.0,2622471.0,5,0,jdietrich,,,Users of the BBC website outside the UK get served ads.,1307298851.0
59,2622549,comment,2622271.0,2622543.0,7,0,coliveira,,,"It is sad that the current status quo on software development consider vendor lookup as a good thing. For example, people feel that it is good to use only one processor architecture (x86), and even think that a corporation-sponsored virtual machine (JVM) is a ""good thing"". No wonder why systems research is basically dead, only trying to improve over the clumsiness of existing architectures.",1307298794.0
60,2622548,comment,2622379.0,2622379.0,6,0,Goladus,,,"If I were going to start a project to map elements of a musical score to HTML5 custom attributes, I would probably start with something like Lilypond, which has a convenient formal specification:<p><a href=""http://lilypond.org/doc/v2.12/Documentation/user/lilypond/index.html"" rel=""nofollow"">http://lilypond.org/doc/v2.12/Documentation/user/lilypond/in...</a>",1307298783.0
61,2622547,comment,2622271.0,2622348.0,4,0,chrisjsmith,,,"Arguably (this will result in an argument - sorry), BBC BASIC on the BBC Micros is much more productive and has a lower learning curve than all the disparate technologies these days.<p>I mean I haven't written anything in it for 15 years but I can still remember ALL of it intimately including the memory maps of the machines.<p>Hibernate for example is more complicated than the operating system and programming language combined on those machines.",1307298765.0
62,2622546,comment,2622021.0,2622541.0,8,0,TheEzEzz,,,"The quantum N-body problem is a 3N dimensional problem. If your element has 100 electrons then you need to model a 300 dimensional space. If you took a very coarse discretization of 10 cells per dimension, you'd need a computer with at least O(10^300) bits of memory.",1307298734.0
63,2622545,comment,2620694.0,2620694.0,2,0,guillermovs,,,You can always buy a premium domain name via Sedo.com or a similar domain marketplace. Then sell it if you don't want it and the money is yours.,1307298664.0
64,2622544,comment,2621371.0,2622499.0,2,0,cubix,,,"Doesn't sound so outlandish to me: <a href=""http://www.youtube.com/watch?v=BHjjF55M8JQ"" rel=""nofollow"">http://www.youtube.com/watch?v=BHjjF55M8JQ</a>",1307298525.0
65,2622543,comment,2622271.0,2622271.0,25,0,chrisjsmith,,,"A history lesson for those either too young to know, or not from the UK.  This will explain a few gaps.<p>Back in the day (i.e. around the late 80's) we used to have PROPER computers in schools in the UK that everyone had free access to.  My particular school had a large network of BBC Master[1] and Acorn Archimedes[2] machines - all proprietary platforms but OPEN with respect to documentation and doing what the hell you liked with them.  In fact, Acorn, the manufacturer would tend to shove all the hardware reference and programmers guides in the box with the machines (you could not break the software on them).  They ALL had BBC BASIC (very advanced variant of structured BASIC) with an inline 6502 or ARM assembler and most of the earlier machines had analogue and digital IO you could just stuff things into.  They were all networked together as well and could talk to each other.<p>We were ACTIVELY ENCOURAGED to build stuff that plugged into these (rather than the recent policies and AUPs that students have to live with) and write software to control things and even modify the operating system at will.  We built a massive transit shuttle system based on Lego, we build automated cranes, we build light sequencers, we built anything we damn wanted and were applauded for it.<p>Most of the software devs I know in the UK (other than the young and really old ones) tend to have cut their teeth on this kit.<p>Then there was the introduction of the PC which destroyed all this in favour of ""security"", ""acceptable use policies"", ""black boxes"", ""no documentation"" and ""vendor lock in"".<p>Mr Braben was a pioneer of these machines [3] [4] and is held close to the heart of many people.  He wants the education sector to go back to these days (rather than the utter corruption that Research Machines, BECTA and Microsoft have destroyed everything with recently) because he truly KNOWS what is good for the industry i.e. people who know how stuff works and are free to understand.<p>Ironically, on a slight tangent, my children have Linux machines in their school these days rather than Windows, which is used for administrative functions only.  It'll only be a few years before my eldest discovers gcc.<p>[1] <a href=""http://en.wikipedia.org/wiki/BBC_Master"" rel=""nofollow"">http://en.wikipedia.org/wiki/BBC_Master</a><p>[2] <a href=""http://en.wikipedia.org/wiki/Acorn_Archimedes"" rel=""nofollow"">http://en.wikipedia.org/wiki/Acorn_Archimedes</a><p>[3] <a href=""http://en.wikipedia.org/wiki/Zarch"" rel=""nofollow"">http://en.wikipedia.org/wiki/Zarch</a><p>[4] <a href=""http://en.wikipedia.org/wiki/Elite_(video_game)"" rel=""nofollow"">http://en.wikipedia.org/wiki/Elite_(video_game)</a>",1307298475.0
66,2622542,comment,2621743.0,2622426.0,1,0,cheez,,,"Ok, but what kept you going? Was it the thrill of getting customers or the thrill of solving that particular problem or...?<p>I'd love to work with someone who has done it before so if I can motivate you, that would be awesome :D",1307298392.0
67,2622541,comment,2622021.0,2622401.0,2,0,hammock,,,"I have always wondered, why is it so difficult to predict the properties of an element?",1307298383.0
68,2622540,comment,2621976.0,2621976.0,3,0,rmason,,,Mixergy has an interview this week with James Altucher who coincidentally provided some of the same advice.  When his company crashed after the bubble he started an exercise routine and forced himself to start getting up at 6:30 am every day as he started a new business.<p>He also spoke of making himself uncomfortable as he reached out daily to people he didn't know in search of customers.,1307298370.0
69,2622539,story,,,9,0,Newky,Early Days of Linux,http://www.linuxuser.co.uk/features/the-early-days-of-linux/,,1307298367.0
70,2622538,comment,2621770.0,2621770.0,1,0,klbarry,,,"I signed up, I love being an early adopter, because I'm on the lookout for things that well give our company an edge. No emails as of yet, though. Keep in mind I am looking to quickly dart through companies, not tirelessly research a database for something that <i>might</i> be useful.",1307298287.0
71,2622537,story,,,1,0,DesignsnPrint,Atlanta Graphic Design Company,http://www.designsnprint.com/atlanta-graphic-designer.html,,1307298218.0
72,2622536,comment,2622250.0,2622250.0,34,0,yaakov34,,,"The nostalgia that this makes me feel is unbelievable. Some things about old Usenet are probably lost forever:<p>1. The feeling that ""this matters"". Usenet wasn't just one discussion forum among millions, it was The One. \n2. The life of the mind - the all-text nature of the old Usenet was somehow incredibly conductive to treating people as pure intellects. ""On Usenet, it doesn't matter if you're a dog."" Somehow even forums like HN don't capture that feeling today.<p>Also, a decent newsreader is still ahead of all modern browser-based software by a mile when it comes to following many discussion threads. For me, nothing today compares with trn.<p>Yeah, I know Usenet is still out there, and I can even be found there sometimes, but it's not the same feeling anymore, not of intellectual wonder and horizons and of being a pioneer. Probably, that's hard to explain to the youngsters who weren't there - wow, the internet has produced its crop of old-timers.",1307298174.0
