,ID,Type,Story,Parent,Points,Comments,Author,Title,URL,Content,Created
73,2622535,comment,2622145.0,2622145.0,1,0,matdwyer,,,"Great post - the SEO and traffic benefits alone can be huge, although there is a large time commitment involved. The more you put in, the more you'll get out.<p>I've just registered on one of the sites, up until now I've been just emailing people in the space. It is hard when you have something that is targeted towards a specific region, but regardless the SEO benefits are huge.",1307298141.0
74,2622534,story,,,1,0,DesignsnPrint,Carbonless Invoice Printing,http://www.designsnprint.com/carbonless-forms.html,,1307298125.0
75,2622533,comment,2621371.0,2621371.0,4,0,tlrobinson,,,"What's the cost of living for a foreigner in Singapore like? Obviously there can be a big range, but I'm curious what your experiences are?<p>More generally, is there some resource for comparing costs of living of various places?",1307298100.0
76,2622532,comment,2620974.0,2621642.0,1,0,solarmist,,,"No it's not easy, but removing distractions helps keep you on track.<p>A lot of people on HN I've heard say they use a web filter on themselves. Only allowing most web sites for certain times of day, otherwise they're locked down to ""productive"" web sites.<p>Also, when you're looking for something new to learn instead of picking a new breadth topic, pick a depth topic you don't know about and learn about in one of your hand picked languages. Like if you're learning about networking or machine learning, use a language that you want to know better, but have ""lost interest"" in instead of one you already know well.",1307298078.0
77,2622531,story,,,1,0,sandravazsal,How popular is Angry birds ,http://www.datashelves.com/how-popular-is-angry-birds,,1307298044.0
78,2622530,comment,2621384.0,2621703.0,1,0,alnayyir,,,It doesn't compare to rails migrations. The lack of integration is crippling as well.,1307297983.0
79,2622529,comment,2621425.0,2622233.0,1,0,aristus,,,"At minimum, doing your data fetching in parallel / asynchronously is a huge boost. Likewise flushing to the client in concurrent / out-of-order chunks, possibly in parallel with other work.",1307297947.0
80,2622528,comment,2619563.0,2621188.0,1,0,FilterJoe,,,Good point. One way to address your point is to try to understand what is appropriate for each kid at the age of 5-6 and slot them in the right school before it's too late. See my reply below.,1307297873.0
81,2622527,comment,2622238.0,2622238.0,2,0,rmason,,,"I'd visit a lawyer who specializes in trademark law.  Most lawyers will give you an initial hour at no charge.  At bare minimum you will learn your options.<p>I faced the same problem as you ten years ago. I received a cease and desist letter from a large multinational. I handed over the domain name, rebranded the business and I'm still here.  So it doesn't have to mean the end of your business.",1307297848.0
82,2622526,comment,2622166.0,2622166.0,5,0,dkarl,,,"I disagreed strongly with this post and was about to post a rebuttal, but then I realized there actually is a situation where untyped languages enjoy a concrete, practical advantage because of the lack of compilation dependencies.  That situation is when you are writing a module (something that would be a compilation unit in a typed language) that calls missing or nonexistent library interfaces, and you want to test parts of the module that do <i>not</i> depend on the missing APIs.  In a typed language, you can't do it.  You would have to satisfy the dependencies first so your code would compile, or you would have to copy snippets of your code out of the compilation unit into a REPL or another file so they could be compiled separately.  In an untyped language, you can experiment with parts of the module and even start writing tests without having to make sure all of the module's dependencies are satisfied.<p>Aside from that one advantage, though, it's the same with types or without them.  For a module as a whole, the compilation dependencies that exist in a typed language are the same as the runtime dependencies that exist in an untyped language.  Whether you're using a typed or untyped language, you can write whatever code you want, but you can't do anything with it until you satisfy its dependencies.  With that one exception, of course:  in an untyped language, you can run code that <i>doesn't</i> depend on the missing APIs but happens to be in the same module as code that <i>does</i> depend on them.<p>Overall, I don't think that amounts to much, especially compared to a typed language like Scala where you can copy snippets into a REPL.  Or even better, Ensime is an Emacs mode that is supposed to let you work with Scala the way Slime lets you work with Common Lisp.  (I haven't tried it myself yet, but it exists, and people are using it for real work.)",1307297846.0
83,2622525,comment,2618181.0,2618742.0,1,0,esrauch,,,"Honestly, I think it's pretty likely that Facebook will tend towards with people having ""Professional"" profiles offsetting LinkedIn and they will offset email.<p>Obviously at this point it is largely just offsetting personal email, but I don't think it's reasonable to dismiss that as insignificant.",1307297844.0
84,2622524,story,,,6,1,jjp9999,Operation Cupcake: MI6 Did it for the Lulz,http://techzwn.com/2011/06/operation-cupcake-mi6-did-it-for-the-lulz/,,1307297841.0
85,2622523,comment,2618993.0,2622514.0,1,0,ugh,,,Earning $1 per day is a very low income yet it is still higher than earning $0.5 per day.,1307297803.0
86,2622522,comment,2622238.0,2622427.0,1,0,mst,,,"Also, making a polite agreement with the other business owner doesn't cost him anything. Potentially having to sue you does. This means that provided you can convince him of your good faith, giving you long enough to rebrand is probably in his best interests.<p>And, hell, it requires ... a phone call. No harm trying.",1307297756.0
87,2622521,comment,2619563.0,2621347.0,1,0,FilterJoe,,,"I see your point. But segregation can also occur by entire schools. In CA (where I live), budget constrains and therefore class sizes makes it very difficult for public schools to cater to the individual needs of students. For this reason, our son is going to a private school (partly an economic decision for us - the cost of a house in a town with great public schools was $500,000-$600,000 greater than the house we actually purchased).<p>We checked out many public and private schools to find the best fit for him. Given the kinds of math he was doing before entering Kindergarten and his inquisitive nature, we could see that he would be bored and not challenged going through any of the public schools we checked out. His private school does a great job of exactly what you say - different flavors, different emphasis, different difficultly in homework among essentially same-subject classes.",1307297677.0
88,2622520,comment,2622238.0,2622238.0,1,0,jccodez,,,"Sorry to hear of your trouble. Bootstrapping is very difficult and you should not expect 1 or 2 months is enough time to gain traction and be profitable. I would not say you have ""failed"". Your product may be the best thing no one has heard of. Keep your day job and keep working on your bootstrap. I started out writing code on a thinkpad I bought used on ebay for 200 usd. Talent without endurance is likely to lead to little. Good luck.",1307297655.0
89,2622519,comment,2622238.0,2622238.0,1,0,known,,,Have a Plan B,1307297654.0
90,2622518,comment,2622288.0,2622288.0,9,0,jerf,,,"This debate always reminds me of an older debate, about how the universe must have a maximum speed, and how the universe can not have a maximum speed, as outlined in [1]. The resolution was ultimately that yes, both were actually true, and the failure of understanding was somewhere else entirely: Galilean transforms are the wrong way to add two velocities, you need Lorentz transforms, and both of Zeno's arguments are thus satisfied.<p>Similarly, while you don't get it from this source as he has made his decision, there are some reasons why everyone has gone to discrete models. But I suspect the ultimate resolution will have both elements, which the essay does mention at the end, and that contra what the author says, there won't be an ""ultimate"" to either of them; I bet the universe can not be discrete <i>and</i> it can not be continuous, and the truth is some weird combo of the two in which ultimately the question is simply sidestepped, not resolved, much like the resolution to Zeno's paradoxes.<p>[1]: <a href=""http://www.mathpages.com/rr/s3-07/3-07.htm"" rel=""nofollow"">http://www.mathpages.com/rr/s3-07/3-07.htm</a>",1307297646.0
91,2622517,comment,2622238.0,2622404.0,1,0,calebhicks,,,"I didn't know that I was infringing until he notified me. But after doing the research, I am quite certain that I am. I definitely plan on making the necessary adjustments.",1307297516.0
92,2622516,comment,2607303.0,2609883.0,1,0,Rickasaurus,,,Thanks.  I'll think hard about doing this and see what happens.,1307297492.0
93,2622515,story,,,1,0,known,"The Currency That's Up 200,000 Percent",http://finance.yahoo.com/banking-budgeting/article/112854/currency-up-200000-percent-smartmoney?mod=bb-budgeting,,1307297488.0
94,2622514,comment,2618993.0,2619390.0,1,0,rospaya,,,"How don't they contradict each other? They said one thing, the reality is another thing.",1307297437.0
95,2622513,comment,2622420.0,2622420.0,2,0,wrrice,,,"2006 called, it wants it's flame war back.",1307297412.0
96,2622512,comment,2621362.0,2621362.0,3,0,bxr,,,"<i>Wendys providing unlimited baked potatoes and Frosties, in exchange for a 5 percent equity stake.</i><p>I'd take that deal.",1307297397.0
97,2622511,comment,2618993.0,2619526.0,1,0,rospaya,,,"This is beyond foolish and even with the worthwhile points in the article (I read it, ""stopped reading was only a figure of speech) it renders it amateur and not serious.",1307297388.0
98,2622510,story,,,1,0,imranulhaq,"Nokia X7 Is In Pre-orders In UK, First Taste Of Symbian Anna ",http://www.mediatalking.com/nokia-x7-is-in-pre-orders-in-uk-first-taste-of-symbian-anna.html,,1307297382.0
99,2622509,comment,2618181.0,2618793.0,1,0,esrauch,,,I don't really understand your point; any amount of money that they make from search or gmail or docs is just because someone is on that page and sees ads. The exact same situation applies with GChat assuming you use it through the gmail interface rather than through an alternate client (which most people do).,1307297375.0
100,2622508,comment,2622238.0,2622366.0,2,0,JabavuAdams,,,"> You're absolutely right. I don't contest that we are infringing.<p>In the future, don't say things like this in writing. Not trying to be hard on you, or to encourage you to be dishonest.<p>It's just that statements like this can really come back to bite you when they come up out of context in a legal context.",1307297358.0
101,2622507,comment,2622288.0,2622288.0,7,0,dto1138,,,"Hey, I'm not a particle physicist, but I've read a bunch of books by people who think the universe is a computer. (Three Scientists and Their Gods, A New Kind Of Science, and The Recursive Universe (this last is out of print and much better than Wolfram's newer but more turgid ANKOS.)<p>I don't think the universe is a computer either, but I don't think this guy understands what that would mean anyway.<p>From the article: ""I just find it obvious that pretty much by definition, discrete objects are always less fundamental and less complete than the continuous ones. A discrete description of some object or phenomenon is always an approximation.""<p>Now the whole thrust of the ""computer-universe-ism"" people's argument, if I read them correctly, is that the universe is really a discrete structure, in which case a discrete model of said structure would not be ANY kind of approximation. I.e. to what are the integers (a discrete structure) a (supposedly poor) approximation? What about the two-element set {0,1} or (say) groups? (The group theory bit is a trick for the author.)<p>We'd better leave these questions to be answered by empirical data---or if we need philosophers to chime in, better ones than this.",1307297357.0
102,2622506,story,,,1,0,harrypickel69,Freebie: Minimal User Interface Elements PSD,http://inspirationfeed.com/2011/06/freebie-minimal-user-interface-elements-psd/,,1307297312.0
103,2622505,story,,,1,0,dekra,Forecast for mobile in 2015,http://vimeo.com/23903009,,1307297172.0
104,2622504,comment,2622202.0,2622398.0,2,0,awj,,,"I'm not sure I follow what you're saying. How can you make daily deals algorithm based? They rely on third parties (merchants) agreeing to the promotions. Anything algorithm based would have to know enough about those merchants to make coupon decisions on their behalf, and be trusted to do so. I have a hard time seeing merchants in quantity going for this.",1307297164.0
105,2622503,comment,2622420.0,2622420.0,2,0,pitchups,,,"In my experience, many programmers trained in a specific lanaguge or framework, tend to become attached to it over time to the point of becoming zealous about its benefits. If you define religion as being overzealous, then it not just Ruby/ROR, but C++, .Net, PHP, Perl and most other languages. Most find it difficult to be agnostic about their choice of the language/framework they select and use regularly.   Just my 2 cents :)",1307297164.0
106,2622502,comment,2622202.0,2622398.0,1,0,jforman,,,"They aren't waiting   watch the demo of Google Wallet / Google Offers from D9 last week:<p><a href=""http://allthingsd.com/video/?video_id=49011B68-9F7F-44C0-BC20-86A4797D4709"" rel=""nofollow"">http://allthingsd.com/video/?video_id=49011B68-9F7F-44C0-BC2...</a>",1307297150.0
107,2622501,story,,,1,0,johnw4545,Celebrity hair styles  |celebrity hairstyles|short hair styles|short hair cuts,http://celebrity-hairstylesphotos.blogspot.com/,"We have the latest celebrity hair styles, celebrity haircuts as well as celebrity gallery pictures",1307297101.0
108,2622500,comment,2622248.0,2622441.0,1,0,bjelkeman-again,,,"I suppose it's because HN is primarily about software startups, and the community heere seem mostly interested in growing software and online services companies quickly. Nothing wrong with that, but it would be very interesting to see a green entrepreneurial community with the same strong drive, to both help each other and make money sustainably.<p>Personally I am taking what I have learned from my software startups and starting sustainable food production at large scale next.",1307297095.0
109,2622499,comment,2621371.0,2621742.0,4,0,miked,,,">> had the police order him off the street at gun point because he was jaywalking.<p>I simply don't believe your friend's dad was telling the truth. There are plenty of bad cops in the US, but drawing a gun on someone because they were jaywalking? I call bullshit.",1307297081.0
110,2622498,comment,2622271.0,2622485.0,4,0,idonthack,,,"Those are first-world kids, with rich parents.<p>A $15 computer is obviously not targeted at that market.",1307297042.0
111,2622497,comment,2622271.0,2622271.0,-1,0,smoove,,,Offtopic: I just noticed that the bbs' videoplayers volume goes UP TO 11!,1307297033.0
112,2622496,comment,2622238.0,2622238.0,4,0,cincinnatus,,,"Dude, you are just getting started. Someone threatening to sue you is the first sign of success. If you have cash flow fight on. Figure out your partnership issues and go for it.",1307296999.0
113,2622495,comment,2622271.0,2622348.0,5,0,hsmyers,,,"Having been there and having done that and still being involved, I respectively disagree. It was simpler in virtually all respects. I watched people of all different levels of interest and education (house wives, grad students, math majors, art majors and so on [notice no comp sci---there wasn't such a program]) learn to program in a subset of IBM BAL---this before any of the various micros you mention existed. Later when such things became available I was lucky enough to watch a very much larger audience teach themselves what they needed to know in order to accomplish what they wanted to do. And all of this before the internet had escaped the clutches of DARPA. In most cases, all that was available was the machine and the documentation that came with. In sum, I know what it takes to be creative now and I know what it took then. I would suggest that at best, it might be a draw. My bias would like to say that the good old days were better, but given the richness of today's environment, in fairness I have to come down squarely in the middle.",1307296992.0
114,2622494,comment,2622288.0,2622423.0,1,0,vidiviciveni,,,> The universe is continuous not discrete and those who believe otherwise are insane<p>Quite a bold statement.,1307296985.0
115,2622493,story,,,56,21,TrevorBurnham,(Mis)adventures in trying to promote a book on AdWords,http://trevorburnham.posterous.com/misadventures-in-adwords,,1307296975.0
116,2622492,comment,2621907.0,2622113.0,2,0,InclinedPlane,,,Not everyone understands that scrum and agile have this heritage of coming from getting horribly managed projects worked on by extremely mediocre devs in the enterprise trenches on track.,1307296964.0
117,2622491,comment,2622166.0,2622166.0,13,0,colanderman,,,"Um... NO.  This argument applies equally to functions and constants and is equally wrong.<p><i>Types</i> are <i>not</i> anti-modular: the culprit is module systems that don't allow type parameterization.  Systems such as Java solve this problem for functions and constants by allowing code to be parameterized over interfaces.  Bam, you can compile code using said functions and constants separately from their implementation.<p>The solution for types is exactly the same: move types into interfaces.  Guess what, Objective Caml and Coq do this via module functors and it's glorious.  If my airline scheduler module needs to compile separately from my graph module, well I can write:<p>module Scheduler(Graph: sig\n  type graph\n  val traverse: graph -> (string -> unit) -> unit\nend) = struct\n  ...blabla...\nend<p>and I can compile that code without ever writing a snippet of the graph module -- not even defining the ADT!<p>TLDR: this problem has been solved 30 years ago by people who actually use typed languages.",1307296925.0
118,2622490,comment,2622238.0,2622340.0,3,0,eps,,,"Are you in the same business domain as they are?<p>IIRC the way trademarks work is that they are issued for use in specific application area. A business that is using Xyz for a bakery does not violate an Xyz trademark of, say, a welding shop.",1307296918.0
119,2622489,comment,2621907.0,2621907.0,2,0,lyudmil,,,"This feels like an argument on the wrong level of abstraction. Even if the methodology is at fault, it seems silly to say ""Waterfall is the problem."" That's simply too large of a point to make. You could say that you fell behind during development and couldn't tell that you were falling behind, so the problem snowballed. That's specific enough for people to discuss without resorting to politics. Otherwise you're taking the organization's dysfunctions head-on, which is a losing battle.",1307296884.0
120,2622488,comment,2622379.0,2622433.0,2,0,cgcardona,,,Great suggestion. I'll look into it. Thanks.,1307296860.0
121,2622487,comment,2621599.0,2622003.0,1,0,thematt,,,"They also hired Palm's designer of the WebOS notification system last year, so perhaps they already have something in the works.<p><a href=""http://www.appleinsider.com/articles/10/06/09/designer_of_notification_system_for_palms_webos_hired_by_apple.html"" rel=""nofollow"">http://www.appleinsider.com/articles/10/06/09/designer_of_no...</a>",1307296828.0
122,2622486,comment,2622006.0,2622006.0,2,0,m0nastic,,,"I've been using the beta for a while now, and look forward to it being launched.  I must be in the small minority of people who prefer hosted Exchange to Gmail (but oh do I), but I've been pretty impressed so far with the functionality.",1307296812.0
